ba58911808ab4c22dd74a78af6f19d0e£ Preheat oven to 400 degrees F (200 degrees C). Place chicken wings on a non-greased cookie sheet. Bake in the preheated oven for 45 minutes to 1 hour, turning once, until golden brown. Move to serving dish/platter. In a medium skillet saute garlic and jalapeno peppers in olive oil until soft. Add chicken broth, fish sauce, paprika and sugar. Add cornstarch and let thicken. Stir all together and pour over crispy chicken wings. Enjoy! 
143866d10823d074b7b1054b66ef60e1£
424a51ed7ed746c04df17ec6583448da£ Heat the oil in a large skillet over medium heat. Stir in the garlic, and cook until the aroma of the garlic has mellowed, about 1 minute. Add the red curry paste, and stir for 1 minute more. Whisk in the peanut butter, brown sugar, chili powder, cayenne pepper, fish sauce, sesame oil, and coconut milk. Bring to a simmer, whisking occasionally, until the sauce has thickened and is smooth. 
24c698cec66d83fd3e3076630d2d1cb4£ Mix sugar and dry seasonings in a small bowl. In a 2-cup measuring cup, mix peanut sauce, coconut milk and broth. Split each breast by cutting in half horizontally. Lightly pound to about a 1/2-inch thickness. Place chicken and oil in a medium bowl; toss to coat. Sprinkle seasoning mix evenly over chicken breasts. Heat a 12-inch non-stick skillet over medium-high heat until very hot, then add chicken. Cook, turning once, until crusty brown and fully cooked, about 2 minutes per side. Transfer to a cutting board and let rest. Add peanut mixture to empty skillet; cook, stirring constantly to loosen brown bits, until sauce reduces by half, about 2 to 4 minutes. Return to measuring cup. (Chicken and sauce can be made 2 hours ahead; reheat in a warm oven or microwave.) To serve, cut each breast cutlet into 12 to 15 bite-sized pieces. Transfer to a serving platter. Drizzle with a little peanut sauce, then sprinkle with peanuts and scallions. Serve immediately with toothpicks and remaining dipping sauce. 
e60e44d1664a58269ad8fdcd499acf5b£ In a medium bowl, stir together the coconut milk, ground coriander, curry powder, fish sauce, and chili oil. Add the chicken breast strips, and stir to coat. Cover, and refrigerate for at least 30 minutes, and up to 2 hours. Preheat an indoor or outdoor grill for high heat. Thread the chicken strips onto skewers. Discard marinade. Grill chicken for 2 to 3 minutes per side, until no longer pink. Time will depend on how thick your strips are. Transfer to a serving plate, and garnish with cilantro and peanuts. Serve with peanut sauce for dipping. 
fe9320affa5091cac3758d44b96abf37£ Place ginger, garlic, onion, brown sugar, fish sauce, vegetable oil, soy sauce, coriander, cumin, turmeric, and cayenne pepper into a mixing bowl; whisk into a smooth marinade. Bruise lemon grass by hitting it lightly several times with the back of a large chef&#39;s knife; mince the lemon grass and add to the marinade. Cut beef sirloin into strips about 2 1/2 inches long and 1/8 inch thick. Thoroughly mix the beef into marinade until all beef strips are completely coated, about 1 minute. Cover bowl with plastic wrap and marinate in refrigerator for 2 to 4 hours. Preheat an outdoor grill for high heat and lightly oil the grate. Remove beef from marinade and shake off excess marinade. Thread 1/4 the meat onto each metal skewer. Arrange skewers on the preheated grill and cook until the meat stops sticking to the grill, about 1 to 2 minutes. Flip skewers over onto other side and cook until meat is well browned and shows grill marks, 2 to 2 1/2 minutes. Turn onto first side again and cook until meat is still slightly pink, 2 more minutes. Transfer to a platter and let skewers rest about 2 more minutes before serving. 
7a3a4b15f43860c6c2b28704ec1a86a6£ Place the rice and water in a saucepan, and bring to a boil. Reduce heat, cover, and simmer for 20 minutes. Heat the oil in a wok over medium heat. Cook and stir the onions and garlic in the hot oil until tender. Mix in the rice, sugar, and salt, and cook 5 minutes, until well blended. Stir in the egg until the rice is coated. Increase heat to high, and mix in the crabmeat, green onions, and cilantro. Continue cooking 2 to 5 minutes, until the crab is heated through. Garnish with the cucumber and lime slices to serve. 
b86bb935229ca11d282c7f090ea70df0£ In a large saucepan, bring the chicken stock to a boil. Stir in the tom yum paste and garlic, and cook for about 2 minutes. Stir in the lemon grass and kaffir lime leaves. Place the chicken in the saucepan, and cook 5 minutes, or until no longer pink and juices run clear. Mix in the mushrooms. Add the fish sauce, lime juice, and green chile pepper. Continue cooking until well blended. Remove from heat, and serve warm with the coriander and basil. 
e3fd1695b64f9f0174d978c32802c344£ Bring a medium stockpot of lightly salted water to a low boil. Cook shrimp 2 to 3 minutes, or until opaque. Drain, allow to cool slightly, and pat dry with paper towel. Peel, devein, and slice in half. Bring another stockpot of lightly salted water to a boil. Cook pork at a low boil for approximately 10 minutes, to an internal temperature of 145 degrees F (63 degrees C). Allow to cool, and slice into thin strips. Again, bring a stockpot of water to a boil. Cook noodles until tender, stirring occasionally, approximately 7 to 8 minutes. Strain, and rinse to prevent sticking. Fill a medium bowl with warm water. Dip each wrapper in water for about 30 seconds until soft and flexible. Lay wrapper on a flat surface, and place 2 basil leaves in center, side by side, about 2 inches from edge of wrapper. Lay 4 to 5 shrimp halves on basil, followed by a small amount of pork, then a small amount of noodles. Sprinkle with cilantro, mint, and top with bean sprouts. Starting at one end, roll the wrapper over once, fold both sides in toward center, and continue rolling as tightly as possible without tearing. The end result should be a roll approximately 1 to 1 1/2 inches thick. Warm hoisin sauce, peanut butter, and water in a saucepan over medium-high heat. Bring to a boil, and immediately remove from heat. Garnish sauce with chopped peanuts, if desired, and serve with rolls for dipping. 
f654a503294fed7b9e2660a300214285£ In a bowl, thoroughly mix minced tuna, bread crumbs, green onion, carrot, ginger, cilantro, sesame oil, ketchup, soy sauce, cumin, salt, pepper, and egg. Cover, and refrigerate for 30 minutes. Preheat oven broiler. Form tuna mixture into 6 patties, and place in a broiler pan on top oven rack. Cook, uncovered, 4 minutes per side, or until easily flaked with a fork. Serve on hamburger buns with lettuce and tomato. 
7087e647be59150385c98e69e1864951£ Stir together the sesame salad dressing, Thai chili paste, ginger garlic paste, and peanut butter in a bowl until the mixture is well combined. Dip chicken pieces in the mixture, and place into a slow cooker. Pour the remaining sauce over the chicken. Set the cooker to Low, and cook 4 to 6 hours, until the chicken is very tender. 
97d7d4889f293a24b91ae97dd23d1a5c£ Pour the coconut milk and water into a saucepan, and bring to a boil. Add the chicken strips, and reduce heat to medium. Simmer for about 3 minutes, just until the chicken is cooked through. Stir in the ginger, fish sauce and lime juice. Sprinkle in the green onions and cilantro, and serve. 
c5d03a667799d96ace0ac08cba037958£ Place water in a medium saucepan, and stir in the rice. Bring to a boil. Cover, reduce heat, and simmer 20 minutes. Remove from heat, cool slightly, and fluff with a fork. Heat the sesame oil in a separate medium saucepan over medium heat. Stir in tofu. Stirring occasionally, fry about 20 minutes, until evenly crisp and lightly browned. Season with salt. In a small saucepan, bring the coconut milk to a boil. Mix in green curry paste. Reduce heat, and simmer 5 minutes. Drizzle generously over the tofu and rice to serve. 
45181e993374d3f828e30d3e3565f9e9£ In a slow cooker on low heat, combine chicken broth, wine, water, onion, green onion, garlic, carrots, celery, salt, black pepper, curry, sage, poultry seasoning, oregano and cayenne. In a skillet over medium heat, cook chicken in oil until brown. Stir into slow cooker. Cook soup 8 hours on low or 5 hours on high. About halfway through the cooking time, stir in the red pepper. 15 minutes prior to serving, stir in the noodles. 
d53c94bb44a02f075386d05cb6a90204£ Soak the vermicelli 30 minutes in warm water; drain. In a large bowl, mix the vermicelli, eggs, onion, mushrooms, shrimp, pork, vegetable oil, carrot, crabmeat, bean sprouts, pepper, soy sauce, fish sauce and garlic. One by one, moisten the rice wrappers with a damp tea towel and fill with 2 to 3 tablespoons of the vermicelli mixture. Roll the wrappers, and allow them to set for 30 minutes. In a large saucepan, heat the oil to 375 degrees F (190 degrees C). Fry the spring rolls one or two at a time until golden brown, about 3 minutes. Drain on paper towels. 
66c5dd7162c267b39269e6bf2bc103fa£ Preheat oven to 400 degrees F (200 degrees C). Prepare the dressing by combining the fish sauce, lime juice, brown sugar and chopped chiles in a small bowl; set aside. Place the salmon filet on a baking tray, and rub olive oil over. Bake for 20 minutes in the preheated oven, or until easily flaked. Let cool for at least 15 minutes. Place salmon filet into a big bowl; use fork to break salmon meat into big chunks. Add onion, tomato and basil; pour dressing over, and toss lightly until well mixed. Place mixture on lettuce leaves, and serve immediately. 
e56a8e9515881a3d0a7eb5edcbdeea50£ In a medium nonporous bowl, combine the garlic, ginger, lime zest, lime juice, crushed red pepper flakes, water, soy sauce, Worcestershire sauce and sugar. Mix well and place the chicken in the sauce, turning several times to coat. Cover and marinate in the refrigerator for 4 to 24 hours. Preheat an outdoor grill for high heat and lightly oil grate. Grill chicken over high heat for 6 to 8 minutes per side, or until internal temperature reaches 180 degrees F (80 degrees C). Discard any remaining marinade. 
e8932b7e71fe87b337edd841345128b9£
54de0ecf7dee623053526470bacd6720£ Pour the coleslaw mix into a large bowl. Pour in the lime juice, rice vinegar, fish sauce, sesame oil, honey, and peanuts. Stir until well blended. If you have a bowl with a lid, put the lid on and shake thoroughly. Taste, and season with salt and pepper. Refrigerate for a few hours, stirring or shaking occasionally, to allow the flavors to blend before serving. 
feb7ee5d2f856e07b1d3ef8755a00896£ In a shallow dish, mix together the coconut milk, fish sauce, 2 tablespoons minced garlic, cilantro, turmeric, curry powder, and white pepper. Add chicken, and turn to coat. Cover, and refrigerate for 4 hours or overnight. Preheat grill for high heat. In a saucepan, combine vinegar, water, sugar, 1 teaspoon minced garlic, bird&#39;s eye chile, and salt; bring to a boil. Reduce heat to low, and simmer until liquid is reduced, about 5 minutes. Stir sauce from time to time. Remove from heat and allow to cool before use. Lightly oil grill grate. Discard marinade, and place chicken on the grill. Cook for 10 minutes per side, or until slightly charred and juices run clear. Brush with sauce before serving. Serve remaining sauce on the side for dipping. 
574bd51a525f4a840b6613e505d97a42£ In a large bowl, combine soy sauce, rice vinegar, rice wine, lime juice and sesame oil. Stir in onion, basil, mint, lemon grass and crushed peanuts. Season with chile paste, coriander and garlic salt. Layer flank steak with marinade. Refrigerate 6 hours or overnight. Preheat an outdoor grill for medium high heat, and lightly oil grate. Spray a large sheet of aluminum foil with non-stick cooking spray. Drain liquid from marinade. Layer meat on foil with the remaining non-liquid marinade ingredients. Fold edges of foil to seal, then grill for 20 minutes. 
fd72c5e2098ab485cd13982df9a968f8£ Stir the dark soy sauce, soy sauce, sugar, and chile-garlic sauce together in a small saucepan and place over medium-how heat; simmer and stir until the sugar dissolves into the sauce, about 5 minutes. Remove from heat and set aside. Heat the olive oil in a skillet over medium heat. Cook and stir the garlic and chicken in the hot oil until the chicken is no longer pink in the center, 7 to 10 minutes. Stir the broccoli into the chicken mixture; cook and stir until the broccoli is thoroughly heated. Add the noodles and stir until all the ingredients are evenly mixed. Pour the sauce over the mixture and stir until everything is evenly coated; continue cooking until the sauce begins to thicken. Push the chicken mixture to the side of the skillet with a spatula. Add the egg to the skillet in the vacated space. Scramble the egg, cooking it through. Once egg is cooked, mix ingredients back in and heat thoroughly. Garnish with the sesame seeds and red pepper flakes to serve. 
30591236dc3ef1973d85808570979514£ Place peanut butter in a mixing bowl. Whisk garlic, brown sugar, fish sauce, soy sauce, and sesame oil into peanut butter, followed by lime juice and chile-garlic sauce. Bring coconut milk to a simmer in a small saucepan over medium heat; pour over into peanut butter mixture. Whisk until smooth. Transfer to a serving bowl and garnish with chopped red pepper, cilantro, and peanuts. 
32833d0da3e096f47bb700ef2128733d£ Bring a large pot of water to a boil. Stir noodles into boiling water and cook until al dente, 8 to 10 minutes. (For a chewier texture, shock the noodles by pouring 1 cup cold water into the pot when it starts to foam, then letting it come to a boil again to finish cooking.) Drain and divide into two serving bowls. Meanwhile, bring chicken broth to boil in a medium saucepan with mushrooms and green onions. Cut chicken into bite-sized pieces and stir into boiling broth. When broth returns to a boil, crack eggs into broth. Continue to cook until chicken is no longer pink and eggs are cooked, about 10 minutes. Pour the chicken soup over the noodles in the bowls and serve immediately. 
8d0655bf5a919059ce3e33e5d260c5b0£ Bring the rice and water to a boil in a pot. Cover, reduce heat to low, and simmer 45 minutes. Heat the olive oil in a large pot over medium heat, and cook the onion, garlic, ginger, and carrots 5 minutes, until tender. Mix in broccoli, red bell pepper, coconut milk, broth, wine, fish sauce, soy sauce, Thai chile peppers, lemon grass, garlic sauce, and saffron. Simmer 25 minutes. Pour soup in batches into a blender or food processor, and blend until smooth and creamy. Return to the pot, and mix in yogurt and cooked rice. Top with cilantro to serve. 
3cf01c8201babd277b28d2518355eb21£ Combine fish, 1/2 cup flour, oyster sauce, sweet chili sauce, fish sauce, brown sugar, cilantro, green onions, and egg in a food processor. Process until well combined. Refrigerate for 30 minutes. Shape mixture into patties, and dust with flour. Pour enough oil into a heavy skillet to fill the pan with 1/2 inch of oil. Heat over medium-high heat until hot. Fry fish cakes for 8 minutes, turning once, or until golden brown. 
fb167281467dbf1f62c411019bf5f1bf£ Heat peanut oil in a large sauce pan over medium heat. Stir in chopped onion, and cook until softened and translucent, 3 to 5 minutes. Add red bell pepper and continue to cook for 3 to 5 more minutes, until softened. Stir in the curry paste and cook for 1 minute. Pour in the coconut milk and slowly bring to a simmer. Once coconut milk begins to simmer, stir in cubed monkfish, and simmer 7 to 10 minutes, or until the fish is firm and the center is no longer opaque. Stir in fish sauce, lime juice, and cilantro before serving. 
604fdf1e1fbce66711de74dd0e8a1021£ Place the potatoes and onion in a slow cooker. Melt the butter in a skillet over medium-high heat. Cook the beef and garlic together in the melted butter until the beef is browned on all sides. Transfer the beef and garlic to the slow cooker while keeping the beef drippings in the skillet. Return the skillet to the medium-high heat. Stir the coconut milk, peanut butter, and curry powder into the reserved beef drippings; cook and stir until the peanut butter melts. Pour the coconut milk mixture into the slow cooker. Turn the slow cooker on to Low; stir the fish sauce, brown sugar, and beef broth into the slow cooker. Cook on Low until the beef is fork-tender, 4 to 6 hours. Stir the peanuts into the curry about 30 minutes before serving. 
8a75ef23e0a5d5c9d29cbf1341e46654£ Heat the oil in a large skillet or wok over medium heat; cook the garlic in the hot oil until browned, 5 to 7 minutes. Add the onion and baby corn and cook until the onion is translucent, 5 to 7 minutes. Add the mushrooms to the mixture and cook until slightly softened, about 2 minutes. Pour the fish sauce, soy sauce, and oyster sauce into the mixture and stir until incorporated. Whisk the cornstarch and water together in a small bowl until the cornstarch is dissolved into the water; pour into the mushroom mixture. Cook and stir until thickened and glistening. Transfer to a serving dish; garnish with the chile pepper and cilantro to serve. 
e05ec6f4bd38ff8441740ea50f29c890£ Preheat an outdoor grill or grill pan for medium-high heat. Place the shrimp in a bowl and toss with olive oil and salt and black pepper. Grill the shrimp on the preheated grill until opaque, 2 minutes per side. Remove from the grill and set aside. Combine the cabbage, carrot, garlic, 1 tablespoon ginger, teriyaki sauce, and lime juice in a bowl, stir well. Working with one at a time, wet rice paper with water and lay out on a clean surface. Place a quarter of the cabbage mixture in the center of the paper, top with a quarter of the shrimp. Shape the filling into a log shape and roll the rice paper around the filling, tucking the ends in as you go. Repeat with the remaining rice papers. Whisk together the peanut butter, teriyaki sauce, sesame oil, hot sauce, garlic, 1 tablespoon ginger, salt and pepper. Slice the rolls in half on an angle, and serve with the peanut sauce on the side. 
d0d9401fee3dffebb5b6740bb760ce61£ Preheat oven to 400 degrees F (200 degrees C). In a large bowl combine the broth, sugar, fish sauce, vinegar, cornstarch and paprika. Set aside. In a hot wok or skillet add the oil, garlic and chiles. Stir fry over high heat until the garlic turns slightly golden, about 4 minutes. Add the broth mixture and stir until it boils and is reduced to about 1 1/4 cups, about 10 to 15 minutes. Keep warm. Place the chicken wings in a 10x15 inch baking dish and bake, uncovered, in the preheated oven for 60 to 70 minutes (until browned and crisp). Turn occasionally. Drain off the fat. With a slotted spoon, transfer the wings to a platter and pour the garlic sauce mixture over them, mixing well. Garnish with red bell pepper strips if desired. 
b5c95b69c6271e1bd43273e3c3061cfe£ Whisk together the honey mustard, chili sauce, eggs, and sea salt in a bowl. Place the chicken drumsticks in a large, sealable plastic bag; pour the marinade over the chicken and seal the bag. Allow to chill in refrigerator at least 4 hours. Preheat an oven to 350 degrees F (175 degrees C). Place the bread crumbs in the bottom of a wide dish; dredge the marinated chicken in the bread crumbs to coat. Heat the vegetable oil in a large, deep pan over medium-high heat. Gently lie the breaded chicken into the hot oil until golden brown, 5 to 7 minutes, turning once if needed to get even coloring; transfer to a baking sheet. Cook the chicken legs in the preheated oven until no longer pink at the bone and the juices run clear, about 30 minutes. An instant-read thermometer inserted near the bone should read 165 degrees F (74 degrees C). 
084e2494997769212353d6f3a2fd8695£ Cover noodles with boiling water and let stand for 5 minutes; drain well and reserve. Heat half the oil in a wok or deep skillet set over high heat. Crumble in chicken and add hot sauce; stir-fry for 3 to 5 minutes or until browned. Reserve on a platter. Add remaining oil and peppers to pan; stir-fry for 3 minutes. Add shrimp and stir-fry for 2 minutes. Stir in garlic, ginger, broth, ketchup, lime juice, sugar and fish sauce. Bring to a boil. Add noodles and reserved meat; toss mixture to combine. Heat through. Add sprouts and toss gently. Sprinkle with onions, coriander and peanuts. 
ce7e1d3e1c493a29b769faf5577aaae1£ In a medium bowl, mix together the ground lamb, bread crumbs and steak seasoning until well blended. Form into meatballs about 1 inch in diameter. Heat a greased skillet over medium-high heat and fry the lamb balls until they are a bit black and crusty, about 5 minutes. Remove balls from pan and set aside. Toss the curry paste into the hot skillet and fry for about a minutes. Then pour in the entire can of coconut milk and lower the heat. Let the mixture simmer, stirring frequently for 5 to 10 minutes. Serve the meatballs and curry sauce over rice. 
b29f804138547104f6b40b7db0418762£ Whisk together the fish sauce, rice wine, sesame oil, sugar, garlic, ginger, and honey in a small bowl. Marinate meat at least 6 hours or over night before cooking. 
2af4e62cb1913e258dfc4e73819faa60£
c91fe8a0d53c8d7403a9e4c81e6e8393£ Cover the rice with several inches of fresh water. Allow rice to stand for 30 minutes. Drain off water so that rice is covered by 1/4 inch of water. Place the rice in a microwave oven, cover, and cook on High until the water has mostly absorbed but the rice is still wet, about 10 minutes; stir and cook until almost dry, an additional 4 minutes. Mix half the coconut milk and 1 cup of sugar in a bowl, stirring to dissolve the sugar. Pour the mixture over the rice and stir to coat rice with the mixture. Cover and allow the rice to stand at room temperature for 20 minutes. Pour the remaining 1/2 can of coconut milk into a saucepan and whisk in 1 tablespoon of sugar, salt, and cornstarch until smooth. Bring the mixture to a simmer over medium heat, whisking constantly, and simmer until thickened, about 2 minutes. Remove from heat and allow to cool. To serve, scoop the rice into individual serving bowls and top each serving with about 2 tablespoons of the coconut sauce and several pieces of mango. 
b1ea17e8e48745c91502e07ecbf1c64b£ In a medium bowl, mix chicken, celery, green onions and peanuts. In a small bowl, whisk lime juice, fish sauce, ginger, sugar, red pepper, cilantro and mint, plus 2 Tbs. water. Toss dressing with chicken mixture and serve on a bed of Boston lettuce with the suggested accompaniments. 
93eeb2826d63cb9fff8b8bc567757fd6£ Preheat grill for medium-high heat. Grill beef to desired doneness, and allow to cool. While beef is cooling, stir together fish sauce, lime juice, kecap manis, garlic, ginger, cilantro, sesame oil, and chili oil; mix in the green onions and shallots. Adjust seasoning to your taste. Cut beef into bite-sized pieces. In a large bowl, toss with onion, tomatoes, cucumber, and chili peppers. Pour in the dressing, and toss to coat. 
732cd6e0a2772f6e79f88af22f6e26fb£ Heat the sesame oil and vegetable oil in a large wok over high heat. Fry the onion, ginger and chile pepper, stirring constantly until onion is tender. Add chicken strips, lime juice, soy sauce, basil and cilantro. Cook, stirring constantly until chicken pieces are golden and cooked through. Pour in the coconut milk, and bring to a boil. Stir together the cornstarch and water; stir into the sauce. Let simmer for 10 minutes, or until thickened. Meanwhile, soak noodles in hot water for 3 minutes. Bring a large pot of water to a boil. Add soaked noodles, and cook for 3 minutes, or until tender; drain. Serve the chicken mixture over noodles, and garnish with a twist of lime and a drizzle of cream. 
9a5c6131812a034fd75312bf5989e7e4£ In a food processor, combine chile peppers, green onions, lime zest and juice, 1/2 of the cilantro, fish sauce, lemon grass, salt, sugar and mustard. Blend until smooth. Rinse chicken and cut to appropriate serving size. Place in a bowl with blended ingredients and refrigerate for 1 to 4 hours. Preheat oven to 350 degrees F (175 degrees C). In a shallow dish or bowl mix together the bread crumbs, cilantro, cheese, sesame seeds and salt and pepper to taste. Remove chicken from marinade (disposing of any remaining marinade) and roll in crumb mixture until well coated on both sides. Place coated chicken in a lightly greased 9x13 inch baking dish (if desired, dab with olive oil on top for a crisp finish) and bake at 350 degrees F (175 degrees F) for 20 minutes or until chicken is cooked through and juices run clear. NOTE: You can make a dipping sauce by blending 2 green chile peppers with some fish sauce and sugar and topping the blend with some sesame seeds. 
f95de3b2bdace6daaa2ea7f1b57fe530£ Place the rice noodles in a bowl. Pour the boiling water over the noodles; set aside. Heat the oil in a large wok or skillet over medium-high heat. Cook and stir the onion, zucchini, and mushrooms until softened; remove from skillet, reserving the oil, and set aside. Reheat the remaining oil in the skillet. Cook and stir the chicken in the hot oil until no longer pink, about 5 minutes. Return the vegetable mixture to the skillet and add the fish sauce, curry paste, and sugar; stir to coat the chicken and vegetables with sauce. Drain the rice noodles and add to the mixture. Pour the coconut milk into the skillet and stir to combine. Sprinkle with cilantro to serve. 
b1588ef3d056a2e6599ead065272c1e8£ Place coffee and cardamom in the filter of your coffee machine. Place enough water to make 2 cups of coffee in the machine. Turn on the coffee machine. Pour brewed coffee into 2 coffee cups, and stir 1 tablespoon sweetened condensed milk into each cup. Serve. 
