3688340d41b43457b4de7ec1d9345fb8£ Place shiitake mushrooms in a small bowl. Cover with hot water and let soak until tender, about 20 minutes. Drain. Squeeze out excess water and slice. Pound cilantro root, garlic, and black peppercorns into a coarse paste in a mortar and pestle. Transfer paste to a large pot. Pour beef stock into the pot. Add pork belly and chicken wings. Bring to a simmer; cook for 10 minutes. Add sliced shiitake mushrooms, tofu, and pickled radish. Simmer soup until chicken wings are cooked through, about 45 minutes. Stir in oyster sauce and soy sauce. Season with fish sauce and sea salt. Place a steamer basket into a large pot and fill with water to just below the bottom of the steamer. Bring water to a boil. Add noodles, cover, and steam until tender, about 5 minutes. Place some noodles in each serving bowl and ladle soup on top. Garnish with bean sprouts, green onions, and cilantro. 
302679ecfbf5cb1571891decc5efa1ca£ Bring coconut milk and chicken stock to a boil in a pot over high heat. Reduce heat to medium. Add cilantro, lemongrass, galangal, Thai chile peppers, and kaffir lime leaves; simmer for 5 minutes. Increase heat to medium-high heat. Add chicken; simmer until no longer pink in the center, about 7 minutes. Stir in cabbage; cook until wilted, about 3 minutes. Remove soup from heat; stir in lime juice and fish sauce. 
30e7b2cea23b727f578bdebe1688a4ba£ Bring chicken stock to a boil in a saucepan; add lemon grass, galangal, cilantro, green onion, and kaffir lime leaves. Stir, reduce heat, and simmer for 5 minutes. Mix chicken, fish sauce, sugar, and red pepper flakes into stock mixture; stir and simmer for 5 minutes. Add coconut milk, shiitake mushrooms, and cremini mushrooms; stir and simmer for 5 minutes. 
be693c1a301da01131f2332a84a0c309£ Heat oil in a deep skillet over medium-high heat and saute chicken until browned, 2 to 3 minutes. Add garlic and curry paste and cook until fragrant, about 2 minutes. Pour in coconut milk and season with sugar and salt. Mix well. Add broccoli, cover, and simmer until broccoli is soft, about 7 minutes. Sprinkle with green onions. 
8bd4478fbbc96ccdacd60769dfa0fc1f£ Combine lime juice, fresh Thai peppers, 1/4 cup plus 2 tablespoons fish sauce, and dried chile flakes in a bowl and mix well. Add shallots, mint, cilantro, peanuts, onion, red onion, green onions, and ginger. Mix well. Heat a nonstick skillet over medium-high heat. Add pork; cook and stir to break it up until pork is no longer pink in the center but not yet browned, 3 to 5 minutes. Drain and discard grease. Allow pork to cool briefly, about 5 minutes. Transfer pork to a bowl and add dressing mixture; mix very well. Let the salad sit for at least 10 minutes before serving. Spoon mixture into lettuce leaves, like putting a hot dog in a bun. 
92a5c18d125ca825675ec7dd911f36f9£ Heat 1 tablespoon peanut oil in a large saucepan over medium heat. Add lemongrass, lime juice, ginger, garlic, and red pepper flakes; heat until fragrant, about 30 seconds. Add onion; cook and stir until soft, about 5 minutes. Add remaining 1 tablespoon peanut oil and tofu; stir-fry until tofu is lightly browned, about 5 minutes. Combine water, chicken stock, coconut milk, soy sauce, fish sauce, and brown sugar in a large pot; bring to a boil. Pour in lemongrass mixture. Simmer over low heat until flavors combine, about 20 minutes. Add bok choy and rice noodles; cook until tender, about 5 minutes. Garnish with cilantro. 
2dae9e35505f6a19a94dbcbc2222f1c9£ Place tofu onto a plate and place another plate on top. Set a 3- to 5-pound weight on top. Press tofu for 20 to 30 minutes; drain and discard the accumulated liquid. Slice into 1/2- to 1-inch thick slabs wide enough for easy flipping. Mix soy sauce, rice vinegar, lime juice, coconut oil, tamarind paste, garlic, ginger, and chili-garlic sauce together in a square container. Fit the tofu slabs in the marinade so they are submerged; marinate at least 15 minutes. Transfer tofu to a oven-proof plate, reserving the marinade. Preheat the oven to 350 degrees F (175 degrees C). Combine cabbage, carrots, daikon, red bell pepper, and onion in a skillet over medium heat. Add 1/4 cup water; saute vegetables until tender, 10 to 15 minutes. Bake tofu in the preheated oven, flipping after 15 minutes, until dry, 30 to 40 minutes. Chop tofu into smaller pieces. Whisk flaxseed meal, peanut butter, chili powder, black salt, and stevia into the marinade. Let sit until sauce is thickened, about 5 minutes. Stir kelp noodles and bean sprouts into the cabbage mixture in the skillet; cook and stir until softened and heated through, about 2 minutes. Mix in the sauce; cook and stir until sauce thickens and sticks to the noodles, about 5 minutes. Add chopped tofu, green onions, peanuts, and cilantro. 
1b6f713442e5bcc676c3e8ac20f94ad2£ Bring a pot of water to a boil. Add noodles, remove from heat, and let soak until noodles are softened, about 15 minutes. Drain. Mix ketchup, sesame oil, fish sauce, soy sauce, and red pepper flakes together in a bowl. Set aside. Heat 1 teaspoon oil in a large nonstick skillet over medium-high heat. Add shrimp; saute until firm and opaque, 3 to 5 minutes. Remove shrimp and add remaining oil to the skillet. Pour eggs into the skillet; cook and stir until lightly scrambled, about 5 minutes. Add green onions, bean sprouts, and garlic. Cook until fragrant, about 1 minute. Add the noodles, ketchup mixture, and cooked shrimp. Cook for 3 minutes more. Sprinkle with peanuts. 
9c2b676df25bb40852491474ae269175£ Heat oil in a large pot over medium heat. Add onion, curry paste, ginger, and garlic. Stir continuously until onion begins to soften, about 2 minutes. Pour in vegetable broth and coconut milk. Add sugar. Bring to a boil. Stir in tofu, broccoli, cauliflower, and mushrooms. Reduce heat and cover pot. Simmer soup, stirring occasionally, until vegetables are tender, 5 to 8 minutes. Season with salt and pepper. 
afaae000c862b0a2401d92d8c807741e£ Heat 1 tablespoon vegetable oil in a wok or large skillet over high heat. Cook onion and tofu until lightly browned, 3 to 5 minutes. Add peas and tomatoes and cook for 1 minute. Stir in rice and a little more oil if necessary to keep the rice from sticking. Stir-fry for 1 minute. Season with light soy sauce and sweet soy sauce; stir well. Move rice to one side of the wok or skillet and add remaining 1 tablespoon of vegetable oil to the empty side. Crack eggs into the skillet and season with soy seasoning. Let eggs cook for about 3 minutes; flip and scramble. Stir into rice mixture. Stir in pineapple until warmed through. Season with white pepper. Taste and adjust seasoning if needed. 
e7e620c7f7b9db6e6616fbffea173ff3£ Combine green chiles, shallots, cilantro roots, garlic, Thai basil, lemongrass, galangal, kaffir lime peel, shrimp paste, cumin seeds, turmeric, coriander seeds, salt, and white pepper in a mortar and pestle; pound into a smooth paste. 
976dfe693af775f87ac38d96eab1971e£ Place peppercorns in a mortar and pound with a pestle until finely ground. Add cilantro root and garlic; pound until everything is mashed together well. Set aside. Heat oil in a skillet over medium heat and cook garlic paste until fragrant, about 2 minutes. Add pork and cook, stirring often, until pork is cooked through and mixed well with garlic paste, about 5 minutes. Season with fish sauce and palm sugar and stir until well combined. Mix in peanuts. Taste pork; it should taste savory with a hint of sweetness. Adjust seasonings if necessary. Peel, core, and slice pineapple into 1-inch slices. Cut slices into bite-sized pieces and lay onto a serving dish. Top pineapple pieces with pork mixture. Garnish each pineapple piece with a cilantro leaf and a sliver of red chile pepper. 
e9a13d6b023889f5a44092f7b4bcff6c£ Set oven rack about 6 inches from the heat source and preheat the oven&#39;s broiler. Line a baking sheet with aluminum foil. Place serrano peppers with cut sides down onto the prepared baking sheet. Cook under the preheated broiler until the skin of the peppers has charred, 5 to 8 minutes. Immediately put peppers in a heatproof bowl, cover tightly with plastic wrap, and let sit until cool enough to handle, 5 to 10 minutes. Scrape the skins off with your fingers, core and seed chile peppers. Dice peppers. Cut rib-eye steak into thin slices. Chop slices finely. Transfer to a bowl. Add serrano peppers, egg, panko, sriracha sauce, ginger, salt, pepper, and lime zest. Wet your hands and form mixture into ping pong-sized balls. Coat a saute pan with olive oil and heat over medium-high heat. Add meatballs and sear both sides evenly, about 4 minutes. Pour in beer and soy sauce. Stir in peanut butter and reduce heat; simmer sauce until thickened, 5 to 10 minutes. Garnish with cilantro. 
0dc2e7439c336b28ac5df6dfabe89d2e£ Whisk chicken stock, peanut butter, coconut aminos, brown sugar, lime juice, rice wine, chile sauce, garlic, and ginger together in a bowl. Set sauce aside. Fill a large pot with lightly salted water and bring to a rolling boil; stir in rice noodles and return to a boil. Cook noodles uncovered, stirring occasionally, until tender yet firm to the bite, 4 to 5 minutes. Heat oil in a skillet over medium heat. Add carrots and cook for 1 minute. Add chicken; cook and stir until chicken is no longer pink inside and juices run clear, 5 to 7 minutes. Add cooked noodles and pour sauce over noodles. Reduce heat to medium-low to prevent overcooking noodles. Cook and stir until sauce thickens, 3 to 5 minutes more. Stir in bean sprouts and green onions and remove from heat. Garnish with chopped peanuts, cilantro, and sriracha sauce. 
2a038a886e9d4a7524df8930a05f406e£ Heat 1 tablespoon oil in a skillet over medium heat. Fry tofu until browned on all sides, 5 to 7 minutes. Transfer to a bowl. Add sesame oil and onion to the same skillet and cook onion until soft and translucent, 3 to 5 minutes. Add curry paste and stir for 1 to 2 minutes. Add chiles; cook and stir for another 1 to 2 minutes. Add coconut milk and bring to a boil, mixing well. Add eggplants and bell pepper to the skillet with the coconut milk. Cook until eggplant is almost tender, 10 to 15 minutes. Add tofu and tomatoes; cook until warmed through, 1 to 2 minutes more. 
e468e7d2bc1e208ea4124253631c966d£ Heat 1 tablespoon oil in a wok or skillet and saute eggplant in batches on both sides until browned, 3 to 5 minutes per side, adding more oil as needed. Combine cilantro roots, onion, chile peppers, garlic, sugar, lime juice, and fish sauce in a mortar; crush with a pestle into a soft paste. Heat 1 tablespoon oil in a wok or skillet over high heat, add curry paste and stir-fry for 1 minute. Add eggplant, cover, and cook for 3 minutes. Mix in tofu and Thai basil. 
048b45973795e676e7e7f33c2cffbb1f£ Whisk peanut butter, 1/3 cup hot water, brown sugar, soy sauce, rice vinegar, and curry paste together in a bowl. Set peanut sauce aside. Heat 2 tablespoons oil in a deep skillet or large wok over medium-high heat. Add chicken, ginger, and garlic. Saute, stirring constantly, until chicken is no longer pink in the center and juices run clear, 5 to 7 minutes. Remove chicken from skillet and set aside. Pour 2/3 cup hot water into skillet. Add broccoli, carrot, and green beans. Cover and steam for 2 minutes. Remove vegetables from skillet and reserve steaming liquid in a bowl. Add 1 tablespoon oil to skillet. Add zucchini, onion, and red pepper; stir-fry for 4 minutes. Return steamed broccoli, carrots, and green beans to the skillet. Add remaining oil, if needed. Continue cooking until vegetables are tender but still crisp, 3 to 5 minutes more. Reduce heat to medium-low. Return cooked chicken to skillet. Add peanut sauce, scallions, 1/3 cup peanuts, and 1/3 cup cilantro. Stir thoroughly and heat through, 1 to 3 minutes. Add reserved steaming liquid to thin sauce, if necessary. Garnish with lime wedge and remaining peanuts and cilantro. Sprinkle with red pepper flakes. 
2490dec1bbc75976876f5c3d08cfcc9b£ Heat oil in a medium pot over medium heat. Add curry paste and stir until fragrant, 2 to 3 minutes. Add pork. Stir-fry until cooked through and coated in curry paste, 3 to 5 minutes more. Add coconut milk and bring to a gentle boil. Add squash. Reduce heat and simmer until squash is barely cooked through, 7 to 10 minutes. Add cabbage and simmer 5 minutes more. Season with fish sauce and sugar. 
f72993951a61ef1c508b53002fa9bf00£ Combine tofu, whiskey, fish sauce, light soy sauce, black soy sauce, and oyster sauce in a bowl and marinate for 10 minutes. Meanwhile, heat oil in a wok over medium heat and fry cashews until browned, 3 to 5 minutes. Transfer cashews to a bowl and pour out oil. Add garlic to the wok and stir-fry for 1 minute. Stir in tofu and onion and stir-fry for 1 minute. Add palm sugar and chile peppers. Continue cooking for 2 more minutes. Add water and stir until well mixed. Remove from heat. Sprinkle the cashews and green onions on top. 
475e8cdd80799b2c298a251d711a8036£ Cover mung bean noodles with warm water and soak until soft, about 30 minutes. Cut into 1/2-inch pieces. Combine pork, bean sprouts, cabbage, mung bean noodles, egg, light soy sauce, sugar, and white pepper in a bowl. Mix well. Heat 1 tablespoon oil in a skillet over medium-high heat and cook garlic until fragrant, about 1 minute. Add pork mixture and stir-fry until pork is cooked through and looks somewhat dry, about 3 minutes. Add more soy sauce, sugar, or pepper to taste. Set aside to cool. Stir 1 tablespoon flour with some water to make a sticky paste for sealing the spring rolls. Lay 1 spring roll wrapper on a flat work surface with one of the corners facing you. Place a scant teaspoon of the cooled filling right below the middle of the wrap. Fold the corner facing you over the filling. Roll the filling up about a half turn. Fold the left and right sides in to create an envelope shape. Finish rolling up the spring roll tightly, sealing the top corner with a dab of the flour paste. Store unused wrappers and finished spring rolls under a moistened kitchen towel, to prevent them from drying out. Heat oil in a heavy pot over medium-low heat. Fry spring rolls in batches until cooked through and golden brown, about 5 minutes. Drain on paper towels and serve immediately. 
3f24a5a5215f11b1438e04e0a0a5b9d4£ Heat 2 tablespoons oil in a skillet over medium-high heat. Drop in a cumin seed to test the heat; if it sizzles, it is hot enough. Add cumin seeds and cook until they begin to crackle, about 1 minute. Add bananas and sliced garlic. Cook until bananas are browned on both sides, about 3 minutes. Transfer bananas to a bowl. Heat remaining oil in a skillet over medium-high heat and cook onions until soft and starting to brown, about 5 minutes. Add minced garlic and butter beans and cook until butter beans are warmed through, about 2 minutes. Add bananas and curry paste. Stir thoroughly, but try not to mash the bananas. Pour in coconut milk and cook on medium-low heat until thickened, about 15 minutes. Add cilantro and cook for 5 minutes more. 
24195419b99e7de07ea4cbd22e28d6df£ Mix mangoes, onion, avocado, and peanuts together in a large bowl. Combine soy sauce, sugar, lime juice, Thai pepper sauce, and garlic in a small bowl. Pour dressing over mango mixture. Stir until thoroughly coated. Let salad sit at room temperature for 10 minutes before serving so flavors can blend. 
5a01e5bce4b5bb84538e354125fa3c68£ Preheat the oven to 450 degrees F (230 degrees C). Place catfish on a baking sheet. Roast in the preheated oven until flesh is opaque, 10 to 15 minutes. Flake into large pieces with a fork. Lay the flaked fish out on a plate to dry. Heat oil in a large pan over medium-high heat. Fry fish in batches until golden brown, about 5 minutes. Try not to break up the fish too much in the pan. Toss mango, shallots, cilantro, green onions, peanuts, fish sauce, lime juice, Thai chiles, and sugar together in a large bowl. Toss in crispy catfish at the very last minute. Check the seasoning; the salad should taste sour, hot, and salty, with a slight sweetness at the end. 
97a4b2214123649288d725b01ec4e557£ Mix mangoes, red onion, bell pepper, mint, cilantro, and chile pepper together in a bowl. Mix fish sauce and sugar together in a bowl until dissolved. Pour dressing over salad. Refrigerate at least 2 hours. Top with peanuts and lime juice just before serving. 
2b286cd8351b7342294972d35a3773ad£ Combine water, black rice, and salt in a saucepan. Bring to a boil. Reduce heat and cover; simmer for 40 minutes. Add coconut milk and sugar. Bring back to a boil. Reduce heat and simmer, uncovered, until rice reaches a sticky consistency, about 30 minutes. Remove from heat and allow mixture to cool. Stir and serve. 
717ea32a61a481fe82793add8083c479£ Bring broth to a boil in a large pot. Remove the outermost leaf from each stalk of lemongrass. Pound stalks to release flavor; cut into 1-inch lengths. Add the lemongrass, Thai chiles, garlic, lime leaves, and galangal to the broth. Cover and boil for 10 minutes. Reduce heat and add shrimp, mushrooms, onions, and tomatoes to the broth. Boil for 3 minutes. Add fish sauce and sugar; cook for 2 minutes more and remove from heat. Stir in cilantro and lime juice. 
e063ea0bb1b89c58b1ee83ba4ba265d4£ Bring water to a boil in a saucepan. Add lemon grass, galangal, and kaffir leaves. Cook for 1 minute. Add fish sauce and cook for 1 minute. Add chile paste and reduce heat to medium. Add tomatoes and cook 2 to 3 minutes. Add mushrooms and cook for 1 minute. Increase heat to high and add chicken. Cook, stirring occasionally, until chicken is cooked through, about 5 minutes. Add lime juice and stir. Add chiles to soup and remove from heat. 
550d68df8b942388bbf06d959c516e21£ Combine lemongrass, garlic, chiles, ginger, and lime zest in a food processor. Process until a fine paste forms. Place beef in a bowl and season with salt and pepper. Heat oil in a large Dutch oven over medium-high heat. Cook beef, turning occasionally, until browned, 10 to 15 minutes. Transfer beef to a plate. Cook lemongrass paste in the same Dutch oven stirring often, until beginning to soften, 5 to 8 minutes. Add soy sauce, brown sugar, fish sauce, browned beef and any juices, and 10 cups water. Bring to a boil and reduce heat. Simmer stew, partially covered and skimming occasionally, until beef is tender and liquid is slightly thickened, 2 1/2 to 3 hours. Meanwhile, preheat the oven to 350 degrees F (175 degrees C). Place coconut flakes on a rimmed baking sheet. Toast coconut in the preheated oven, tossing occasionally, until golden around the edges, about 4 minutes. Set aside. Add carrots and shallots to the stew. Continue cooking, partially covered, until vegetables are soft and beef is falling apart, 35 to 45 minutes more. Stir in green onions. Bring a large pot of lightly salted water to a boil. Cook rice noodles in boiling water, stirring occasionally, until noodles are tender yet firm to the bite, 5 to 7 minutes, or according to package directions. Divide cooked noodles into individual bowls and ladle stew on top. Top with toasted coconut and serve with lime wedges. 
6f74d044d179c03fdceb683aa9f2097a£ Combine water, potatoes, carrots, clam base, and dill in a large soup pot. Bring to a boil, then reduce to a simmer. Meanwhile, heat butter in a skillet over medium heat. Add shallots, jalapeno pepper, and garlic. Cook until shallots are translucent, about 5 minutes. Add wine and transfer mixture to the soup pot. Add coconut milk, crabmeat, lemongrass, lemon juice, and ginger to the soup pot. Add water to desired consistency. Simmer soup about 20 minutes more and season with black pepper. 
31af29282046f34e523379aab8a98e63£ Place rice noodles in a large bowl and cover with several inches of room temperature water; let soak for 30 to 60 minutes. Drain. Whisk sugar, vinegar, fish sauce, and tamarind paste in a saucepan over medium heat. Bring to a simmer, remove from heat. Heat 1 tablespoon vegetable oil in a skillet over medium-high heat. Add chicken; cook and stir until chicken is cooked through, 5 to 7 minutes. Remove from heat. Heat 1 tablespoon oil and minced garlic in a large skillet or wok over medium-high heat. Stir in eggs; scramble until eggs are nearly cooked through, about 2 minutes. Add cooked chicken breast slices and rice noodles; stir to combine. Stir in tamarind mixture, 1 1/2 tablespoons sugar, and salt; cook until noodles are tender, 3 to 5 minutes. Stir in peanuts; cook until heated through, 1 to 2 minutes. Garnish with bean sprouts, chives, paprika, and lime wedges. 
c80de9fd1bc461808f40f348389acfbb£ Fry the curry paste in the oil in a large skillet or wok over medium heat until fragrant. Stir the coconut milk into the curry paste and bring to a boil. Add the chicken; cook and stir until the chicken is nearly cooked through, 10 to 15 minutes. Stir the palm sugar, fish sauce, and lime leaves into the mixture; simmer together for 5 minutes. Taste and adjust the saltiness by adding more fish sauce if necessary. Garnish with sliced red chile peppers and Thai basil leaves to serve. 
01d9f836f1fc70e23cef9376a3054c81£ In a large saucepan over medium heat, heat peanut oil. Stir in garlic, ginger, lemon grass, red pepper, coriander and cumin and cook until fragrant, 2 minutes. Stir in chicken and onion and cook, stirring, until chicken is white and onion is translucent, 5 minutes. Stir in bok choy and cook until it begins to wilt, 5 to 10 minutes. Stir in water, coconut milk, fish sauce and cilantro. Simmer until chicken is thoroughly cooked and flavors are well blended, 30 minutes. 
24a7adf54829e5188d888335413e2dc9£ On a plate, combine the flour, cumin, cayenne pepper and 1/2 teaspoon of salt. Stir to distribute the spices. Coat the pork chops with the flour mixture, and shake off any excess. Heat the oil in a large skillet over medium-high heat. Place the pork chops in the hot skillet, and fry for about 4 minutes per side, until cooked through. While the pork chops cook, stir together the chicken broth, coconut milk, peanut butter, honey, ginger and 1/4 teaspoon of salt. Remove the pork chops to a serving platter, and keep warm. Pour the peanut sauce into the skillet. Cook, stirring constantly for 2 minutes, or until thickened. Pour peanut sauce over the chops, and garnish with green onion, bell pepper, peanuts and cilantro. 
cb38df4bb507e3c78de5fce2cfa1e9d5£ In a large bowl, mix together the chicken and bread crumbs. Season with green onion, ground coriander, cilantro, chili sauce and lemon juice; mix well. Using damp hands, form mixture into evenly shaped balls that are either small enough to eat with your fingers, or large enough to use as burgers. Heat oil in a large skillet over medium heat. Fry the chicken balls in batches until well browned all over. 
1516e2db5d8c1c5c092040040e88afe4£ Fill a large bowl with hot tap water and place the noodles in it to soak for 20 minutes. In a small bowl, stir together the fish sauce, lime juice, sugar, oyster sauce, 2 teaspoons of the chile sauce and chicken stock. Set aside. Heat a wok or large skillet over high heat and add vegetable oil. When the oil is hot, stir in garlic and cook for about 10 seconds. Add shrimp and chicken; cook, stirring constantly until shrimp is opaque and chicken is cooked through, 5 to 7 minutes. Move everything in the wok out to the sides and pour the eggs in the center. Cook and stir the eggs until firm. Add the noodles to the wok and pour in the sauce. Cook, stirring constantly, until the noodles are tender. Add a bit more water if needed to finish cooking the noodles. Stir in 3 cups of bean sprouts and green onions. Remove from the heat and garnish with chopped peanuts. Taste for seasoning, adjusting the spice or lime juice if needed. Serve garnished with fresh cilantro and remaining bean sprouts and lime wedges on the side. 
aa71a8b5216a5ad13198492837f43cf6£ In a large bowl, combine the soy sauce, garlic, ginger and hot pepper sauce. Mix well and place chicken in the bowl, turning to coat evenly. Cover and marinate in the refrigerator for at least one hour. Heat the sesame oil in a Dutch oven over medium high heat. Add the brown sugar, stirring until dissolved. Add the onion and saute for 5 minutes. Add the chicken parts and saute for 5 minutes, turning to brown evenly. Pour in marinade, add the water and bring to a boil. Reduce heat to low and simmer for 15 to 20 minutes. Add the peanut butter, stirring well, and simmer for 10 more minutes. Transfer chicken to a serving platter, pour sauce over, and garnish with the chives. 
9b55c2b63c964020106862c70072f597£ Heat olive oil and sesame oil in a skillet over medium-high heat. Reduce heat to medium, and cook green onions for one minute. Add tofu, and continue cooking 4 minutes more, sprinkling with soy sauce halfway through. Gently stir in the peanut butter and ginger, being careful not to break the tofu, until well incorporated. Remove from heat, and toss in coconut. Transfer to a serving dish, and sprinkle with sesame seeds. 
c32753494a3a812b5802cea316584eed£ In a large stock pot, combine the lime juice, coconut milk, wine, curry paste, garlic, fish sauce and sugar. Stir to dissolve sugar and curry paste and bring to a boil over high heat. Boil for 2 minutes then add mussels. Cover and cook, stirring occasionally, until mussels are opened, 5 to 8 minutes. Remove from the heat and discard any unopened mussels. Pour mussels and liquid into a serving dish and toss with cilantro. 
