f8bdea03c6bc0a3a92cda380fd450c6f£ Whisk together the oyster sauce, fish sauce, and sugar in a bowl. Heat the oil in a wok over medium-high heat until the oil begins to smoke. Add the garlic and serrano peppers, stirring quickly. Stir in the chicken, bell pepper, onion and oyster sauce mixture; cook until the chicken is no longer pink. Raise heat to high and stir in the chilled rice; stir quickly until the sauce is blended with the rice. Use the back of a spoon to break up any rice sticking together. Remove from heat and mix in the basil leaves. Garnish with sliced cucumber and cilantro as desired. 
f6ff05121b282c8a3f6aaca5603ef2dc£ In a food processor or blender, combine the coconut milk, almonds, onion, ginger, turmeric, lemon grass, and 1/4 teaspoon of salt. Process until smooth. Heat a large non-stick skillet over medium-high heat. Season the fish fillets with salt and pepper on both sides, then place them skin-side up in the skillet. Pour the pureed sauce over the fish. Use a spatula to coat the fish evenly with the sauce. Sprinkle with red pepper flakes. Reduce heat to medium, cover, and simmer for about 15 minutes, until the puree is thickened and fish flakes easily with a fork. 
f041adc5abbb8e46cd8aa111b8ee5ed1£ Preheat the oven to 400 degrees F (200 degrees C). In a small bowl, stir together the peanut sauce and peanut butter. Spread over the pizza crust. Arrange strips of chicken on top. Sprinkle on the green onions and cheese. Bake for 8 to 12 minutes in the preheated oven, until cheese is melted and bubbly. Top with bean sprouts, carrot shreds and peanuts, if using. Slice into wedges and serve. 
57385c7c5ece20a12cbbb4bb2ac22769£
c0dbf136d369471d64b3250695e0df9b£
0da3929d814f56661ec1aa53b3ac1253£ Bring a pot of water to a boil. Blanch the bean sprouts in boiling water for approximately 30 seconds, remove, and drain well. When the water returns to a boil, add noodles. Cook for 3 to 5 minutes until tender but firm; drain and rinse under cold water Beat the eggs with a pinch of salt in a small bowl. Stir together the lime juice, ketchup, brown sugar, and fish sauce in a separate bowl; set aside. Heat the oil in a wok or large skillet over medium-high heat. Fry the garlic for a few seconds. Add the pepper flakes and carrot, and cook for one minute, then remove. Add the beaten egg, and gently scramble. When the eggs have set, pour in the carrots, sauce, bean sprouts, noodles, peanuts, and green onion; toss together. 
192878668fbfb9799190b6db7e98065c£ Heat the oil in a large skillet over high heat; heat the curry paste in the oil about 30 seconds. Add the chicken and cook another 3 minutes. Stir in the onion, bell pepper, lemon zest, coconut milk, fish sauce, and lemon juice; bring to a boil; cook until the chicken is cooked through, 5 to 7 minutes. Sprinkle cilantro over the dish; stir. Serve hot. 
265c93210b17be3a7c820c36217a56eb£ Bring a large pot of lightly salted water to a boil. Break pasta into small pieces and add to boiling water; cook for 8 to 10 minutes or until al dente; drain. In a large bowl, toss together the pasta, cabbage, carrots, green, red and yellow bell peppers, 1/2 of the cilantro, 1/2 of the onions, and shrimp. In a small bowl, stir together the peanut butter, tahini, rice wine vinegar and sweet chile sauce. Season with soy sauce, sesame oil, brown sugar, garlic powder, salt and pepper. Ten minutes before serving, toss the sauce with the cabbage mixture until evenly coated. Garnish with remaining cilantro, green onions, peanuts and black sesame seeds. 
3e799e34bc521f206c6842674e34753d£ In a large bowl, stir together the green onions, lemon grass, cilantro, mint leaves, lime juice, fish sauce, chili sauce and sugar until well combined and the sugar is dissolved. Adjust the flavor, if desired, by adding more sugar and/or fish sauce. Set aside. Cook the steak over high heat on a preheated grill for approximately 4-6 minutes on each side, until it is cooked medium. Do not overcook the meat! Remove from heat and slice into thin strips. Add the meat and its juices to the sauce and refrigerate, tightly covered, for at least 3 hours. Tear the lettuce into bite size pieces and place in a salad bowl. Arrange the cucumber on top of the lettuce, and then pour the meat and sauce over. Top with the cherry tomatoes and garnish with fresh cilantro leaves. 
a47bfeef1fc336fad94fd9515287c9a5£ Cook rice noodles according to package directions. Slice chicken breasts into strips. Marinate in soy sauce for about 1/2 hour. In a large saucepan or wok, heat sesame oil over medium heat. Cook chicken until no longer pink. Add garlic, ginger, and onions; cook until onions are tender. Add mushrooms and cucumbers; cook until mushrooms are tender. Add peppers, carrot, peanut sauce, oyster sauce, and hot chili pepper sauce. Heat through. Toss cooked rice noodles with saute. Garnish with sesame seeds. 
3ea36607dcc45c51163ce07552060ad0£ Heat a wok over high heat until smoking. Pour in peanut oil, then immediately add garlic. Stir-fry garlic until it begins to turn golden brown, about 20 seconds. Mix in the ground chicken and continue cooking and stirring until the meat is crumbly and no longer pink, about 2 minutes. Stir in the sliced chilies, soy sauce, and fish sauce. Cook for about 15 seconds to soften the chilies, then add the basil, and continue cooking until the basil has wilted. 
117f382032978f8b3fc61ef306fe319e£ In a large bowl, mix together the honey, sweet chili sauce and soy sauce. Set aside a small dish of the marinade for basting. Place chicken drumsticks into the bowl. Cover and refrigerate at least 1 hour. Preheat an outdoor grill for medium-high heat. Lightly oil the grill grate. Arrange drumsticks on the grill. Cook for 10 minutes per side, or until juices run clear. Baste frequently with the reserved sauce during the last 5 minutes. 
de6b5e8b16714393bd94798b5589e0e2£ In a medium bowl, whisk together chili sauce, fish sauce, sesame oil, ginger, and garlic. Set aside a few tablespoons of the mixture for brushing the steaks during grilling. Score flank steak and place in a shallow dish. Pour remaining marinade over the steak, and turn to coat. Cover, and marinate in the refrigerator at least 3 hours. Preheat an outdoor grill for high heat. Lightly brush the grilling surface with oil. Grill steak 5 minutes per side, or to desired doneness, brushing frequently with the reserved marinade mixture. 
8b1bc4a5d9fbfe74d98be668cd6f1b25£ Fill a large pot with lightly salted water and bring to a rolling boil over high heat. Once the water is boiling, stir in the spaghetti, and return to a boil. Cook the pasta uncovered, stirring occasionally, until the pasta has cooked through, but is still firm to the bite, about 12 minutes. Drain well in a colander set in the sink. Meanwhile, whisk the cornstarch into the vegetable broth until dissolved. Whisk in the peanut butter, soy sauce, honey, brown sugar, sesame oil, ground ginger, and red pepper. Bring to a boil over medium-high heat, then reduce heat to medium-low, and simmer until thickened, about 5 minutes. Stir in the sake and keep warm. Heat the vegetable oil in a large skillet over medium heat. Stir in the garlic and onion; cook and stir until the onion has softened and turned translucent, about 5 minutes. Stir in the broccoli, carrots, red bell pepper, and sugar snap peas. Reduce heat, cover, and steam until the vegetables are tender, about 5 minutes. Toss the vegetables with the peanut sauce and pasta to serve. 
3dd00deacd226675006909e6a4c60a1a£ In a 2 quart saucepan, combine water and rice. Cover, and bring to a boil over high heat. Reduce heat, and simmer for 20 minutes. In a medium size bowl, combine the chicken and curry powder, and toss to coat. Coat a large nonstick skillet with cooking spray. Cook the chicken, stirring frequently, over medium-high heat for 4 minutes. Mix in the asparagus, snow peas, carrots and green onions; cook for 3 minutes. Pour in the coconut milk , continue cooking until sauce is hot, and chicken is cooked through. Serve over the hot, cooked rice. 
704039e877a8ac7fb1d96506c35da755£ In a resealable plastic bag, mix the soy sauce, fish sauce, hot pepper sauce, garlic, and ginger. Place the chicken in the bag, seal, and marinate at least 2 hours in the refrigerator. In a medium saucepan, bring the jasmine rice and 2 cups water to a boil. Reduce heat, cover, and simmer 20 minutes. Heat the sesame oil in a large skillet over medium heat. Stir in the brown sugar until dissolved. Stir in the onion, and cook about 5 minutes, until tender. Reserving the marinade mixture, place the chicken into the skillet, and cook about 10 minutes, until browned. Stir the reserved marinade and 3/4 cup water into the skillet, and bring to a boil. Continue to cook and stir 10 minutes, or until the chicken is no longer pink and juices run clear. Thoroughly blend in the peanut butter. Serve over the jasmine rice with a sprinkling of cashews. 
2c75d8a0b4418166568c66d365119f0c£ Place the pork roast, red bell peppers, garlic, teriyaki sauce, and rice wine vinegar in a slow cooker. Sprinkle with red pepper flakes. Cover, and cook 8 hours on Low. In a pot, bring the rice and water to a boil. Reduce heat to low, cover, and cook 20 minutes. Remove meat from slow cooker, and shred. Stir the peanut butter into the slow cooker. Return shredded meat to slow cooker, and mix with the sauce to coat. Serve over the cooked rice with a sprinkling of peanuts and green onions. 
3fef4c3e2d00d8709eb7520a6cc04a27£ Cook and stir the curry powder and curry paste in a saucepan over medium-low heat until fragrant, about 2 minutes. Pour the coconut milk into the saucepan and mix well. Stir in the fish sauce, brown sugar, and 1 cup chicken stock. Place the chicken thighs, peas, peppers, and carrots into the saucepan with the curry sauce. Bring the mixture to a boil over medium-high heat, then reduce the heat to low. Simmer until the chicken is cooked though, about 25 minutes. Whisk together 1 tablespoon of cornstarch with 2 tablespoons of cold chicken stock. Stir cornstarch mixture into the curry. Mix the pineapple into the curry and cook until the sauce thickens, about 5 minutes. 
3d66a6cd81bbad7c4d1b8d8c706fc5b4£ In a saucepan over medium heat, combine coconut milk, peanut butter, onion, soy sauce, brown sugar, and pepper flakes. Bring to a boil, stirring frequently. Remove from heat, and keep warm. 
e7a5500f3c67db79b593487c1df4efef£ Heat oil in large skillet and cook chicken until it is no longer pink, about 2-3 minutes. Reduce heat to low and add ginger, Hoisin sauce, Peter Pan peanut butter and McCormick cayenne pepper. Cook, stirring frequently, until sauce is bubbly and warm, 1-2 minutes. Remove from heat and sprinkle with scallions. Serve immediately. 
1f0ef9972666968842939a0c4f3a8e73£ In a medium saucepan, heat oil and butter over low heat. Cook garlic, shallots, chilies, and lemongrass in oil until fragrant (be careful not to burn the garlic). Stir in chicken stock, coconut milk, and pumpkin; bring to a boil. Cook until pumpkin softens. In a blender, blend the soup in batches to a smooth or slightly chunky consistency, whatever you prefer. Serve with basil leaves. 
5ba4aa3fb876c8e82ba9b880f484ef52£ In a bowl of cool water, soak a wrapper until limp. Lay wrapper out flat. Place 1/6 of each ingredient down middle of wrapper, starting with lettuce. Fold over each end and tightly roll the wrapper around the contents, as if making a burrito. Moisten at seam; press to close. Lay on plate, cover with moist paper towel and refrigerate until ready to serve. Then slice in two and serve with Quick Thai Dipping Sauce, below, or peanut sauce. To make the Quick Thai Dipping Sauce, combine all ingredients in a small bowl. 
305223341eb61eeecea12ad01bc67390£ Heat the oil in a skillet over medium heat, and cook the onion and yellow bell pepper until tender. Mix in the ketchup, oyster sauce, soy sauce, chicken broth, sugar, and chile paste. Place the chicken, zucchini, squash, broccoli, and mushrooms in the skillet. Continue to cook and stir 10 minutes, until vegetables are tender and chicken juices run clear. Mix in the cashews just before serving. 
68509ebbfb08f7fb413e83ebf3c4943b£ Heat oil in a skillet over high heat. Saute chicken pieces in hot oil for 6 to 7 minutes. Do not overcook! Preheat oven to 425 degrees F (220 degrees C). To Assemble Pizza: Spoon 1/4 of peanut sauce onto each pita. Sprinkle 1/4 of the browned chicken and 1/4 of the scallions on top of each. Top each &#39;pizza&#39; with 1 slice cheese. Place on a lightly greased cookie sheet and bake in the preheated oven for 10 to 12 minutes, until the cheese is melted and bubbly. Let stand for 1 to 2 minutes outside of oven before you cut with a pizza cutter. 
a331904bdb1bc48c36407494c943d12f£ Trim lemongrass and cut into matchstick size pieces. To make stock: Add the shrimp heads and shells to water, then cook for 20 minutes. Turn the fire off. Soak the heads and shells for further 20 minutes before discarding. Trim lemongrass and cut into matchstick size pieces. Add stock, lemon grass, kaffir lime leaves, galangal, chili padi, fish sauce, lime juice, sugar, and chili paste to a pot and bring to a boil. After boiling for 5 minutes, add shrimps and both mushrooms. Cook for further 10 minutes. Garnish with coriander leaves. 
d3750223384283bf9d2d15a4cc3718b7£ Bring a pot of water to a boil. Boil the shrimp until cooked, about one minute. Drain shrimp, and set aside. Pour the coconut milk and 2 cups of water in a large saucepan; bring to a simmer. Add the galangal, lemon grass, and lime leaves; simmer for 10 minutes, or until the flavors are infused. Strain the coconut milk into a new pan and discard the spices. Simmer the shiitake mushrooms in the coconut milk for five minutes. Stir in the lime juice, fish sauce, and brown sugar. Season to taste with curry powder. To serve, reheat shrimp in the soup, and ladle into serving bowls. Garnish with green onion and red pepper flakes. 
620acbedc8266dee38f61ec7e0bdcaa5£ Submerge the rice noodles in a large bowl of hot water for about an hour. Pour 1/2 tablespoon of oil into a large skillet, and add eggs. Scramble into medium-sized pieces, and transfer to plate. Set aside. In a saucepan, mix together peanut oil, peanut butter, water, soy sauce, milk, brown sugar, and lemon juice. Season with garlic powder and paprika. Heat until sauce is smooth. Season liberally with cayenne pepper. Drain noodles; noodles should be very flexible, but still relatively firm. Heat remaining 1 1/2 tablespoons vegetable oil in a large saucepan or wok. Cook noodles in oil, stirring constantly, until they are tender, about 2 minutes. Stir in peanut sauce, sprouts, carrots, scallions, ground peanuts, and the scrambled eggs. Continue to cook over low heat until vegetables are crisp-tender, about 5 minutes. Serve immediately, garnished with lime wedges. 
80cc782a464adb01fda635bcfc5e0b56£ Bring the rice and water to a boil in a saucepan over high heat. Reduce heat to medium-low, cover, and simmer until the rice is tender, and the liquid has been absorbed, 20 to 25 minutes. Set the cooked rice aside. Mix together curry powder, fish sauce, and pineapple juice in a small bowl. Heat the vegetable oil in a large skillet or wok over medium-high heat until the oil shimmers, and cook and stir the chicken and onion until the chicken is no longer pink and the onions are translucent, about 5 minutes. Stir in the cooked rice, pineapple chunks, and curry mixture, and cook and stir until the fried rice is hot, 5 to 10 minutes. 
00541f635a0cccac53ead9746fd76b04£ Combine 1/2 cup coconut milk, 2 teaspoons curry powder, 1 teaspoon sugar, 1 teaspoon fish sauce, and granulated garlic in a bowl; add chicken pieces and toss to coat. Cover and refrigerate for at least 2 hours. Thread marinated chicken pieces onto skewers. Heat olive oil in a large skillet over medium-high heat. Cook chicken skewers in hot oil until browned and no longer pink in the center, 3 to 4 minutes on each side. Bring 3/4 cup coconut milk to a simmer in small saucepan or skillet over medium heat. Stir 1 tablespoon curry powder into the coconut milk and simmer for 4 minutes. Add chicken broth, peanut butter, 1 tablespoon sugar, lime juice, and 1 tablespoon fish sauce; simmer for 1 minute. Serve dipping sauce with chicken skewers. 
bfefb84dbf8e08a084af03bae4b34f05£ Combine all ingredients in a large bowl and stir well. Transfer to a serving bowl and spoon over seafood of your choosing. 
7b297a5a821d68c7d98fa9c56e52dae5£ Cut cilantro roots off at the stem, and mince thoroughly. Set aside a few leaves for garnish. In a blender or food processor, combine cilantro roots and leaves, garlic, chile peppers, turmeric, curry powder, sugar, and salt. Process to a coarse paste. Pour in fish sauce, and blend until smooth. Place chicken in a large shallow dish. Rub with the cilantro paste. Cover, and marinate in the refrigerator at least 3 hours, or overnight. Preheat grill for high heat. Lightly oil the grill grate. Place chicken on the prepared grill, and brush liberally with coconut milk. Grill chicken 8 to 15 minutes on each side, depending on the size of the pieces. Turn only once, and baste occasionally with coconut cream. Cook until browned and tender, and juices run clear. 
8a9eaa00994bd815e9305d319f8d55a2£ In a medium bowl, soak the noodles in cold water for 15 min; drain. Cover noodles with hot water, and soak for 15 minutes; drain. Rinse with cold water, drain, and set aside. Heat oil in a wok or large heavy skillet over medium heat. Saute onion and garlic until onion is soft and translucent, about 5 minutes. Add shrimp, and cook until pink. Stir in ketchup, fish sauce, sugar, lemon juice and vinegar. Pour in the beaten egg, and cook without stirring until egg is partially set. Add drained noodles, 1/4 pound bean sprouts, and 1/2 cup peanuts. Mix while cooking until noodles are tender. 
6c1270c09d2d7eb0ea746971212ef041£ Combine the garlic, ginger, jalapeno, salt and turmeric in the container of a food processor or blender. Process to a smooth paste. Set aside. Heat oil in a skillet over medium heat. Add onion, and cook until translucent, stirring frequently. Mix in the spice paste, and cook for a few minutes to release the oils. Add shrimp, and cook for a few minutes until pink, then add the tomatoes and coconut milk. Cover, and simmer for about 5 minutes, then remove the lid and simmer an additional 5 minutes to thicken the sauce. Stir in the fresh basil during the last minute of cooking. 
7938c6e0784159c29b0cc95151f2de54£ In a medium bowl, mix peanut butter, green onions, soy sauce, lemon juice, brown sugar, garlic, coriander, and cayenne pepper; add pork, and stir to coat. Cover, and marinate in the refrigerator at least 30 minutes. Preheat grill for high heat. Thread marinated pork, water chestnuts, green bell pepper, red bell pepper, and sweet onion alternately onto skewers. Transfer remaining marinade to a small saucepan, bring to a boil, and cook for several minutes. Lightly oil grate. Cook skewers for 10 minutes, or to desired doneness. Turn skewers while grilling to cook evenly, and brush with boiled marinade during last few minutes. 
8e9b114853a451f1bf40dd1147208d4e£ Over medium heat, whisk coconut milk and curry paste together in a large saucepan. Simmer for 5 minutes. Stir in chicken broth, water chestnuts, bamboo shoots, bell pepper, mushrooms, and chicken. Season with fish sauce and basil. Simmer for 10 more minutes, or until chicken is cooked, yet still tender. 
0de2bdf23e50f052b22394382c770504£ Place the dry rice noodles in a bowl, cover with hot water, and let soak until white and softened, about 1 hour. Drain the noodles, and set aside. Heat 1 1/2 teaspoon of olive oil in a wok or large skillet over low heat, and cook and stir 2 minced garlic cloves until brown and beginning to crisp, 2 to 3 minutes. Stir in the soaked noodles, 1/2 teaspoon of thick soy sauce, and 2 teaspoons of sugar, and cook and stir until the noodles have absorbed the soy sauce and turned brown, about 3 minutes. Remove the noodles from the skillet. Heat the remaining 1 1/2 teaspoons of olive oil in the wok over low heat; stir in the remaining 2 minced garlic cloves, and cook until brown and beginning to crisp, 2 to 3 minutes. Raise the heat to medium-high, and stir in the pork, serrano pepper, basil, 1/2 teaspoon thick soy sauce, 1 teaspoon sugar, and salt. Cook and stir until the pork is no longer pink and the edges of the meat are beginning to brown, about 5 minutes. Return the noodles to the wok, and stir in the bean sprouts. Cook and stir until heated through, about 5 more minutes. 
e0fb8cac79a1b7a07a929d5f71dca947£ In a wok, combine coconut milk, curry paste, fish sauce, and minced pepper. Slowly bring to a simmer over medium low heat, stirring frequently. Reduce heat to low, and add shrimp. Cook uncovered, stirring frequently, until prawns are cooked and flavors mellow, about 15 minutes. 
aa16d421bef3bde201caf03bd7595817£ In a small bowl, mix together mayonnaise, coconut, and mint. Cover, and refrigerate for at least 1 hour. In a large bowl, mix together ground chicken, panko crumbs, Thai peanut sauce, curry paste, green onion, parsley, soy sauce, garlic, lemon juice, lime juice, and hot pepper sauce. Be careful not to over-mix. Divide into 8 equal size balls. Flatten into patties about 1/2 inch thick. Preheat the grill for medium-high heat. Lightly oil the grill grate. Grill burgers for 6 to 8 minutes per side, or until well done. Serve on toasted buns with Coconut-Mint Mayonnaise. 
c53983af03b67b72631eb5bacf3ffb00£ In a large pot of lightly salted boiling water, cook the udon noodles for about five minutes or until tender. Drain and rinse the noodles under cold running water and let cool. Whisk the peanut butter, milk, ginger, garlic, vinegar, soy sauce, sesame oil, and red pepper flakes in a small bowl until well blended. In a large salad bowl, combine the cooked noodles, cucumber, sprouts, carrot, green onions and mint. Wisk the peanut butter dressing and pour it over the salad. Stir until well coated and serve chilled on a bed of romaine leaves. Garnish with the roasted and chopped peanuts. 
deb11bf2f3d71e720d3ac7d6f49e4400£ Heat the oil in a large skillet over medium-high heat. Cook and stir the shallots, garlic, and ginger in the hot oil 3 to 4 minutes, until shallots are tender. Mix in the green curry paste. Cook and stir 1 minute. Season the chicken with salt and pepper, and place the chicken and lemon grass in the skillet. Cook 5 minutes, until chicken begins to brown. Mix in the baby corn and water chestnuts. Cook and stir until the chicken is no longer pink and juices run clear. Mix the coconut milk into the skillet, and bring to a boil. Reduce heat, and simmer, stirring occasionally, until the coconut milk has thickened. Top with basil leaves to serve. 
bb01c063db6893bdd6df1c254c7221e2£ Soak rice vermicelli noodles in a bowl filled with hot water until softened, 30 minutes to 1 hour. Drain and set aside. Heat peanut oil over medium heat in a large wok. Cook and stir tofu in the wok, turning the pieces until they are golden on all sides. Remove tofu with a slotted spoon and drain on plate lined with paper towels. Pour all but 1 tablespoon of used oil from the wok into a small bowl; it will be used again in a later step. Heat the remaining 1 tablespoon of oil in the wok over medium heat until it starts to sizzle. Pour in beaten egg and lightly toss in the hot oil to scramble the egg. Remove egg from the wok and set aside. Pour reserved peanut oil in the small bowl back into the wok. Toss garlic and drained noodles in wok until they are coated with oil. Stir in vegetable broth, lime juice, soy sauce, and sugar. Toss and gently push noodles around the pan to coat with sauce. Gently mix in tofu, scrambled egg, salt, chili flakes, and 3 tablespoons peanuts; toss to mix all ingredients. Mix in bean sprouts and green onions, reserving about 1 tablespoon of each for garnish. Cook and stir until bean sprouts have softened slightly, 1 to 2 minutes. Arrange noodles on a warm serving platter and garnish with 3 tablespoons peanuts and reserved bean sprouts and green onions. Place lime wedges around the edges of the platter. 
aa4b84eb825da2009474e135dc60088f£ Place the dry rice noodles in a bowl, cover with hot water, and let soak until white and soft but not mushy, about 10 minutes. Drain and set aside. Bring a small pot of water to a boil; cook the broccoli in the boiling water until cooked and still firm, 5 to 7 minutes. Drain and set aside. Heat the oil in a skillet over medium heat; cook the garlic in the hot oil until fragrant, 3 to 5 minutes. Stir in the sliced steak; cover the skillet and cook until the meat is just turning from pink to grey, 5 to 7 minutes. Whisk the water and cornstarch together in a bowl; pour into the skillet along with the oyster sauce, soy sauce, fish sauce, and sugar. Add the rice noodles and broccoli and stir to mix evenly. Season with salt and pepper. Allow the mixture to simmer while you prepare the egg. Prepare a small skillet with cooking spray and heat over medium-low heat. Cook the egg in the prepared skillet until cooked through and the yolk is solid. Add the cooked egg to the other skillet and stir to incorporate. Serve hot. 
6a4dbd20f271e6c22df2efa8b5359922£ Dissolve the cornstarch in 1/2 cup of cold water; set aside. Whisk together the soy sauce, peanut butter, brown sugar, white vinegar, sesame oil, and 1 cup warm water in a small saucepan over medium heat; simmer and stir until sugar has dissolved. Stir in the cornstarch mixture; simmer until the sauce is thick, 1 or 2 minutes. Serve warm. Garnish with chopped peanuts and mint leaves as desired. 
