762abbea08fe4c8d9a6e417848e0cf8e£ In a large saucepan over medium heat, heat peanut oil. Stir in garlic, ginger, lemon grass, red pepper, coriander and cumin and cook until fragrant, 2 minutes. Stir in chicken and onion and cook, stirring, until chicken is white and onion is translucent, 5 minutes. Stir in bok choy and cook until it begins to wilt, 5 to 10 minutes. Stir in water, coconut milk, fish sauce and cilantro. Simmer until chicken is thoroughly cooked and flavors are well blended, 30 minutes. 
1049016f5b4b796c11c4dcca43df9794£ Place chicken breasts in a large pot and cover with water; bring to a boil. Reduce heat to medium-low and simmer until no longer pink in the center, about 20 minutes. Drain and cool until easily handled. Pour rice into a strainer. Rinse with cold water and drain. Repeat once more. Heat oil in a large saucepan over high heat. Add 1/2 cup sliced ginger and 2 tablespoons crushed garlic; saute until fragrant, 1 to 2 minutes. Stir in rice; reduce heat to medium. Season rice with 1 tablespoon sugar and 1/4 teaspoon salt. Cook and stir until rice turns white, adding water to prevent it from burning, about 10 minutes. Remove rice from heat and add pandan leaves. Transfer to a rice cooker. Pour in chicken stock. Cook rice according to manufacturer&#39;s instructions until tender. Fluff lightly with a rice paddle. Combine 1 cup chopped ginger, 1/2 cup chopped garlic, chile peppers, 6 tablespoons sugar, dark soy sauce, soy sauce, lime juice, vinegar, soybean paste, cilantro, chicken bouillon granules, and 1 teaspoon salt in a blender; blend into a smooth sauce. Pour sauce into a pot over medium heat. Simmer for 5 minutes. Slice chicken and serve over rice, with sauce alongside. 
8ca04d74d018aaea8668f58d4c3a184d£ Combine garlic, tapioca flour, fish sauce, soy sauce, sugar, and white pepper in a bowl; add prawns and toss to coat. Heat 2 tablespoons oil in a heavy skillet over high heat. Add 1/2 of the prawns in single layer; fry until golden brown and crispy, 1 to 2 minutes per side. Repeat with remaining oil and remaining prawns. 
b0e6517c07c587dadf8f9ee0ec37b668£ Toss the cucumbers, dried shrimp, beans, and tomatoes together in a bowl. Stir the Thai chilies, palm sugar, fish sauce, and lime juice together in a small bowl; pour over the cucumber mixture. Toss to combine. Adjust seasoning to your taste. Sprinkle chopped peanuts over the mixture to serve. 
b9cc59088ab418692117fd7a8bf3efd6£ Whisk together rice vinegar, fish sauce, lime juice, palm sugar, red pepper flakes, and black pepper in a large bowl. Marinate chicken into rice vinegar mixture; set aside while preparing remaining ingredients. Separate rice noodles in warm water, about 5 minutes; drain. Heat the vegetable oil in a large skillet or wok over medium heat. Cook and stir the garlic and onion in the hot oil until the onion is soft and translucent, about 5 minutes. Increase heat to medium-high. Stir chicken and marinade into onion mixture; cook and stir until chicken is no longer pink in the center and sauce begins to thicken, 7 to 10 minutes. Stir rice noodles, oyster sauce, soy sauce, red bell pepper, tomatoes, green onion, and basil leaves into the chicken mixture; cook and stir until sauce is evenly distributed and noodles are tender, 5 minutes more. 
e78e0e7439551d8c86f811268dddecba£ Combine the rice and water in a saucepan; bring to a boil; cover and reduce heat to low. Simmer until water is absorbed, 15 to 20 minutes. While the rice cooks, mix together 1 1/2 cups coconut milk, 1 cup sugar, and 1/2 teaspoon salt in a saucepan over medium heat; bring to a boil; remove from heat and set aside. Stir the cooked rice into the coconut milk mixture; cover. Allow to cool for 1 hour. Make a sauce by mixing together 1/2 cup coconut milk, 1 tablespoon sugar, 1/4 teaspoon salt, and the tapioca starch in a saucepan; bring to a boil. Place the sticky rice on a serving dish. Arrange the mangos on top of the rice. Pour the sauce over the mangos and rice. Sprinkle with sesame seeds. 
507bcd3d94c6c3c197b0d3056ea5d9a3£ Place grated carrots in a large bowl. Combine sugar, water, and vinegar in a saucepan and bring to a boil; cook until sugar is dissolved, about 5 minutes. Reduce heat to medium; add garlic, fish sauce, and curry paste to sugar mixture and simmer until flavors blend, 2 to 5 minutes. Remove saucepan from heat and cool dressing completely, about 30 minutes. Stir lime juice and red pepper flakes into dressing and pour over carrots. Add peanuts and toss to coat. Refrigerate until chilled, at least 30 minutes. 
6cff8e4eb568dce3be3089a90e4bd9db£ In a medium bowl, stir together the coconut milk, ground coriander, curry powder, fish sauce, and chili oil. Add the chicken breast strips, and stir to coat. Cover, and refrigerate for at least 30 minutes, and up to 2 hours. Preheat an indoor or outdoor grill for high heat. Thread the chicken strips onto skewers. Discard marinade. Grill chicken for 2 to 3 minutes per side, until no longer pink. Time will depend on how thick your strips are. Transfer to a serving plate, and garnish with cilantro and peanuts. Serve with peanut sauce for dipping. 
f2cd434a502607cc5a14b5c92ad23596£ Blend chile peppers, onions, cilantro, oil, garlic, coriander, lemon zest, cumin, shrimp paste, paprika, peppercorns, lemon grass, turmeric, and salt together in a blender until a smooth, paste-like consistency is reached. 
821e73c6d9cc27071f8b235aede53313£ Season chicken pieces with salt and pepper. Heat oil and curry powder in a large skillet over medium-high heat for two minutes. Stir in onions and garlic, and cook 1 minute more. Add chicken, tossing lightly to coat with curry oil. Reduce heat to medium, and cook for 7 to 10 minutes, or until chicken is no longer pink in center and juices run clear. Pour coconut milk, tomatoes, tomato sauce, and sugar into the pan, and stir to combine. Cover and simmer, stirring occasionally, approximately 30 to 40 minutes. 
8edec5516004344984904f14a337416a£ Bring a large pot of water to a boil. Add noodles and cook until tender according to package directions. Drain. Meanwhile, combine chicken broth, ginger, soy sauce, peanut butter, honey, chili paste, and garlic in a small saucepan. Cook over medium heat until peanut butter melts and is heated through. Add noodles, and toss to coat. Garnish with green onions and peanuts. 
5184477f05d55110ca0620bf36111d37£ Heat the oil in a large pot over medium heat. Cook and stir the ginger, lemongrass, and curry paste in the heated oil for 1 minute. Slowly pour the chicken broth over the mixture, stirring continually. Stir in the fish sauce and brown sugar; simmer for 15 minutes. Stir in the coconut milk and mushrooms; cook and stir until the mushrooms are soft, about 5 minutes. Add the shrimp; cook until no longer translucent about 5 minutes. Stir in the lime juice; season with salt; garnish with cilantro. 
bdeb34372e15fd97a122e3dc17ddb0a0£ Soak rice noodles in cold water 30 to 50 minutes, or until soft. Drain, and set aside. Heat butter in a wok or large heavy skillet. Saute chicken until browned. Remove, and set aside. Heat oil in wok over medium-high heat. Crack eggs into hot oil, and cook until firm. Stir in chicken, and cook for 5 minutes. Add softened noodles, and vinegar, fish sauce, sugar and red pepper. Adjust seasonings to taste. Mix while cooking, until noodles are tender. Add bean sprouts, and mix for 3 minutes. 
ddc7112f30ec7258e9066fbe525a0a65£ In a mixing bowl, combine peanut butter, soy sauce, lime juice, brown sugar, curry powder, garlic and hot pepper sauce. Place the chicken breasts in the marinade and refrigerate. Let the chicken marinate at least 2 hours, overnight is best. Preheat a grill to high heat. Weave the chicken onto skewers, then grill for 5 minutes per side. 
0e4ecdb31d67af23facb6a85bf60691a£ Whisk chicken broth, oyster sauce, soy sauce, fish sauce, white sugar, and brown sugar together in a bowl until well blended. Heat large skillet over high heat. Drizzle in oil. Add chicken and stir fry until it loses its raw color, 2 to 3 minutes. Stir in shallots, garlic, and sliced chilies. Continue cooking on high heat until some of the juices start to caramelize in the bottom of the pan, about 2 or 3 more minutes. Add about a tablespoon of the sauce mixture to the skillet; cook and stir until sauce begins to caramelize, about 1 minute. Pour in the rest of the sauce. Cook and stir until sauce has deglazed the bottom of the pan. Continue to cook until sauce glazes onto the meat, 1 or 2 more minutes. Remove from heat. Stir in basil. Cook and stir until basil is wilted, about 20 seconds. Serve with rice. 
170e7118a934257271f05fd5ef02f902£ Toss chicken first in 1 tablespoon dark soy sauce, then in the flour, coating pieces evenly. Heat the oil in a large skillet over medium high heat. Place chicken in the skillet, cook and stir chicken until browned, about 5 minutes. Remove chicken. Reduce heat to medium and stir in curry paste. Cook for 1 minute until fragrant, then stir in green onions, garlic, and ginger; cook an additional 2 minutes. Return chicken to the skillet, stirring to coat with the curry mixture. Stir the coconut milk, fish sauce, 1 tablespoon soy sauce, and sugar into the chicken-curry mixture. Allow to simmer over medium heat for 20 minutes until the chicken is tender. Serve garnished with cilantro leaves. 
01cd8252e2ae0067c4bd2754c1737414£ Bring rice and water to a boil in a pot. Reduce heat to low, cover, and simmer 25 minutes. In a bowl, whisk together curry paste and 1 can coconut milk. Transfer to a wok, and mix in remaining coconut milk, chicken, fish sauce, sugar, and bamboo shoots. Bring to a boil, and cook 15 minutes, until chicken juices run clear. Mix the red bell pepper, green bell pepper, and onion into the wok. Continue cooking 10 minutes, until chicken juices run clear and peppers are tender. Remove from heat, and stir in pineapple. Serve over the cooked rice. 
0d4088f84acd36f0a46eb558a7f075bc£ Heat the oil in a large skillet over medium-high heat. Add the chicken pieces; cook and stir for about 3 minutes. Mix in the curry paste, zucchini, bell pepper, carrot and onion. Cook and stir for a few minutes. Dissolve the cornstarch in the coconut milk, then pour into the skillet. Bring to a boil, then simmer over medium heat for 1 minutes. Right before serving, stir in the cilantro. 
592f6110807e2d37a184e5813be81f52£ Bring rice and water to a boil in a pot. Cover, reduce heat to low, and simmer 20 minutes. In a bowl, mix the coconut milk, soy sauce, rice wine vinegar, fish sauce, and red pepper flakes. In a skillet or wok, heat the oil over medium-high heat. Stir in the onion, ginger, and garlic, and cook until lightly browned. Mix in chicken strips, and cook about 3 minutes, until browned. Stir in the coconut milk sauce. Continue cooking until sauce is reduced be about 1/3. Mix in mushrooms, green onions, and basil, and cook until heated through. Serve over the cooked rice. 
d0f00549df93e9d1664b6c10c82402c1£ Place the chicken breast strips, bell pepper and onion into a slow cooker. Pour in the chicken broth and 1/4 cup of soy sauce, then season with cumin, garlic, red pepper flakes, salt and pepper. Stir to blend, then cover and cook on Low for 4 1/2 to 5 hours. Remove 1 cup of the liquid from the slow cooker, and mix this with the cornstarch, peanut butter, 1 tablespoon of soy sauce and lime juice. This should blend into a fairly thick sauce. Stir the sauce back into the slow cooker, and place the lid on the pot. Cook on High for 30 minutes. Garnish with green onions, cilantro and peanuts before serving. 
f431d3b6befbc2ecccb5b492075e5598£ Heat the oil in a skillet over medium-high heat, and cook the garlic and chile peppers until golden brown. Mix in chicken and sugar, and season with garlic salt and pepper. Cook until chicken is no longer pink, but not done. Stir oyster sauce into the skillet. Mix in mushrooms and onions, and continue cooking until onions are tender and chicken juices run clear. Remove from heat, and mix in basil. Let sit 2 minutes before serving. 
77c46b3a617841df8a8d6e38166c2d15£ Cut chicken into thin strips and saute in oil for to 2 to 3 minutes until the chicken turns white. In a pot, bring coconut milk and water to a boil. Reduce heat. Add ginger, fish sauce, lime juice, cayenne powder and turmeric. Simmer until the chicken is done, 10 to 15 minutes. Sprinkle with scallions and fresh cilantro and serve steaming hot. 
a13fe1ddeec604b2e2d82e971e48e017£ In a bowl, mix the peanut butter, coconut milk, water, lime juice, soy sauce, fish sauce, hot sauce, ginger, and garlic. Mix in the cilantro just before serving. 
09e45d5f6c2bacc2f294d5849894bb63£ In a large pot, cook soba noodles according to package directions. Drain, rinse noodles with cold water, and set aside. Pour into a large bowl the sesame oil, rice vinegar, soy sauce, and lime juice. Mix in lime zest, brown sugar, garlic, and red pepper flakes; stir until sugar dissolves. Toss in carrots, peanuts, and cilantro. Cut noodles into 3-inch lengths. Stir into dressing mixture. Cover, and refrigerate at least 1 hour. Toss salad again before serving. If dry, splash with soy sauce and vinegar. Serve cold. 
a10677d1bbf7a49bdffe60fdc77ad53f£ Heat 1 tablespoon oil in a skillet over high heat. Add cabbage and 1 tablespoon water stir-fry for 30 seconds. Remove cabbage from skillet and place on a serving platter. Heat the remaining 1 1/2 tablespoons oil in the skillet over high heat. Place the garlic and shrimp in the skillet and stir until garlic is lightly browned and shrimp turns pink. Add pepper, onion, cilantro, soy sauce and remaining water to the skillet. Stir-fry for 10 seconds. Pour the hot mixture onto the cabbage. 
9f69b1fd47f6f21bf63f7cecac236758£ Place the rice and 2 cups water in a pot, and bring to a boil. Reduce heat to low, cover, and simmer 20 minutes. Pour the remaining 10 cups water into a large pot, and bring to a boil. Place chicken in the pot. Stir in kaffir lime leaves, lemon grass, green onions, garlic, tomatoes, fish sauce, mushrooms, cilantro, red chile peppers, and tamarind soup base. Cook chicken 30 minutes, or until juices run clear. Remove chicken from pot, debone, and chop. Return meat to the soup, and discard bones. Serve over cooked rice. 
36499cc08d791e4059cbb217d14ab197£ Place duck legs fat-side down in a large skillet over medium-high heat, searing them on both sides until golden, about 3 minutes per side. Remove legs from pan, and reserve about 3 tablespoons of fat. Place onions in skillet with reserved duck fat, and cook over medium heat until they are soft and translucent, about 5 minutes. Stir in garlic, serrano peppers, and ginger; cook for about 3 minutes. Skim the coconut cream from 1 can of coconut milk, and stir the cream into the onion mixture. Stir in the curry paste, and cook until fragrant, about 1 or 2 minutes. Stir into the skillet the additional 2 cans of coconut milk, kaffir lime leaves, green onions, and fish sauce. Return duck legs to the pan. Simmer on low heat until just done, about 15 minutes. (If the curry sauce needs further reducing, remove the duck legs to an oven set at low heat, and cook down the sauce over medium heat.) Meanwhile, bring a large pot of lightly salted water to boil, and cook the noodles according to package directions. When done, drain, and run cold water over noodles. Set aside. Toss the noodles in the curry, and serve with chopped cilantro. 
b58fe3186619e80d261a8d0e14421556£ Bring the rice and water to a boil in a saucepan over high heat. Reduce heat to medium-low, cover, and simmer until the rice is tender, and the liquid has been absorbed, 20 to 25 minutes. Once cooked, spread the rice into a shallow dish, and refrigerate until cold, or use 1 1/2 cups leftover cooked rice. Heat the oil in a wok or large skillet over medium-high heat. Stir in the garlic and cook a few seconds until fragrant, then stir in the carrots and onion, and continue cooking until the onion begins to soften. Add the cold rice, and cook and stir until hot. Pour in the soy sauce, soy seasoning, green onions, cashews, raisins, salt, and white pepper. Cook and stir until hot, then stir in the quartered lychees to serve. 
5b79b7cf77ddfa01d87111d66257fca1£ Heat oil in a saucepan over medium heat; gently cook and stir rice in the hot oil until toasted, 2 to 3 minutes. Add coconut milk, water, sugar, and salt; bring to a boil. Reduce heat, cover saucepan, and simmer until rice is tender and has absorbed all the liquid, 20 to 25 minutes. Stir coconut cream into rice. Scoop rice into a serving bowl and top with mango. 
334d6cc3f0e0cf1a008e58d92f56ab58£ Whisk coconut milk, liquid amino acid, peanut butter, red curry powder, red curry paste, basil, red pepper flakes, and brown sugar together in crock of a slow cooker. Add onion, bell pepper, and cilantro to slow cooker; stir. Place chicken in slow cooker. Cook on High until chicken is no longer pink in the center, about 3 hours. Add snap peas, stir, and continue cooking until peas are heated through, 5 to 10 minutes more. 
9c6ba1f1a114aa184904c31de3e95673£ Place water, sugar, star anise, cinnamon stick, and cardamom in a saucepan; bring to a boil. Remove from heat and add tea bags. Let tea steep and cool to room temperature, about 1 hour. Remove tea bags and strain out whole spices; discard. Whisk in condensed milk. Pour into a large pitcher and refrigerate until flavors combine, at least 1 hour. Fill 4 glasses with ice. Serve tea over ice. 
cd088afa1c79e9fabc1437616505578e£ Bring the coconut milk to a boil in a pot. Add the bananas to the coconut milk and cook until tender, about 15 minutes. Dissolve the sugar and salt into the mixture. Stir the coconut cream through the mixture. Remove from heat; serve hot. 
017f2a648f510a2cd8d6029c89e1347a£ Bring water to a boil in a pot. Place rice noodles in a large bowl. Pour boiling water over noodles and allow to soak until softened, about 20 minutes. Drain. Heat vegetable oil in a wok over medium heat. Cook and stir garlic and pork in hot oil until pork is no longer pink in the center, about 5 minutes. Stir in soaked rice noodles, bean sprouts, dried shrimp, palm sugar, fish sauce, soy sauce, and lime juice, stirring until palm sugar has dissolved. Cook until noodles are heated through, 3 to 4 minutes. Stir in salted radish until combined. Lightly toss peanuts and noodle mixture together until combined Transfer to a platter. Garnish with cilantro. 
3a5e2109af3664a220957d76e3327c38£ Blend chile peppers, onions, cilantro, oil, garlic, coriander, lemon zest, cumin, shrimp paste, paprika, peppercorns, lemon grass, turmeric, and salt together in a blender until a smooth, paste-like consistency is reached. 
c2890537579e3f29c0eb6cf26680ba78£ Heat a large skillet or wok over medium heat and cook bacon until browned and crisp, about 5 minutes. Drain, reserving bacon grease in a bowl. Spoon 2 tablespoons grease back into the skillet. Increase heat to medium-high and cook garlic until fragrant, about 30 seconds. Add onion and cook, stirring often, until softened, 2 to 3 minutes. Stir in tomato and pineapple and stir-fry until warmed through, about 2 minutes. Increase heat to high and add 1 tablespoon bacon grease. Add rice and stir-fry, breaking up with a spatula so it gets coated well with bacon grease. Cook for about 3 minutes. Season with ketchup, soy sauce, sugar, and white pepper. Move rice mixture to one side of the skillet or wok and pour beaten eggs onto the empty side. Stir-fry until eggs are almost set, 2 to 3 minutes. Mix eggs with rice mixture. Fold in bacon bits. Serve with cucumber, green onions, cilantro, lemon wedges, and chile peppers. 
a67c99d9943f97e10db3d21c273c23cc£ Combine pork, sugar, fish sauce, garlic, salt, and pepper in a bowl. Mix together thoroughly. Dissolve baking powder in 1 tablespoon water and blend completely into the pork mixture. Cover bowl with plastic wrap and chill in the refrigerator for 1 hour. Preheat an outdoor grill for medium heat and lightly oil the grate. Thread a handful of the pork mixture through a skewer using lightly oiled hands. Shape meat into a 1-inch-thick sausage around the skewer. Repeat with the remaining pork and skewers. Grill skewers, turning as needed, until browned on all sides and no longer pink in the center, about 15 minutes. Cut each sausage into bite-sized pieces before serving. 
fce08bc942abe51317c259b354413288£ Bring 8 cups water to a boil in a large saucepan. Turn off heat. Place rice noodles into the hot water and soak for 20 minutes. Drain noodles and set aside. Whisk fish sauce, lime juice, sugar, oyster sauce, chile-garlic sauce, chicken stock, and 2 cloves minced garlic together in a saucepan. Bring to a boil; reduce heat to low, and simmer sauce while you prepare other ingredients. Cook and stir chicken in a skillet with vegetable oil until no longer pink in the center and juices run clear, 5 to 10 minutes. Remove chicken with a slotted spoon, and set aside. Stir shelled edamame, green onions, eggplant, 4 cloves minced garlic, mushrooms, water chestnuts, bean sprouts, cilantro, carrots, and cooked chicken into the same skillet, and cook and stir until eggplant and edamame are tender and the sauce has thickened slightly, about 15 minutes. Serve over rice noodles. 
39959fa77b20b683461d71de5a14b8d3£ Place the chili peppers in a bowl; pour enough water over the chili peppers to cover. Allow the peppers to soak until softened, about 10 minutes; drain. Chop the peppers and set aside. Grind the cumin, turmeric, coriander, and mace using a mortar and pestle into a fine powder. Add the galangal, lemon grass, salt, shallot, garlic, shrimp paste, fresh turmeric, and reconstituted chile peppers and grind into a paste. Stir the fish sauce and palm sugar into the paste. Transfer to a large bowl. Add the chicken to the paste and toss to coat the chicken evenly; allow to marinate for at least 20 minutes, or up to 24 hours in the refrigerator. Heat the oil in a large skillet over medium heat; cook the chicken until no longer pink in the center and the juices run clear, 5 to 7 minutes. Stir the water, 1/2 cup peanuts, ginger, and tamarind juice into the chicken, bring to a simmer, and cook until thickened, 20 to 30 minutes. You can also cook this at a lower temperature for up to 2 hours. Garnish with 2 tablespoons peanuts to serve. 
53f08ae8a5189862ffdd36a085bf1a3e£ Place the mung beans into a large container and cover with several inches of cool water; let stand 3 hours to overnight. Drain and rinse before using. Combine the beans with 5 1/4 quart water in a large pot over medium heat; cook until the beans are tender, about 30 minutes. Stir the sugar into the mixture; cook and stir until the sugar is completely dissolved. Remove from heat and serve warm. 
e97703f248cc63ce47434f52a54ebc3f£ Stir the chili-garlic sauce, garlic, lime juice, and white wine together in a small saucepan over medium-high heat; allow the mixture to simmer until reduced to about 1/3 its original volume, about 10 minutes. Set aside to cool. Pour the heavy cream into a saucepan and cook over medium heat until reduced to about 1/3 its original volume, about 10 minutes. Reduce heat the medium low. Whisk the cooled garlic mixture into the cream. Add the butter to the mixture about 2 tablespoons at a time, whisking vigorously to incorporate. Season with salt and pepper to serve. 
812232627ed50802da6cbdcd3e448def£ Bring water to a boil in a small saucepan. Remove from heat and add black tea; let steep about 10 minutes or to desired strength. Strain tea into a container and discard leaves. Add sugar and evaporated milk; stir until sugar is dissolved. Fill 2 glasses with ice. Pour tea over ice. Top each glass with 1 1/2 teaspoon milk. 
99637f444cecec0ae0d592173dc9e61d£ Place noodles in a large bowl and cover with hot water. Set aside until noodles are flexible but still firm, about 10 minutes. Drain. Heat a wok or large skillet over medium-high heat until it starts to smoke. Add oil; heat until it shimmers. Add peanuts; cook and stir until roasted, 1 to 2 minutes. Remove from wok. Stir chile peppers, shallot, and garlic into the oil; cook and stir until garlic just begins to brown, about 30 seconds. Add chicken and tofu; cook until no longer pink in the center and the juices run clear, 4 to 5 minutes. Add noodles, stirring quickly to mix in and prevent them from sticking. Add sugar, tamarind paste, fish sauce, and white pepper together; cook, stirring constantly, until sauce thickens, about 2 minutes. Push noodle mixture to one side of the wok; crack egg into the empty space. Stir until scrambled, 1 to 2 minutes; fold into noodles. Stir in shrimp; cook until opaque, 2 to 3 minutes. Add roasted peanuts, bean sprouts, chives, and lime juice; cook and stir until flavors combine, 1 to 2 minutes more. 
6f8c0cc61806169bd8c5f563c4d401ac£ Coat tofu with cornstarch in a bowl. Heat 2 tablespoons vegetable oil in a wok or large skillet over medium heat; fry tofu until lightly browned on all sides, 1 to 2 minutes per side. Place noodles in a bowl and pour in enough boiling water to cover; soak until softened, about 3 minutes. Drain. Combine water, sriracha, soy sauce, sugar, tamarind concentrate, and red pepper flakes in a saucepan over low heat. Cook and stir sauce until flavors blend, about 5 minutes. Heat 1 tablespoon vegetable oil in a wok over medium-high heat. Add tofu, noodles, and sliced onion; cook and stir until tofu is golden brown; about 3 minutes. Stir in sauce gradually until noodles are well-coated. Push noodle mixture to one side of the wok. Crack egg onto opposite side of wok; stir until beginning to set, 30 seconds to 1 minute. Stir egg into noodles gently. Garnish with green onions, peanuts, and lime wedges. 
