2478d59ce9e61550f86f70c7bb2d1980£ Combine 3 cups flour, baking powder, 1/4 teaspoon salt, egg and warm water in a medium size mixing bowl. Mix well. Knead the dough, adding flour until the dough in stiff and hard to work with, let the dough rest. Roll dough into a 1/2 to 3/4 inch wide cylinder. Bring a pot of salted water to boil. Using scissors cut dough in 1/2 to 3/4 inch pieces into the boiling water. The dumplings will sit on the bottom of the pot until almost done. When almost finished cooking, the knoephla will rise to the surface. Once they have risen to the surface let them cook 2 minutes longer. Drain well. Place oil in a large skillet and heat over medium-high heat. Add potatoes and salt and pepper to taste. Fry until potatoes are cooked through and golden brown. While potatoes are frying, place 1 tablespoon butter in a non-stick skillet, heat over medium-high heat. Cook the kneophla in batches, transferring the fried dumplings into the skillet with the potatoes. When all of the knoephla and potatoes are nicely browned and combined in one skillet, add the sauerkraut to the mixture and heat through. Serve immediately. 
5153794a5da196a4b90596874efdc715£ Pound out cubed pork, and cut in half. Heat oil in a large skillet or Dutch oven over medium heat. Dip pork in egg, then bread crumbs, and place in hot oil. Cook, turning, until golden brown. Remove to a warm plate. Prepare gravy mix according to package directions. Stir in mushrooms, and cook with gravy. Meanwhile, bring a large pot of lightly salted water to a boil. Add the egg noodles, and cook until al dente, about 8 to 10 minutes; drain. Serve pork over noodles and smother with gravy. 
3c9ebc093c8cc36f16ffc1add55bfca4£ Preheat oven to 425 degrees F (220 degrees C). In a spice grinder or mortar, combine kosher salt, caraway seeds, sage, fennel, coriander, and rosemary. Grind to a coarse powder. Transfer spice mixture to a bowl and stir in paprika, garlic powder, flour, and onion powder; mix in vegetable oil to make a smooth paste. Pat chicken halves dry with paper towels and tuck wing tips up behind the back. Brush spice paste onto chicken halves, coating both sides, taking care to season under wings and legs. Place chicken halves in baking dish or roasting pan with skin sides up, leaving space around chicken so halves aren&#39;t touching. Roast in preheated oven until a thermometer inserted in a thigh reads 165 degrees F (74 degrees C), about 1 hour. Remove from oven and let rest for 10 minutes before slicing. 
4c0724a5f5e2c72c36c884b8a6ac8051£
1733e98d800b341c2e681c532591b2a1£ Place potatoes in a large pot and cover with salted water; bring to a boil. Reduce heat to medium-low and simmer until tender, about 20 minutes. Drain. Sprinkle on parsley and serve hot. 
c6975525578ca60691cdb076ca6a271e£ Mix together flour, salt, white pepper, and nutmeg. Beat eggs well, and add alternately with the milk to the dry ingredients. Mix until smooth. Press dough through spaetzle maker, or a large holed sieve or metal grater. Drop a few at a time into simmering liquid. Cook 5 to 8 minutes. Drain well. Saute cooked spaetzle in butter or margarine. Sprinkle chopped fresh parsley on top, and serve. 
23c1b24e552fac0795e4ec7cbebfecb3£ Combine flour, yeast, 2 tablespoons sugar, salt, 3/4 cup milk, and 3 tablespoons butter or margarine. Turn dough out onto a lightly floured surface. Knead until smooth and elastic, about 15 to 20 minutes. Place in a well greased bowl, and cover. Let rise in a warm place for 1 hour, or until doubled. Punch down the dough. Roll out to a 1/2 inch thickness. Spread into a greased 8 inch square baking pan. Cover, and let rise for 30 minutes. Melt 3 tablespoons butter or margarine and confectioner&#39;s sugar in a saucepan. Add almonds and 1 tablespoon milk. Remove from heat, and stir in honey. Spread evenly and carefully onto the dough. Allow dough to continue to rise for an additional 30 minutes. Bake at 400 degrees F (205 degrees C) for 20 to 25 minutes, or until crust turns golden brown. Cool completely on a wire rack. Dissolve cornstarch in a little milk. Combine 1 1/2 cups milk, cornstarch, and 1 tablespoon sugar inn the top of a double boiler. Heat while stirring until thickened, about 2 to 3 minutes. Add in beaten egg, and keep stirring for about 2 more minutes, or until thick. Remove from heat, and stir in extract. Chill, covered, in refrigerator for at least 1 hour. Beat the whipping cream with the cream of tartar until stiff. Fold into the chilled pudding. Cut the cooled almond crust bread into 1 1/4 x 2 inch rectangles. Slice each horizontally into halves. Fill with pudding mixture. Chill, and serve cold. 
393501677afd58f06741040b638a18ed£ Place the bread cubes into a large bowl. Heat the milk until it starts to bubble at the edges, then pour it over the bread cubes. Stir briefly to coat the bread. Let soak for 15 minutes. Meanwhile, melt the butter in a skillet over medium heat. Add the onions; cook and stir until tender. Stir in the parsley, and remove from the heat. Mix into the bowl with the bread along with the eggs, salt and pepper. Use your hands, squeezing the dough through your fingers until it is smooth and sticky. Bring a large pot of lightly salted water to a boil. The water should be at least 3 or 4 inches deep. When the water is boiling, make a test dumpling about the size of a small orange or tangerine, by patting and cupping between wet hands. Gently drop into the boiling water. If it falls apart, the dough is too wet. In this case, stir some bread crumbs into the rest of the dumpling batter. Form the remaining dough into large dumplings, and carefully drop into the boiling water. Simmer for 20 minutes, then remove to a serving plate with a large slotted spoon. They should come out soft, spongy and delicious! 
0405ed07577de72eed4cdbd1a84a69ea£ Beat the egg whites in a clean bowl until soft peaks form. Lift your beater or whisk straight up: the egg whites will form soft mounds rather than a sharp peak. Beat the egg yolks in a separate bowl until smooth; mix in the milk, sugar, salt, flour, and raisins until just moistened. Fold in the egg whites. Melt the butter in a large skillet over medium heat. Pour the batter into the skillet and cook until golden brown; flip and cook until set on the other side, about 1 minute. Tear the kaiserschmarren into pieces using two forks and continue cooking until golden brown, about 2 minutes. Sprinkle with confectioners&#39; sugar to garnish and serve with applesauce. 
907f69753e483aca05e4d50703481465£ Preheat oven to 350 degrees F (175 degrees C). Place chicken in a roasting pan, and season generously inside and out with salt and pepper. Sprinkle inside and out with onion powder. Place 3 tablespoons margarine in the chicken cavity. Arrange dollops of the remaining margarine around the chicken&#39;s exterior. Cut the celery into 3 or 4 pieces, and place in the chicken cavity. Bake uncovered 1 hour and 15 minutes in the preheated oven, to a minimum internal temperature of 180 degrees F (82 degrees C). Remove from heat, and baste with melted margarine and drippings. Cover with aluminum foil, and allow to rest about 30 minutes before serving. 
668aa920d17bc3207a3ea4270091cb7b£ Preheat oven to 350 degrees F (175 degrees C). Grease and flour one 9x13 inch cake pan. In a mixing bowl; beat oil and eggs with an electric mixer until creamy. Add the sugar and vanilla and beat well. Combine the flour salt, baking soda, and ground cinnamon together in a bowl. Slowly add this mixture to the egg mixture and mix until combined. The batter will be very thick. Fold in the apples by hand using a wooden spoon. Spread batter into the prepared pan. Bake at 350 degrees F (175 degrees C) for 45 minutes or until cake tests done. Let cake cool on a wire rack. Once cake is cool serve with a dusting of confectioners&#39; sugar or with a Cream Cheese Frosting. 
5c8a033468b393afe9d4d505b4beac42£ Bring a large pot of salted water to a boil. Add potatoes and cook until tender but still firm, about 30 minutes. Drain, cool and slice thin. Place bacon in a large, deep skillet. Cook over medium high heat until evenly brown. Drain, crumble and set aside, reserving drippings. Saute onions in bacon drippings until they are golden-brown. In a small bowl, whisk together the flour, sugar, salt, celery seed, and pepper. Add to the sauteed onions and cook and stir until bubbly, then remove from heat. Stir in water and vinegar, then return to the stove and bring to a boil, stirring constantly. Boil and stir for one minute. Carefully stir bacon and sliced potatoes into the vinegar/water mixture, stirring gently until potatoes are heated through. 
e618b5309b5236445f0272c0ca429dc8£ In a shallow dish, mix together the bread crumbs and flour. Season with salt and pepper. Place the egg in a separate dish. Heat oil in a large skillet over medium-high heat. Dip pork steaks in egg, then coat with the bread crumb mixture. Fry in the hot oil until browned on both sides and cooked through, about 5 minutes per side. Remove the pork to a platter and keep warm. Add onion and mushrooms to the skillet and cook until lightly browned. Pour in water and dissolve the bouillon cube. Simmer for about 20 minutes. Stir together the cornstarch and sour cream; stir into the skillet. Cook over low heat until thickened but do not boil. Spoon over the pork cutlets and serve immediately. 
fac94568fa5c2d65e0b3ff7b099d7a20£ Preheat oven to 350 degrees F (175 degrees C). Melt butter in a medium baking dish. In a medium bowl, mix flour, milk, eggs and salt. Pour the mixture into the prepared baking dish. Bake on center rack in the preheated oven for 30 to 40 minutes, until golden brown. 
2075b900f053cdbc1ca6baa58482fbb9£ Place butter, cabbage, apples, and sugar into a large pot. Pour in the vinegar and water, and season with salt, pepper, and clove. Bring to a boil over medium-high heat, then reduce heat to low, cover, and simmer until the cabbage is tender, 1 1/2 to 2 hours. 
7c21b77b9ae3b100851ea26fc17c3b7c£ Bring a large pot of salted water to a boil. Add potatoes; cook until tender but still firm, about 15 minutes. Drain, cool and chop. Place bacon in a large, deep skillet. Cook over medium high heat until evenly brown. Drain, crumble and set aside. Reserve bacon fat. Add the flour, sugar, water and vinegar to skillet and cook in reserved bacon fat over medium heat until dressing is thick. Add bacon, potatoes and green onions to skillet and stir until coated. Cook until heated and season with salt and pepper. Serve warm. 
6a4ba45512cf4205517decc9014297dc£ Cut the flank steak into thin filets; about 1/4 inch thick and 3 inches wide. Generously spread one side of each filet with mustard to taste. Place bacon, onions and pickle slices on each filet and form into a roll. Use string or toothpicks to hold the roll together. Heat a skillet over medium heat and melt butter. Place the rolls in the butter and saute until browned. Pour in 2 1/2 cups of water and add the bouillon cube; stirring to dissolve the bouillon cube. Simmer the rolls for about an hour. 
fdb7e5fca6a1c8abe560fae313e922f6£ In a saucepan, combine the water, sugar, and cinnamon stick. Bring to a boil, reduce heat, and simmer. Cut the orange in half, and squeeze the juice into the simmering water. Push the cloves into the outside of the orange peel, and place peel in the simmering water. Continue simmering for 30 minutes, until thick and syrupy. Pour in the wine, and heat until steaming but not simmering. Remove the clove-studded orange halves. Serve hot in mugs or glasses that have been preheated in warm water (cold glasses will break.) 
598bf08876b4c4196d9518728728a7e1£ In a slow cooker combine sausage, beer and sauerkraut. Cook on low for 5 to 6 hours, until the meat is tender and plump. 
6531ae4a66d258726bc9afbf8c15ca20£ Bring a large pot of salted water to a boil. Add peeled and cut potatoes; cook until tender but still firm, about 15 minutes. Drain, and transfer to a large bowl. Add onions. In a large bowl, whisk together the mayonnaise, oil, vinegar, sugar, parsley, salt and pepper. Gently stir in the potatoes and onion. Let stand for 1 hour before serving to enhance flavors. 
b232ac94bda1119cc50a8190b5641a0d£
6e9c1021b4f6fe760c828d5750d812f6£ In a large bowl, stir together 1 cup of flour, yeast, sugar, 2 tablespoons of butter, and 1 1/3 cup water. Let this mixture stand until bubble begin to form, about 15 minutes. Stir in the salt and gradually stir in the remaining flour until dough can be picked up and kneaded on the counter. Knead until smooth and elastic, about 8 minutes, adding more flour if needed. Divide the dough into 6 pieces and let them rest for a few minutes. Roll out one piece at a time into a rope about 15 inches long. Loop and twist into that cool pretzel shape. Set on a baking sheet while you roll out the remaining portions. Preheat the oven to 450 degrees F (220 degrees C). Bring the remaining 3 cups of water to a boil and add the baking soda. Remove from the heat. Dip pretzels into the water bath for about 45 seconds, flipping over about halfway through. Place the soaked pretzels on a greased baking sheet. Brush them with melted butter and sprinkle with coarse salt. Bake in the preheated oven until golden brown, 8 to 10 minutes. 
73c6229fe749b23cf7d0927a5f549e32£ Preheat oven to 350 degrees F (175 degrees C). Brown onion and ground beef in a large skillet over medium high heat; drain extra fat out of skillet, then stir in drained sauerkraut. Heat through and set aside. Press 1 package of crescent roll dough into the bottom of a lightly greased 9x13 inch baking dish. Spread beef mixture on top, then lay 2nd package of crescent roll dough over the top of the beef mixture. Press dough seams together and sprinkle all with cheese. Bake in preheated oven for 25 to 30 minutes, or until golden brown. 
ee96aef07ea83cfa3dec248a936f8ab8£ Cut the veal into steaks, about as thick as your finger. Dredge in flour. In a shallow dish, beat the eggs with 1 tablespoon oil, salt and pepper. Coat the veal with egg mixture, then with bread crumbs. Heat 1/4 cup oil in a heavy skillet over medium heat. Fry veal until golden brown, about 5 minutes on each side. 
b5d852c2bcf17ea8371031d44493ee07£ Preheat oven to 425 degrees F (220 degrees C). Place butter in a 10 inch cast iron skillet and heat the skillet in oven. Beat eggs at high speed with an electric mixer. Slowly add the milk and flour. Pour batter into hot skillet. Return skillet to oven and bake for 20 minutes. It will rise like a souffle, then fall when taken out of oven. Lightly dust with powdered sugar and serve. 
64ffa277d2f5ea1cab80b9dbcd1563f5£ Place the sauerkraut, caraway seeds, brown sugar, and apple into a large saucepan over medium-low heat, and bring the mixture to a simmer. Reduce heat to low, and cook for 2 hours, stirring occasionally. Preheat oven to 325 degrees F (165 degrees C). Grease a 9x13-inch baking dish. Place the bacon and onion into a skillet over medium heat, and cook until the bacon is almost crisp and the onion is beginning to brown, about 10 minutes. Stir the bacon mixture into the sauerkraut. In the same skillet, brown the kielbasa sausage in the remaining bacon grease until the sausage begins to brown, 10 to 15 minutes; stir into the sauerkraut mixture. Spoon the sauerkraut and sausage mixture into the prepared baking dish. Bake in the preheated oven until bubbling, about 1 hour. 
6b786e75e44b6ef5b4af0113f05186f6£ Preheat oven to 400 degrees F (200 degrees C). Grease a 9x13 inch baking pan with the melted butter. Place eggs, milk and flour in a blender and whip until smooth. Pour into prepared pan. Bake in preheated oven for 20 minutes, or until golden. In a small saucepan, combine sugar, buttermilk, butter, corn syrup, baking soda; boil for 7 minutes. Remove from heat and stir in vanilla. Spoon over slices of pancake. 
07a89bce3d57bef450c5cf3d6b1a465d£ Place potatoes into a large pot and cover with salted water; bring to a boil. Reduce heat to medium-low and simmer until tender, 15 to 20 minutes; drain. Combine chicken broth, vinegar, and oil in a large pot; bring to a boil. Add onion to broth mixture; cook until onion is desired tenderness, 2 to 6 minutes. Remove pot from heat and add potatoes, bacon, and dill; gently stir, adding more chicken broth if needed to moisten salad. Season potato salad with salt and pepper. 
3c892703b762a0a080454121cc3eb8c6£ Melt butter in a large skillet over medium heat; saute potatoes, onion, and 1 1/2 teaspoons black pepper until just tender, about 20 minutes. Stir 3 cups milk into potato mixture and heat until almost boiling, about 5 minutes. Remove skillet from heat. Bring water and chicken bouillon to a boil in a Dutch oven or heavy pot. Combine flour, 7 tablespoons milk, egg, dill, parsley, 1 teaspoon pepper, and salt together in a bowl until dough is stiff. Add more milk, 1 tablespoon at a time, if needed. Roll dough into ropes about 1/2-inch thick on a work surface. Cut ropes into 1/4-inch pieces and drop into boiling broth. Reduce heat, cover Dutch oven with a lid, and simmer until knoephla begin to float, about 10 minutes. Stir potato mixture into broth and knoephla; simmer until potatoes are tender, about 20 minutes. 
96223f9ccde165e4913a0307e24eacbc£ Place flour, egg, salt, cayenne, cream fraiche, and milk in a mixing bowl. Whisk together until batter drips slowly off the whisk. If batter seems too thin, add a bit more flour; if too thick, add a bit more milk. You can test the thickness using the smooth side of a cheese grater with fairly large holes. If a dollop of the batter does not drip through the grating holes, it&#39;s the right consistency. Bring a pot of salted water to a simmer over medium-high heat. Use a spatula to push a spoonful of batter through the holes of the smooth side of the grater into the simmering water. When dumplings rise to the surface of the water, they are done. This will take just a few minutes. Remove dumplings with a slotted spoon, and repeat in batches with remaining batter. 
337eaa8416eea24b676034f72a15c096£ Place potatoes into a large pot and cover with salted water; bring to a boil. Reduce heat to medium-low and simmer until tender, about 20 minutes. Drain; allow potatoes to cool slightly. Peel and slice potatoes. Mix potatoes and onions in a bowl; stir in mustard, salt, and black pepper. Bring vegetable stock to a boil in a small saucepan, pour over potato mixture and stir to combine. Stir in vinegar and let rest for 10 minutes. Stir in vegetable oil and season with salt and black pepper if desired. 
43c487a1d6fc182d6e6f860cc0c3bb57£ Mix cucumbers and salt in a bowl; let sit for 1 hour. Drain cucumber in a colander, squeezing as much excess liquid as you can with your hands. Combine cucumbers and green onions in a bowl. Stir sour cream, vinegar, oil, and dill together in a small bowl; drizzle over cucumber mixture and toss to coat. 
56d8ef695268b9c5eb12edee45a4b2cf£ Preheat oven to 350 degrees F (175 degrees C). Season pork loin with salt, black pepper, paprika, and caraway seeds; spread mustard over pork. Heat vegetable oil in a large skillet over medium-high heat; fry pork until browned on all sides, about 15 minutes. Transfer pork to a large roasting pan. Add onion, carrots, celeriac, and spring onion to the same skillet used to fry pork; cook and stir until vegetables are tender, about 10 minutes. Spread vegetable mixture around pork in roasting pan. Pour 1 cup hot water into the skillet used to cook the pork and vegetables; simmer and scrape up any browned bits from the bottom with a spatula. Pour water over pork. Bake in preheated oven until pork is slightly pink in the center, 2 1/2 to 3 hours, basting often. An instant-read thermometer inserted into the center should read at least 145 degrees F (63 degrees C). If vegetables become dry, add 1 cup hot water, or as needed. Transfer pork roast to a large platter and keep warm. Strain remaining liquid through a sieve into a saucepan; reserve vegetables. Bring liquid to a boil and add butter and cornstarch; simmer until sauce is thickened, about 5 minutes. Slice pork and serve with sauce and vegetables. 
e9c06447c0d3e3d44c1bec3b3cc2331b£ In a large bowl, stir together the melted butter, melted lard, white sugar, brown sugar, and eggs. Mix until well blended. Stir in the flour, baking soda, salt, cinnamon, and almonds. Shape the dough into two logs about 2 1/2 inches in diameter; wrap tightly in waxed paper and refrigerate 8 hours or overnight. Preheat oven to 350 degrees F (175 degrees C). Remove the dough logs from the fridge and let them rest at room temperature for about 5 minutes. Slice dough into slices about 1/4 inch thick. (The thinner you slice them, the crispier the cookies will be.) Bake in the preheated oven for 8 to 10 minutes until the edges begin to brown. Cool on wire racks. 
978447afad8b19315dbd1ba09f2d8837£ Beat the eggs, sugar, lemon peel and anise oil until very thick. Blend the flour and ammonium carbonate. Add in fourths to the egg-sugar mixture, mixing until blended after each addition. Cover dough with a clean towel and let stand at room temperature for 1 hour. Shape the dough into a ball and on a lightly floured surface, knead it lightly. Roll it out to 1/4 inch thick. Press a lightly floured springerle rolling pin or mold firmly into the dough to make clear designs. Brush the dough surface gently with a soft brush to remove any excess flour. Cut the frames apart, cover with a clean kitchen towel and let stand for 24 hours. Preheat oven to 325 degrees F (165 degrees C). Lightly grease cookie sheet and sprinkle the entire surface with anise seeds. Lightly brush the back of each frame with water and set on the anise seed coated cookie sheet. Bake for 8 minutes. When cookies are thoroughly cooled, store them in a tightly covered container for 1 to 2 weeks before serving. To soften cookies, store them for several days with a piece of apple or orange. 
2e076db95bcb24eedf76df28e0b079fd£ Bring a large pot of salted water to a boil. Add potatoes and cook until tender but still firm, about 15 minutes. Drain, cool and chop. Place bacon and onion in a large, deep skillet. Cook over medium heat until bacon is evenly brown. Drain excess grease from skillet. Add the sugar and vinegar to the bacon and onion mixture and bring to a boil. Pour the mixture over the potatoes and stir. 
1f278595dfdce261ff9ebdcd2058a7a2£ Place the fruit in a bowl with the rum, and soak for at least 1 hour. Sprinkle 1 1/2 tablespoons flour into the fruit, together with the almonds. Stir until the flour is completely absorbed. In a small bowl, stir the yeast and 1 teaspoon sugar into the water. Let stand for 15 minutes. Warm the milk until it is lukewarm, and stir in the remaining sugar until it has dissolved. Stir in the almond extract and lemon rind. Place all but 1/4 cup of the flour in a large bowl with the salt, and make a well in the center. Pour in the yeast mixture, and stir in a little of the flour from the edge of the well. Add egg and the milk and sugar mixture. Beat in softened butter. Mix together to form a dough. Turn dough onto a floured work surface. Knead, using the rest of the flour, for 15 minutes, or until no longer sticky. Knead in fruit and almonds. Clean and dry the bowl, and brush the inside with 1 tablespoon melted butter. Brush the top of the dough with another 2 teaspoons melted butter or margarine, and place it in the bowl. Cover the dough with a clean cloth. Let rise for 2 hours, or until doubled in size. Punch down the dough, and let it rest for 10 minutes. Roll it out into a 8 x 12 inch rectangle. Brush with remaining melted butter or margarine. Bring one long side across it, overlapping it in place with seam by about 1 inch. Press the edge gently to keep it in place. With floured hands, taper the ends of the loaf slightly and push the sides gently together to mound it in the center. The finished loaf should be about 3 1/2 inches wide and 14 inches long. Place the loaf on a floured baking sheet, and brush it with any remaining melted butter or margarine. Leave it in a warm place for 1 hour, or until doubled in size. Bake at 375 degrees F (190 degrees C) for 45 minutes, or until golden and crusty. Cool on a wire rack. Just before serving the stollen, sift the confectioners&#39; sugar over the top. 
fab1c5a7c2e28189f4b9b54093fa9c09£ Bring a large pot of salted water to a boil. Add potatoes and cook until tender but still firm, about 15 minutes. Drain, cool and chop. Place eggs in a saucepan and cover with cold water. Bring water to a boil; cover, remove from heat, and let eggs stand in hot water for 10 to 12 minutes. Remove from hot water, cool, peel and chop. Place bacon in a large, deep skillet. Cook over medium high heat until evenly brown. Drain, crumble and set aside. Reserve bacon drippings. Place potatoes in skillet with reserved bacon dripping, fry until heated through. Add escarole, bacon, eggs and vinegar. Cook until escarole becomes wilted and serve warm. 
62dbba6e81e4204de6287ea735c947ed£ In a large mixing bowl, beat the sugar and eggs together with an electric mixer for 20 minutes. Sift together the flour, cinnamon, cloves and pepper and stir them into the egg mixture. Roll the dough into 1 inch balls and place them on a lightly greased cookie sheet. Let the cookies sit out overnight to dry. Preheat the oven to 350 degrees F (175 degrees C). Bake the cookies for 10 to 15 minutes. Cool and store in an airtight container for a week to blend the flavors. 
