a9b56d8af15218f3d30ccc6f3e296350£ Grease a large bowl. Lightly grease three 5 x 9-inch loaf pans. Pour the warm water into a large mixing bowl, and stir in the yeast until dissolved. Allow to rest until the mixture becomes creamy, about 15 minutes. Stir in 2 tablespoons of white sugar and 3 cups of flour until evenly blended. Pour the prune juice into a pan, and stir in the condensed mincemeat. Bring the mixture to a boil over medium heat, stirring occasionally, and cook 1 minute at a rolling boil. Remove from the heat, and stir in the prunes, butter, raisins, walnuts, brown sugar, and salt. Combine the prune mixture with the yeast mixture in the mixing bowl. Gradually stir in the flour, 1 cup at a time, until well blended to make a moist dough. Turn out onto a floured board, and knead in any remaining flour to make 9 cups. Gather dough into a ball and place into greased bowl. Cover with a cloth, and place in a warm place until doubled in size, about 1 1/2 hours. Punch down dough, knead lightly on a floured board, and return to the bowl. Allow to rise again, about 1 hour. Turn dough out onto a floured board. Punch down and shape into 3 loaves. Place each loaf into a prepared loaf pan. Lightly grease tops of each loaf with1 teaspoon butter. Cover with a clean cloth, and allow to rise until doubled in size, about 1 hour. Preheat oven to 300 degrees F (150 degrees C). Bake in preheated oven for 1 hour. Lower heat to 250 degrees F (120 degrees C), and bake 1/2 hour more. Remove from pans, and cool on racks. 
3eb64431dd8bdf33326495d6aee26e8e£ Place the dill pickles, pickle juice, canola oil, fresh dill, and salt and pepper in a blender, and blend until smooth. 
8053f1eb51e095da58dfbb158f2be441£ Crumble the yeast into a small bowl. Pour in the sugar and water, and stir with a fork until the yeast has dissolved. Allow to sit for 15 minutes, then stir in the salt and clarified butter. Pour the flour into a large bowl and make a well in the center. Stir in the yeast mixture, then knead until the dough is smooth and elastic, about 12 minutes. Return dough to the bowl, cover with a cloth, and let rise in a warm place until doubled in bulk, about 1 hour. While dough is rising, cook bacon in a skillet over medium heat until nearly crispy; drain off fat. Mix together the sour cream, eggs, caraway seed, nutmeg, salt, and pepper in a bowl until smooth. Set aside. Preheat oven to 350 degrees F (175 degrees C). Roll out the dough into a rectangle to fit a baking sheet. Place the dough onto the baking sheet and sprinkle with bacon. Evenly cover the dough with well drained sauerkraut, then drizzle the sour cream and egg mixture over the sauerkraut. Bake on the middle rack of the preheated oven for 40 minutes, or until bread is browned on the top and underneath. Let cool slightly, then cut into squares to serve. 
febe038c230e393c384b21165008e8c9£ Remove any skin and bones from the mackerel, and place into the bowl of a food processor. Pulse until no large pieces remain. Add the cream cheese, butter, and lemon juice; process until smooth. Place into a small serving bowl, and refrigerate until firmed, about 2 hours. 
ef0c6f4bbcb3eab6bb7898c354676a25£
1ce8288049334d987df1d9d53e99cc4b£ Stir the sugar, vegetable oil, ketchup, vinegar, lemon juice, water, Worcestershire sauce, and minced onion together in a bowl until the sugar is dissolved and the ingredients are completely mixed. Chill in refrigerator 2 hours before serving. 
5c65a738aea6d6bfc1a473bfa7551666£ In a large bowl, stir together the honey, molasses, cinnamon, nutmeg and cloves until well blended. Mix in the candied orange peel, citron, almonds, brown sugar, orange and lemon zests. Stir the baking soda into the hot water, then beat into the mixture along with the egg. Gradually mix in the flour. The dough should be very stiff, you may need to knead it on the counter to get it thoroughly blended. Cover and chill overnight so the flavors can ripen. Preheat oven to 350 degrees F (175 degrees C). On a lightly floured surface, roll the dough out to 1/2 inch thickness. Cut into bars about 2 inches long and 3/4 inch wide. Place cookies 1 inch apart onto ungreased cookie sheets. Bake for 12 to 15 minutes in the preheated oven, until the bottoms are only starting to brown. Remove cookies to cool on wire racks. Ice them with a thin confectioners glaze while they are still warm, if you like. When cool, store in a tightly closed container. If you want soft cookies, put half an apple in the container for several days. 
7dc3b429b6afbd07b66f09136f03c3d0£ Pour the sauerkraut into a slow cooker with one can of the chicken broth and the caraway seeds. Cover, and cook on Low for 2 hours. Pour the remaining cans of chicken broth into a large pot, and bring to a rapid boil. In another saucepan, bring water, milk and margarine to a boil. Mix in instant potato flaked until well blended, remove from heat, and stir in the eggs, baking powder, and enough flour so that the dough is firm but not sticky. Pour the remaining cans of chicken broth into a large pot, and bring to a rapid boil. Pinch off pieces of the potato dough, and roll them into long thin dumplings (like pigtails). Drop the tails into the boiling chicken broth, and cook for 15 to 20 minutes. Strain the dumplings from the broth, and add them to the sauerkraut in the slow cooker. Season with salt and pepper. 
44d800a75a12ebee2c4820a6b49dd469£ Line the bottom of a large Dutch oven or slow cooker with the gingersnaps. Place the roast on the cookies and cover with water. Place the potatoes, carrots, celery and onion on top of the meat, and crumble the bouillon cubes into the water. Bring to a boil, reduce heat and simmer 3 to 6 hours (or 8 hours on low in a slow cooker), until meat is tender. 
fbdefbfd7ee8b13be6d43f76b0dca0b1£ Preheat oven to 350 degrees F (175 degrees C). Grease cookie sheets. In a large bowl, beat the egg, brown sugar, honey and molasses until smooth. Combine the flour, cinnamon, nutmeg, cloves, allspice and baking soda; blend into the molasses mixture. Stir in the almonds and candied citron. Working with 1/4 of the dough at one time, roll out the dough on a lightly floured surface to 1/4 inch in thickness. Cut into desired shapes with cookie cutters. Place the cookies at least 1 inch apart onto prepared cookie sheets. Bake in the preheated oven for 10 to 12 minutes or until set. Cool on wire racks and store at room temperature in an airtight container. 
ca5aee650400508a40ae7d28d8ae5485£ Place prunes and water in a large saucepan and let rest in refrigerator 8 hours or overnight. Cook prunes in same saucepan with soaking water over medium heat, covered, 1 hour, until soft. Let cool. In a small saucepan over medium heat, cook apples until soft, about 20 minutes. Reserve prune water and remove pits from prunes. Puree pitted prunes with cooking water in a food processor or blender until smooth. Combine prune puree and cooked apple in a large saucepan with the cinnamon stick. Combine the potato flour with the half-and-half and stir into fruit mixture. Bring to a boil, then stir in sugar. Reduce heat to medium-low, stir in grape juice and raisins, and partially cover. Let simmer until thoroughly heated, then remove from heat. Chill 2 hours in refrigerator before serving. 
b86e3d887623370049a598025d5fd645£ Heat milk over low heat until just below boiling. Remove from heat;stir in butter, honey and salt. Set aside and let cool. In a large bowl, combine yeast and lukewarm water. Set aside 5 minutes for yeast to soften. Add cooled milk mixture to softened yeast and beat in 4 cups flour. Knead dough in a bowl, adding up to 1/2 cup more flour if necessary, until a smooth, soft dough forms. Divide dough into 8 balls 3 inches in diameter. Place balls 4 inches apart on lightly greased cookie sheets; pat into 4 inch rounds. Set aside, lightly covered with kitchen towels, about 1 hour, or until doubled in size. Preheat oven to 350 degrees F (180 degrees C). Bake raised rounds 30 minutes, or until golden brown. Remove from oven; leave oven on. Let cool on sheets 10-15 minutes, or until cool enough to handle. With a serrated knife, cut each round into six 1/2-inch slices. Place slices, cut sides down, on cookie sheets and return to oven 5 minutes. Turn slices and bake 5 to 7 min. longer, or until golden on both sides. Turn off heat and leave zwieback in unopened oven until cool, about 45 minutes. Store in a tightly covered container. 
8d410baa9ed14249f6c3dbc4bcdc7159£ Preheat oven to 350 degrees F (175 degrees C). Toss pork and flour together in a bowl to coat. Place bacon in a large skillet and cook over medium-high heat until enough fat renders to coat the bottom of the pan; add pork and onion. Cook and stir the mixture until completely browned, about 10 minutes. Drain about half the grease from the skillet and return to heat. Season mixture with paprika; stir. Pour beer over the pork mixture, bring to a simmer, and cook 5 minutes. Spread sauerkraut into the bottom of a casserole dish. Pour pork mixture over the sauerkraut. Cover dish with aluminum foil. Bake in preheated oven for 45 minutes. 
d9e675b0648c4680a85cc1ac7f113d71£ Combine apple slices and cinnamon in a saucepan and cook over low heat for 10 minutes. If necessary, add a tiny bit of water so apples don&#39;t burn. Remove from heat and set aside to cool. Preheat the oven to 350 degrees F (175 degrees C). Grease a 10-inch springform pan with butter Combine butter, sugar, vanilla sugar, and egg in a large bowl; beat using an electric mixer until smooth and creamy. Mix flour and baking powder in a separate bowl. Add 2/3 of flour mixture, 1 tablespoon at a time, to butter mixture and beat on low speed. Add remaining flour mixture and mix in by hand to make a crumbly dough. Transfer 1/2 the dough into the prepared springform pan and press down to create a bottom crust. Add apple slices, leaving a small space around the edges. Crumble remaining dough evenly on top. Bake in the preheated oven until streusel and crust are lightly browned, about 50 minutes. Cool on a wire rack for 5 minutes. Run a table knife around the edges to loosen. Carefully transfer to a serving plate or cooling rack. 
f061290f59cfd7448d46ce4779f7689d£ Beat cream in a chilled glass or metal bowl using an electric mixer until frothy. Add vanilla sugar gradually, continuing to beat until soft peaks form. Pour frozen raspberries into a glass bowl and top with whipped cream. Layer meringue cookie chunks on top. Refrigerate for 2 to 3 hours. Serve and mix right before eating. 
810bec9995fa94003be4ff08e2937bc5£ Combine flour and baking powder in a large bowl. Mix in 1 cup sugar, vanilla sugar, and salt. Add 1 1/3 cups butter and eggs. Knead everything into a smooth dough. Shape dough into a ball, press flat, cover, and chill in the refrigerator 1 hour to overnight. Preheat the oven to 350 degrees F (175 degrees C). Grease a baking sheet with butter. Cut halved plums in half again, without cutting all the way through, so they fan out. Roll pastry dough out on a lightly floured work surface. Line the bottom and sides of the prepared baking sheet with dough. Mix 2 tablespoons sugar and cinnamon together in a bowl. Arrange plums side by side on the pastry dough; very small plums should overlap. Dot plums with 2 tablespoons butter and sprinkle with cinnamon sugar and almonds. Bake in the preheated oven until pastry crust is lightly browned, 30 to 40 minutes. Remove from oven. Allow plum cake to cool, then cut into squares. Serve lukewarm or at room temperature. 
eccaa96324875c1d02b24b601362036e£ Heat a large skillet over medium-high heat. Cook and stir beef, onion, and garlic in the hot skillet until beef is browned and crumbly, 5 to 7 minutes; season with salt and pepper. Transfer beef mixture to a bowl. Put cabbage and water into the skillet; bring water to a boil, reduce heat to medium-low, place a cover on the skillet, and cook cabbage at a simmer until soft, about 30 minutes. Stir beef mixture and tomato soup into the cabbage mixture; cook until hot, about 5 minutes. 
4c6dbc105d44b28460096c623ed329d2£ Dissolve yeast in 1/2 cup milk in a bowl; add 4 1/2 tablespoons sugar. Let stand until the yeast softens and begins to form a creamy foam, about 5 minutes. Stir yeast mixture and 2 1/4 cups flour together in a bowl until dough is dry and clumpy. Allow dough to rise for 15 minutes. Add remaining 1/2 cup milk, butter, egg, lemon zest, and salt to dough until evenly mixed. Knead dough, adding more flour as needed, until dough is elastic. Cover bowl with a clean damp towel or plastic wrap and allow dough to rise in a warm area until doubled in size, about 1 hour. Preheat oven to 390 degrees F (199 degrees C). Grease a baking sheet. Gently knead dough; roll into a long rope on the prepared baking sheet and twist into a pretzel shape. Cover dough with a clean towel or plastic wrap and allow to rise for 15 minutes more. Brush egg yolk over dough and sprinkle 1 teaspoon sugar over egg yolk. Bake in the preheated oven until golden brown, 25 to 30 minutes. 
9de33384f0e7f536ae01ccbe7f3fd645£ Bring milk to a boil in a saucepan; add rice and reduce heat to low. Simmer until rice is tender, about 20 minutes. Stir in sugar and salt. Remove from heat and allow rice to cool. Beat heavy cream in a bowl until stiff peaks form. Lift your beater or whisk straight up: the whipped cream will form sharp peaks. Fold whipped cream into cooled rice. Divide rice into 4 bowls and garnish with a few blackberries. Serve remaining blackberries on the side. 
efd637706786121b18e5b79a4d73688c£ Beat confectioners&#39; sugar and eggs together in a large bowl until thick. Place anise seed in a bowl. Pour water over anise seed into bowl and let mixture sit to steep, 2 to 3 minutes. Beat anise mixture and lemon zest into egg mixture. Sift flour and measure again. Sift flour once more together with baking powder. Add flour mixture to egg mixture and beat until dough forms. Divide dough into flat rounds, wrap each in waxed paper, and refrigerate for 1 hour. Roll dough out on a flat surface lightly dusted with confectioners&#39; sugar to 1/4-inch thickness. Roll dough with a springerle roller to shape cookies. Repeat with remaining dough rounds. Cover cut cookies with a towel and let dry for at least 6 hours or up to overnight. Transfer to baking sheets. Preheat oven to 375 degrees F (190 degrees C). Bake in batches in the preheated oven until edges are lightly golden, 12 to 15 minutes. 
824ee0d5ee188038d32c6e166f9b9d77£ Melt butter in a stockpot over medium heat; add onions, bacon, and bay leaf. Cook and stir the onion mixture until the onions are nearly clear, 5 to 7 minutes. Pour chicken broth into the pot; add potatoes, flour, marjoram, caraway seed, salt, and pepper. Bring the mixture to a boil, reduce heat to medium-low, and simmer until the potatoes are tender, about 20 minutes. Stir sour cream into the soup; cook another 1 to 2 minutes. 
d9ec9b58714cb2242be1429e7face2e8£ Wipe beef with a damp cloth and season with salt and pepper. Place seasoned beef in a large glass bowl. Combine vinegar, carrots, onion, peppercorns, cloves, bay leaves, and parsley in a bowl; pour over beef. Cover dish tightly with a lid or plastic wrap. Refrigerate beef, turning daily, for 3 to 7 days. Drain meat, reserving liquid and vegetables. Rub flour over all sides of beef. Heat butter in a large Dutch oven over medium-high heat; brown beef on all sides, 5 to 10 minutes. Add onions, carrots, and 2 cups reserved liquid. Cover Dutch oven, lower heat to medium-low, and simmer until meat is tender, about 2 hours. Transfer beef to a serving platter. Stir gingersnap crumbs and sugar into the liquid in Dutch oven; cook and stir until sauce is thickened, about 5 minutes. Pour sauce over meat. 
333c0fe473924a0804523c689c655b63£ Place potatoes into a large pot and cover with salted water; bring to a boil. Reduce heat to medium-low and simmer until tender, 30 to 40 minutes. Drain. Cool until easily handled, about 5 minutes. Peel while still warm. Cut into thin slices and put in a large bowl. Add onion. Mix hot broth with vinegar, oil, salt, and sugar. Pour immediately over warm potatoes and onion; the potatoes need to still be warm so they can absorb the dressing better. Allow to stand for 5 minutes; season with salt and pepper. Sprinkle with chopped chives and serve warm. 
552337abe89e1192e2089b0a16e7e44f£ Place sausages in a small pot and cover with water; bring to a boil. Reduce heat to medium-low and simmer until no longer pink in the center, 10 to 15 minutes. Drain. Cut into slices. Heat oil in a large pot over medium heat. Cook potatoes in the hot oil, stirring often, until they start to crisp on the edges, about 8 minutes. Stir in carrots, onions, leek, scallions, and garlic. Dissolve vegetable bouillon in hot water; pour into the pot. Season soup with salt, black pepper, marjoram, paprika, and nutmeg. Bring to a boil; reduce the heat and cook, covered, until carrots are tender, about 30 minutes. Stir sausage slices, parsley, and chives into the soup. Simmer until flavors combine, about 5 minutes. Stir in sour cream just before serving. 
6afebedfe7cebd887d8b76b09c1ffb6c£ In large bowl cream together shortening and confectioners&#39; sugar. Beat in uncooked egg yolks and hard-boiled eggs. Gradually blend in flour. Cover dough and chill for 8 hours or overnight. Pre-heat oven to 350 degrees F (175 degrees C) and lightly grease two cookie sheets. Roll out dough on floured surface to 1/4 inch thickness. Cut into pencil thick strips about 6 to 8 inches long. For each cookie, braid three strips and form into a circle pinching ends together. Place cookies 1 inch apart on cookie sheets. Brush with the beaten eggwhites. Sprinkle with confectioners&#39; sugar. Bake for 12 to 15 minutes until lightly colored. Cool on wire racks. 
1714dede3d0471723feac3c45e84a2ab£ In a medium size bowl, combine the flour, walnuts, baking powder, and spices. Set aside. In a large bowl, cream the vegetable shortening with the sugar until light and fluffy. Beat in the egg. Gradually blend in the dry ingredients. Cover and chill for 8 hours or overnight. Preheat oven to 350 degrees F (180 degrees C). On a floured surface, roll out the dough to a thickness of 1/4 inch. Cut into rounds using a 2-inch round cookie cutter and place 1-1/2 inches apart on ungreased cookie sheet. Bake for 15 to 18 minutes, until golden. Transfer to a wire rack to cool. Melt chocolate over low heat and drizzle over cooled cookies. 
70952809e735c31b7706bb6be1d1d58e£ Beat eggs until light and fluffy, gradually adding sugar ( approx. 15 minutes) This is important, do not underbeat. Fold in extract and flour. Roll dough out on lightly floured surface to about 3/8 inch. Use rolling pin to firmly &quot;imprint&quot; the design onto dough. Cut cookies apart and on greased baking sheet, sprinkle with anise seeds. Let cookies sit out overnight, covered, to &quot;dry&quot;. Preheat oven to 375 degrees F (190 degrees C). Place cookies into oven and reduce temp to 300 degrees F (150 degrees C). Bake until light yellow only, approx. 15 minutes. They are not supposed to get brown! These cookies are a hard cookie, need to be stored for at least 2-3 weeks. You can add a slice of apple to &quot;soften&quot; back up or a slice of bread works, too. Replace bread or apple every 2-3 days. 
9a8a9dba77ce62346e08783eaaa5fc57£ Prepare the hot roll mix according to manufacturers instructions, adding the 2 tablespoons of sugar. Cover dough and put in a warm draft free place to rise. Let rise until doubled, then punch down and divide into three pieces. Roll pieces of dough out into a circle about 8 or 9 inches in diameter. Place dough into three greased 8 or 9 inch pans, and let rise until doubled. In a saucepan over medium heat, combine the prunes and water. Simmer for 5 minutes, then remove from heat and cover. In a small bowl or cup, stir together the remaining sugar and cinnamon. Set aside. Preheat oven to 375 degrees F (190 degrees C). When the dough has risen, spread the prune puree over the three cakes. Stir sour cream to soften, and spread over the prunes. Dust with the cinnamon sugar mixture. Bake for 20 to 25 minutes in the preheated oven, until top edges are golden. Cover with more sour cream and cinnamon sugar if desired before serving. 
8acb2b53f81d3231fa598b485190e384£ Sift together the flour, baking powder and salt; set aside. In a medium bowl, cream together the butter, brown sugar and cinnamon until light and fluffy. Beat in the lemon zest, egg and vanilla. Mix in 1 cup of chopped almonds, then stir in the sifted ingredients. Press 2/3 of the dough into the bottom of a greased or parchment lined 8x8 inch baking pan. Roll the remaining portion between two pieces of waxed paper, out to an 8 inch square. Refrigerate all of the dough for at least 2 hours. While the dough is chilling, place the apricots into a small saucepan with water to cover. Bring to a boil and cook for three minutes. Remove from heat and set aside to cool. Drain the excess liquid from the apricots and mix in the preserves and lemon juice. Preheat oven to 350 degrees F (175 degrees C). Spread the apricot filling evenly over the chilled crust, leaving a 1/4 inch border on edges. Cut the chilled square of dough into 1/2 inch strips. Place the strips over the filling in a lattice design. Trim edges to fit and press the edges into the border. Brush the top with egg white then sprinkle with remaining chopped almonds and coarse sugar. Bake for 15 to 20 minutes in the preheated oven, until filling is bubbly and the crust is golden brown. Allow to cool completely before cutting into squares. 
2f16797f6db60614335011209aeee32b£ In a large bowl, beat eggs with sugar until thick and pale, about 10 minutes. Stir in the anise extract. Sift together the flour and baking powder; fold into the egg mixture. Cover and let rest for 15 minutes. Divide dough into 3 parts. On a lightly floured surface, roll the dough out to 1/4 inch thickness. Flour a springerle mold or rolling pin, and press the design into the dough. Cut apart the cookies and place them 1 inch apart onto a greased cookie sheet. Cover with a towel and let stand overnight. Preheat the oven to 300 degrees F (150 degrees C). Dust excess flour from cookies. Bake for 15 to 18 minutes in the preheated oven, until bottoms are lightly browned. Cool and store in an airtight container for up to 2 months. 
1970713ad08dc1bde59681de34342109£ Mix flour, basil, and onion powder in a large bowl. Season with salt and black pepper to taste. Make a well in the center of the flour mixture. Whisk eggs and 1 3/4 cups water in another bowl; pour egg mixture into the well and stir until combined. Dough will be thick. Bring 4 cups water and 2 tablespoons salt to a boil in a wide pot. Place part of the dough into a spaetzle press or potato ricer. Press dough into boiling water; cook and stir until pasta is tender, about 1 minutes. Remove pasta with a slotted spoon to a large bowl. Repeat with remaining dough. 
46930cf51c6cfd02278f6a5b19b13c08£ Heat vegetable oil in large pot over medium heat; cook and stir onions, carrots, and celeriac until beginning to soften, about 5 minutes. Stir in potatoes and vegetable stock. Simmer until potatoes are tender, 15 to 20 minutes. Add parsley and blend potato mixture with a stick blender until soup is smooth. Stir half-and-half, salt, black pepper, and cumin into soup. Ladle soup in bowls and garnish with tomatoes and hot dogs. 
ec52624776e99e1f66991123ae7d3d5e£ Cover almonds with boiling water in a bowl. Let stand for 1 to 2 minutes and drain. Rinse with cold water and drain again. Pat almonds dry and remove skin. Allow almonds to dry on paper towels. Place half the almonds in a food processor; pulse until finely chopped. Add apricots and dates; pulse until fruit is chopped. Reserve remaining 1 cup almonds. Combine flour, cinnamon, ginger, baking powder, cloves, cardamom, and salt in bowl. Beat eggs, brown sugar, honey, molasses, water, almond extract, orange zest, and 1 teaspoon lemon zest in a large bowl with an electric mixer until smooth. Add apricot mixture, blending until evenly distributed. Gradually stir in flour mixture on medium speed until dough comes together. Cover dough with plastic wrap and refrigerate for 8 hours to overnight. Preheat oven to 350 degrees F (175 degrees C). Turn dough onto a lightly floured surface and roll out to about 1/2-inch thick. Cut out cookies with a 2 1/2 to 3-inch diameter cookie cutter. Arrange cookies about 1 inch apart on ungreased baking sheets. Lightly press 3 almonds into each cookie with tips towards the center to create a star pattern. Bake in preheated oven until cookies begin to brown, about 12 minutes. Cool in the pans for 10 minutes before removing to cool on a wire rack. Meanwhile, whisk confectioners&#39; sugar, milk, and 1 teaspoon lemon zest in a bowl until glaze is smooth. Brush warm cookies with glaze and allow cookies to cool completely. 
ada3cd1285d0346fdf6169cb727809e3£ Preheat oven to 400 degrees F (200 degrees C). Spread sauerkraut into bottom of a 9-inch square glass baking dish. Stir reserved liquid from sauerkraut, brown mustard, brown sugar, celery seed, and black pepper together in a bowl; drizzle over sauerkraut. Arrange sausage slices in a layer over the sauerkraut and sauce. Loosely pile frozen french fries atop the sausage. Bake in preheated oven until the french fries are lightly browned, 20 to 30 minutes. 
60b2e36dfc9927c04e9f7c32e5ef0d07£ Melt butter in a skillet over medium-high heat. Add bacon; cook, stirring, until almost crisp, 3 to 4 minutes. Stir in onions. Cook, stirring, until bacon is crisp and onions are soft and translucent, 8 to 10 minutes. 
