2ba63f543c0b991b0a8ae3fca4a822d1£ Combine onion, parsley root, carrot, rosemary, bay leaves, and white peppercorns in a bowl. Stir in white wine. Place duck in a large bowl and pour marinade over duck. Cover with foil and marinate in the fridge for at least 12 hours. Preheat oven to 425 degrees F (220 degrees C). Combine chestnuts, apple, bread, and egg in a bowl; season with tarragon, salt, and pepper. Remove duck from the marinade and strain marinade through a sieve. Dry duck inside and out with paper towels. Rub salt and pepper all over the skin. Fill cavity with stuffing, being careful not to overstuff. Secure opening with wooden skewers. Pour oil into a roasting dish. Add stuffed duck, breast-side up. Roast duck in the preheated oven, turning occasionally, until golden brown on all sides, about 20 minutes. Heat marinade in a saucepan over medium heat until warmed through, about 5 minutes. Pour warm marinade into the roasting pan. Cover with a lid or aluminum foil and return to the oven. Reduce oven temperature to 350 degrees F (175 degrees C) and bake duck until no longer pink at the bone and the juices run clear, about 90 minutes. An instant-read thermometer inserted into the thickest part of the thigh, near the bone, should read 165 degrees F (74 degrees C). Remove duck from the roasting pan and transfer to a baking sheet. Set oven rack about 6 inches from the heat source and preheat the oven&#39;s broiler. Roast duck until skin is golden-brown, 3 to 5 minutes. Remove duck from the oven, cover with a doubled sheet of aluminum foil, and allow to rest in a warm area for 10 minutes before slicing. Strain the stock, removing any burnt bits and skimming off fat. Heat stock in a saucepan over high heat and cook until gravy is reduced to 1/3, 5 to 10 minutes. Season with salt and pepper. Carve duck and serve with gravy. 
8f4c094a36054f8e47645d35f3bfaf75£ Dissolve yeast in lukewarm milk in a bowl. Stir 1 tablespoon sugar and 1 tablespoon flour into milk mixture. Let stand until yeast softens and begins to form a creamy foam, about 30 minutes. Mix half of the remaining sugar, oil, 2 eggs, lemon zest, and salt together in a bowl. Add remaining flour and yeast mixture and knead into a smooth dough. Place dough in a large, lightly oiled bowl and turn to coat. Cover with a clean towel and let rise in a warm place until doubled in volume, about 1 hour. Combine remaining sugar, remaining eggs, chopped apples, almond meal, marzipan, raisins, rum, cinnamon, and almond extract in a large bowl and mix well for the filling. Line a baking sheet with parchment paper. Dust a work surface with flour and roll out dough into a rectangle. Dust with bread crumbs and cover with apple filling, leaving a 1-inch border. Roll up dough from the 2 long sides, meeting in the middle. Place on the prepared baking sheet, cover with a clean cloth, and let rise, about 20 minutes. Preheat oven to 350 degrees F (175 degrees C). Bake stollen in the preheated oven for about 1 hour. Cover with aluminum foil after 30 minutes if stollen gets too dark. Remove from oven. Brush hot stollen with melted butter and dust generously with confectioners&#39; sugar. Let cool before slicing. 
a7a431552f7a94a38daa4e138f3d1a89£ Place flour in a large bowl, make a well in the center, and crumble fresh yeast into it. Sprinkle in sugar and add 1 tablespoon milk. Cover and let rise at a warm place for 15 minutes. Heat 1 1/2 cups milk and 1 cup plus 2 tablespoons unsalted butter in a saucepan over low heat until butter is melted. Pour milk-butter mixture over yeast mixture and add 1 cup sugar, egg yolks, and salt. Knead until a soft dough forms. Cover with a clean dish towel and let rise in a warm place until doubled in volume, about 1 hour. Line a baking sheet with parchment paper. Mix almonds, raisins, candied lemon peel, and candied orange peel together and fold into the dough. Shape dough into a loaf and place on the prepared baking sheet. Cover and let rest until the loaf has risen again slightly, about 30 minutes. Preheat oven to 375 degrees F (190 degrees C). Bake in the preheated oven until toothpick inserted in the middle comes out clean, 45 to 60 minutes. Remove from oven. Brush hot stollen immediately with 2 tablespoons melted butter and dust with confectioners&#39; sugar. 
df68b6cd4bdfb03fd9e26850d4dd8ed0£ Combine flour, 1 cup plus 2 tablespoons butter, white sugar, and eggs in a large bowl and knead into a smooth dough. Shape into a ball. Flatten, cover with plastic wrap, and refrigerate for 2 hours. Preheat oven to 375 degrees F (190 degrees C). Grease 2 baking sheets or line with parchment paper. Dust a work surface with flour and roll out dough to 1/4-inch thickness. Cut out hearts with a heart-shaped cookie cutter and arrange cut-out cookies on prepared baking sheets. Bake in the preheated oven until lightly browned, 10 to 15 minutes. Remove from baking sheets carefully and transfer to wire racks. Cool completely, about 20 minutes. Mix 1 cup of confectioners&#39; sugar with as much lemon juice needed to form a thick icing. Cover half of the hearts with the white icing. Mix the remaining 1 cup confectioners&#39; sugar with raspberry syrup and cover the other half with pink icing. Let cookies stand until icing dries completely, about 2 hours, or up to overnight. 
9b05a50d14495176f33b5580b732924f£ Place almonds in a heat-proof bowl and cover with boiling water. Let stand for a few minutes until cool enough to handle. Slip the almonds out of their skins one by one, leaving the remaining almonds in the warm water. Drain almonds in a colander and pat dry with paper towels. Place almonds, confectioners&#39; sugar, rose water, and almond extract in a food processor fitted with a metal blade and process to a paste. Scrape the sides a few times to ensure even processing. Process marzipan until it is smooth and no longer grainy. Wrap in plastic wrap and store marzipan in a cool, dry place, 8 hours to overnight. Shape marzipan into a 1/2-inch thick roll. Cut into 1/2-inch pieces and roll each piece into a ball. Dredge balls in cocoa. 
d87fbdf1ee6d5ad3946b86e11d76af1d£ Preheat oven to 300 degrees F (150 degrees C). Line 2 baking sheets with parchment paper. Beat egg whites in a glass, metal, or ceramic bowl until stiff peaks form. Gradually add sugar, 1 teaspoon at a time, while continuing to beat at high speed. Combine ground almonds and cinnamon in a bowl and fold into the egg white mixture with a spatula. Add more ground almonds if mixture is too runny. Use 2 teaspoons to place little mounds of almond mixture 2 inches apart onto the prepared baking sheets. Bake in the preheated oven until lightly browned and baked through, 15 to 20 minutes. Carefully remove from baking sheets and cool on wire racks. 
8db87ead325cf531acc73d68c3a032e3£ Melt butter in a large pot over low heat and cook onions until they are softened, about 15 minutes, stirring occasionally. Add garlic and salt and continue to cook until onions are soft, lightly browned, and caramelized, stirring every 5 minutes, about 15 minutes. Season with paprika and cayenne and stir so onions turn a bright red, about 1 minute. Pour 2 tablespoons water and vinegar into the pot and stir to combine. Add tomato paste, marjoram, and caraway seeds. Add beef, season with salt, and enough water to cover beef halfway. Cover pot and bring to a simmer over low heat. Cook goulash on a low simmer, stirring every 30 minutes, about 3 hours. Season with salt and pepper. 
2bce9847e772ffad0b94c14dd95f184c£ Preheat oven to 400 degrees F (200 degrees C). Line a rimmed baking sheet with parchment paper. Combine 3/4 cup plus 2 tablespoons sugar, 1/4 cup butter, and 2 teaspoons vanilla sugar in a large bowl; beat with an electric mixer until smooth and creamy. Add eggs one at a time, beating well after each addition. Beat in lemon zest with the last egg. Combine 2 3/4 cups flour and baking powder. Sift over butter mixture and quickly beat into batter with the electric mixer running on low speed. Combine apple slices, lemon juice, and cinnamon sugar in a bowl and fold into batter. Spread batter onto the prepared baking sheet. Spoon applesauce onto batter and spread out evenly. Combine 1 cup plus 2 tablespoons flour, 1/2 cup cubed butter, 1/2 cup plus 2 tablespoons sugar, almond meal, and 2 teaspoons vanilla sugar in a bowl and mix into streusel. Sprinkle streusel over applesauce. Bake in the preheated oven until streusel is lightly browned and cake is set, about 40 minutes. 
8c4f1ba34a92932ca14010d698e9f70d£ Preheat oven to 350 degrees F (175 degrees C). Grease a large, rimmed baking sheet with butter. Combine 2 cups confectioner&#39;s sugar, 1 cups plus 2 tablespoons butter, vanilla sugar, lemon zest, and salt in a large bowl; beat with an electric mixer until smooth and creamy. Add eggs one at a time and beat well after each addition until batter is very foamy, about 10 minutes total. Combine flour and baking powder and beat in alternately with the milk. Spread batter onto the prepared baking sheet, smoothing out with a spatula. Cover with cherries. Bake in the preheated oven until cake is set, about 45 minutes. Allow to cool for about 30 minutes. Dust with 1 tablespoon confectioners&#39; sugar. 
a1d97d8ac27f1f8dcbba5938d66ee0f5£ Combine olive oil, vinegar and salt in a large salad bowl. Stir in onion. Fold tomatoes carefully into onion mixture. 
eb1559d69edfe72a26b21149c20c5f25£ Preheat the oven to 425 degrees F (220 degrees C). Grease a deep baking pan with butter or line with parchment paper. Toss apple slices with lemon juice in a bowl and set aside. Combine butter, sugar, and vanilla sugar in a large bowl and beat using an electric blender until pale and fluffy. Add eggs, one at a time, and mix well after each addition. Combine flour, baking powder, and salt together in a separate bowl and mix on low speed. Fold apple slices into the batter. Spread batter into the prepared baking pan and smooth the top. Bake in the preheated oven until a toothpick inserted into the center comes out clean, about 30 minutes. 
88e5607be7109639e2a90972992c8d06£ Preheat the oven to 400 degrees F (200 degrees C). Line a baking sheet with parchment paper. Combine egg yolks, 1/2 cup sugar, and 2 teaspoons vanilla sugar in a large bowl; beat with an electric mixer until foamy. Beat egg whites in a glass, metal, or ceramic bowl until foamy. Gradually add confectioners&#39; sugar, continuing to beat until stiff peaks form. Slide over the egg yolk mixture. Sift flour and baking powder over the stiff egg whites. Carefully fold everything into the egg yolk mixture until batter is well combined, but do not overmix. Spread batter onto the prepared baking sheet. Bake in the preheated oven until sponge cake is set and lightly browned, 15 to 20 minutes. Lay a clean dish towel on a flat work surface and sprinkle dish towel with 2 teaspoons sugar. Invert sponge cake onto the dish towel and remove parchment paper. Roll up cake with the dish towel and allow to cool completely, about 1 hour. Beat cream in a chilled glass or metal bowl with an electric mixer until frothy. Add vanilla sugar gradually, continuing to beat until stiff peaks form. Fold in strawberries with a spatula. Carefully unroll sponge cake. Spread strawberry cream on top, leaving a little room on the edges. Carefully roll up and place seam down onto a cake platter. Allow to chill in the refrigerator for 1 hour. 
c7b1db68b2da09285e975c2c390fabfe£ Combine kohlrabi, salt, and sugar in a pot. Set aside until kohlrabi releases liquid, about 5 minutes. Cover pot and bring to a boil over medium heat. Shake pot from time to time, so nothing sticks to the bottom. Cook for about 4 minutes. Stir in cream and simmer another 30 seconds without allowing cream to boil. 
5c549ce994606b47cb6a626fcf613180£ Melt butter in a large saucepan over medium heat. Stir in sugar and honey. Bring to a boil; let cool, about 10 minutes. Whisk flour, cinnamon, and cloves together in a bowl. Mix baking soda and water together in a bowl; stir into butter mixture. Mix in eggs. Add flour-spice mixture; stir until dough is combined. Cover with plastic wrap; refrigerate for 24 to 48 hours. Preheat oven to 325 degrees F (165 degrees C). Roll dough out; cut into cookies and place on a baking sheet. Bake in the preheated oven until edges are golden, 10 to 12 minutes. Cool on the baking sheet for 1 minute; transfer to a wire rack to cool completely. 
95ba785c6897e2c785816fda385fab31£ Dissolve yeast and sugar in 2 tablespoons of the lukewarm milk in a bowl. Let stand until yeast softens and begins to form a creamy foam, about 5 minutes. Sift flour into large bowl, add yeast mixture, melted butter, remaining milk, egg, and salt. Stir well to combine until dough has pulled together. Turn dough out onto a lightly floured surface and knead until smooth and elastic, about 8 minutes. Place dough in a large bowl. Cover with a towel and let rise in a warm place until doubled in volume, about 1 to 1 1/2 hours. Punch dough down, cover with a towel, and let rise in a warm place for 1 hour. Place bacon pieces in a large skillet and cook over medium-high heat, turning occasionally, until evenly browned, about 5 minutes. Add onion and saute on low heat until soft, about 15 minutes. Remove from pan and cool slightly. Mix bacon-onion mixture with sour cream and season with a little salt and pepper (be careful not to over-salt, as bacon is already salty). Preheat oven to 400 degrees F (200 degrees C). Grease a 10- or 12-inch springform pan. Roll dough on lightly floured surface to fit springform pan and cover pan. Fill with bacon-onion mixture. Bake in preheated oven until dough is set and filling is slightly browned, about 30 minutes. 
a929b514807b82a9ce75ac881fe69e84£ Beat butter, sugar, and sorghum together in a bowl until creamy. Mix all-purpose flour, anise, baking soda, cinnamon, and salt together in a separate bowl; stir into butter-sugar mixture until just incorporated. Roll dough into 1-inch thick logs. Arrange logs on a baking sheet and refrigerate 8 hours or overnight. Preheat oven to 350 degrees F (175 degrees C). Slice dough into small cookies; arrange on baking sheets. Bake cookies in the preheated oven until lightly browned, 8 to 9 minutes. 
8ff76da4012ea4cd21a26508b11c23f7£ Place the eggs, sugar, flour and milk into the container of a blender. Process until smooth on low speed. Heat a large skillet or griddle over medium heat. Pour batter about 1/4 cup at a time (or more for larger pancakes). Tilt pan to achieve a round shape. Heat until golden, then flip and brown on the other side. Serve immediately with syrup, or fresh berries and whipped cream. 
b3e2658c5886db050a3531b210fb445c£ Preheat oven to 350 degrees F (175 degrees C). Line the bottoms of two 8 inch round pans with parchment paper circles. Sift together flour, cocoa, baking soda and 1 teaspoon salt. Set aside. Cream shortening and sugar until light and fluffy. Beat in eggs and vanilla. Beat in flour mixture, alternating with buttermilk, until combined. Pour into 2 round 8 inch pans. Bake at 350 degrees F (175 degrees C) for 35 to 40 minutes, or until a toothpick inserted into the cake comes out clean. Cool completely. Remove paper from the cakes. Cut each layer in half, horizontally, making 4 layers total. Sprinkle layers with the 1/2 cup kirshwasser. In a medium bowl, cream the butter until light and fluffy. Add confectioners sugar, pinch of salt, and coffee; beat until smooth. If the consistency is too thick, add a couple teaspoons of cherry juice or milk. Spread first layer of cake with 1/3 of the filling. Top with 1/3 of the cherries. Repeat with the remaining layers. In a separate bowl, whip the cream to stiff peaks. Beat in 1/2 teaspoon vanilla and 1 tablespoon kirshwasser. Frost top and sides of cake. Sprinkle with chocolate curls made by using a potato peeler on semisweet baking chocolate. 
70b5612234ba958fa4bf99e369fc7581£ Stir together the molasses, honey, shortening, and margarine in a saucepan over medium heat; cook and stir until creamy. Remove from heat and allow to cool to room temperature. Stir in the eggs. Combine the flour, white sugar, brown sugar, cardamom, nutmeg, cloves, ginger, anise, cinnamon, baking soda, pepper, and salt in a large bowl. Add the molasses mixture and stir until thoroughly combines. Refrigerate at least 2 hours. Preheat oven to 325 degrees F (165 degrees C). Roll the dough into acorn-sized balls. Arrange on baking sheets, spacing at least 1 inch apart. Bake in preheated oven 10 to 15 minutes. Move to a rack to cool. Dust cooled cookies with confectioners&#39; sugar. 
ca49881780ac8830f2532d0debff6e4b£ In a large mixing bowl, dissolve yeast and sugar in warm water. Let sit until creamy; about 10 minutes. Mix in shortening, salt and 3 cups of the flour. Beat with dough whisk or heavy spoon for 2 minutes. Fold in egg whites. Gradually add flour 1/4 cup at a time, until dough forms a mass and begins to pull away from bowl. Turn onto a floured surface. Knead, adding more flour as necessary, for 8 to 10 minutes, until smooth and elastic with bubbles. Lightly oil a large mixing bowl, place the dough in the bowl and turn to coat with oil. Cover with a damp cloth and let rise in a warm place until doubled in volume, about 1 hour. Deflate the dough, form into a round and let rise again until doubled, about 45 minutes. Preheat oven to 425 degrees F (220 degrees C). Deflate the dough and turn it out onto a lightly floured surface. Divide the dough into 24 equal pieces and form into oval rolls about 3 1/2 inches long. Place on lightly greased baking sheets, cover and let rise until doubled in volume, about 40 minutes. Place an empty baking sheet on the bottom rack of the oven. In a small bowl, lightly beat the egg white with the 2 tablespoons of milk to make the egg wash. Lightly brush the risen rolls with the egg wash. Place 1 cup of ice cubes on the hot baking sheet in the oven and immediately place the rolls in the oven. Bake at 425 degrees F (220 degrees C) for about 20 minutes or until the tops are golden brown. Remove to a wire rack and cool. 
a92cd4ba1b1a9de9666fd87b0c8deee5£ Spread cucumbers and onion on a platter; season with salt and let rest for 30 minutes. Squeeze excess moisture from cucumbers. Stir sour cream, sugar, vinegar, dill, and parsley together in a large bowl. Fold cucumber and onion slices into the sour cream mixture. Refrigerate 8 hours to over night; garnish with paprika to serve. 
db0f4701d00c52f8122d996faa50e7b2£ To Make Sweet Dough: In a medium bowl combine the yeast, sugar and water and mix together; let stand 10 minutes. Stir in flour, dry milk, baking powder and shortening, then knead mixture for 10 minutes, adding as little flour as necessary. Cover bowl with a damp cloth and let rise in a warm place for 30 minutes, then knead again. To Make Filling: Meanwhile, brown beef, sausage and onion in a large skillet over medium high heat. Drain extra fat from skillet, then stir in cabbage, mustard, salt and pepper and cook for 5 minutes. Add cheese and cook, stirring, until cheese is melted. Preheat oven to 350 degrees F (175 degrees C). Flatten a piece of dough. Place large spoonful of meat filling onto dough and fold over to form a round bun. Lay folded-side-down in a lightly greased 9x13 inch baking dish. Repeat with remaining dough and filling. Bake in preheated oven for 20 minutes, or until golden brown. 
ee9b92a1b60306193f7ddb386855ea02£ Place each veal cutlet between two pieces of plastic wrap, and pound with the flat side of a meat mallet until about 1/4 inch thick. Dip in flour to coat. In a medium bowl, stir together the Parmesan cheese, eggs, parsley, salt, pepper, nutmeg and milk. Place bread crumbs on a plate. Dip each cutlet into the egg mixture, then press in the bread crumbs to coat. Place coated cutlets on a plate and refrigerate for 1 hour or overnight. Melt butter in a large skillet over medium heat. Cook the breaded cutlets until browned on each side, about 3 minutes per side. Remove to a serving platter, and pour the pan juices over them. Garnish with lemon slices. 
8d9b054f43e81d503f7de54e4bd57d7c£ Preheat oven to 350 degrees F (175 degrees C). Heat a large nonstick skillet over medium-high heat, and brown the pork chops on both sides, about 5 minutes per side. Place the chops into a 9x13-inch baking dish. Mix the sauerkraut, apple, onion, brown sugar, and caraway seeds in a bowl until well combined, and spread the sauerkraut mixture over the pork chops. Cover the dish with aluminum foil. Bake in the preheated oven until the pork is no longer pink inside, about 45 minutes. An instant-read thermometer inserted into the center of a chop should read 145 degrees F (63 degrees C). 
2a7dd93d0242fb18fc4a6288390e6d20£ In a saucepan over low heat, melt together sugar, shortening and honey. Let cool. Mix together eggs, vanilla, baking soda and ginger. Gradually add to cooled honey mixture. Slowly add 4 cups of flour to mixture. Stir until well blended. Drop by teaspoonfuls onto cookie sheets about 2 inches apart. Bake at 350 degrees F (180 degrees C) until golden (about 12-15 minutes). 
a7346b1add6f68ca71cf6b062a841bd9£
413c90e869a7d14bada0cd55b3738df8£ Place bacon in a large, deep skillet. Cook over medium high heat until evenly brown. Drain on paper towels and set aside. Sprinkle rabbit with salt and coat with 1/3 cup flour, shaking off excess. Brown rabbit in remaining bacon fat. Remove from skillet, along with all but 2 tablespoons of the fat, and reserve. Saute shallots and garlic in skillet for about 4 minutes, until tender. Stir in wine, 1 cup water and bouillon. Heat to boiling, then stir in jelly, peppercorns, bay leaf, and rosemary. Return rabbit and bacon to skillet. Heat to boiling, then reduce heat to low. Cover and let simmer about 1 1/2 hours or until rabbit is tender. Remove bay leaf and discard. Place rabbit on a warm platter and keep warm while preparing gravy. To Make Gravy: Stir lemon juice into skillet with cooking liquid. Combine 3 tablespoons water with 2 tablespoons flour and mix together; stir mixture into skillet over low heat. Finally, stir in thyme. Pour gravy over stew and serve, or pour into a gravy boat and serve on the side. 
94ca0061b93e5d28a2ff5128f95b7d78£ In a medium size mixing bowl, combine chili sauce, cranberry sauce, sauerkraut, water, and brown sugar. Mix well. Pour sauce and meatballs in a slow cooker, stir. Cook, covered, at a medium temperature for 4 hours. Stir occasionally to coat meatballs. 
abe72121c3f612adededefe9e1d20b1d£ Place the potatoes, garlic, salt, and pepper in a slow cooker; stir to coat. Season the pork roast with salt and pepper; lay atop the potatoes. Pour the sauerkraut over the roast; sprinkle with caraway seeds. Cook in slow cooker on Low 8 to 10 hours. 
6ba6e380948de9c369659a40b9088610£ Saute margarine and onions in a large skillet until the onions are soft. Stir cabbage and potatoes into the skillet and saute until the cabbage becomes wilted. Place the kielbasa, wine vinegar, salt and pepper into the skillet. Cook kielbasa covered over a low heat, stirring occasionally until cooked through. Pour the water into the pan, cover and cook another 10 minutes before serving. 
1ca7ce0e010a05d287b07fc408b08be0£ Preheat oven to 375 degrees F (190 degrees C). Bring a large pot of lightly salted water to a boil. Add pasta and cook for 8 to 10 minutes or until al dente; drain. In a blender or with an electric mixer, blend mushroom soup, cream of chicken soup and milk until smooth. Cut sausage in half lengthwise and slice thinly. In a 9x13 inch dish, layer 1 cup soup mixture, 3 noodles, half the sauerkraut, half the sausage and a third of the cheese. Repeat. Top with remaining 3 noodles and remaining soup mixture. Cover with foil. Bake in preheated oven 25 minutes, then uncover and bake 15 minutes more. Sprinkle with remaining cheese when still hot. 
55da0ade5fd6bccac318f74a83b5b315£ Place lentils in a 5 to 6 quart slow cooker. Add chicken stock, bay leaf, carrots, celery, onion, and ham. Season with Worcestershire sauce, garlic powder, nutmeg, hot pepper sauce, caraway seed, celery salt, parsley, and pepper. Cover, and cook on Low for 8 to 10 hours. Remove bay leaf before serving. 
14168f3e09b97c8114a2c6ab1868d7c7£ Spread 1/2 tablespoon mustard over one side of each piece of meat. Sprinkle the onion, paprika, salt, and pepper evenly over the steaks. Lay one slice of bacon on each piece. Roll the steaks jelly-roll style and secure with toothpicks. Heat the canola oil in a skillet over medium heat. Cook meat on all sides until browned. Add the beef broth and water; bring to a boil. Reduce heat to medium low; cover and simmer until tender, about 30 minutes. Remove the meat rolls. Strain the broth mixture and return liquid to the skillet. Whisk together the cornstarch and 1 cup of water. Slowly pour the cornstarch slurry into the skillet, stirring continually until the sauce has thickened, 2 to 3 minutes. Stir in the sour cream. Return rolls to the sauce; serve immediately. 
926a04609f5eb00fcb612d4c4edc2561£ Bring water, salt, and pepper to boil in a slow cooker set to High. Stir in steel cut oats, cover, and cook 90 minutes. In a large bowl, mix beef, pork, and onions. Stir into the oat mixture, and reduce heat to Low. Cover, and continue cooking 3 hours, stirring occasionally. Transfer the mixture to a medium baking pan, and cool until semi-solid. Turn out onto wax paper, and chill 1 hour in the refrigerator, or until firm. Heat oil in a large, heavy skillet over medium high heat. Cut the refrigerated mixture into thin slices. Cook slices one at a time in the heated oil until evenly brown. 
