9c74e66e2d0328965239b0075dee70f3£ In a medium saucepan, stir together the honey and molasses. Bring the mixture to a boil, remove from heat and stir in the brown sugar, egg, lemon juice and lemon zest. In a large bowl, stir together the flour, baking soda, cinnamon, cloves, allspice and nutmeg. Add the molasses mixture to the dry ingredients and mix well. Stir in the citron and hazelnuts. Cover dough and chill overnight. Preheat oven to 350 degrees F (175 degrees C). Grease cookie sheets. Using a small amount of dough at a time, roll out on a lightly floured surface to 1/4 inch thickness. Cut into small rectangles and place them 1 inch apart onto the prepared cookie sheet. Bake for 10 to 12 minutes in the preheated oven, until no imprint remains when touched lightly. Brush the icing over the cookies while they are still hot and quickly remove them to wire cooling racks. Store in airtight container with a cup of orange or apple for a few days to mellow. To make the icing: Combine the sugar and water in a small saucepan. Heat to between 234 and 240 degrees F (112 to 116 degrees C), or until a small amount of syrup dropped into cold water forms a soft ball that flattens when removed from the water and placed on a flat surface. Remove from heat and stir in the confectioners&#39; sugar. If icing becomes sugary while brushing cookies, re-heat slightly- adding a little water until crystals dissolve. 
0d3cc17f22b048e8cd30e13aebe62684£ Preheat oven to 350 degrees F (175 degrees C). Grease and flour one 10 inch tube pan. In a large bowl, cream the butter with the sugar. Beat in egg yolks. Continue beating for 10 minutes. Gradually stir in flour, alternating with splashes of milk, until all of the flour and milk are mixed in. Stir in baking powder. In a separate bowl, beat egg whites. Fold egg whites into batter. Reserve 1/4 of the batter, and pour the rest into a greased, floured tube pan. Mix cocoa into the remaining 1/4 of the batter. Then turn into tube pan, and fold under with a fork to produce a marbled appearance. Bake in the preheated oven for 60 to 70 minutes, or until a toothpick inserted into the center of the cake comes out clean. Let cool in pan for 10 minutes, then turn out onto a wire rack and cool completely. 
429c2f2141bf78b7d5a4855e619cf06a£ Melt butter in a stockpot over medium-high heat. Stir in bacon and cook until just beginning to crisp, 4 to 6 minutes. Add onions; cook and stir until onions are lightly browned and translucent, 6 to 8 minutes. Stir in chicken broth, red wine, apple slices, and apple cider vinegar; bring to a boil. Stir in sugar, cloves, bay leaves, nutmeg, cinnamon, salt, and black pepper. Stir in red cabbage; cover, reduce heat to low, and simmer until cabbage is soft and cooked through, 30 to 45 minutes. 
dee79705f7f27d0c58fae8c58c5ce206£ Scald milk. Add sugar, butter, and salt, and cool to lukewarm. Add 2 whole eggs, and 2 yolks. Mix. Add to 3 cups flour and yeast in food processor. Process and let rise until double. Add cardamom, raisins, citron, and cherries, and rest of flour. Process and put on floured board and knead. Let rise in greased bowl. When risen, cut into 3-4 pieces. Roll each into an oval, butter, and fold in half lengthwise. Put on greased baking sheet, cover, and let rise until double. Bake at 375 degrees F (190 degrees C) for 25 minutes. Remove to rack. When cool, frost with white butter frosting and decorate with candied cherry halves and sprinkle with colored sugar. 
a9f1f41b276ee3c59ef3882ffca60e7d£ Whisk together the flours, baking powder, and spices. In a large bowl, cream the butter or margarine with the brown sugar. Beat in the eggs, then the honey, orange liqueur, sour cream, and orange juice. Beat the flour mixture into the creamed mixture, and then stir in the raisins and almonds. Turn batter into a greased and floured tube pan. Bake cake at 350 degrees F (175 degrees C) for 80 minutes, or until it tests done with toothpick. Transfer to a rack to cool. 
3afa75d803b841218a929fc7fcb4fc9a£
557d6d15797117f38246011dee6a111e£ Preheat oven to 350 degrees F (175 degrees C). Grease and flour a 9x13 inch pan, or a 10 inch tube pan. Stir the flour, baking soda and salt together and set aside. In a large bowl, cream the oil, eggs, 1 cup brown sugar and 2 teaspoons vanilla. Add the flour mixture and mix well. Stir in the chopped apples and nuts. Pour batter into prepared pan. Bake at 350 degrees F (175 degrees C) for 30 minutes, or until a toothpick inserted into the center of the cake comes out clean. For the Topping: In a saucepan, combine 1 cup brown sugar, 1/2 cup butter and 1/4 cup cream. Bring to a boil, and continue boiling for 3 minutes. Cool slightly and pour over warm cake. 
c3ee2614e390d6dbf68d3954c2033dfd£ Place the potatoes in a large pot with enough water to cover. Bring to a boil, and cook until the potatoes are soft, about 20 minutes. Drain water, and place potatoes into a large bowl. Mash potatoes, leaving them slightly lumpy (just like making mashed potatoes). Mix in the salt, eggs, flour, 2/3 cup of bread crumbs, and nutmeg. Roll into walnut sized balls. If the dough is too sticky, you may want to mix in more flour or bread crumbs. Bring a large pot of lightly salted water to a boil. Gently drop the dumplings into the water. When they come up to the surface, allow them to boil uncovered for 3 minutes. Remove the dumplings with a slotted spoon, and keep warm. While you are waiting for the water to boil, melt the butter in a skillet over medium heat. Add onions and 1/4 cup of bread crumbs. Cook, stirring constantly, until the onions are tender, and the sauce has thickened some. Pour sauce over the dumplings before serving. 
48b39dc33055c2907650eee8cdc5f5d4£ Preheat oven to 350 degrees F (175 degrees C). Heat oil in a medium skillet over medium heat. Saute onions and 2 cloves of garlic until onions are translucent. Add rice and saute 2 minutes. Stir in vegetable broth, cover and cook until rice is done, about 15 minutes. Meanwhile, in a large bowl combine tofu, parsley, mushrooms, eggs, bread crumbs, walnuts, Worcestershire, soy sauce, paprika, and cooked rice. Slice the tops off of the peppers; save tops. Core peppers and stuff with tofu mixture. Replace tops on peppers. In a shallow baking dish combine tomatoes, wine, tomato paste and remaining garlic. Place peppers in dish and cover. Bake in preheated oven for 1 hour. 
8f035da14f2f38637ac000cd180014be£ Combine flour, yeast, 2 tablespoons sugar, salt, 3/4 cup milk, and 3 tablespoons butter or margarine. Turn dough out onto a lightly floured surface. Knead until smooth and elastic, about 15 to 20 minutes. Place in a well greased bowl, and cover. Let rise in a warm place for 1 hour, or until doubled. Punch down the dough. Roll out to a 1/2 inch thickness. Spread into a greased 8 inch square baking pan. Cover, and let rise for 30 minutes. Melt 3 tablespoons butter or margarine and confectioner&#39;s sugar in a saucepan. Add almonds and 1 tablespoon milk. Remove from heat, and stir in honey. Spread evenly and carefully onto the dough. Allow dough to continue to rise for an additional 30 minutes. Bake at 400 degrees F (205 degrees C) for 20 to 25 minutes, or until crust turns golden brown. Cool completely on a wire rack. Dissolve cornstarch in a little milk. Combine 1 1/2 cups milk, cornstarch, and 1 tablespoon sugar inn the top of a double boiler. Heat while stirring until thickened, about 2 to 3 minutes. Add in beaten egg, and keep stirring for about 2 more minutes, or until thick. Remove from heat, and stir in extract. Chill, covered, in refrigerator for at least 1 hour. Beat the whipping cream with the cream of tartar until stiff. Fold into the chilled pudding. Cut the cooled almond crust bread into 1 1/4 x 2 inch rectangles. Slice each horizontally into halves. Fill with pudding mixture. Chill, and serve cold. 
67421a188645c1bb5482181e5c5d7dc5£ Place the bratwurst into a large skillet with 1 tablespoon of bacon drippings over medium heat; cook and stir the bratwurst until the pieces are browned and no longer pink inside, about 15 minutes. Drain excess grease. Place remaining 1 tablespoon of bacon drippings in a large, deep pot over medium heat, and cook and stir the onion, green and jalapeno peppers, and garlic until the onion is translucent, about 8 minutes. Place the bratwurst into the pot with the vegetables, and stir in the sauerkraut, red beans, petite diced tomatoes, crushed tomatoes, tomato sauce, tomato juice, beer, salt, black pepper, cumin, chili powder, sugar, garlic powder, paprika, allspice, and oregano. Bring the chili to a boil, reduce heat to a simmer, and stir in the milk chocolate until melted and dissolved. Simmer for 5 hours, stirring occasionally. 
8c389d04c4cc3129f5cf791154b36ca0£ Soak Kaiser roll in a bowl of water for 10 minutes. Drain, squeezing out excess water, and crumble into a large bowl. Mix crumbled roll with ground beef, ground pork, onion, parsley, egg, paprika, salt, and black pepper until well blended. Shape meat into large flattened meatballs. Heat a large nonstick skillet over medium heat; fry meatballs until browned and no longer pink in the center, about 5 minutes per side. 
7f22566bb2c0c52a7ab20861939aa058£ Heat 1 tablespoon vegetable oil in a large pot over medium-high heat. Stir in ground beef, and cook until crumbly and no longer pink, about 5 minutes. Stir in chopped onion, and cook until the onion has softened and turned translucent, about 5 minutes more. Add the chopped cabbage; cook and stir until the cabbage has softened, about 10 minutes. Season with salt and pepper, then spread the mixture onto a baking sheet to cool until cool enough to handle. Once the mixture has cooled, flatten a dinner roll, and place several tablespoons of the cabbage mixture in the center. Pull the edges of the dough over the filling and pinch to seal. Repeat with remaining dough and filling. Heat the oil in a deep-fryer or electric skillet to 350 degrees F (175 degrees C). Fry bierocks a few at a time in the preheated oil on both sides until golden brown, 5 to 7 minutes; drain on paper towels. 
bc295092b8f242a2d3842e08064f5f0f£ Pour the milk into a bowl; soak the rolls in the milk for about 15 minutes. Place the milk-soaked rolls, beef, pork, eggs, onion, parsley, marjoram, garlic, salt, and pepper in a large bowl; mix with your hands until evenly combined. Divide the mixture into eight portions and roll them into balls. Flatten the balls to make 1-inch thick patties. Melt the butter in a large skillet. Fry each patty in the melted butter until meat has reached an internal temperature of 160 degrees F (72 degrees C), about 6 minutes each side. These can be served either hot or cold. 
ee2b2ffbe2261bec7ade9047943191ff£ Combine potatoes, onion, celery, green bell pepper, oil, vinegar, salt, and pepper in a slow cooker. Cook on Low 5 to 6 hours. Garnish with bacon and parsley. 
459f52b0e2c1c4f64b5992c69662535d£ Mix potatoes, carrot, onion, garlic, parsley, and dill in a large bowl. Stir in lemon juice, 1/4 cup of olive oil, flour, bread crumbs, salt, and pepper. Knead just until mixture holds together. Heat the remaining 1/4 cup olive oil in a skillet over medium heat. Working in batches, drop spoonfuls of potato mixture in hot oil. Cook approximately 4 minutes per side, or until golden brown. Serve hot. 
50cabf446e9c6af3ca1b8d5d00f5b70c£ Preheat an oven to 350 degrees F (175 degrees C). Grease the bottom and halfway up the sides of a 9 inch springform pan. Mix together the sugar, cornstarch, and flour and set aside. Combine the cream cheese and cottage cheese; beat with an electric mixer at high speed until smooth and fluffy. Beat in the softened butter. Gradually add the sugar mixture, beating until combined. Add the eggs one at a time, blending well and scraping down the bowl after each addition. Stir in the lemon juice and vanilla and mix just until smooth. Pour the batter into the prepared pan and bake for 1 hour and 10 minutes. Turn off the oven and let the cheesecake rest in the oven with the door closed for 2 hours. Remove and cool on a wire rack. Chill for 4 hours or overnight. 
0def0c9879db14a9d3c13a48663c27af£ In large non-metal bowl, combine red wine vinegar, red wine, onions, carrots, bay leaf, whole allspice, whole cloves, peppercorns and salt. Place roast in marinade, cover and refrigerate 3 days, turning once daily. Remove roast from marinade; wipe dry. In a large saucepan, heat the marinade over medium-low heat. Melt 1/4 cup butter with the oil in a Dutch oven over medium heat. Brown the beef on all sides, sprinkling the flour over it as you turn it. Pour heated marinade into Dutch oven with the roast, cover, reduce heat to low and simmer 3 hours, until beef is tender. Pour the marinade off from the meat, skim off the fat, and strain. In a large skillet over low heat, melt remaining 1/4 cup butter with sugar. Cook and stir until golden in color. Pour in the strained marinade slowly, stirring until smooth and thickened. Sprinkle in the gingersnaps. Pour sauce over the meat in the Dutch oven, return the pot to low heat and simmer 30 minutes. Serve. 
57e5be94a3126f18553a6f48c32a3686£ In a jar with lid, combine the sugar, vinegar, water, salt, mustard seed and celery seed. Cover tightly and shake vigorously until sugar is dissolved. Chill dressing for several hours or overnight. In a large bowl, toss together the cabbage, celery, green peppers, pimento and dressing until evenly coated. Cover and chill until serving. 
79b8ad468a097db3befef54b40476002£ Place whole potatoes in their skins into a large pot of boiling water; boil for 25 to 30 minutes. Remove potatoes, and discard water. When cool enough to handle, peel potatoes, and place on a lightly floured surface. Mash potatoes with a rolling pin. Place mashed potatoes into a large bowl. Stir in flour, egg, parsley, salt, and nutmeg. Knead well to form a smooth dough. Then roll out the dough to a thickness of about 1/2 inch. Cut flattened dough into thin strips, about 1 1/2 inches long. Gently roll out the strips, or stretch them until the ends taper. Set aside for 15 minutes. In a large skillet, heat lard over medium heat. Place the potato strips into the skillet, and fry until golden brown on both sides. 
44209ced496540294f7b8ea7c54ed539£ Preheat oven to 375 degrees F (190 degrees C). Bring a large pot of lightly salted water to a boil. Cook kluski noodles in the boiling water, stirring occasionally until cooked through but firm to the bite, about 8 minutes. Drain and set aside. Melt butter in a large pot over medium heat. Whisk in flour, dry mustard, and black pepper; cook until smooth, about 2 minutes. Whisk in milk, a little at a time, and bring white sauce to a boil. Cook for 1 minute, whisking constantly, to make a smooth, thick sauce. Whisk 3/4 cup Cheddar cheese into sauce until melted. Stir kluski noodles, sauerkraut, and kielbasa sausage into the sauce and transfer to a 3-quart casserole dish. Mix bread crumbs with 1/4 cup Cheddar cheese in a bowl and sprinkle over the casserole. Bake in the preheated oven until casserole is heated through, about 20 minutes. 
cbbba05ad73567926e30441ad05887c5£ Preheat oven to 350 degrees F (175 degrees C). Grease a metal colander. Whisk together the flour and salt in a bowl. Mix the eggs and water, and pour into the flour mixture. Stir to form a dough. Bring a pot of water to a boil. Place the spaetzle dough into the oiled colander, and set the colander over the pot of water. Use a flexible spatula to push the dough into the boiling water through the holes in the colander. Stir the spaetzle as they boil. When they have floated to the top, they are done (about 5 minutes). Scoop the spaetzle out of the boiling water, and place into an ungreased 9x9-inch baking dish. Place the bacon in a skillet over medium heat, and cook, stirring often, until the bacon is crisp, about 8 minutes. Remove bacon, leaving drippings in pan, and set aside. Cook the onion in the same pan as the bacon until browned, about 10 minutes. In a large skillet, melt the butter over medium heat until foamy, and stir in the apple and brown sugar. Cook and stir until the apple is soft, about 5 minutes. Transfer the cooked bacon, onions, and sauerkraut into the skillet, and cook, stirring often, until the flavors have blended, about 5 minutes. Pour the sauerkraut mixture into the 9x9-inch baking dish on top of the spaetzle. Place the kielbasa pieces into a microwave-safe dish, and cook on full power in a microwave oven until the sausage is hot and has lost its pink color, 2 or 3 minutes. Transfer the sausage to the baking dish. Bake in the preheated oven until bubbling, about 15 minutes. 
d588aa1a357c0094c7df34fb5b01ef65£ Preheat oven to 325 degrees F (165 degrees C). Heat vegetable oil in a Dutch oven over medium heat; brown the pot roast on all sides in the hot Dutch oven, 2 to 3 minutes per side. Mix the Dijon mustard, brown sugar, garlic, and nutmeg together in a small bowl; spread evenly over the browned pot roast. Layer the onion slices atop the pot roast. Pour the beer and beef stock over the pot roast; season with salt and black pepper. Cover the Dutch oven. Roast in the preheated oven until completely tender, about 3 1/2 hours. Remove the cover from the Dutch oven during the final 20 minutes of cooking time. Transfer the roast to a platter, and cover with aluminum foil; allow to rest for 10 minutes. While the meat rests, whisk the cornstarch and water together in a small bowl; stir the cornstarch slurry into the juices left in the Dutch oven. Place the Dutch oven over medium heat; bring the gravy to a low boil, and cook and stir until thickened. Serve on the side as gravy, or slice the beef and pour over the slices on a platter. 
7ff712878b566be780c44403126504c7£
abb0d168bb78f8fd5d1cb7606f131746£ In a large bowl, combine eggs, flour, salt, 1 tablespoon oil, and 1/2 cup water. Mix until smooth, then let rest for 10 minutes. Meanwhile, heat 1/4 cup oil in a skillet over medium heat. Saute onion slices until golden brown; set aside. Preheat oven to 300 degrees F (150 degrees C). Bring a large pot of lightly salted water to a boil. Place 1/3 of the dough into a spaetzle maker or coarse sieve or collander with holes about 4 millimeters in diameter. Let dough drop into boiling water. Boil until spaetzle rises to the top, then transfer to a 9 inch casserole dish with a slotted spoon. Cover with 1/3 of the cheese. Repeat layers with remaining spaetzle and cheese. Spoon fried onions over top. Bake in preheated oven for 15 minutes, or until cheese is thoroughly melted. Before serving, sprinkle with 1 or 2 tablespoons vinegar, and sprinkle with chopped parsley. 
0fb6389b0e557accb4c8f6ae386974bd£ In a large pot over medium heat, heat the olive oil, and cook the skinned bratwurst until browned, breaking the sausage up into chunks as it cooks, about 10 minutes. Stir in the onions and garlic, and cook until the onions are translucent, about 5 more minutes. Mix in fennel seed and sauerkraut with juice, and allow the mixture to pan-fry for 2 minutes without stirring. Mix in the rice and soup base, and stir until the rice is colored and the soup base is incorporated, about 2 more minutes. Stir in water, black pepper, and raisins, and bring to a boil; cook for 5 minutes, stirring frequently. Reduce heat to a simmer, and cook until rice is tender and almost all the water has absorbed, about 30 minutes. 
8b7d58c7d09be66a98ace13aeeb4a6d4£ Preheat oven to 350 degrees F (175 degrees C). Grease and flour an 8 inch square pan. In a large bowl, mix apples and sugar together. Let stand until sugar is thoroughly dissolved, about 8 minutes. Stir egg and vanilla into apple mixture. Sift together flour, baking soda and cinnamon; stir into apple mixture. Fold in nuts and raisins. Pour batter into prepared pan. Bake in the preheated oven for 40 to 45 minutes, or until a toothpick inserted into the center of the cake comes out clean. Pour topping over cake while cake is still hot. For the Topping: In a saucepan, combine 1/2 cup brown sugar, 1/2 cup white sugar and 2 tablespoons flour. Stir in the water. Cook over medium heat, stirring, until mixture boils and thickens. Remove from heat and stir in butter, vanilla, chopped walnuts and raisins. Stir until butter melts, then pour over cake. 
30a751a1428d2bacd49e8ad0462a3d83£ Butter a 9x13 inch pan and set aside. In a small mixing bowl, dissolve yeast in warm water. Let stand until creamy, about 10 minutes. Place milk, 1/2 cup sugar, salt and 1/2 cup butter in saucepan. Heat until sugar dissolves and butter melts. Cool to lukewarm. Add dissolved yeast and set aside. In large bowl combine flour, eggs and yeast mixture. Stir until smooth and blended. Pour into a buttered 9x13 inch pan, spreading dough evenly. Let rise in warm place for 45 minutes. Meanwhile, preheat oven to 375 degrees F (190 degrees C). In a small bowl, combine 1/2 cup butter, 1 cup sugar and 1/2 teaspoon cinnamon. mix together and sprinkle over the dough. Bake in preheated oven for 30 minutes, or until the top is golden and syrupy. 
f49ef0dcc3ac0353ce20d64ae5805bea£ Preheat oven to 375 degrees F (190 degrees C). Line baking sheets with parchment paper. In a large bowl blend the shortening, salt, lemon zest and nutmeg together. Add the sugar and beat well. Beat in the eggs and milk and mix until well combined. Sift flour, baking powder and baking soda together. Add to the shortening mixture and blend until combined. Drop dough by teaspoonfuls onto the baking sheets and flatten with a glass. Sprinkle tops with sugar. Bake at 375 degrees F (190 degrees C) for 8 to 12 minutes. Enjoy! 
bedcba0a09af2bb1d46a561b22053e03£ Preheat oven to 350 degrees F. Combine dry ingredients and set aside. In a separate bowl, beat butter and sugar together until light. Add eggs one at a time, beating well after each addition. Stir in dry ingredients 1/2 cup at a time. Add almonds, if desired. Roll into one inch balls and arrange 1 inch apart on ungreased baking sheet. Bake 11 to 14 minutes. Cool and store in airtight containers for 3 days to mellow flavors. 
533adc20556ea1f1e4ee6913d506b048£ Preheat oven to 325 degrees F (170 degrees C). Line a baking sheet with parchment paper. Combine flour, 1/3 cup sugar, and ground almonds. Cut in butter with pastry blender, then quickly knead into a dough. Shape dough into logs and cut off 1/2-inch pieces. Shape each piece into a crescent and place on prepared baking sheet. Bake in preheated oven until edges are golden brown, 8 to 10 minutes. Cool 1 minute and carefully roll in vanilla sugar mixture. 
5785d8cf8e610b88dae44a7e67fc0037£ Place the milk and salt in a saucepan, and set over medium heat. In a small bowl, mix together 1 1/2 tablespoons of flour and water. When the milk begins to bubble, stir in the flour mixture, and cook stirring constantly until thickened, 2 or 3 minutes. Let cool until set. You can put the mixture in the refrigerator to speed the process. Fold the eggs into the chilled dough. Add 1 cup of flour and mix thoroughly (dough will be lumpy). Drop into simmering soups by the teaspoonful. Simmer covered for 10 minutes, remove lid, and simmer 10 minutes more. 
16d34e1be9269178fa0ed78f6b284f3d£ Preheat oven to 250 degrees F (120 degrees C). Place pork roast into a large baking dish and scatter sauerkraut around the roast. Arrange apple and onion quarters around the roast. Sprinkle sauerkraut, apples, and onions with brown sugar. Pour beer over roast and sauerkraut mixture. Cover dish with aluminum foil and seal foil to the edges of the dish. Bake in the preheated oven until roast is tender and pan juices are reduced, 3 to 4 hours. If roast, vegetables, and apples seem dry, pour in 1 more can beer. To serve, gently toss sauerkraut with apple and onion quarters and serve with the roast. 
e661280c902e0e5351632680e4a349d9£ Preheat oven to 350 degrees F (175 degrees C). Lightly grease a 9 inch springform pan. In a medium bowl, mix together the butter and sugar until smooth. Mix in 1 egg, then stir in the baking powder and flour. Knead together into dough. Press into the bottom and up the sides of the prepared pan. Mix together the quark, oil, 3/4 cup white sugar, vanilla sugar, and pudding mix in a large bowl until smooth. Blend in the egg yolks, egg, milk, and lemon juice; pour mixture into the prepared pan. Bake in preheated oven until the filling no longer moves when you shake the pan, about 1 hour. 
