05092e594cc44dc3e2d9fb802b215737£ Fry the bacon in a large skillet over medium heat until slightly crispy. Remove to paper towels to drain and set aside. In a large bowl, stir together the water and eggs. Gradually stir in the flour and salt until smooth. Add the cabbage and ginger; stir until evenly distributed. Heat a skillet over medium heat and coat with cooking spray. Pour about 1/4 of the batter into the center of the skillet. Place 4 slices of cooked bacon in the center. Use a spatula to shape the pancake into a circle. Fry for about 5 minutes or until the edges are dry. Flip and cook on the other side until the center is stable and it is browned on both sides. Remove from the pan and drizzle with tonkatsu sauce to serve. Continue with remaining batter and bacon. 
9f19e7e615b6e692bcd14543e8ce4305£ Preheat the oven to 350 degrees F (175 degrees C). Line the bottom of a 9 inch round cake pan cake pan with parchment paper. Warm the cream cheese and milk in a small saucepan over medium-low heat. Cook, stirring occasionally, until cream cheese is melted. Remove from the heat and set aside. In a medium bowl, beat egg yolks and half of the sugar until light and fluffy using an electric mixer. Fold the cream cheese mixture into the yolks. Sift in the flour and cornstarch, and stir until blended. In a separate bowl, using clean beaters, whip egg whites with cream of tartar until they can hold a soft peak. Gradually sprinkle in the remaining sugar and continue whipping to stiff peaks. Fold egg whites into the cream cheese mixture. Pour into the prepared cake pan. Place the pan on a baking sheet with sides. Place the baking sheet with the cheesecake into the oven, and pour water into the baking sheet until it is half way full. Bake for 20 minutes in the preheated oven, then reduce the heat to 300 degrees F (150 degrees C). Continue to bake for 15 more minutes. Let the cake cool before removing from the pan. Run a knife around the outer edge of the cake pan, and invert onto a plate to remove the cake. Peel off the parchment paper and invert onto a serving plate so the top of the cake is on top again. 
32c962f682f0cae3ec495679e3c28034£ Preheat the oven to 400 degrees F (200 degrees C). Fill a large skillet with about 1 inch of water and bring to a boil. Poach fish just until cooked on the outside, about 2 minutes per side. Transfer fillets to a broiler pan. In a small bowl, stir together the miso paste, sake, brown sugar, sesame seeds, sesame oil, water, salad dressing and rice vinegar. Spread this over the tops of the salmon fillets. Bake for 15 minutes in the preheated oven, or until almost cooked through. Switch the oven to broil, and broil until the top is browned and bubbly, about 5 more minutes. Cut fillets into portions to serve. 
2c11d7fb40f88ee2272c041143de651e£ Combine the water and rice in a saucepan and bring to a boil. Cover, reduce heat to low and simmer for 20 minutes, or until rice is tender and water has been absorbed. Remove from the heat and stir in the vinegar and a pinch of salt. Set aside to cool. Cover a bamboo sushi mat with plastic wrap to keep the rice from sticking. Place a sheet of seaweed over the plastic. Use your hands to spread the rice evenly onto the sheet, leaving about 1/2 inch of seaweed empty at the bottom. Arrange strips of cucumber and avocado across the center of the rice. Lift the mat and roll over the vegetables once and press down. Unroll, then roll again towards the exposed end of the seaweed sheet to make a long roll. You may moisten with a little water to help seal. Set aside and continue with remaining nori sheets, rice and fillings. Use a sharp wet knife to slice the rolls into 5 or 6 slices. Serve cut side up with your favorite sushi condiments. 
f1e4625ce378e1f036ea404018401685£ In a blender or food processor, combine mayonnaise, water, ketchup, sugar, and hot pepper sauce. Season with garlic powder, paprika, white pepper, and black pepper, and salt. Blend until smooth. 
f6ccdf862b2a581f694a590d7d6dffdb£ Combine soy sauce, sake, mirin and sugar in a small saucepan over medium heat and stir until sugar is dissolved. Can be used immediately or cooled and refrigerated. 
ba63cd4681f83a0f33255c8971696cc3£ In a small bowl or ramekin, stir together the soy sauce and rice vinegar. Drip in the chili oil to taste. Stir with chopsticks, and dip away! 
1e29adc92292cd216a1bfe73f44d9494£ In a large bowl, mix chicken, cabbage, carrots, green onions, green beans, green bell pepper and zucchini. In a separate bowl, beat together eggs, flour, chicken stock and soy sauce. Pour batter over chicken mixture and toss to thoroughly coat. Mix vegetable oil and sesame oil in a skillet over medium heat. Scoop about 1/4 cup batter into skillet, enough to make a 2 1/2 inch circle. Cover and cook 4 minutes, or until bottom is golden brown. Flip and continue cooking 4 minutes, or until cooked through. Drain on paper towels. 
e49668baf972a873e539a346b98d3f59£ Wash the rice in a mesh strainer until the water runs clear. Combine washed rice and 4 1/2 cups water in a saucepan. Bring to a boil over high heat, stirring occasionally. Reduce heat to low; cover. Simmer rice until the water is absorbed, 15 to 20 minutes. Let rice rest, for 15 minutes to allow the rice to continue to steam and become tender. Allow cooked rice to cool. Combine 1 cup water with the salt in a small bowl. Use this water to dampen hands before handling the rice. Divide the cooked rice into 8 equal portions. Use one portion of rice for each onigiri. Divide one portion of rice in two. Create a dimple in the rice and fill with a heaping teaspoon of bonito flakes. Cover with the remaining portion of rice and press lightly to enclose filling inside rice ball. Gently press the rice to shape into a triangle. Wrap shaped onigiri with a strip of nori. Sprinkle with sesame seeds. Repeat to make a total of 8 onigiri. 
49e187f87d8df929a9ade05a1481a74b£ Whisk together sesame oil, vinegar, garlic, ginger, sugar, salt, and pepper in a small bowl until the sugar has dissolved. Toss the cabbage, green onions, almonds, and sesame seeds in a large bowl with the dressing until well coated. 
d714c1745498570d14d0fc5941f7f7e5£ Cut cucumbers lengthwise, scoop out seeds with a spoon, and slice cucumbers into bite-sized pieces. Transfer to a salad bowl. In a small bowl, mix together salt, oil, sugar, rice wine vinegar, and soy sauce. Pour over cucumbers, and gently toss. Refrigerate several hours before serving, tossing every now and then. 
3a21a87374a8f2de56b5f9dd561bc4cb£
239de8c4c90802e3151f39c6e4fde3d9£ Combine the ketchup, soy sauce, Worcestershire sauce, sherry, sugar, garlic powder, and ginger in a microwave-safe coffee mug or glass measuring cup. Stir well with a fork and microwave on high for 1 minute. Stir again and set aside. Let stand for 1 hour to allow the flavors to incorporate. 
1a7aba8ddd12ac82e3701d19838a1ca3£ Heat canola oil in a large Dutch oven over medium-high heat until hot. Sear pork slices until well browned on both sides, then remove. Stir in the garlic and ginger, cook until fragrant, about 30 seconds. Add the water, soy sauce, brown sugar, and miso; bring to a simmer, scraping the bottom of the pan to dissolve the caramelized juices. Place pork into pot, add additional water if needed to cover pork with the sauce. Then, reduce heat to medium-low, cover, and simmer for 3 hours until the pork is tender, and the sauce has thickened. 
aa51220b7c0b51df594d0a0ad8187227£ In a medium dish, mix together the sake, soy sauce, sugar, garlic and ginger. Add chicken, and allow to marinate for 15 minutes. Preheat your oven&#39;s broiler. Grease six metal skewers, and thread alternately with 3 pieces of chicken and 2 pieces of leek. Place on a baking sheet or broiling pan, and brush with the marinade. Broil for about 5 minutes, baste again, then broil for another 5 minutes, or until chicken is cooked through. Discard remaining marinade. 
40f489f658cba9d69c6aaf7c8689ecab£ Bring the rice and water to a boil in a saucepan over high heat. Reduce heat to medium-low, cover, and simmer until the rice is tender, and the liquid has been absorbed, 20 to 25 minutes. Stir in rice vinegar and salt. Allow to cool completely. Lay out seaweed sheets. Moisten hands with water, then spread the rice evenly on each sheet, leaving a 1/2 inch gap along one edge, lengthwise. Arrange strips of cucumber, imitation crabmeat, and cream cheese in a straight line along the side opposite of the gap. Roll the sushi from the toppings to the exposed end of the the seaweed sheet. Using a sharp wet knife, slice each roll into 5 or 6 pieces. Serve with minced ginger on the side. 
9ab9b42a88c5220ba1c913aad1c2968c£ In a small bowl, stir together the mayonnaise, sugar and chili garilc sauce. Use immediately or refrigerate and use within one week. 
73f013657d6aca7f12c9923912c35154£ Add potatoes to a large pot of salted water, and bring to a boil; cook until tender, about 15 minutes. Drain, pour potatoes into a large bowl. Stir in butter, and mash with a fork or potato masher. Set aside. Heat 1 tablespoon oil in a large skillet over medium heat. Stir in onions, and cook until soft. Stir in beef and soy sauce. Cook, stirring continuously, until beef is browned and all the liquid is evaporated. Combine beef and onions with potatoes, and stir well. Heat 1/2 cup oil in a deep skillet or wok over medium-high heat. Shape potato and beef mixture into 10 similar-size balls, and flatten into patties. Dredge patties in flour. Then dip in egg, and coat with panko bread crumbs. Carefully place patties into oil, and fry until golden brown on each side. 
d00b5ba36cdfa5408662418ad6efc2d8£ Place pork belly into a large pot, and cover with water about 1-inch above the pork. Bring to a boil over medium-high heat, and simmer for 2 minutes. Discard water and fill pot with fresh water about 1-inch above the pork. Bring to a boil over medium-high heat, then reduce heat to a simmer. Cook until the pork begins to soften, about 1 hour. Remove the pork from the water, and place on a cutting board. Allow pork to cool for a few minutes, then slice off the thick skin and discard. Cut the remaining pork meat into 1-inch wide slices. Set aside. Combine the soy sauce, brown sugar, 1/2 cup water, mirin, ginger, and garlic in a large saucepan, and bring to a boil over high heat. Add the sliced pork belly, then bring to a boil again. Reduce heat to low, and place a sheet of aluminum foil directly over the meat and sauce. Simmer uncovered until the pork is tender, 30 to 45 minutes, turning the pork several times to cook evenly. 
01f253920703a65f5264389d2187a521£ Whisk sugar, rice vinegar, sesame oil, chile paste, and salt together in a bowl. Add cucumbers and stir to coat. Allow salad to marinate for 30 minutes before serving at room temperature. 
d33880c0bc4ce623694af56dfa2ff77d£ In a large bowl, mix together the ginger, soy sauce, sake and mirin. Add the sliced pork, cover, and marinate for about 1 hour. Heat the oil in a skillet or wok over high heat. Add the pork, and fry until brown. The pork should have a dark crispy look to it. Do not cook on low or medium heat, as the juices will not cook fast enough to get a crispy texture. Discard leftover marinade. 
2ecc7b5218c948a52295a9557f10d6ec£ Dissolve gelatin in the hot water in a small bowl. Pour gelatin mixture, coffee, and sugar in a saucepan and bring to a boil over high heat. Pour coffee mixture into glasses for individual servings or a large pan for cubing. Chill in the refrigerator until solidified, 6 to 7 hours. 
c7bde8f8d7f390fd4a1dfece41f79eec£ Heat soy sauce, sugar, and mirin into a small saucepan over medium heat. Cook and stir until liquid is reduced to about 3/4 cup. 
566155b216d8cee86c2f206b739e2d9d£ Cut the ginger into chunks and place them into a bowl. Sprinkle with sea salt, stir to coat and let stand for about 30 minutes. Transfer the ginger to a clean jar. In a saucepan, stir together the rice vinegar and sugar until sugar has dissolved. Bring to a boil, then pour the boiling liquid over the ginger root pieces in the jar. Allow the mixture to cool, then put the lid on the jar and store in the refrigerator for at least one week. You will see that the liquid will change to slightly pinkish in few minutes. Don&#39;t be alarmed because it&#39;s the reaction of rice vinegar that causes the change. Only quality rice vinegar can do that! Some commercial pickled ginger has red coloring added. Cut pieces of ginger into paper thin slices for serving. 
01d1fdf0d1cee2d940f7aedb997c8d7e£ Preheat oven to 350 degrees F (175 degrees C). Grease 12 muffin cups, or line with paper muffin liners. Whisk the flour, salt, baking powder, matcha, and sugar together in a mixing bowl; set aside. Whisk together the egg, melted butter, and milk in another bowl. Stir the milk mixture into the flour mixture until just moistened. Stir in walnuts. Divide the batter among the prepared muffin cups. Bake in the preheated oven until golden and the tops spring back when lightly pressed, about 25 minutes. Cool in the muffin tin for 5 minutes, then remove to cool on a wire rack. 
e629e3cbba6f59664e41e98015ebb110£ Heat dashi stock, chicken, carrots, soy sauce, mirin, sugar, and salt in a pot over medium heat. Simmer until chicken is no longer pink in the center, 5 to 7 minutes. Add tofu, mushrooms, and bok choy, stirring until vegetables are tender, about 5 minutes more. Stir udon noodles into broth and simmer until tender, 3 to 4 minutes. Add leeks and crack eggs into soup; simmer until eggs are slightly firm, about 5 minutes more. 
9b401ca91809be6a399f3f917f045e2b£ In a saucepan on low heat, combine marshmallows and milk. Cook until marshmallows are melted, and mixture starts to boil. Remove from heat. In a large bowl, beat cream cheese until smooth. Stir in egg yolk. Fold in 1/3 of the melted marshmallow mixture, then quickly fold in remaining marshmallow until no streaks remain. Stir in lemon juice. In a large bowl, beat cream until soft peaks form. Fold the whipped cream into the cream cheese mixture until no streaks remain. Spread into graham crust. Refrigerate for 3 hours. 
1065abe424ac500eb9d1ea98c8920268£ Rinse fillets, and pat dry with paper towels. In a medium bowl, mix together the soy sauce, mirin, sugar and fresh ginger. Place fillets into the marinade, and let stand for at least 20 minutes. Preheat your ovens broiler, or an outdoor grill for high heat. Broil the fillets, basting occasionally, until the fish flakes easily with a fork, about 5 to 8 minutes. Serve with a lemon slice or long white radish slice as a garnish. 
37dec82920a196ad88e84359e54a4b8a£ Heat oil in a deep-fryer to 375 degrees F (190 degrees C). Whisk flour, cornstarch, and salt in a large bowl. Make a depression in the center of the flour. Stir in the water and egg yolk. Mix just until moistened; batter will be lumpy. Stir in egg whites. One at a time, dip shrimp into the batter to coat. Do not batter tails. Carefully place a few shrimp at a time into the hot oil. Fry until golden brown, about 1 1/2 minutes. Drain on paper towels. 
ef8d46617c5923ede4880c89f48a8ecb£ In a small saucepan, combine the soy sauce, sherry, chicken broth, ginger, garlic powder and green onions. Bring to a boil, and immediately remove from heat. Set aside. Preheat your oven&#39;s broiler. Thread chicken pieces onto metal or bamboo skewers. Arrange on a broiler pan that has been coated with cooking spray. Spoon 1 or 2 tablespoons of the sauce over each chicken skewer. Place the pan under the broiler, and broil for about 3 minutes, until browned. Remove from the oven, turn over, and spoon more sauce onto each one. Return to the oven until chicken is cooked through and nicely browned. 
b0d45617ce12bf00ab93783e8437bb34£ Wrap red bean paste in aluminum foil and place in the freezer for at least 3 hours. Mix sweet rice flour and green tea powder thoroughly in a microwave-safe glass or ceramic bowl. Stir in water, then sugar. Mix until smooth. Cover bowl with plastic wrap. Cook the rice flour mixture in the microwave for 3 minutes and 30 seconds. Meanwhile, remove red bean paste from the freezer and divide paste into 8 equal balls. Set aside. Stir rice flour mixture and heat for another 15 to 30 seconds. Dust work surface with cornstarch. While the mochi is still hot from the microwave, begin rolling balls the size of about 2 tablespoons. Flatten the mochi ball and place 1 frozen red bean paste ball in the center. Pinch the mochi over the red bean paste until the paste is completely covered. Sprinkle with additional cornstarch and place mochi seam side down in a paper muffin liner to prevent sticking. Repeat until all the mochi and red bean paste is used. 
24b7a56316559e508430c0ac76365f7a£ Whisk the tahini, soy sauce, mayonnaise, garlic, ginger, and paprika together in a bowl. Gradually stir the water into the mixture until you reach a desired consistency. Refrigerate until ready to use. 
a21a26688d34280355b163d3618c4990£ Heat a skillet over medium heat, and coat with cooking spray. Add the cooked rice, 2 tablespoons ketchup, ham, and cheese, if using. Cook and stir until the ingredients are well combined and heated through, about 8 minutes. Scoop the mixture onto a serving bowl and shape into an oval. In a bowl, beat eggs and salt and pepper. Heat a small skillet coated with cooking spray over medium heat. Add egg mixture; cook over medium heat. As eggs set, lift edges, letting uncooked portion flow underneath. Use a spatula to gently fold the eggs into a cocoon shape. When eggs are completely set, remove from the heat. Place the omelet on top of the rice and run a knife length-wise through the top layer of the omelet. It should open like a butterfly and drape over the rice. Top with the final tablespoon of ketchup and a sprinkle of parsley. 
32d795476b3e32de12bb77ca5c2347d0£ Slice pork as thinly as possible. Working with partially frozen chops makes this easier. In a medium bowl, mix pork with mirin, rice vinegar, and soy sauce. Cover, and let marinate in refrigerator while you prepare the remaining ingredients. Slice mushrooms, green pepper, green part of green onions, and set aside. Mince white part of green onions, garlic, and ginger. Heat wok or large skillet over medium heat, then coat with sesame oil. Saute minced green onion, garlic, and ginger until fragrant. Increase heat to high. Squeeze marinade off pork, and place pork into wok. Reserve marinade. Cook and stir until pork is no longer pink, about 4 minutes. Stir in mushrooms, green pepper, and sliced green onion. Cook, stirring, until vegetables are tender, about 4 minutes. Stir in reserved marinade, and cook about 2 minutes. 
b6edb76526c02818bf5f6387638036be£ Bring the rice and water to a boil in a saucepan; reduce heat to medium-low, cover, and simmer until the rice is tender and the liquid has been absorbed, 20 to 25 minutes. Bring the chicken stock to a boil in a small saucepan. Stir in the soy sauce and brown sugar until the sugar has dissolved. Reduce heat to low; keep warm. Heat several tablespoons of the chicken sauce in a skillet over medium heat. Cook and stir the onion and shiitake mushrooms in the sauce until the onion has softened, about 3 minutes. Add the chicken, green onions, and a few more tablespoons of the sauce; continue cooking until the chicken is no longer pink in the center, about 5 minutes more. Spread the chicken mixture evenly over the skillet; pour the beaten egg overtop. Reduce heat to medium-low and sprinkle with the snow peas. Cook and stir until the egg has firmed and is no longer runny, about 3 minutes. Divide the rice between two bowls and spoon the egg mixture evenly overtop. Pour additional chicken sauce over the rice to serve. 
3c0b9bccb524d870987a0a017a8780b6£ Beat eggs thoroughly in a bowl; whisk in dashi stock, sugar, mirin, and soy sauce until sugar has dissolved. Place a nonstick skillet or omelet pan over medium heat. Oil the pan with vegetable oil. Pour a thin layer of egg mixture into the hot pan and swirl to coat pan. When egg layer is firm on the bottom but still slightly liquid on top, lift up about 1 inch of the edge of the omelet with a spatula and fold end over remaining egg layer; continue rolling the omelet to the end and push the roll to the edge of the skillet. Oil the skillet again if it looks dry; pour another thin layer of egg into the skillet and lift the roll to let the egg flow underneath the omelet roll. Fold the omelet roll over the new layer of egg, continuing to roll to the end as before. Push omelet to edge of skillet. Pour a new egg layer into the skillet, oiling the pan if needed. Roll the omelet over to incorporate the next egg layer into the roll. Pour new layers and roll into the omelet until all egg mixture has been used. Remove omelet to a serving platter and cut into 6 equal pieces to serve. 
49d6d72d31e85df698ff77665f7bf094£ Heat the sesame oil in a large skillet over medium heat until hot. Add the spinach 3 to 4 cups at a time. Cook and stir to wilt, then add more spinach. Grind the sesame seeds into fine crumbs using a mortar and pestle. When spinach is wilted, move it to the sides of the pan and sprinkle sugar in the center. When the sugar melts, stir in the spinach to coat. Transfer spinach to a serving plate and sprinkle ground sesame seeds on top. 
fd7109a0be8ed10a6da5d7a050730b51£ Mix the soy sauce, sugar, vinegar, chicken stock, sesame oil, and chili oil together in a small bowl, and stir until the sugar dissolves. Set aside. Bring a saucepan of water to a boil. Add the ramen noodles and cook for 2 minutes. Drain immediately, and refrigerate noodles until cold. Meanwhile, heat a small nonstick skillet over medium heat. Pour in the beaten egg and tilt the pan to thinly coat the bottom with egg. When firm, fold the egg in half and remove from the pan. Slice into thin strips. To serve, place cold noodles on serving plates. Top with separate piles of egg, cucumber, carrot, and ham. Pour the sauce over the top and sprinkle with crumbled nori. Serve with a touch of hot mustard on the side. 
7f07066d7e0300fb2bbb0e219b3cb71f£ Bring the vegetable broth to a boil in a saucepan. Add the mushrooms, reduce heat to low, and simmer 4 minutes. Stir the miso paste and soy sauce together in a small bowl; add to the broth along with the tofu and continue cooking for 1 minute more. Pour the soup into bowls and top with the green onions to serve. 
b15b31cbbfc578093c53a364b378b764£ In a medium bowl, whisk eggs gently while slowly pouring in the chicken stock, sake, and soy sauce. Divide the mushroom and chicken evenly between two small tea cups. Pour the egg mixture into each cup until filled. Bring about 1 inch of water to a boil in a steamer or saucepan. Reduce heat to a simmer, and place cups into the steamer. Cover, and steam for 12 minutes, or until egg is firm but soft and silky like tofu. Garnish each cup with a sprig of parsley, and serve. 
16b9177a72b26086191d454332ce6f62£ In a shallow bowl, mix together 1/2 cup of sesame seeds, seasoning salt, white pepper, onion powder, wasabi powder, kosher salt and flour; set aside. In a separate bowl, mix together the eggs and milk. Dip tuna steaks in the egg mixture, then dredge in the flour mixture until well coated on both sides. Press on as many extra sesame seeds as possible, so it is well coated. Heat the vegetable oil in a large heavy skillet over medium-high heat. Fry tuna steaks for 2 minutes per side, and immediately remove from heat. The inside of the fish should still be red. To make the soy miso dressing, mix together the miso soup mix and soy sauce. Heat in a small saucepan or microwave, and drizzle over steaks. 
0e8e2a1a2d5dd09b879abe6cd010a341£ Heat oil in a wok or large heavy skillet over medium-high heat. Add beef, and cook until evenly brown. Stir in beef stock, soy sauce and butter. Push meat to the side, and toss in onion, celery and mushrooms. Cook, stirring, for about 4 minutes. Add spinach, and cook for 2 more minutes. 
6867781e4ebc9cf50a329014498b8828£ In a medium saucepan, bring the water to a boil. Ladle out about 1/2 cup of the boiling water, and reserve. Add tofu. Reduce the heat to medium, cover, and cook for 1 to 2 minutes. Add spinach or bok choy; simmer about 1 to 2 minutes, or until the greens are tender. Remove soup from heat. Blend white miso and barley miso into reserved hot water. Stir into soup. Ladle into bowls, and garnish with scallion. Serve immediately. 
28928235c9b151ca8de3d366a4bde821£ Heat oil in a large skillet or wok over medium-high heat. Brown beef in hot oil, then stir in soy sauce, MSG, broth, and sugar. Mix in onion and celery, and cook until tender. Stir in bamboo shoots, green onions, mushrooms, and water chestnuts. Reduce heat to medium, stir in cornstarch, and simmer until sauce is thickened. 
f7ef013273a7ffa7354a334b9c8b51f5£ In a medium saucepan, bring stock to a boil; reduce heat to simmer, add mushrooms, and cook for 3 minutes. In a small bowl, mix miso paste and soy sauce together; stir into stock along with tofu. Simmer 5 minutes, and serve topped with with green onion. 
41cd3808d9e366fa508c7c7a6f9222d0£ Cut chicken meat into bite size pieces. In a medium bowl combine the sugar, soy sauce, and mirin wine. Mix well, and set aside. In a skillet or wok, heat oil over medium-high heat. Squeeze juice from grated ginger into wok, add grated ginger, and stir fry until brown. Discard ginger fibers. Increase heat to high, and stir in chicken. Season with soy sauce mixture, and cook for 2 more minutes. One at a time add the carrots, onions, bamboo shoots, mushrooms, and watercress. Stir after each addition. Add rice noodles; cook, stirring, for about 3 more minutes, or until done. 
