0a5aa8b3add27af0c63ea9c0bef73ec7£ Heat water in a large pot over low heat. Add kombu and cook until the mixture just begins to simmer. Stir bonito flakes into kombu mixture until combined. Remove pot from the heat and let dashi sit, uncovered, for 5 minutes. Strain and set aside. Heat 3 1/2 cups dashi in a pot over medium heat. Add tofu and wakame; stir to combine. Remove 1 cup warmed dashi to a small bowl and whisk in miso paste. Pour miso mixture back into the pot with remaining dashi. Stir until warmed through. Serve garnished with chopped green onions. 
5a21503bfeae70845e82e06cd03e9e73£ Pour oil into the bottom of a large saucepan, and place over medium heat. Add onion; saute until tender and almost brown. Add garlic and ginger; saute until fragrant, just a minute or two. Add tofu. Cook, stirring occasionally, until browned; this should take about 5 minutes Stir in soy sauce, thoroughly coating tofu. Add water and sherry. Bring back up to heat, and add carrots and spinach. Heat through. Thin miso with some of the soup, and add back into the soup. Simmer over medium low heat for 5 to 10 minutes, stirring occasionally. Season with black pepper to taste. Serve. 
d8ebdb22887abba8f9461519c48deaa9£ In a large saucepan cover rice with water and let stand for 30 minutes. In a shallow dish combine soy sauce, honey and garlic. In this mixture marinate tofu for at least 30 minutes. Bring water and rice to a boil and then reduce heat; simmer for about 20 minutes, or until thick and sticky. In a large glass bowl combine cooked rice with rice vinegar. Place a sheet of nori on a bamboo mat. Working with wet hands, spread 1/4 of the rice evenly over the nori; leave about 1/2 inch on the top edge of the nori. Place 2 strips of marinated tofu end to end about 1 inch from the bottom. Place 2 strips of cucumber next to the tofu, then avocado and carrot. Roll nori tightly from the bottom, using the mat to help make a tight roll. Seal by moistening with water the 1/2 inch at the top. Repeat with remaining ingredients. Slice with a serrated knife into 1 inch thick slices. 
c56751c00d866f38ac484d919a035cde£ Place the pork chops between two sheets of heavy plastic (resealable freezer bags work well) on a solid, level surface. Firmly pound the pork with the smooth side of a meat mallet to a 1/4-inch thickness (about .75 cm). Season with salt and pepper to taste. Pour oil into a skillet about 1/2 inch (1.25 cm) deep. Heat the oil over medium-high heat to 375 degrees F (190 degrees C). Place the flour, egg, and panko crumbs in separate bowls. Coat each cutlet in flour, then egg, and finally in bread crumbs. Tap off any loose crumbs. Fry the cutlets until golden brown and cooked through, about 4 minutes per side. Drain on paper towels. 
3b1ddb1ac9c3bca76613d517b87d58cf£ Preheat an oven to 350 degrees F (175 degrees C). Grease a 9x13 inch baking dish. Whisk the rice flour, sugar, and baking powder together in a mixing bowl. Beat the eggs, coconut extract, and vanilla extract in a mixing bowl until the eggs are smooth. Whisk in the milk, coconut milk, and melted butter until incorporated. Stir in the flour mixture a little at a time until no lumps remain; scrape into the prepared baking dish, and smooth the top. Bake in the preheated oven until the mochi is golden brown, about 1 hour. Cool to room temperature before cutting into 24 pieces to serve. 
69fa36ee11c14d10f723e4027d3adf32£ Preheat the oven&#39;s broiler and set the oven rack about 6 inches from the heat source. Wash the mushrooms; arrange on a baking sheet with top side of the mushroom facing down. Whisk together the soy sauce, sesame oil, ginger, and garlic in a small bowl; brush the mixture evenly over the mushrooms. Roast the mushrooms under the broiler until soft, about 10 minutes. 
76d3b90754cae9dbd4f99de7fc53691a£ Mix the soy sauce, sugar, dashi granules, and water together in small bowl until sugar dissolves. Place the tofu on a small plate and top with ginger, green onion, and bonito shavings. Drizzle the soy mixture on top, and sprinkle with sesame seeds. 
a76e8c6ac841957ad6b9d6b922edf128£ Preheat oven to 350 degrees F (175 degrees C). Grease a 9-inch Bundt pan or a 9x13 inch baking pan. In a large bowl, mix together the butter, sugar, eggs, vanilla and milk. Stir in the rice flour and baking powder. Pour the batter into the prepared pan. Drop red bean paste by scant teaspoonfuls onto the top of the cake. If spoonfuls are too big, the filling will sink to the bottom. Bake for 1 hour and 10 minutes in the preheated oven, or until cake springs back when lightly touched. If using a Bundt pan, invert the cake onto a serving plate. Cake must be completely cooled before unmolding from Bundt pan, or it will be too soft to hold its shape. Serve small slices of this very rich cake at room temperature or slightly warmed. 
e0acda96952e0b171d65175fdf154aeb£ In a bowl, stir together olive oil, wasabi powder, sesame seeds, and cracked black pepper. Toss tuna into mixture until evenly coated. Adjust seasoning as desired with additional wasabi powder or black pepper. Serve on sliced French bread. 
9a47c50d0b822a09cbe98c0efbb08115£ In a small saucepan, bring water to a boil. Stir in dashi, and cook for 2 minutes. Remove from heat, and stir in mirin and soy sauce. 
e34ed297148ddd9656b7db12b4cb5199£ Combine the graham cracker crumbs with 2 tablespoons of sugar in a mixing bowl. Drizzle in the melted butter and mix until evenly moistened. Press into the bottom of a 9-inch springform pan lined with waxed paper; set aside. Stir the tea powder into the warm water; set aside. Sprinkle the gelatin over the cold water; set aside. Whip the cream to stiff peaks; set aside. Beat the cream cheese, 1/2 cup sugar, vanilla, and honey in a clean mixing bowl. Beat in the eggs one at a time until evenly blended. Cook the gelatin mixture in the microwave until melted, about 45 seconds. Beat the gelatin and tea into the cream cheese mixture, then fold in the whipped cream until smooth. Pour into the springform pan. Refrigerate 7 hours to overnight before unmolding and serving. 
b2f34cfcfb1fc1d4a47ce4232b587956£ Put the snow peas in a small saucepan with enough water to cover; bring to a boil and immediately remove from heat. Drain and set aside. Heat the oil in a large skillet over medium heat; cook the beef in the oil until browned. Add the potatoes; cook and stir until soft, 5 to 7 minutes. Stir the dashi soup, soy sauce, sake, and sugar into the mixture; simmer for 10 minutes. Reduce heat to low and scatter the chopped onion over the mixture; allow to simmer until the liquid is nearly completely evaporated, about 15 minutes more. Top the mixture with the snow peas to serve. 
be9c1b1eadde87ba864a8d2d9f4c04f3£ Place eggs in a saucepan; cover with water. Bring to a boil, remove from heat, and let eggs stand in hot water for 15 minutes. Remove eggs from hot water, cool under cold running water, and peel. Place sesame seeds in a dry skillet over medium heat; cook and stir until lightly browned, about 3 minutes. Remove to cool on a plate lined with a paper towel. Cut each egg in half lengthwise; place egg yolks into a food processor with mayonnaise, soy sauce, wasabi paste, and rice vinegar. Process until smooth; place green onion and panko bread crumbs into yolk mixture and pulse just enough to mix evenly. Arrange egg white halves on a serving platter; spoon yolk mixture into whites. Sprinkle with toasted sesame seeds. 
54c0e222104b8cf056803f12f9da9e25£ Place tofu between two plates, and weigh down with a heavy book. Allow tofu to drain for 1 hour, pouring out the expelled liquid every 20 minutes. Whisk together the soy sauce, mirin, sesame oil, and rice vinegar in a small bowl. Heat the oil in a small pan over medium heat, stir in the garlic and ginger, and gently cook until lightly golden; stir into the soy sauce mixture. Cut tofu into bite-sized pieces, and toss together with the tomato, onion, and cilantro. Pour in the dressing and toss to coat. Garnish with a sprinkle of sesame seeds. 
bed1765d1d8e2d5357f6c7294075ade0£ In a serving bowl, stir together the red wine vinegar, mirin, brown sugar, ginger and lime juice. Add the cucumber and onion, and toss gently to coat. Chill for 30 minutes to blend flavors before serving. 
b6b618958087b6559cc4659650aa545d£ In a saucepan, combine the water, salt, sugar and nori. Bring to a boil and add the rice. Cover, set heat to low and simmer for 20 minutes. 
04c500dd8d9ae61657cb8c662cecaf2a£ In a saucepan, stir together the sugar and gelatin. Mix in hot coffee and water. Cook over low heat, stirring frequently until the gelatin and sugar have completely dissolved. Remove from heat, and stir in lemon juice. Pour into a 4 1/2 cup mold. Refrigerate until set, at least 6 hours or overnight. Serve with whipped cream. 
42d8beed585f685f120ddf974abf556c£
4b2f548593c6cc5d65a2cbac5f15ccd9£ Place the block of tofu onto a plate and place another plate on top. Set a 3 to 5 pound weight on top (a container filled with water works well). Press the tofu for 10 to 15 minutes, then drain off and discard the accumulated liquid. Cut the tofu into 1/2-inch cubes. Combine the tofu, ground beef, shiitake mushrooms, miso paste, egg, salt, pepper, and nutmeg in a large bowl. Divide into 6 balls, and flatten into patties. Stir together the mirin, soy sauce, garlic paste, and ginger in a small bowl. Set aside. Heat the vegetable oil in a large skillet over medium-high heat. Brown the burgers on each side, about 2 minutes per side. Reduce the heat to low; cover the pan and cook until the juices run clear, about 5 minutes. Drain and discard any excess grease. Pour the soy sauce mixture into the pan. Keep moving the pan so the sauce doesn&#39;t burn, and flip the burgers occasionally to coat both sides with the sauce. The sauce will thicken and create a shiny glaze on the burgers. When all the sauce has been used up, the burgers are ready. 
44735b510e50ff75d347f30c3e3a8076£ Combine dashi, soy sauce, mirin, and sugar in a bowl and set aside. Soak noodles in boiling water for 1 minute. Drain and rinse under cold water. Heat 2 tablespoons canola oil; cook and stir beef in the hot oil until no longer pink, 2 to 3 minutes. Drain and set aside. Heat 1 tablespoon canola oil in the skillet; cook and stir onion, celery, carrot, and mushrooms until softened, about 4 minutes. Stir in green onions, and dashi mixture, noodles, beef, and tofu. Bring to a simmer. Divide hot sukiyaki among four bowls and serve. 
8dd99c1c6e7f663f2088e2fd8ad09e95£ Bring the rice, water, and vinegar to a boil in a saucepan over high heat. Reduce heat to medium-low, cover, and simmer until the rice is tender, and the liquid has been absorbed, 20 to 25 minutes. Let stand, covered, for about 10 minutes to absorb any excess water. Set rice aside to cool. Lightly mix together the tuna, mayonnaise, chili powder, and wasabi paste in a bowl, breaking the tuna apart but not mashing it into a paste. To roll the sushi, cover a bamboo sushi rolling mat with plastic wrap. Lay a sheet of nori, rough side up, on the plastic wrap. With wet fingers, firmly pat a thick, even layer of prepared rice over the nori, covering it completely. Place about 1 tablespoon each of diced cucumber, carrot, and avocado in a line along the bottom edge of the sheet, and spread a line of tuna mixture alongside the vegetables. Pick up the edge of the bamboo rolling sheet, fold the bottom edge of the sheet up, enclosing the filling, and tightly roll the sushi into a thick cylinder. Once the sushi is rolled, wrap it in the mat and gently squeeze to compact it tightly. Cut each roll into 6 pieces, and refrigerate until served. 
0d9091a24ad1531d53e4386b4251cd1b£ Heat the oil in a skillet over medium heat. Add the mushrooms, cover and allow them to sweat over low heat until soft. Do not let them brown. Meanwhile, bring a large pot or skillet of water to a boil. Blanch asparagus by lowering it in a strainer into boiling water; cook just until bright green, about 30 seconds, and then transfer asparagus into ice water to stop the cooking. Set aside. Set oven rack about 6 inches from the heat source and preheat the oven&#39;s broiler. Grease a broiling pan. To construct the rolls, lay the steaks out flat. If your steaks are thick, pound them to about 1/4 inch thickness. Brush soy sauce onto the surface, then place a few mushrooms, a couple of green onions and 3 asparagus spears at one end of each steak. Roll up towards the other end to enclose, and secure each bundle with a toothpick. Place the rolls seam side down on the broiling pan. Roast under the preheated broiler until browned on top, about 3 minutes. Turn the rolls over and brown on the other side, 2 to 3 more minutes. Be careful not to overcook; this could burn the steaks or make the meat tough. 
d4bbde061a0c39d9a5d5f22c8cf70980£ Set a bamboo steamer large enough to contain a 9x9 inch pan over simmering water. Sift together the cake flour, baking powder and green tea powder. Set aside. In a large bowl, combine the egg yolks, sugar, water and vanilla extract. Using an electric mixer, beat on medium speed until mixture has tripled in volume. Fold in the flour mixture, mixing just until combined. Beat the egg whites until they form stiff peaks. Gently fold whites into the egg yolk mixture. Pour batter into the cake pan. Place cake pan in steamer. Stretch a kitchen towel over the cake pan without touching the surface, then cover with steamer lid. Steam cake for 20 minutes, or until a toothpick inserted in the center comes out clean. Cool on wire rack. Sprinkle with black sesame seeds and cut into pieces before serving. 
a18ab374db05e25dc57427292800c15b£ Partially peel cucumbers lengthwise, leaving thin green stripes around the cucumber. Halve cucumbers lengthwise. Scoop seeds from cucumber halves with a spoon. Discard seeds. Slice cucumbers thinly and put in a bowl. Add salt to cucumber and mix with hand until cucumber is limp; set aside for 45 minutes. Transfer cucumbers to a strainer and squeeze as much liquid out as possible. Mix lemon juice, sugar, and vinegar together in a large bowl until the sugar dissolves. Add the drained cucumber and toss to coat. Spoon into small bowls and top each portion with toasted sesame seeds. 
dcdad6f7ff04e6cfe37b13fb91b3ee07£ Wrap a sushi rolling mat completely in plastic wrap and set aside. Bring water and rice to a boil in a saucepan over high heat. Reduce heat to medium-low, cover, and simmer until the rice is tender and the liquid has been absorbed, 20 to 25 minutes. Transfer rice to a bowl and cut in rice vinegar using a rice paddle or wooden spoon. Season with 1 teaspoon sugar and 1 teaspoon salt, or to taste. Allow to cool to room temperature, about 30 minutes. Combine crab meat with mayonnaise in a small bowl. Place a sheet of nori on a flat work surface. Spread a thin layer of rice on top of the nori. Place the nori, rice side down, on the prepared rolling mat. Place 2 to 3 avocado slices on top of the nori in one layer. Top with 2 to 3 tablespoons of the crab mixture. Spoon 1 to 2 teaspoons tobiko lengthwise on one side of the avocado-crab mixture, and 2 cucumber strips on the other side. Using the mat as a guide, carefully roll the California roll into a tight log. Remove the rolling mat. Top roll with more tobiko, cover with plastic wrap, and gently press the tobiko into the top of the roll. Remove the plastic and cut roll into 6 even pieces using a wet knife. Repeat with remaining sheets of nori and filling. Serve garnished with pickled ginger, soy sauce, and wasabi paste 
be6da29a25efd111b63796676ef0d0b1£ Whisk miso into the water until dissolved; set aside. Heat the sesame oil in a frying pan or wok over medium-high heat. Cook the white parts of the green onion until lightly colored and fragrant, 30 seconds to 1 minute. Stir in the ground meat, and cook for a few minutes until nearly done. Gently stir in the tofu with the miso paste. Bring to a simmer, and cook for a few minutes to warm the tofu. Sprinkle with the green parts of the green onions before serving. 
16fca05eec5d36c04ce434247dfa3a1c£ Place cucumber slices in a bowl and season with salt and pepper. Toss in imitation crabmeat. Whisk vinegar and soy sauce together in a separate bowl. Pour over the cucumber and crab mixture and toss to coat. 
5d5129a07716743db086d45b6eb72bfb£ Wipe away any dirt from the kombu with a paper towel, being careful not to rub off the white powdery deposits on the seaweed. Place the kombu and water in a saucepan, and allow it to soak for 30 minutes to become soft. Remove the kombu from the water, and cut several lengthwise slits into the leaf. Return the kombu to the water, and bring it to a boil. As soon as the water begins to boil, remove the kombu to prevent the stock from becoming bitter. Stir the bonito flakes into the kombu-flavored water, bring back to a boil, and take the pan off the heat. Allow the water to cool. When the bonito flakes have settled to the bottom, strain the dashi through a strainer lined with cheesecloth or a coffee filter. 
3f8c34d77c3bf8299fe2156c4b39f4ef£ Whisk the green tea powder, water, and milk together in a bowl; sweeten with the honey and continue whisking until dissolved into the tea. Chill completely in the refrigerator. Serve poured over ice. 
3f369098c5570c00e32b404a297e8946£
3cc08b780736874ef6769511664adedc£ In a medium bowl, stir together the soy sauce, honey and sake. Mix in the pressed garlic, if using. Use as a marinade and/or a basting sauce while grilling chicken. 
a5d88d3d74b96000c44003d72bcbfa3e£ In a medium bowl, beat egg yolks and lemon juice with a wooden spoon. Beat in vegetable oil a few drops at a time, beating well after each addition until the mixture begins to emulsify. When all of the oil has been incorporated, stir in the miso, salt, white pepper and grated yuzu. Refrigerate in a squeeze bottle for convenient application. 
c71704b5f7251dfb02fae0c60668d2df£ Preheat oven to 450 degrees F (275 degrees C). Dip mochi into soy sauce, then place on a baking sheet. Let bake for about 5 minutes, or until heated through. While mochi is cooking, cut the dried seaweed into 8 strips. Place these strips in a large frying pan over medium heat. When they are warmed, after approximately 1 to 2 minutes, remove them from the heat. Wrap each mochi cake in seaweed; serve warm. 
c3ca27ecfa9ab409ba2d5016321c550e£ In a small bowl mix vanilla wafers, egg, and water until well blended. Refrigerate 1 to 2 hours. To make dipping sauce: In a small sauce pan blend nectar into cornstarch. Stir in brown sugar, vinegar and catsup. Heat mixture over a medium heat, stirring constantly until mixture thickens and comes to a boil. Set aside. In a stockpot or deep fryer heat 2 cups oil to 375 degrees F (175 degrees C). Dip shrimp in vanilla wafer batter and fry 4 to 6 shrimp at a time until golden brown. Drain well. Serve hot with dipping sauce. 
a761f29ed29a385fc7e3b6f63ba5adc2£ Preheat oven to 325 degrees F (165 degrees C). Lightly grease an 8-inch round cake pan and line with parchment paper. Place cream cheese in a bowl with milk; soak for 20 minutes. Heat cream cheese with milk and butter in the top of a double boiler over simmering water, stirring frequently, until melted and smooth, about 5 minutes. Remove from heat and cool completely, at least 15 minutes. Sift cake flour and cornstarch together into a bowl. Sift again into the cream cheese mixture; mix well. Add egg yolks and lemon juice and mix well. Beat egg whites, cream of tartar, and salt together in a separate bowl using an electric mixer until foamy; add sugar, 2 tablespoons at a time, beating well after each addition. Continue beating on high speed until soft peaks form. Fold cream cheese mixture into egg white mixture until well mixed; pour into the prepared pan. Place pan inside a larger baking dish and fill the baking dish with water until it reaches halfway up the sides of the cake pan. Bake in the preheated oven until cheesecake is set and golden brown on top, about 1 hour 10 minutes. Turn off oven and leave cake in oven with door ajar for 1 hour. Transfer to a wire rack to cool completely. 
acdb3c55585a6c7ab865bc2adf71f2b2£ In a saucepan, combine the azuki beans, 1/3 cup of sugar, lemon juice and water. Bring to a boil, and boil uncovered for 3 minutes. Reduce the heat to low, and simmer for 2 1/2 to 3 hours, or until the beans are very tender. When done, the beans and liquid should amount to 3 cups. If not, add more water to compensate. Strain the bean mixture through a sieve - I use a wooden paddle for this, and discard the bean skins. Refrigerate for about 2 hours, or until cold. In a saucepan, combine the milk and cream. Bring to a boil over medium heat. While you wait for that to boil, whisk together the egg yolks and 2/3 cup of sugar in a medium bowl. When the cream and milk come to a boil, ladle about 1/4 cup of the hot liquid into the bowl with the egg yolks, and whisk until smooth. Pour the yolk mixture into the pan with the cream, and cook over low heat until thick enough to coat the back of a metal spoon. This should take about 5 minutes. Do not cook too long, or you will get lumps. Remove from the heat, and stir in the vanilla. Refrigerate until cold. Once both of the mixtures are cold, stir them together. Pour into an ice cream maker, and freeze according to the manufacturer&#39;s instructions. 
8a1df9cf9c0817bdb8ab5166f832996a£ Place the avocados, lime juice, onion, jalapeno pepper, shiso leaf, ginger, wasabi paste, white pepper, and hot sauce into a bowl. Mash until no large pieces of avocado remain, or to your desired consistency. Gently fold in the chopped tomato and season to taste with salt and pepper before serving. 
903f2aea72981da3cb1e6617e4c9c8f2£ Combine rice and water in a saucepan and bring to a boil. Reduce heat to low, cover, and cook for 20 minutes, or until tender and water is absorbed. Leave covered, and let stand for 10 minutes. Remove to a bowl to cool completely. Heat a skillet over medium heat, and coat with cooking spray. Pour in the eggs, and scramble until cooked through. Season them with a little salt and pepper. Remove from heat and set aside. Lay one sheet of nori on a clean work surface, or if you have one, a sushi mat. Wet your hands, and press a layer of cooled rice about 1/3 inch thick onto half of the sheet. Spread a line of pesto across the edge of the rice about 1/2 inch wide. Top with a line of egg. Roll the sheet of nori over the pesto egg and rice to reach the empty part of the sheet. Wet the end, and roll up to seal. Use a knife to cut the roll into 6 small rolls. 
a1174e9cd672ebf70334bf8e322fb606£ Preheat oven to 450 degrees F (230 degrees C). Grease an 11x7 inch pan. Line bottom with parchment paper and grease and flour paper. Sift together the flour, cornstarch and 1 tablespoon green tea. Set aside. In a large bowl, beat eggs, yolks and 6 tablespoons sugar until tripled in volume, about 5 minutes. Fold flour mixture into whipped eggs. In a large glass or metal mixing bowl, beat egg whites with cream of tartar until foamy. Add 2 tablespoons sugar, continuing to beat until stiff peaks form. Fold 1/3 of the whites into the batter, then quickly fold in remaining whites until no streaks remain. Spread batter into prepared pan. Bake in the preheated oven for 8 to 10 minutes, or until center of cake springs back when lightly tapped. Sprinkle with confectioners&#39; sugar, then invert onto a flat surface. Let cool. To make the Green Tea Whipped Cream: In a medium bowl, whisk the heavy cream with the 4 teaspoons superfine sugar and 2 teaspoons green tea until stiff peaks form. To make the Decorative Green Tea Marzipan: Knead the almond paste with 1 teaspoon green tea. Roll out between 2 sheets of plastic wrap, or lightly dust with confectioners&#39; sugar while rolling. When cool, remove parchment paper from bottom of cake. Cut cake horizontally down the middle to make two layers. Spread bottom layer with 1/2 of the whipped cream, then cover with top layer of cake and spread top with remaining whipped cream. Cut assembled cake into 12 pieces using a knife or decorative cutters. Roll out the marzipan and cut into 12 pieces to match the shapes of the cakes. Place the decorative marzipan pieces on top of cakes. 
d0aef993048617f652e500bbf5556926£ In a saucepan, combine soy sauce, mirin, orange juice, pineapple, Granny Smith apple, garlic, ginger, and half of the sugar; bring to a boil. Reduce heat, and simmer 20 minutes. Adjust sweetness to taste with remaining sugar. Strain through a fine mesh sieve; cool. 
118c9464b63ecb8e799d60dd2bf84f33£ In a bowl, mix the mirin, garlic, soy sauce, monosodium glutamate, and sugar; stir to dissolve the sugar. Place the beef and green onions into the marinade, stir to coat with marinade, and allow to stand for 30 minutes. Soak bamboo skewers in water. Preheat the oven&#39;s broiler and set the oven rack about 6 inches from the heat source. Roll a slice of thin beef around a piece of green onion; skewer the roll with 2 bamboo skewers, place about 1/2 inch apart. Repeat twice more, placing 3 beef rolls onto the 2 skewers. Repeat with remaining beef, green onion, and skewers until all the beef is rolled up. Place skewers onto a broiling pan. Discard used marinade. Broil until browned on both sides, about 3 to 3 1/2 minutes per side. 
08c5ac6345523a85bd62e445dd0095ac£ Combine soy sauce, grapefruit juice, hoisin sauce, ketchup, rice wine vinegar, brown sugar, ginger, habanero pepper, and garlic in a saucepan over medium high heat. Bring to a boil, then reduce heat to medium-low, and simmer 10 minutes, or until thick, stirring occasionally. Strain sauce to remove pepper and garlic. Refrigerate in a covered container until ready to use. 
f2bc083915a998326acebe325dbd6070£
