d85415a35c1b72dff0c12651b2404535£ Cook pork in a skillet over medium heat, breaking up the meat with a wooden spoon, until no longer pink in the center, 8 to 10 minutes. Drain excess grease and transfer to a bowl. Heat 1 tablespoon vegetable oil in the same skillet. Add onions; cook and stir until slightly softened and translucent, about 5 minutes. Season with salt. Add carrots; cook and stir until softened, 6 to 8 minutes. Add to the cooked pork. Cook cabbage in the same skillet over medium-high heat, adding the pork-carrot mixture in gradually, until wilted, 6 to 8 minutes. Stir in vinegar, ginger, grape jelly, teriyaki sauce, 1 tablespoon soy sauce, 1 tablespoon oyster sauce, and sesame oil. Cook and stir gyoza filling until flavors combine, about 3 minutes. Combine 1 tablespoon water and cornstarch in a small bowl. Add to the gyoza filling. Cook and stir until thickened, 3 to 5 minutes. Let cool, at least 20 minutes. Place a dab of filling in the center of a dumpling wrapper. Fold over to form a semicircle and seal the circle edge with water; press firmly. Place gyoza on a baking sheet. Repeat with the remaining filling and wrappers. Combine 1/2 cup water, rice wine vinegar, 1 1/2 teaspoons soy sauce, and 1 1/2 teaspoons oysters sauce in a bowl to make sauce. Heat 1 tablespoon oil in a skillet over medium heat. Add gyoza in batches; cook until browned, 4 to 5 minutes. Add some of the sauce. Cook, covered, until liquid is absorbed, about 5 minutes. Repeat with remaining gyoza and sauce. 
b17f06dbfef7a69d0ccc325892570ecd£ Pour water into a large saucepan. Drop konbu into the water. Bring to a simmer; the water will start sucking in the essence of the konbu. Add soy sauce, mirin, and sake. Simmer, tasting from time to time, about 5 minutes. Remove konbu and let cool completely. Pour into a bottle, seal, and store inside a refrigerator. Use as soon as possible. 
8d2e2e45f636179230e99329e707470b£ Place daikon in a colander and press down lightly to drain excess water. Bring dashi to a boil in a large Japanese nabe or pot over medium heat. Add daikon; return to a boil. Add tofu, bring to a boil, and reduce heat to low. Add mitsuba and salt. 
ebf6b5c7dec74cd6abbda10bf6621e13£ Cut tofu into squares. Place on a microwave-safe plate and cover with paper towel. Microwave until moisture is evaporated, 3 to 4 minutes. Heat vegetable oil in a large saucepan over medium-high heat. Cover tofu squares generously with potato starch. Fry in the hot oil until golden brown, 3 to 5 minutes per side. Place in a bowl. Mix water and 2 teaspoons potato starch together in a bowl to make the thickening agent. Combine sake, soy sauce, mirin, and fish stock in a saucepan over medium-high heat. Bring to a boil and add carrots and mushrooms. Cook and stir until carrots are tender, about 5 minutes. Stir in the thickening agent. Cook and stir until sauce is thickened and flavors combine, about 2 minutes more. Pour sauce over the tofu. Top with Welsh onion and ginger. 
020096a47723da0e824148888a597245£ Preheat the oven to 275 degrees F (135 degrees C). Place black fungus in a large bowl and fill with water. Combine mirin, 1/2 cup soy sauce, 1/2 cup brown sugar, 3 green onion bulbs, chopped onion, and garlic in an oven-safe pot over high heat. Bring to a boil. Place pork belly skin-side down on a flat work surface. Roll up lengthwise and wrap with butcher&#39;s twine. Place pork belly in the pot with the mirin mixture and partially cover with a lid. Bake in the preheated oven until pork is tender and an instant-read thermometer inserted into the center reads at least 145 degrees F (63 degrees C), about 4 hours. Bring a separate pot of water to a boil over high heat. Gently place eggs in the pot and cook until yolks are barely set, 8 to 10 minutes. Transfer eggs to a bowl filled with ice water. Let sit, about 1 minute. Remove from water and peel eggs. Place eggs in a container with 1 cup water, 1/2 cup soy sauce, and 2 tablespoons brown sugar. Dampen a paper towel in the mixture and use it to cover the container. Refrigerate 4 hours to overnight. Drain the fungus and add to the liquid in the pot with the pork belly. Cover with a lid and refrigerate, 4 hours to overnight. Skim fungus from the top of the pork belly mixture and place in a pot with 8 cups water; fungus should be covered in pork belly fat. Add 1/4 cup soy sauce and miso paste. Bring to a boil. Remove skin from the pork belly using a knife. Chop the meat into pieces of desired thickness. Cut eggs in half lengthwise. Bring a separate pot of water to a boil. Cook ramen in boiling water, stirring occasionally, until noodles are tender, yet firm to the bite, about 3 minutes. Drain. Place 4 slices of nori diagonally in the corner of each bowl. Place noodles on top; arrange 2 egg halves and a few pork belly slices in separate corners. Cover with black fungus, top with green onions, and pour in broth. Top each bowl with a few slices of naruto. Let sit, about 3 minutes, before serving. 
a4597eb6b2bb4d9757e6abe41790b604£ Place chicken, scallops, anchovies, shrimp, bonito flakes, half the ginger, and kombu in an electric pressure cooker. Add water; close and lock the lid. Select the Soup setting; set timer for 90 minutes according to manufacturer&#39;s instructions. Allow 10 to 15 minutes for pressure to build. Release pressure using the natural-release method according to manufacturer&#39;s instructions, 10 to 40 minutes. Strain broth through a colander or fine-mesh sieve. Skim the fatty oil off the top of the broth. Combine soy sauce, mirin, sake, green onions, bonito flakes, sugar, garlic, and kombu in a medium saucepan over high heat. Bring to a boil. Reduce heat to low and simmer until flavors blend, about 10 minutes. Strain tare sauce through a fine-mesh sieve into a bowl. Pour 2 tablespoons of tare sauce into a large bowl. Ladle in about 2 cups of broth. Add 1/6 of the ramen noodles. Repeat with remaining tare, broth, and ramen. 
7c9b3802ff20e9d386a89780135617fd£ Place wakame in a fine-mesh sieve and soak in some cold water for 10 minutes. Combine 4 cups water and dashi granules in a saucepan and bring to a boil over medium heat. Add miso paste and whisk to dissolve. Add wakame and simmer for 3 minutes. Divide tofu between 4 serving bowls. Ladle miso soup on top and garnish with green onions. 
e235a6a237bd5cb6bbce475d5db1d586£ Combine tofu and rice flour in a bowl; mix together by hand until smooth and slightly elastic. Pull dough thinly to test consistency; if it feels like your earlobe, it&#39;s ready. Add water or more rice flour as needed. Separate dough into 3 equal parts. Add red food coloring to 1 portion; mix by hand to evenly distribute the color. Note that color will intensify once dango are boiled. Mix another portion of dough with green tea powder; leave the last portion white. Separate each portion of the dough into 3 equal parts; roll into balls to make the dango. Bring a large pot of water to a boil. Drop dango into the pot and boil until they float to the top, 3 to 5 minutes. Continue boiling for 2 minutes more. Remove dango with a slotted spoon and place into a bowl of cold or room-temperature water for 1 minute until just warm to the touch. Thread them through skewers in order of your liking. The traditional order is green, white, and pink. 
b2e46cc76744e77f74a2ccb5f3e6e65f£ Preheat the oven to 320 degrees F (160 degrees C). Grease an 8-inch round pan with butter and line the bottom with parchment paper. Fill a pot about 1/4 full with water and bring to a boil. Combine and milk in a heatproof bowl large enough to sit on top of the pot without touching the water. Reduce heat to medium and whisk until butter is melted, about 1 minute. Add cream cheese and whisk until smooth, about 2 minutes. Add honey and whisk until melted, about 1 minute. Remove bowl from heat. Add egg yolks, 1 at a time, to the cream cheese mixture; whisk batter well after each addition. Add lemon juice and zest. Use a fine mesh strainer to sift flour, cornstarch, and salt into the batter. Whisk until blended together. Pour batter through the strainer into a clean bowl to remove any lumps. Set aside. Whisk egg whites in a bowl until foamy. Add cream of tartar. Whisking continuously, slowly adding white sugar, until soft peaks form. Fold 1/3 the egg whites into the batter using a whisk. Fold in remaining egg whites. Pour batter into the prepared pan and tap on a flat surface to remove any air bubbles. Place a clean towel in the bottom of a shallow baking sheet. Place filled cake pan on top of the towel. Pour enough water into the baking sheet to come 1 to 2 inches up the side of the cake pan. Place baking sheet on the lowest rack of the preheated oven; bake for 20 to 22 minutes. Reduce temperature to 275 degrees F (135 degrees C), leaving oven door closed. Continue baking until mostly set but center is still jiggly, about 55 minutes more. Turn oven off and leave door ajar with cake inside for 30 minutes. Remove cake from pan. Decorate with confectioners&#39; sugar and refrigerate for 1 to 2 hours before serving. Cake may also be served at room temperature. 
09dffa7502f90e1c506a56870b1413f4£ Beat eggs and sugar together in a bowl using an electric mixer on medium speed until well blended. Mix flour and baking powder together in a separate bowl. Slowly mix into the sugar-egg mixture; batter will thicken rather quickly. Slowly add milk. Stir in vanilla extract. Heat a lightly oiled griddle over medium-high heat. Drop batter by large spoonfuls onto the griddle and cook until bubbles form and the edges are dry, 3 to 4 minutes. Flip and cook until browned on the other side, 2 to 3 minutes. Repeat with remaining batter. 
f6a889ea619eb193229038cbc28e8b04£ Place sliced cucumber in a bowl and sprinkle with a bit of salt. Let sit until tender, about 5 minutes. Squeeze cucumber to remove excess water. Place drained cucumber in a small bowl. Place potatoes in a pot and rinse to remove extra starch. Drain. Add fresh water to cover. Add eggs and 1/2 teaspoons salt. Place pot over high heat and bring to a boil. Reduce heat to medium and cook until potatoes are tender, 10 to 15 minutes. Transfer cooked eggs to a bowl filled with cold water. Drain potatoes well and return them to the empty pot. Season with salt and black pepper and mash potatoes while still hot; leave some chunks for texture. Peel eggs, cut into chunks, and add to the pot with the potatoes. Add cucumber, imitation crab, and corn. Add mayonnaise, vinegar, salt, and black pepper to taste. Chill potato salad before serving, about 30 minutes. 
b97355bc015fd325d14be81be7a6b4cd£ Combine onion, peanut oil, rice vinegar, water, ginger, ketchup, soy sauce, sugar, lemon juice, garlic, salt, and pepper in a blender. Blend until well combined. 
4a7f25f23f48643db601fbb06ec59155£ Rinse fish fillets and pat dry with paper towels. Combine miso, brown sugar, mirin, and sesame oil in a bowl. Stir well until brown sugar is fully dissolved. Place cod on a baking sheet and brush about 2 tablespoons miso glaze on each fish fillet. Marinate 30 minutes to 1 hour. Set an oven rack about 6 inches from the heat source and preheat the oven&#39;s broiler. Place fish under broiler for 3 to 4 minutes, or until top is slightly charred and glaze has caramelized. Remove fish from oven and brush with remaining glaze. Reduce oven temperature to 375 degrees F (190 degrees C). Cook an additional 5 to 6 minutes, until fish is flaky but not overcooked. Sprinkle with toasted sesame seeds and scallions before serving. 
a504cee738a8eba9fd7c96fb56ea44d1£ Combine soy sauce, mirin, garlic powder, black pepper, and ground ginger together in a bowl. Add sliced beef and mix well. Leave to marinate at least 1 hour. Heat oil in frying pan over medium-high heat. Fry beef slices, about 10 minutes, and place on a serving dish. Pour leftover marinade into the same frying pan over low heat. Add mirin and simmer until sauce is slightly thickened, 1 to 2 minutes. Pour sauce over beef and serve. 
f7d73be48375fbc5ffbb5890bdd32b72£ Mix flour, dashi, egg, zucchini, cabbage, carrot, and 1 green onion in a large bowl for the batter. Heat oil in a pan over medium heat. Pour in batter. Top with bacon slices. Cook until golden brown, 5 to 15 minutes per side. Top with okonomiyaki, mayonnaise, and remaining green onion. 
a5307d642a847837d7fa0693e5f9669f£ Combine natto and eggs in a bowl; mix well. Add cooked rice and mix using a rice paddle. Heat olive oil in a skillet over medium heat. Spread egg mixture in the skillet and cook without stirring until browned, about 2 minutes. Add cabbage and soy sauce. Stir until mixed in and heated through, about 5 minutes. Season fried rice with salt and pepper. Place portions onto 3 individual plates; sprinkle laver and bonito flakes on top. 
4d7ac6f0bda1477ecfa90b5bc037c85c£ Whisk water and bread flour together in a saucepan over low heat. Cook roux until an instant-read thermometer inserted into the center reads 150 degrees F (65 degrees C). Remove from heat and let cool to room temperature. Place 3 cups plus 3 tablespoons bread flour, sugar, milk powder, yeast, and salt in the bowl of a stand mixer fitted with a dough hook. Mix on low speed. Add cooled roux, egg, cream, and water. Knead dough until it comes together in a shaggy mass, 1 to 2 minutes. Continue to mix on low speed until dough starts to leave the sides of the bowl. Increase speed to medium and start adding butter. Mix until completely incorporated and dough is smooth, 10 to 20 minutes. Remove dough from the mixer and place in a greased bowl. Cover and let rise until doubled, about 40 minutes. Flatten dough and roll into an oblong shape. Place in a greased loaf pan. Cover and let rise until doubled, 45 to 60 minutes. Preheat the oven to 450 degrees F (230 degrees C). Uncover loaf and bake in the preheated oven until golden brown, 30 to 35 minutes. Cover with foil if top starts to brown too quickly. Cool in the pan for 10 minutes before inverting onto a rack to cool completely. 
efa8c97d459a1a394e4334e0f916c7c9£ Bring water and rice to a boil in a saucepan. Reduce heat to medium-low, cover, and simmer until rice is tender and liquid has been absorbed, 20 to 25 minutes. Combine dashi, soy sauce, mirin, sugar, and sake in a large saucepan over medium heat. Bring to a boil. Add onion; simmer until softened, 6 to 8 minutes. Add beef; simmer until no longer pink, about 6 minutes more. Divide hot rice equally between individual deep rice bowls. Top with the simmered beef mixture. 
18069f8bf3b1814b8af1247a4b513397£ In a small bowl, whisk together the soy sauce, lemon juice, garlic, ginger, mustard, honey and pepper. Once these are thoroughly combined, add the oil in a steady stream, whisking constantly. When all of the oil is incorporated into the dressing, pour into a glass jar and chill until serving. 
9db565f6a51318a1c628783bff680088£ Heat 2 tablespoons canola oil and sesame oil in a large skillet over medium-high heat. Cook and stir chicken and garlic in hot oil until fragrant, about 1 minute. Stir chile paste into chicken mixture; cook and stir until chicken is completely browned, 3 to 4 minutes. Add soy sauce and simmer for 2 minutes. Pour chicken and sauce into a bowl. Heat 1 tablespoon canola oil in the skillet over medium-high heat; cook and stir cabbage, onion, carrots, and salt in hot oil until cabbage is wilted, 3 to 4 minutes. Stir the chicken mixture into the cabbage mixture. Add noodles; cook and stir until noodles are hot and chicken is no longer pink inside, 3 to 4 minutes. Garnish with pickled ginger. 
e3f2a6e6c1cc4098f0b21d48fa6ee6e6£ In a medium bowl, mix together the eggs, milk, garlic, salt and pepper. Heat oil in a large heavy skillet over medium-high heat. Place the panko crumbs in a shallow bowl. Rinse pork chops with water, then dip in the egg mixture. Coat with panko crumbs, dip in the egg mixture again, then coat with another layer of panko crumbs. Lay coated chops on a plate until the rest are finished. If you have time, let them set for about 10 minutes, and the coating will set very well. If you wish to freeze the chops, now is the time. When the oil is very hot, place pork chops into the pan, and fry for about 5 minutes on each side, until golden brown. 
d9ede6e677d03f0055d92d57d9d20f6f£ In a sauce pan over medium heat, combine shallots, ginger, lemon juice, and white wine. Cook until liquid is reduced to approximately 2 tablespoons. Stir in heavy cream, and bring to light boil. Reduce cream by half; do not burn. Stir in soy sauce, then transfer to blender. Blend on low while slowly adding butter, a few cubes at a time, until all of the butter is emulsified. Roughly chop or tear shiso, add to sauce, and blend for about 10 more seconds. Season to taste with kosher salt and pepper. Keep sauce warm. Preheat oven to 425 degrees F (220 degrees C). Heat oil in a large saute pan over high heat. Season both sides of the fillets with kosher salt and white pepper. Mix together white and black sesame seeds, and place in a plate or flat dish. Press the TOP side only of each fillet into the mixture, and press seeds into fish so it sticks. Make sure that the crusted sides are evenly crusted with the seeds. When oil is smoking, add fish, sesame seed side down to pan, and be careful of oil splatters. Pan sear fish for about 30 to 45 seconds per side. Place pan into oven, or transfer fish to baking sheet, and cook in oven for about 5 to 6 minutes. Serve sesame crust side up with ginger butter sauce. 
c80e5d1e906bbf372ca2acd6b7ad97a9£ In a small bowl, combine mayonnaise, white sugar, rice vinegar, melted butter, paprika and garlic powder. Mix well, cover and refrigerate. 
fb50f596470b9a799bb464b32108832e£
9b1429a9226f7cfd44683f1085ee8274£ Heat oil in a large skillet over medium-high heat. Saute chicken strips and onion until the chicken is cooked through, about 5 to 7 minutes. Drain off as much liquid as possible. Stir in the chicken broth, and simmer for 2 minutes. Add the mushrooms and carrot, and let simmer for a few minutes before stirring in the sugar, soy sauce and salt. Simmer for 3 more minutes. Sprinkle in half of the green onions, stirring gently. Pour beaten eggs over the chicken mixture, and simmer until the eggs are cooked through, about 10 minutes. Serve over Japanese sticky rice. 
870e36d96bc3e39621cf0f6d0d2dd429£ Whisk together the rice vinegar, soy sauce, red pepper flakes, garlic, ginger, green onions, and sesame oil in a bowl; allow to sit 15 minutes before serving. Store in refrigerator up to 1 week. 
d65a932d6e33f5b77bd3212c0cb6d5e1£ Rinse the rice in 3 to 4 changes of water until the rinse water is almost clear, and drain off the rinse water. Bring the rice and 4 cups of water to a boil in a saucepan over high heat. Reduce heat to medium-low, cover, and simmer until the rice is tender and the liquid has been absorbed, 20 to 25 minutes. Place the chicken in a nonstick skillet with a lid, and cook and stir over medium heat until the chicken is no longer pink inside and beginning to brown, about 5 minutes. Stir in the onion, and cook and stir until the onion is soft, about 5 more minutes. Pour in the stock, and whisk in soy sauce, mirin, and brown sugar, stirring to dissolve the sugar. Bring the mixture to a boil, and let simmer until slightly reduced, about 10 minutes. Whisk the eggs in a bowl until well-beaten, and pour over the chicken and stock. Cover the skillet, reduce heat, and allow to steam for about 5 minutes, until the egg is cooked. Remove from heat. To serve, place 1 cup of cooked rice per bowl into 4 deep soup bowls, top each bowl with 1/4 of the chicken and egg mixture, and spoon about 1/2 cup of soup into each bowl. 
2ec660a083fa3b1e6b160088a543d3a9£ In a large saucepan or stockpot, combine the celery, onion, carrot, ginger, garlic, and a few of the mushrooms. Add chicken stock, beef bouillon, and water. Place the pot over high heat, and bring to a rolling boil. When the mixture reaches boiling, cover, reduce heat to medium, and cook for 45 minutes. Place all of the remaining mushrooms into a separate pot. When the boiling mixture is done, place a strainer over the pot with the mushrooms in it. Strain the cooked soup into the pot with the mushrooms. Discard strained materials. Serve the broth with mushrooms in small porcelain bowls, and sprinkle fresh chives over the top. Use Asian soup spoons for an elegant effect. 
4a2963bad3c9ee5b917369591e8e61fb£ For the sauce, stir together the Worcestershire sauce, ketchup, and soy sauce, and a pinch of pepper to taste. Set aside. Heat oil in deep-fryer to 350 degrees F (175 degrees C). Place flour and panko bread crumbs onto separate plates and season with salt and pepper. Place the beaten egg in a medium bowl. Dip flattened chicken pieces first into flour, then egg, and lastly bread crumbs. Fry breaded chicken breasts in preheated oil until golden brown and no longer pink in center, about 8 minutes. Transfer to a paper towel-lined plate to absorb excess oil. Slice chicken into thin strips and top with a drizzle of sauce and a sprinkling of sliced green onions. Serve remaining sauce on the side for dipping. 
255d3e4b46847fbcc25f771d831317ac£ Soak rice for 4 hours. Drain rice and cook in a rice cooker with 2 cups of water. Rice must be slightly dry as vinegar will be added later. Immediately after rice is cooked, mix in 6 tablespoons rice vinegar to the hot rice. Spread rice on a plate until completely cool. Place 1 sheet of seaweed on bamboo mat, press a thin layer of cool rice on the seaweed. Leave at least 1/2 inch top and bottom edge of the seaweed uncovered. This is for easier sealing later. Dot some wasabi on the rice. Arrange cucumber, avocado and smoked salmon to the rice. Position them about 1 inch away from the bottom edge of the seaweed. Slightly wet the top edge of the seaweed. Roll from bottom to the top edge with the help of the bamboo mat tightly. Cut roll into 8 equal pieces and serve. Repeat for other rolls. 
4ef916eae5ce0a79a2437608a8b9008f£ Rinse chicken, and pat dry. In a glass baking dish or bowl, stir together the ginger, garlic, sugar, soy sauce, sake and mirin. Place the chicken into the mixture to marinate. Refrigerate, covered for several hours, or overnight. Heat oil in a large heavy skillet over medium-high heat. Place chicken pieces into the pan skin-side down, reserving marinade. Cook until light brown, then flip and brown the other side. Drain off grease, and pour the marinade into the pan. Cover, and reduce heat to low, and simmer for 8 to 10 minutes. Remove the lid and continue cooking, shaking the skillet occasionally, until marinade is reduced to a nice thick sauce and chicken pieces are fully cooked. 
b85a00e394656e99d424e2fe43657483£ Preheat oven to 350 degrees F (175 degrees C). Grease a 9x13 inch pan. Whisk together the rice flour, sugar and baking powder; set aside. In a medium bowl, mix together the water, vanilla, coconut milk and red food coloring. Blend in the rice flour mixture. Pour into the prepared pan. Cover the pan with foil and bake for 1 hour. Allow to cool completely. Turn the pan of mochi out onto a clean surface that has been dusted with potato starch. Cut into bite size pieces using a plastic knife. The mochi does not stick as much to plastic knives. 
dc1b979de06cf0617bf313ec178b2139£ Cut tofu into 12 cubes. Place cornstarch on a plate or in a shallow bowl and dredge tofu in it, coating thoroughly. Heat enough oil so that tofu will be half-way submerged. Fry tofu in hot oil for 3 to 5 minutes on each side, or until crispy. Drain on paper towels. Sprinkle green onions over tofu and drizzle with hoisin sauce. Serve immediately. 
4334dd51f71e7f5d7d439790ded665e9£ Whisk together the soy sauce, water, sugar, honey, Worcestershire sauce, vinegar, olive oil, onion powder, garlic powder, and ground ginger in a large bowl. Pierce steaks several times with a fork. Marinate steaks in soy sauce mixture for at least 2 hours. Cook the steaks in a hot skillet, wok, or hibachi over medium heat; 7 minutes per side for medium. An instant-read thermometer inserted into the center should read 140 degrees F (60 degrees C). 
2edc92b7bcabd90941137961253b2dd2£ Whisk together the sake, mirin, soy sauce, brown sugar, and miso paste in a bowl to make the marinade. Place the sea bass in a large sealable plastic bag and pour the marinade over the sea bass. Chill in refrigerator 3 to 6 hours. Arrange the fillets on a baking sheet. Discard the marinade. Preheat the oven&#39;s broiler and set the oven rack about 6 inches from the heat source. Prop the oven door to remain slightly ajar. Bake the sea bass under the broiler until the fish flakes easily with a fork, 7 to 9 minutes. Sprinkle with chopped green onions to serve. 
fc1c0e90cf53eb3dd30e2a571ff52339£ In a large bowl, mix together eggs, salt, pepper, sugar, garlic, ginger, sesame oil, soy sauce, and bouillon. Add chicken pieces, and stir to coat. Cover, and refrigerate for 30 minutes. Remove bowl from refrigerator, add potato starch and rice flour to meat, and mix well. In a large skillet or deep fryer, heat oil to 365 degrees F (185 degrees C). Place chicken in hot oil, and fry until golden brown. Cook meat in batches to maintain oil temperature. Drain briefly on paper towels. Serve hot. 
faedf15e3d1cf3c365dacbf60801e8f6£ In a medium bowl, mix together the mochiko, 1 cup of sugar, and water until well blended. Mix in the 2 drops of vinegar to soften. Pour into a microwave-safe dish, and loosely cover with plastic. Microwave for 8 to 10 minutes on HIGH. Remove, and let cool until cool enough to handle. In a small bowl, combine the potato starch, 1/4 cup sugar, and salt. Turn the mochi out onto the plastic, and cut into pieces using a plastic or wooden knife. Metal knives tend to stick too much. Roll the pieces in the potato starch mixture. 
