e593cb5bd0d4601a55a39ae17bea95d3£ In a saucepan on low heat, combine marshmallows and milk. Cook until marshmallows are melted, and mixture starts to boil. Remove from heat. In a large bowl, beat cream cheese until smooth. Stir in egg yolk. Fold in 1/3 of the melted marshmallow mixture, then quickly fold in remaining marshmallow until no streaks remain. Stir in lemon juice. In a large bowl, beat cream until soft peaks form. Fold the whipped cream into the cream cheese mixture until no streaks remain. Spread into graham crust. Refrigerate for 3 hours. 
91acf5d46c334cc6345e83d0173df74d£ Preheat oven to 325 degrees F (165 degrees C). Lightly grease an 8-inch round cake pan and line with parchment paper. Place cream cheese in a bowl with milk; soak for 20 minutes. Heat cream cheese with milk and butter in the top of a double boiler over simmering water, stirring frequently, until melted and smooth, about 5 minutes. Remove from heat and cool completely, at least 15 minutes. Sift cake flour and cornstarch together into a bowl. Sift again into the cream cheese mixture; mix well. Add egg yolks and lemon juice and mix well. Beat egg whites, cream of tartar, and salt together in a separate bowl using an electric mixer until foamy; add sugar, 2 tablespoons at a time, beating well after each addition. Continue beating on high speed until soft peaks form. Fold cream cheese mixture into egg white mixture until well mixed; pour into the prepared pan. Place pan inside a larger baking dish and fill the baking dish with water until it reaches halfway up the sides of the cake pan. Bake in the preheated oven until cheesecake is set and golden brown on top, about 1 hour 10 minutes. Turn off oven and leave cake in oven with door ajar for 1 hour. Transfer to a wire rack to cool completely. 
66fb27a8582c3ae778800ce834da5757£ Mix flour and water together in a bowl until smooth. Stir in cabbage, bacon, eggs, sausage, green onions, shrimp, cheese, and tenkasu. Preheat a griddle to 400 degrees F (200 degrees C); coat with oil. Pour in flour mixture in the shape of a pancake. Cook until golden brown, about 6 minutes per side. Transfer to a serving plate. Mix soy sauce, ketchup, and vinegar together in a small bowl to make okonomiyaki sauce. Drizzle over pancake. Garnish with panko and mayonnaise. 
8a2dbc4f5c72097749f3ec107c07835a£ Place eggs in a saucepan; cover with water. Bring to a boil, remove from heat, and let eggs stand in hot water for 15 minutes. Remove eggs from hot water, cool under cold running water, and peel. Place sesame seeds in a dry skillet over medium heat; cook and stir until lightly browned, about 3 minutes. Remove to cool on a plate lined with a paper towel. Cut each egg in half lengthwise; place egg yolks into a food processor with mayonnaise, soy sauce, wasabi paste, and rice vinegar. Process until smooth; place green onion and panko bread crumbs into yolk mixture and pulse just enough to mix evenly. Arrange egg white halves on a serving platter; spoon yolk mixture into whites. Sprinkle with toasted sesame seeds. 
a4f6029f7c5a88e0700b42f82d352d53£ Stir the rice vinegar, sugar, salt, and lemon juice together in a saucepan until the sugar and salt have dissolved; bring the mixture almost to a simmer over low heat, but not allow to boil. Remove from heat and allow to cool completely. Store in refrigerator. 
30568e1fffcb10c184823630e141f138£ In a bowl, mix the mirin, garlic, soy sauce, monosodium glutamate, and sugar; stir to dissolve the sugar. Place the beef and green onions into the marinade, stir to coat with marinade, and allow to stand for 30 minutes. Soak bamboo skewers in water. Preheat the oven&#39;s broiler and set the oven rack about 6 inches from the heat source. Roll a slice of thin beef around a piece of green onion; skewer the roll with 2 bamboo skewers, place about 1/2 inch apart. Repeat twice more, placing 3 beef rolls onto the 2 skewers. Repeat with remaining beef, green onion, and skewers until all the beef is rolled up. Place skewers onto a broiling pan. Discard used marinade. Broil until browned on both sides, about 3 to 3 1/2 minutes per side. 
fed340eaafd198f131d10606effe6963£ Wrap red bean paste in aluminum foil and place in the freezer for at least 3 hours. Mix sweet rice flour and green tea powder thoroughly in a microwave-safe glass or ceramic bowl. Stir in water, then sugar. Mix until smooth. Cover bowl with plastic wrap. Cook the rice flour mixture in the microwave for 3 minutes and 30 seconds. Meanwhile, remove red bean paste from the freezer and divide paste into 8 equal balls. Set aside. Stir rice flour mixture and heat for another 15 to 30 seconds. Dust work surface with cornstarch. While the mochi is still hot from the microwave, begin rolling balls the size of about 2 tablespoons. Flatten the mochi ball and place 1 frozen red bean paste ball in the center. Pinch the mochi over the red bean paste until the paste is completely covered. Sprinkle with additional cornstarch and place mochi seam side down in a paper muffin liner to prevent sticking. Repeat until all the mochi and red bean paste is used. 
9c7016300cd578bdc72bca30a0a8bbf2£ Season the chicken breasts on both sides with salt and pepper. Place the flour, egg and panko crumbs into separate shallow dishes. Coat the chicken breasts in flour, shaking off any excess. Dip them into the egg, and then press into the panko crumbs until well coated on both sides. Heat 1/4 inch of oil in a large skillet over medium-high heat. Place chicken in the hot oil, and cook 3 or 4 minutes per side, or until golden brown. 
e266fab9e107e8ff302e6816175be36a£ In a large pot, cook soba noodles according to package directions. Drain, rinse noodles with cold water, and set aside. Pour into a large bowl the sesame oil, rice vinegar, soy sauce, and lime juice. Mix in lime zest, brown sugar, garlic, and red pepper flakes; stir until sugar dissolves. Toss in carrots, peanuts, and cilantro. Cut noodles into 3-inch lengths. Stir into dressing mixture. Cover, and refrigerate at least 1 hour. Toss salad again before serving. If dry, splash with soy sauce and vinegar. Serve cold. 
c6f0a6ed4016d33efdb0a8234c9e5d43£ In a large skillet combine sesame oil, canola oil and chili paste; stir-fry 30 seconds. Add garlic and stir fry an additional 30 seconds. Add chicken and 1/4 cup of the soy sauce and stir fry until chicken is no longer pink, about 5 minutes. Remove mixture from pan, set aside, and keep warm. In the emptied pan combine the onion, cabbage, and carrots. Stir-fry until cabbage begins to wilt, 2 to 3 minutes. Stir in the remaining soy sauce, cooked noodles, and the chicken mixture to pan and mix to blend. Serve and enjoy! 
0da2b236197107226ce02fd664cbb545£ In a small bowl, stir together the soy sauce, mirin, honey and sesame oil. Divide into two equal parts. Stir the rice vinegar into one part and set aside as a dipping sauce. Spread the sesame seeds out on a plate. Coat the tuna steaks with the remaining soy sauce mixture, then press into the sesame seeds to coat. Heat olive oil in a cast iron skillet over high heat until very hot. Place steaks in the pan, and sear for about 30 seconds on each side. Serve with the dipping sauce and wasabi paste. 
7c0babe2f87f2e48f31596801b1f48e2£ Rinse the rice in a strainer or colander until the water runs clear. Combine with water in a medium saucepan. Bring to a boil, then reduce the heat to low, cover and cook for 20 minutes. Rice should be tender and water should be absorbed. Cool until cool enough to handle. In a small saucepan, combine the rice vinegar, oil, sugar and salt. Cook over medium heat until the sugar dissolves. Cool, then stir into the cooked rice. When you pour this in to the rice it will seem very wet. Keep stirring and the rice will dry as it cools. 
43bcaf9de89e34b4d310133729daa128£ In a medium saucepan over medium-high heat, combine dashi granules and water; bring to a boil. Reduce heat to medium, and whisk in the miso paste. Stir in tofu. Separate the layers of the green onions, and add them to the soup. Simmer gently for 2 to 3 minutes before serving. 
6c2e1b5b1d19321857bef204f0805d0b£ Place 2 tablespoons of oil in a large pot and place the pot over medium heat. Cook and stir the onions, garlic, beef and sausage until meats are browned. Pour in the tomatoes, beer, coffee, tomato paste and broth. Season with chili powder, cumin, sugar, oregano, cayenne, coriander, salt and wasabi. Stir in one can of beans, bring to a boil, then reduce heat, cover and simmer. In a large skillet over medium heat, heat remaining oil. Cook Anaheim, serrano and habanero peppers in oil until just tender, 5 to 10 minutes. Stir into the pot and simmer 2 hours. Stir in remaining 2 cans of beans and cook 45 minutes more. 
7f311b20adae3b1fc2dd4950eb2573d0£ In a blender, combine the minced onion, peanut oil, rice vinegar, water, ginger, celery, ketchup, soy sauce, sugar, lemon juice, garlic, salt and pepper . Blend on high speed for about 30 seconds or until all of the ingredients are well-pureed. 
15316a9e244db302ed2836621851937c£ Place the shrimp in a bowl and season with salt, pepper and garlic powder. In a small bowl, stir together the flour and paprika. Place eggs and panko crumbs into separate bowls. Heat the oil in a deep-fryer or deep skillet to 375 degrees F (190 degrees C). Dip each shrimp into the flour mixture, then into the egg, and finally into the panko crumbs to coat. Fry a few at a time until golden brown. This should take no longer than 5 minutes. Remove with a slotted spoon and drain on paper towels before serving. 
d6f51b6982aea3605e7d563d2706e77e£ Bring mirin to a boil in a saucepan over high heat. Reduce heat to medium-low, and simmer for 10 minutes. Pour in soy sauce, rice vinegar, sesame oil, and sugar. Season with garlic, ginger, pepper flakes, and black pepper; simmer an additional 5 minutes. Store in a tightly sealed container in the refrigerator. 
eb594204a43b1ee97ae63faaf0b75c34£ Slice beef into very thin strips. Mix cornstarch, broth, soy and sugar until smooth. Set aside. Heat 1 tablespoon oil in saucepot or wok over high heat. Add beef in 2 batches and stir-fry until browned. Set beef aside. Add 1 tablespoon oil. Add the mushrooms, cabbage, peppers, celery and green onions in 2 batches and stir-fry over medium heat until tender-crisp. Set vegetables aside. Stir cornstarch mixture and add. Cook until mixture boils and thickens, stirring constantly. Return beef and vegetables to saucepot and heat through. Serve over rice. 
21d393d4c18a441dc1d01d20e9ccc2b3£ Place rice into a large, deep bowl. Fill with cold water and rub rice together with hands until the water turns milky white. Pour off the cloudy water, being careful not to pour out the rice. Repeat 3 or 4 times until you can see the rice through 3 inches of water. Drain the rice in a fine strainer, then place into a saucepan along with konbu and 3 cups water. Allow to stand for 30 minutes. Stir together rice vinegar, sugar, and salt until dissolved in a small bowl, set aside. Cover, and bring rice to a boil over high heat, then reduce heat to low, and simmer for 15 minutes. Remove from heat and allow to stand, covered, for 5 minutes. Scrape rice into a bowl; remove and discard the konbu. Stir in vinegar mixture until well incorporated and no lumps of rice remain. Allow to cool at room temperature. For a shinier appearance, use an electric fan to cool the rice rapidly. 
d98aaefb8a6c7d163180d1cbab5c57a9£ Preheat the oven to 375 degrees F (190 degrees C). Pour the sesame seeds onto a rimmed baking sheet. Toast the seeds in the oven for 10 to 12 minutes, until they are a rich brown around the edges. Meanwhile, bring a large pot of salted water to a boil. Add the noodles and cook them for 5 to 6 minutes, or until they are just tender. Drain them, rinse them well with cold water, and drain them again. In a large mixing bowl, mix together the vinegar, sugar, soy sauce, garlic, sesame oil and green onions. Add the noodles, and the toasted sesame seeds. Toss well, then stir in the broccoli. Let the dish sit for 30 minutes at room temperature before serving. 
46f8cdbd244d236f6cd424395f75f8d7£ In a medium saucepan, bring 1 1/3 cups water to a boil. Add rice, and stir. Reduce heat, cover, and simmer for 20 minutes. In a small bowl, mix the rice vinegar, sugar ,and salt. Blend the mixture into the rice. Preheat oven to 300 degrees F (150 degrees C). On a medium baking sheet, heat nori in the preheated oven 1 to 2 minutes, until warm. Center one sheet nori on a bamboo sushi mat. Wet your hands. Using your hands, spread a thin layer of rice on the sheet of nori, and press into a thin layer. Arrange 1/4 of the cucumber, ginger, avocado, and imitation crabmeat in a line down the center of the rice. Lift the end of the mat, and gently roll it over the ingredients, pressing gently. Roll it forward to make a complete roll. Repeat with remaining ingredients. Cut each roll into 4 to 6 slices using a wet, sharp knife. 
8a12f56a17af62145ac1a6358cbaf6ed£ Heat sesame oil in a large skillet over medium high heat. Mix in cabbage, onion, garlic and carrot. Cook and stir until cabbage is limp. Mix in ground pork and egg. Cook until pork is evenly brown and egg is no longer runny. Preheat vegetable oil in a large skillet over medium high heat. Place approximately 1 tablespoon of the cabbage and pork mixture in the center of each wrapper. Fold wrappers in half over filling, and seal edges with moistened fingers. In the preheated vegetable oil, cook gyoza approximately 1 minute per side, until lightly browned. Place water into skillet and reduce heat. Cover and allow gyoza to steam until the water is gone. In a small bowl, mix soy sauce and rice vinegar. Use the mixture as a dipping sauce for the finished wrappers. 
f734c4ca13a64c249eb11390a7a55227£ Preheat oven to 350 degrees F (175 degrees C). Grease and flour 2 8-inch round pans. Sift together the all-purpose flour, cake flour, baking soda, salt, and green tea powder; set aside. In a large bowl, beat together sugar, oil, and eggs until smooth. Stir in 1 1/2 teaspoons vanilla. Beat in the flour mixture alternately with the yogurt, mixing just until incorporated. Pour batter into prepared pans. Bake in the preheated oven for 30 to 40 minutes, or until a toothpick inserted into the center of the cake comes out clean. Cool on wire rack for 30 minutes before turning out of the pans. To make Green Tea Frosting: Sift together confectioners&#39; sugar and green tea powder. In a medium bowl, combine tea mixture with butter, cream cheese, vanilla and milk. Beat with an electric mixer until smooth. To assemble the cakes: when the cakes are completely cooled, put one layer on a flat serving plate. Spread a thin layer of frosting over it. Place the other layer of cake on top, and spread frosting to cover the top and sides of cake. Dust with green tea powder if desired. Serve cold or at room temperature. 
a30b155a1fe98409fa927b531864f522£ In a skillet over medium-high heat, cook the sausage until evenly browned. Drain, and remove sausage from the pan. In the same pan, using the remaining coating of grease from the sausage, scramble the eggs, stirring frequently until cooked through. Set aside. Heat the oil in a very large skillet or electric skillet over medium-high heat. Stir fry the cabbage and carrots just until the cabbage has wilted. Add the cold rice, and fry, stirring so that there are no clumps. Mix in the sausage and pour in some soy sauce. Stir in bean sprouts, peas, and eggs, mixing well so there are no big chunks of egg. Season with pepper, and stir in green onions just before removing from the heat. Adjust soy sauce to taste, and serve. 
cc984de6c1b8cfb33fd8150c7c69df51£ Place the green beans into a steamer insert and set in a pot over one inch of water. Bring to a boil, cover and steam for 5 minutes. Remove from the heat and transfer beans to a serving bowl. Meanwhile, in a small bowl, stir together the soy sauce, miso paste, red pepper flakes, garlic and ginger. Pour over the green beans and toss to coat. Sprinkle sesame seeds on top. 
3b6f00e7abfb2c3739e3ac8847c304c8£ Place 1 1/2 tablespoons sesame seeds on a plate; use the bottom of a pot or heavy measuring cup to crush the seeds. Transfer to a bowl. Add water, soy sauce, and sugar; stir dressing. Bring a small pot of water to a boil; add salt. Add spinach and cook until wilted, no more than 1 minute. Drain spinach into a colander and rinse with cool water to stop the cooking process. Squeeze spinach with hands to remove moisture. Cut into strips. Place cooked spinach in serving bowls. Drizzle dressing on top and add remaining sesame seeds as garnish. 
97fc1f2bc390befc8e5f290afebb2a37£ Preheat oven to 375 degrees F (190 degrees C). Line a cake pan with parchment paper. Butter the paper and sprinkle with 1 teaspoon superfine sugar. Bring a saucepan of water to a boil; pour into a large bowl. Whisk 1/4 cup honey and milk together in a bowl until smooth. Beat eggs with an electric mixer in a bowl placed over the hot water. Gradually add 1 1/3 cup superfine sugar; beat until smooth and mixture is warm. Remove bowl of egg mixture from the bowl of hot water and cool to room temperature, about 5 minutes. Return bowl of egg mixture to the hot water and continue beating. Repeat this process a few times until batter is foamy and thick. Pour milk mixture into egg mixture and mix well using a spatula; stir in sifted flour until batter is mixed. Pour batter into the prepared cake pan. Bake in the preheated oven until a toothpick inserted in the center of the cake comes out clean, about 50 minutes. Spread the remaining 1 tablespoon honey over the top of cake. Serve slices with sweet bean paste and ice cream, if desired. 
e7776c6668a674bc3f874b4284421f63£ Combine cornmeal, flour, seasoned salt, and pepper in a bowl. Dredge onion slices in cornmeal mixture. Heat oil in a large skillet over medium heat. Cook breaded onion, turning occasionally until golden brown, 3 to 5 minutes. Bring a large pot of water to a boil. Add kabocha squash, sweet potato, carrot, garlic, and bay leaf; cook until kabocha squash is tender, about 10 minutes. Drain most of the water; discard bay leaf. Mash kabocha squash mixture with a potato masher, adding soy milk, until mixture is the consistency of a thick soup. Stir in garam masala, salt, and pepper. Garnish with fried onions. 
cc7ece46b4d4b465bbac96fd9ed22aa8£ Wash rice in a sieve until the water runs clear. Combine rice, 2 1/2 cups water, sesame seeds, and 1 teaspoon salt in a large nonstick pot over medium heat; bring to a boil. Cover and cook until water is absorbed and rice is soft and sticky, about 15 minutes. Stir in soy sauce. Mix 1 cup water and 1 tablespoon salt in a small bowl until salt is dissolved. Place a 12-inch piece of plastic wrap in a small teacup, molding the plastic to fit the cup and letting the ends hang over the edges. Moisten plastic wrap with some of the salted water. Place a 2x5-inch strip of nori seaweed halfway into the cup. Scoop some rice into the cup, leaving a 1/2-inch gap at the top. Make a small indent in the rice with a spoon; add a spoonful of tuna. Cover tuna with a spoonful of rice and fold over the exposed end of the seaweed strip. Gather the ends of the plastic wrap tightly and remove the rice ball from the cup. Shape and compress the ball tightly with your hands. Transfer to a large plate. Repeat with remaining nori seaweed, rice, and tuna. Refrigerate onigiri until firm, 8 hours to overnight. 
c95d37c97669b5abd62d4e2c251a2887£ Stir water and gelatin together in a bowl until gelatin dissolves. Combine milk, sugar, and black sesame paste in a saucepan over medium heat; cook and stir until sugar melts, 2 to 4 minutes. Stir gelatin mixture into milk mixture; cook and stir pudding for 1 to 2 minutes. Remove from heat. Chill pudding in the saucepan at room temperature for 5 minutes. Pour pudding into small bowls and refrigerate until chilled and set, about 2 hours. 
6fc547506b063c0eeed58ebc91eaf3ba£ Combine orange peel, garlic powder, salt, toasted sesame seeds, black sesame seeds, black pepper, and red pepper flakes in a jar. Seal jar. 
dcc1db8eac5cc932895b11d180e0caa9£ Whisk soy sauce, sake, sugar, and ginger together in a bowl. Add chicken cubes; toss to coat. Marinate in the refrigerator for 2 to 3 hours. Thread chicken cubes and green onions onto skewers. Pour marinade into a small saucepan over medium heat; bring to a simmer. Reduce heat to low and keep warm. Preheat an outdoor grill for medium-high heat and lightly oil the grate. Grill skewers until chicken is browned, for 3 minutes. Flip and brush with warm marinade. Cook until second side is browned, about 3 minutes more. 
7573c3dfdc7a43bdfbb95a88fa9e1554£ Cut tips off melons with a sharp knife; cut in half lengthwise. Scoop out white interior and seeds with a spoon; rinse the melon. Cut into very small pieces. Place in a bowl and generously add kosher salt, mixing until melon is completely covered. Cover and refrigerate until flavors combine, about 5 minutes. Rinse melon to remove excess salt. Place into a pot filled with water; cover and bring to a boil. Cook until melon has softened slightly, about 1 minute. Remove from heat; drain the melon. Heat sesame oil in a skillet over medium-high heat. Add pork; season with garlic salt and garlic pepper. Cook and stir until pork is no longer pink, 7 to 10 minutes. Add melon; cook until soft, about 5 minutes. Reduce heat to medium. Push pork mixture to the edges of the skillet with a spatula. Crack eggs into the center of the skillet; scramble until firm, 3 to 5 minutes. Stir contents of the skillet together until combined. Season with soy sauce. 
f17412fc8b00dc57ef448a27eb7d06ab£ Combine daikon radish, soy sauce, sake, sesame oil, ginger, garlic, and mirin in a large bowl. Add sliced pork; let marinate for 5 minutes. Heat vegetable oil in a wok or large skillet over medium heat. Add onion; cook and stir until softened, 3 to 5 minutes. Remove pork from marinade and add to the wok; cook and stir until evenly browned, 3 to 5 minutes. Pour in remaining marinade; cover and cook until bubbling, about 5 minutes. Season with salt and black pepper. 
a184f28cde6d3094d22b58352bac7702£ Melt butter in a large skillet over medium heat. Add onion; cook and stir until softened and browned, about 5 minutes. Add shrimp; cook and stir until opaque, 1 to 2 minutes. Stir in 2 tablespoons flour and white wine. Pour in milk gradually, stirring constantly with a wooden spoon; cook until white sauce thickens, 3 to 5 minutes. Remove white sauce from heat. Stir in rice until evenly mixed. Add Parmesan cheese, dill, salt, and black pepper. Cool until mixture is easily handled, about 15 minutes. Heat oil in a deep-fryer or large saucepan to 350 degrees F (175 degrees C). Place 3 tablespoons flour in a shallow bowl. Whisk egg in a small bowl. Spread bread crumbs on a plate. Form rice mixture into 8 equal balls. Roll 1 ball in flour, dip in beaten egg, and coat with bread crumbs. Repeat with remaining balls. Deep-fry in hot oil until golden brown, about 3 minutes. 
9b50e245e6751a62c6e2238802f07f62£ Heat a skillet over medium heat; cook and stir beef until cooked through, 5 to 7 minutes. Add ginger and stir well. Stir soy sauce, sake, mirin, and sugar into beef mixture; bring to a boil and cook for 1 minute more. 
2fc8ad63b65ae47b66f15deb248a4b4a£ Fill a small pot halfway with water. Bring to a boil; add egg and cook for 15 minutes. Drain. Run cold water over egg and let cool. Pour sesame oil into a large skillet. Add pork slices. Cover pork with half the olive oil, sesame seeds, basil, and sage. Flip and cover pork with remaining olive oil, sesame seeds, basil, and sage. Cook pork, covered, over medium-low heat, until evenly browned on the bottom, about 5 minutes. Flip and continue cooking until second side is browned, about 5 minutes more. Remove from heat. Bring a large pot of water to a boil. Add ramen noodles; cook for 3 minutes. Drain in a colander set in the sink; rinse noodles until water runs clear. Return noodles to the pot. Stir kombu, bonito stock, soy sauce, and miso paste into the noodles. Cook, stirring with chopsticks, over medium heat, until miso paste is dissolved, 3 to 5 minutes. Transfer noodles to a bowl. Peel and cut egg in half lengthwise. Top noodles with egg, pork slices, and fish paste slices. Garnish with tonkatsu sauce, ginger, green onion, and black pepper. 
e314eb51d8f375239840e3075227a81f£ Heat olive oil in a large skillet over medium heat. Add mushrooms; cook and stir until mushrooms are browned and release their moisture, about 5 minutes. Remove from heat, drain, and pat dry. Beat eggs, sugar, salt, pepper, and red chile powder together in a bowl. Coat the skillet with some vegetable oil; set over medium heat. Pour in some of the beaten eggs, tilting skillet to spread into a thin layer. Cook until almost set, 1 to 2 minutes. Run a heatproof rubber spatula around the edges to loosen. Cover with some mushrooms; roll up egg and move to the side of the skillet. Grease skillet with some more vegetable oil. Pour in more eggs to create a second layer. Lift the first roll up to get raw egg underneath. Sprinkle mozzarella cheese on top; roll second layer up over the first. Repeat layering and rolling process with remaining oil, eggs, mushrooms, and mozzarella cheese. Cook finished tamagoyaki until lightly browned, about 30 seconds per side. Transfer tamagoyaki to a cutting board. Let cool for 5 to 10 minutes before slicing. 
43ee7181881841c03c420cf03b1f15b6£ Beat mirin, champagne vinegar, sunflower seed oil, hazelnut oil, sugar, sesame oil, and ground ginger together in a bowl until smooth. Let dressing sit at room temperature until the flavors blend, at least 30 minutes. 
