1184d82b84924f43d6b46de96725f400£ Heat canola oil in a deep-fryer or large saucepan to 375 degrees F (190 degrees C). Gather about 2 tablespoons of shredded plantains and shape into patties. Fry the patties in the preheated oil until golden and crispy, about 10 minutes. Drain on paper towels and season with garlic salt. 
fe7f8da43a8e3964c1cd93e49b760d44£ Combine oxtail, onion, thyme, browning sauce, scallions, red pepper flakes, ginger, allspice, garlic, and bay leaves in a large bowl. Cover with plastic wrap and marinate in the refrigerator, 8 hours to overnight. Heat a pressure cooker over medium-high heat. Add the beef. Cook, turning halfway, until juices are released and outsides are browned, about 10 minutes. Add 1 cup broth and water. Cover pot, lock the lid, and place pressure regulator over vent according to manufacturer&#39;s instructions. Reduce heat to low and simmer until mostly tender, about 2 1/2 hours. Stir remaining beef broth and tomato paste into the beef. Cover with the lid and seal. Increase heat to high. Heat until steam escapes in a steady flow and makes a whistling sound, 7 to 10 minutes. Reduce heat to low and cook until oxtail is tender, 40 minutes to 1 hour. Let pressure release naturally according to manufacturer&#39;s instructions, 5 to 10 minutes. Unlock lid and add beans, salt, and pepper. Increase heat to medium-high high; cook until flavors meld, about 5 minutes more. 
a58fd98e74f0c688b80d61cb999ed07e£ Mix mustard and rum together in a bowl to make a paste. Add marmalade and soy sauce. Stir until combined. Store in the refrigerator. 
e203c992fd010e83ab32076a282b6daf£ Wash red snapper thoroughly with water and lime juice. Let soak in lime water with 1 teaspoon black pepper in the refrigerator, 10 to 20 minutes. Pat dry with paper towels. Mix flour, salt, and 1 tablespoon pepper in a shallow bowl. Pat snapper dry with paper towels and lightly coat both sides with flour mixture. Heat oil in a heavy frying pan until very hot. Deep-fry snapper until golden brown, 4 to 5 minutes per side. Transfer to a plate. Pour out all but 3 tablespoons of the oil. Add onion, Scotch bonnet pepper, whole peppercorns, and allspice to the oil in the frying pan. Cook until onion softens, about 5 minutes. Pour in vinegar and stir until heated through. Add ketchup and simmer for 1 minute. Pour over hot snapper and let soak in. Serve hot or cold. 
6109253ff29f0ffc27769ae19c4bd72a£ Place chicken in a pot and cover with water. Bring to a boil; reduce heat to low and simmer until tender, 15 to 20 minutes. Drain and cool until easily handled, about 5 minutes. Shred. Pour chicken broth into a saucepan over medium heat. Cover and keep warm. Place plantains and salt in a bowl of cold water. Let soak for 5 minutes. Drain and blot dry with a paper towel. Place bacon in a large skillet and cook over medium-high heat, turning occasionally, until evenly browned, about 10 minutes. Drain bacon slices on paper towels. Crumble into small pieces. Heat 1 inch oil in a deep-fryer or large saucepan to 350 degrees F (175 degrees C). Fry plantains in batches until golden brown, 2 to 3 minutes per batch. Drain on paper towels. Smash plantains with the bottom of an empty chicken broth can. Fry again until crispy, 1 to 2 minutes more. Drain; blot with paper towels. Transfer plantains to a large bowl. Add bacon and garlic; mash together. Fill an empty chicken broth can halfway with mashed mixture. Press down until firmly packed. Invert can onto a plate; tap until mofongo slides onto the plate. Repeat with remaining mashed mixture. Cover mofongos with shredded chicken and warmed broth. Season with salt and pepper. Garnish with cilantro. 
f5502ec13a9b0bd17f6f572da1df474a£ Preheat oven to 350 degrees F (175 degrees C). Peel plantains; cut into 1-inch pieces. Heat oil in a skillet; add plantains and cook until golden, 3 to 5 minutes. Transfer to a baking dish; reserving oil. Add onion and garlic to the skillet; cook and stir until softened, 3 to 5 minutes. Mash plantain in the baking dish, using a fork until the texture resembles corn bread stuffing. Add pork rinds; mix in onion-garlic mixture and salt. Pour in broth, dot with 2 tablespoons plus 2 teaspoons margarine, and cover tightly with aluminum foil. Bake in the preheated oven for 30 minutes. 
7b6d64062225993ac13c0b8ecd1cf66d£ Boil water in a large saucepan; add plantains, 2 tablespoons salt, and a dash pepper. Cook until very soft, about 30 minutes. Drain. Fry bacon in a skillet until crisp, 5 to 7 minutes. Transfer to a bowl; crumble. Crush pork rinds in a mortar; transfer to a bowl. Blend olive oil, onion, cilantro, garlic, remaining 1 tablespoon salt, and a dash pepper in a food processor until liquefied. Mash warm plantains in the mortar in batches; transfer to a large bowl. Stir in pork rinds, bacon, and olive oil mixture until well combined. Shape mofongo into balls. 
97dd2d694ff0094feefdf6af6bcf6962£ Bring water and rice to a boil in a saucepan. Reduce heat to medium-low, cover, and simmer until rice is tender and liquid has been absorbed, 20 to 25 minutes. Heat olive oil in a stock pot over medium heat. Add onion; cook and stir until slightly softened, about 2 minutes. Stir in green peppers and cook 2 minutes. Add tomatoes, cilantro, and bay leaves; saute 2 minutes. Stir in garlic and saute until fragrant, about 30 seconds. Pour in white wine, bring to a boil, and cook until wine is reduced by half. about 3 minutes. Reduce heat to medium low. Place white fish and shrimp into pot and gently simmer until fish starts to turn white, about 5 minutes. Season with saffron, salt, and pepper. Add 2 cups seafood stock, clams, and mussels and cook 5 minutes. Pour in remaining 2 cups seafood stock. Simmer until flavors are combined and seafood is cooked through, 20 to 30 minutes. Spoon rice into stew by tablespoons until stew has reached your desired thickness. Season with salt and pepper and simmer for 5 more minutes. 
53e716f91b4e8bb699e5ba1a7044f2b9£ Heat oil in a skillet over medium to high heat and saute meat on all sides until brown, about 10 minutes. Crush garlic with pepper and oregano in a mortar. Pour wine into skillet with beef. Add crushed garlic mixture, sofrito, salt, beef bouillon cube, and bay leaves; stir to combine and bring to a boil. Reduce heat to low, cover, and cook until meat is tender, about 1 hour. If meat is not tender yet, add 1/2 cup of water and continue to cook until meat can easily be pierced with a fork. Stir in potatoes, carrots, olives, and tomato paste. Cook on low heat until vegetables are done and sauce thickens, about 20 minutes. 
86dc9345e1515bc69e247cbd22890921£ Combine coconut milk, sugar, vanilla extract, and salt in a saucepan. Bring to a boil and cook for 6 minutes, stirring occasionally. Combine cornstarch and water in a bowl. Whisk until mixture has a uniform consistency. Pour cornstarch-water mixture into the saucepan and whisk until mixture thickens into a pudding, about 2 minutes. Remove from heat and strain the mixture into a bowl. Pour the strained mixture into a mold, pan, or individual serving glasses. Smooth out the surface and allow to cool about 15 minutes. Refrigerate for at least 2 hours. Sprinkle with ground cinnamon before serving. 
20dc3df16e16ab3e7adb53b9af1df705£ Stem and seed habanero peppers, wearing gloves. Heat olive oil in a skillet over medium heat. Cook and stir onion and garlic until onion is translucent, about 5 minutes. Combine habanero peppers, onion, garlic, lime juice, brown sugar, apple cider vinegar, tequila, salt, mustard powder, and allspice in a blender; puree until smooth. 
93cd1bdb7cf2154d1e159b6bfea810f3£ Combine chicken, mango, black beans, red onion, cilantro, garlic, and red pepper flakes in a large bowl. Divide chicken mixture among tortillas. Roll up tortillas. Toss salad greens with dressing in a large bowl; garnish with macadamia nuts. Serve each wrap with 2 cups of salad. 
e2b1e99fa193b5c96fe260a17f555be8£ Preheat oven to 300 degrees F (150 degrees C). Grease five 8x4-inch baking pans. Combine brown sugar, coconut, flour, raisins, fruit peel, cherries, baking powder, mixed essence, and nutmeg in a large bowl using a large wooden spoon. Combine margarine and shortening in a microwave-safe bowl; heat in microwave until melted, 30 seconds to 1 minute. Pour melted mixture into flour mixture, alternating with milk, until batter is just mixed. Add water, a teaspoon at a time, if more moisture is needed. Pour batter into the prepared baking pans, smoothing the tops with the back of a wet spoon. Sprinkle white sugar over each loaf. Bake in the preheated oven until a toothpick or skewer inserted in the middle comes out clean, about 1 hour. Cool in the pans for 5 minutes. Invert onto cooking racks. 
26130920b57ac2002f11dac0295bc77b£ Bring chicken stock and yellow split peas to a boil in a saucepan. Reduce heat and simmer until split peas are soft, about 20 minutes. Drain and let cool, about 15 minutes. Combine yellow split peas, scotch bonnet chile pepper, garlic, turmeric, and cumin in a food processor; blend until filling is finely ground. Combine flour and 2 tablespoons vegetable oil in a large bowl. Pour in water slowly, stirring constantly, until dough starts to come together. Add a little more water if dough seems dry. Knead dough on a floured work surface until soft and no longer sticky. Let dough rest for 10 minutes, covered with a damp cloth. Roll dough into a large circle about 1/4-inch thick. Brush 1 teaspoon vegetable oil over the surface of the dough. Roll up into a long roll. Cut into 10 pieces. Roll each piece of dough into a 6-inch circle. Let circles rest, covered with damp cloth, for 5 minutes. Divide filling among circles. Wrap dough around filling, pinching edges to seal; roll into balls. Roll each ball back out into a large, thin circle. Heat 1 teaspoon oil in a large skillet. Cook 1 piece of dough in the hot skillet until it puffs up and turns light brown, about 2 minutes. Flip and continue cooking until second side is browned, 1 to 2 minutes. Transfer to a colander to cool; cover with a damp cloth. Repeat with remaining oil and dough. 
b6c870e3827c60443071d02c4ca57a4a£ Combine cornmeal, flour, sugar, salt, baking powder, black pepper, paprika, and cinnamon in a large bowl. Add butter; use fingers to crumble into flour until the mixture resembles peas. Combine water and milk in a saucepan over medium heat; bring to a simmer and remove from heat. Pour into cornmeal mixture; stir rapidly until dough forms a soft ball that separates from the sides of the bowl. Add Cheddar cheese; stir to combine. Cover bowl with a clean dish cloth; allow dough to rest for 5 minutes. Scoop a heaping teaspoon of dough; using your hands, form a ball and then roll into a stick. Repeat with remaining dough. Heat oil in a large skillet; fry sticks until golden, 3 to 5 minutes per side. 
4bd4ab88e19382d256236fd9e8ea94ed£ Preheat oven to 350 degrees F (175 degrees C). Beat white sugar, butter, and shortening together in a bowl using an electric mixer until creamy. Mix in almond extract. Add flour in batches, kneading the dough to thoroughly combine. Roll dough into walnut-size balls and place 2 inches apart onto baking sheets. Make a well in each cookie with a wooden spoon handle. Sprinkle colored sugar, sprinkles, and guava paste into the wells. Bake in the preheated oven until lightly golden, 16 to 20 minutes. 
cc814666be7fd8f04812a5a5bdc98591£ Preheat oven to 350 degrees F (175 degrees C). Grease and flour an 8-inch round cake pan. Sift flour, baking powder, and salt in a large bowl. Heat a skillet over medium heat. Add pumpkin seeds and cook, stirring frequently, until lightly brown and toasted, about 5 minutes. Pour into a food processor. Blend the toasted pumpkin seeds in the food processor until sand-like in texture. Add to the flour mixture. Place ground flax seeds in the same skillet. Cook and stir until toasted, about 4 minutes. Mix into the flour mixture until well combined. Beat butter and sugar together in a bowl using an electric mixer until light and fluffy. Add eggs, 1 at a time, and vanilla extract, mixing until well combined. Add the flour-seed mixture in batches, alternating with milk, beating batter briefly after each addition until batter is fully blended. Pour batter into the prepared pan. Bake in the preheated oven until a toothpick inserted into center of the cake comes out clean, 35 to 40 minutes. 
16a711fd2cf2b75482d7719330c5523b£ Preheat oven to 425 degrees F (220 degrees C). Line the bottom of a deep-dish pie plate with 1 pie crust. Combine apples, brown sugar, molasses, corn syrup, cornstarch, rum extract, vanilla extract, cinnamon, and nutmeg in a bowl. Mix well and pour over the crust. Cover with top crust. Cut slits into the dough and crimp the edges. Wrap bottom and sides of the pie plate in aluminum foil. Bake in the preheated oven until crust is golden brown, 50 minutes to 1 hour. Cool for 15 to 20 minutes and serve with caramel syrup drizzled on top. 
745f01659ef59cf5cfa72e7445b7bc73£ Preheat the oven to 350 degrees F (175 degrees C). Butter a 9x5-inch loaf pan. Mix bread and raisins together in a bowl; transfer mixture to the loaf pan. Beat eggnog, eggs, white sugar, and vanilla extract together in a separate bowl. Pour over the bread mixture. Bake in the preheated oven until a knife inserted into the center comes out clean, 40 to 45 minutes. Melt brown sugar and butter in a saucepan over medium heat. Add cream and rum; simmer until sauce thickens and is reduced to 1 1/2 cups, about 5 minutes. Serve warm over the bread pudding. 
965046aa240ba7326bf265d566199cda£ Combine evaporated milk, cream of coconut, sweetened condensed milk, spiced rum, egg yolks, vanilla extract, and ground cinnamon in a blender; you may need to do this in batches. Blend until thoroughly combined. 
8c527c1e6cf91342cceb8bed8d6c37f9£ Combine coconut milk, condensed milk, evaporated milk, cream of coconut, egg yolks, and cinnamon stick in a blender; blend until cinnamon stick is broken into tiny bits. Pour rum into a clean bottle. Add the milk and egg mixture and shake the bottle vigorously. Refrigerate; the coquito will thicken as it cools. 
c8d2df5eaa42331085ddeff145dbb563£ Stir water and brown sugar together in a small bowl. Sprinkle yeast evenly over the surface. Cover with a clean cloth and let stand until yeast softens and forms a creamy foam, about 7 minutes. Mix all-purpose flour, whole wheat flour, shortening, and salt together in a large bowl until shortening is thoroughly incorporated. Pour in yeast mixture; mix with your hands or a wooden spoon until dough comes together. Dust a flat work surface with flour. Knead dough until smooth and holding its shape. Lightly grease a large bowl with 1 teaspoon vegetable oil. Add dough; turn to coat with oil. Cover with a clean cloth and let rise until doubled, about 35 minutes. Gently punch down dough to deflate. Dust your work surface with more flour. Roll dough out until it is 1/3-inch thick. Fold in half and roll out again. Repeat this process 4 times. Fill a large baking pan with 1 inch water and place it on the bottom rack of the oven. Preheat oven to 350 degrees F (175 degrees C). Lightly grease a jelly roll pan with 1 teaspoon vegetable oil. Cut dough into 9 pieces and place on the greased pan. Cover with a clean, damp cloth; let rise until puffy, about 25 minutes. Bake in the preheated oven above the water until browned on top, 15 to 20 minutes. 
4ee0bc4ed60e74c3f7f63dd93aea68f1£ Place salmon in a large bowl with ice cold water and 1 pinch salt. Let soak, about 10 minutes. Run a knife along the skin to remove all scales. Rinse salmon in ice cold water and lemon juice. Pat dry with a paper towel. Preheat oven to 325 degrees F (165 degrees C). Combine garlic powder and 1/4 teaspoon salt in a small bowl. Sprinkle lightly over both sides of each salmon fillet. Rub jerk marinade over both sides of salmon. Place salmon fillets in a large bowl. Add scallions, onion, cilantro, and ginger; mix well to combine. Heat oil in an ovensafe skillet over medium heat. Cook salmon fillets skin-side down, in batches if necessary, until skin is golden, about 2 minutes. Flip and continue cooking until flesh is pale pink, 1 to 2 minutes more. Place skillet in the oven. Bake salmon in the preheated oven until flesh flakes easily with a fork, about 2 minutes. Remove skillet from oven and allow salmon to rest before serving, 3 to 5 minutes. 
c394a33fae638ccf4d2203c4ee220ff0£ Mix sugar and lime juice in a glass; add mint and muddle until mint is broken down. Add sparkling water and ice cubes. Mix rum and champagne into the drink. 
f78658c86c5d22d333a68860532236b5£ Preheat oven to 350 degrees F (175 degrees C). Place flounder fillets in a 9x13-inch baking dish. Mix lime juice, parsley, and salt together in a small bowl. Pour over fillets. Melt butter in a large skillet over medium heat. Add olive oil, onion, red bell pepper, orange bell pepper, jalapeno pepper, and garlic; cook and stir until tender, about 8 minutes. Stir in tomatoes, orange juice, jerk seasoning, salt, and pepper; bring to a boil. Remove from heat. Spread 3/4 of the onion mixture over the fillets in the baking dish. Bake in the preheated oven until fillets flake easily with a fork, 10 to 13 minutes. Let stand for 5 minutes before serving. Serve remaining onion mixture alongside fillets. 
a5703db827d2ebb63915619cfb5dc819£ Combine yuca, green plantains, yautia, and milk in a blender; puree into a thick paste the consistency of oatmeal. Combine lard and achiote seeds in a saucepan over medium-low heat; heat until lard is melted, and reddish in color, about 5 minutes. Strain out achiote seeds. Mix half of the lard into the yuca paste. Heat olive oil in a large pot over medium heat. Add onion and green bell pepper; cook and stir until tender, about 5 minutes. Add pork, ham, garbanzo beans, tomato sauce, olives, capers, orange juice, cilantro, oregano, salt, and garlic; cook and stir until pork is no longer pink in the center, 8 to 10 minutes. Remove from heat. Mix 2/3 of the remaining lard into the pork mixture. Smear each plantain leaf with a small amount of remaining lard. Place a large spoonful of the yuca paste in the center of each one; top with a scoop of the pork mixture. Fold up the sides of each leaf to enclose the filling and create a rectangular pastel. Stack 2 pasteles and tie them together with kitchen string. Repeat with remaining pasteles. Bring a large pot of water to a boil. Add pasteles. Cook until filling is tender, about 1 hour. Unwrap pasteles before serving. 
3d80f4770dd4b612b0ceae047d660132£ Blend mango, garlic, habanero pepper, cilantro, lime juice, and salt in a blender until desired consistency is reached. 
90153b36bddeec81eaff282946257a3c£ Mix cookie crumbs and melted butter in a bowl until all crumbs are moistened; press firmly into a single layer in the bottom of a baking dish. Refrigerate dish until the crust is set, at least 30 minutes. Beat cream in a chilled glass or metal bowl with an electric mixer until soft peaks form. Stir condensed milk into the cream until smooth and thick; add lemon zest and juice and stir. Spread the creamy mixture over the cookie crust. Refrigerate until the cream layer is set, at least 30 minutes. 
3537c37ff96de1a3efe3a53fb566bc70£ Combine coconut milk, coconut cream, evaporated milk, cinnamon, nutmeg, and ginger in a large saucepan. Mix milk and cornstarch together in a bowl until dissolved; stir into coconut milk mixture. Add sugar, vanilla extract, orange blossom water, salt, and lime zest to coconut milk mixture; cook, stirring constantly, over medium heat until simmering and mixture begins to thicken, about 5 minutes. Lower heat to medium-low and cook until thickened, about 15 minutes. Remove saucepan from heat, pour mixture into a deep 9-inch cake pan, and cool to room temperature, about 30 minutes. Cover pan with plastic wrap and refrigerate until tembleque is chilled, at least 4 hours to overnight. Remove tembleque from refrigerator and allow to sit at room temperature, about 10 minutes. Dip bottom of pan in a bowl of warm water for 1 minute. Carefully separate tembleque from pan by running a thin knife around the edges. Place a serving dish on top of pan and invert tembleque onto dish; garnish with cinnamon. 
ff4f06014ff8907474bdc8b5ff683386£ Preheat oven to 350 degrees F (175 degrees C). Grease a 9x13-inch baking dish. Whisk sugar, flour, cornmeal, baking powder, cornstarch, cinnamon, and nutmeg together in a bowl. Add coconut milk and evaporated milk; fill empty cans with water (totaling 26 fluid ounces) and add to mixture. Mix butter, egg, and vanilla extract into mixture and beat with an electric mixer until well mixed; pour into the prepared dish. Bake in the preheated oven until cornbread is cooked through and set, 1 hour 30 minutes. 
7323c1c0ca3d3392c7ebd0c0fc5a8700£ In a large bowl combine oil, ginger, lime juice, garlic, soy sauce, sugar and red pepper; mix well. Stir in shrimp and cilantro. Cover and refrigerate 1 to 4 hours before serving. Stir occasionally while chilling. 
cc94e2585650a27523a452c017e81fa9£ Place the cranberries, grated orange rind, cinnamon, orange juice, brown sugar and enough water to cover cranberries in a saucepan. Bring mixture to a boil over high heat. Immediately turn heat down and simmer for about one hour or until the sauce has thickened. Taste for sweetness and adjust with additional sugar if necessary. You can not overcook, so continue cooking until you have a good thick consistency. Let mixture cool a bit then refrigerate in a covered container. 
4c496266e27b362b9bc287f8d07d2cd8£ Heat the oil in a heavy skillet over medium heat. Place a few plantain slices in the oil, and cook until lightly golden in color, about three minutes. Drain on paper towels. Repeat with the remaining slices. While the plantain slices are still warm, place them one at a time between two sheets of wax paper, and flatten by hand to 1/4 inch thick. Return flattened slices to the skillet, and continue frying until golden brown. Drain on paper towels, and season with salt and garlic powder. 
dec61817c1f32938a46e79522c35f79a£ Preheat oven to 425 degrees F (220 degrees C). In a large skillet, fry chicken breast in vegetable oil until the chicken just begins to brown. Stir onions, green bell peppers and red bell peppers into the skillet with the chicken. Saute until the onions are translucent. When the vegetables are translucent, stir in the garlic and coconut milk. Let the mixture cook 5 to 8 minutes before removing the skillet from the heat. Season with salt, pepper, and red pepper flakes. Transfer the mixture to a 9x13 inch baking dish and bake in a 425 degrees F (220 degrees C) oven for 45 minutes, or until the vegetables cook down and the chicken is tender. 
ed6ef969e49596668ce103990422b1fa£ Toss the oxtail with the onion, green onion, garlic, ginger, chile pepper, soy sauce, thyme, salt, and pepper. Heat the vegetable oil in a large skillet over medium-high heat. Brown the oxtail in the skillet until browned all over, about 10 minutes. Place into a pressure cooker, and pour in 1 1/2 cup water. Cook at pressure for 25 minutes, then remove from heat, and remove the lid according to manufacturer&#39;s directions. Add the fava beans and allspice berries, and bring to a simmer over medium-high heat. Dissolve the cornstarch in 2 tablespoons water, and stir into the simmering oxtail. Cook and stir a few minutes until the sauce has thickened, and the beans are tender. 
f3f4b1cd7bb7abe35882aa99ce1b05d9£ Heat the oil in a large pot over medium-high heat. Cook the chicken, onions, and garlic until the chicken has browned; about 5 minutes. Stir in potatoes, salt, and curry powder; add enough water to cover the chicken halfway. Cover, and simmer until tender, 30 to 40 minutes. Season to taste with hot pepper sauce. 
01a204a98cd4613d73c0ca79283df5ec£ Heat a small, heavy skillet over medium heat. Add the cumin seeds and peppercorns to the pan; stir constantly until fragrant and beginning to brown, about 2 minutes. Cool. Using a mortar and pestle, crush toasted spices with garlic, salt, and oregano to make a paste. You can also do this in the small bowl of a food processor. Transfer to a small bowl, and stir in orange juice, lime juice, lemon juice, sherry, and olive oil. Place the pork in a large resealable plastic bag. Pour citrus marinade over meat, and seal. Refrigerate for 12 to 24 hours, turning the bag over occasionally. Preheat the oven to 325 degrees F (165 degrees C). Transfer pork and marinade to a roasting pan, and place in the oven. Roast for about 2 1/2 hours, basting with pan juices occasionally, or until an instant read thermometer inserted in the center reads 145 degrees F (63 degrees C). Add small amounts of water to the pan if it dries out. Transfer the pork to a carving board, cover loosely with foil, and let rest for 15 minutes. Carve, and serve. 
f87f8b6afdf0bb94d371205894fbf6bf£ Arrange onion slices in the bottom of a slow cooker; top with pork tenderloin. Sprinkle garlic evenly over onion and pork. Pour orange juice, vinegar, and lemon juice over pork. Sprinkle cumin, grill seasoning, salt, red pepper, bay leaves, and lemon zest over pork. Cover and cook on Low until pork is very tender, 6 to 7 hours. To serve, slice tenderloin into 1 1/2-inch slices, arrange on a platter, and drizzle juices over top. 
