1184d82b84924f43d6b46de96725f400£ Heat canola oil in a deep-fryer or large saucepan to 375 degrees F (190 degrees C). Gather about 2 tablespoons of shredded plantains and shape into patties. Fry the patties in the preheated oil until golden and crispy, about 10 minutes. Drain on paper towels and season with garlic salt. 
2700e94b2bde3cf6061b077805d6c3c9£ Bring vegetable oil, water, and salt to a boil in a saucepan over high heat. Add rice, and cook until the water has just about cooked out; stir. Reduce heat to medium-low. Cover, and cook for 20 to 25 minutes. Stir again, and serve. Rice may be a little sticky and may stick to bottom of pot. 
34920ecb4f1897dbd768f69771cf96b7£ Drain the crabmeat. In a large bowl, mix the crabmeat, bread crumbs, mayonnaise, egg, green onions, hot sauce, and salt and pepper until combined. Shape the mixture into 16 small cakes. Refrigerate for 30 minutes. Meanwhile, in a small bowl combine the diced mango, onion, basil, cilantro, lime juice, jalapeno (if using), and salt and pepper. Refrigerate until ready to use. To grill: Preheat grill for medium heat and lightly oil the grate or a grill basket. Grill about 8 minutes, turning once. To pan-fry: Heat 2 tablespoons vegetable oil in a large skillet over medium heat. Cook crab cake patties until crisp and golden brown on both sides, about 4 minutes per side. Top crab cakes with mango salsa and enjoy. 
5f241d579b156780ce0ba8fd1dd39e87£ Combine 2 1/4 cups of water, rice, and lime peel in a saucepan. Bring to a boil over medium-high heat, then reduce heat to medium-low, cover, and simmer for 20 minutes until the rice is tender. While the rice is cooking, combine 1/2 cup of water, the cinnamon stick, and anise in another saucepan over medium-high heat. Bring mixture to a low boil for 3 minutes, then remove saucepan from stove. Strain flavored water into a bowl and set aside, discarding cinnamon stick and anise pieces. After rice has simmered for 20 minutes, carefully remove the lime peel with a slotted spoon, and over low heat, gradually stir evaporated milk and condensed milk into the rice. Mix in the cinnamon and anise-flavored water, vanilla, and salt. Add raisins, if desired. Continue to stir until the mixture thickens, about 7 to 10 minutes. If the pudding is too watery after 10 minutes, turn up heat to medium-low and stir continuously. When pudding reaches desired consistency, remove from heat and pour into individual dishes, or a large bowl. Store in the refrigerator until ready to serve. 
35ccabb1bfcbbf53aebc108c6fbbdc08£ In a blender or food processor, combine olive oil, garlic, salt, and pepper. Process for 3 to 5 minutes. 
ab3c2ac97529ad9555737e4f8e282e0c£ Rub each breast half with 1/2 teaspoon jerk paste, and place in a shallow dish. Cover, and refrigerate at least 1 hour. Preheat the grill for high heat. Bring a large pot of lightly salted water to a boil, cook the egg noodles 6 to 8 minutes, until al dente, and drain. Lightly oil the grill grate. Grill chicken 8 to 10 minutes on each side, until juices run clear. Meanwhile, heat the olive oil in a large saucepan over medium heat, and cook the garlic for one minute. Mix in the chicken stock, 1 tablespoon jerk paste, white wine, chopped cilantro, juice of 1 lime, salt, and pepper. Bring to a boil, reduce heat to low, and stir in the heavy cream. Cook and stir until mixture is thickened, about 5 minutes. Do not allow it to boil. Pour the cooked egg noodles into the saucepan, and toss with the cream sauce. Divide noodles onto 4 serving plates, and top with grilled chicken. Garnish each serving with a cilantro sprig and the juice of 1/4 lime. 
54efbfa6aa342ee34e3689e5c13135ca£ Make a syrup by bringing the sugar and water to a boil in a small saucepan over high heat, stir and boil until the liquid becomes clear, about 1 minute. Set aside to cool. Blend the drained pineapple in a blender or food processor until very smooth and frothy. In a large bowl, whisk together the syrup, pineapple puree, coconut milk, and lime juice. Refrigerate until chilled, about 3 hours. Freeze in the freezer canister of an ice cream maker according to the manufacturer&#39;s directions. 
83d005372523fda222dd4d4505a9c5d7£ Bring water and rice to a boil in a saucepan. Reduce heat to medium-low, cover, and simmer until the rice is tender and liquid has been absorbed, 20 to 25 minutes. Heat olive oil in a stockpot over medium-high heat; saute onion, bell pepper, carrots, celery, and garlic in hot oil until tender, about 5 minutes. Mix black beans with liquid, chorizo, chicken stock, picante sauce, bay leaves, paprika, red wine vinegar, cumin, sugar, salt, black pepper, and red pepper flakes together in the pot with the onion mixture; bring to a boil, reduce heat to medium-low, place a cover on the pot, and simmer until the beans have softened, about 30 minutes. Remove lid from pot and continue cooking until the mixture reaches your desired consistency, at least 20 minutes more. Remove bay leaves and adjust seasoning to your preferences. Serve over rice. 
3de8ff82a0eb9d8bcce7e35c863b06e2£ Place the yuca into a pan and fill with enough water to cover. Stir in salt. Bring to a boil over medium-high heat, cover, and cook until tender, about 15 minutes. Drain, and place yucca on a serving plate. Meanwhile, place the olive oil, onion, garlic, and lemon juice into a pan. Cook over medium heat about 5 minutes. Pour the hot olive oil mixture over the yuca, and serve immediately. 
e5d5652c808c11ce3cfc8fe51ba7f3bb£ In a shallow dish, combine the breadcrumbs with the oregano, cumin, and salt and pepper. Beat eggs in another shallow dish. Dip each steak in beaten eggs, and then in the breadcrumb mixture. Make sure to cover each steak well with the breadcrumb mixture. In a large, deep skillet, heat 1inch oil over medium high heat. Place the steaks in the oil when it&#39;s hot (so that the breading will not stick to the pan). Cook steaks, turning once, until brown for well done and golden brown for medium. Serve with lemon slices. 
8f873f851dd783e7885471fc1ede6eba£ Preheat oven to 350 degrees F (175 degrees C). Grease a 9x5 inch loaf pan. Sift together the flour, baking powder and salt, set aside. In a medium bowl, cream together the sugar and butter. Beat in the eggs one at a time, then stir in the lime zest, nutmeg, cinnamon and allspice. Add the dry ingredients alternately with the milk, stirring after each addition. Pour batter into the prepared pan. Bake for 75 to 90 minutes in the preheated oven, until a toothpick inserted comes out clean. Cool in the pan for 10 minutes before turning out onto a rack to cool completely. 
ff08da8eaa83c3de65c0b78474a7a55b£ Pour the water, milk, rum, and coconut milk into a blender. Add the cinnamon and salt. Blend until well combined, then refrigerate for at least one hour, or until ready to serve. 
fa28d7f4b6ddec1e8a078d35731b3b24£ Heat the oil in a large skillet over medium heat, and brown the pork on all sides. Mix in the onions, and cook and stir until tender. Mix the bananas and tomatoes with juice into the skillet. Bring to a boil, reduce heat to medium low, and simmer 30 minutes, stirring occasionally, until pork is very tender. Season with cayenne pepper, salt, and pepper. 
ea18ad0b6d63095a81bc891a4364c08b£ Slice sausage lengthwise, then cut into 1/4-inch slices. Heat oil in a large pot over medium-high heat. Brown sausage about 5 minutes. Stir in onion; cook 5 minutes. Stir in chickpeas and juices, tomato sauce, and sherry. Season with oregano, red pepper flakes, black pepper, garlic powder, and adobo seasoning. Simmer, stirring occasionally, at least 10 minutes (1 hour or more is preferable). 
6529dd0bbe6804d0d6bbe4a50a0ed4ac£ In a large bowl, stir together the flour, baking powder and salt. Rub in the butter until it is in pieces no larger than peas. Mix in water 1 tablespoon at a time just until the mixture is wet enough to form into a ball. The dough should be a firm consistency. Knead briefly. Heat the oil in a large heavy skillet over medium heat until hot. Break off pieces of the dough and shape into a patty - kind of like a flat biscuit. Place just enough of the dumplings in the pan so they are not crowded. Fry on each side until golden brown, about 3 minutes per side. Remove from the pan and drain on paper towels before serving. 
321c5e8054a73073d656a201c7611265£ Cut the shrimp into 2 or 3 pieces and place in a large bowl; add the avocado, green onion, red and yellow tomatoes, bell pepper, cilantro, and lime juice; mix. Season with salt and pepper. Refrigerate at least 15 minutes before serving. 
8ea84097d05697830cd86a0dfba1512a£ Heat olive oil in a large skillet over medium heat. Cook and stir onion in hot oil until tender, about 5 minutes; add garlic and continue to cook and stir until fragrant, about 1 minute more. Stir tomatoes, chicken, red bell pepper, raisins, olives, red wine vinegar, oregano, cumin, and bay leaves into the onion mixture; cook until heated through, 5 to 7 minutes more. Remove and discard bay leaves before serving. 
8ddb2ee4fe85c6bc6dc891d8b97f1e82£ Wearing disposable gloves, and being careful not to get any in your eyes or on your skin, roughly chop the habanero peppers. Place the habanero peppers, mango, onion, green onions, and garlic into a blender. Pour in the vinegar, lime juice, and vegetable oil, cover the blender, and pulse until the mixture is very finely chopped. Stop the blender, and add dry mustard powder, salt, curry powder, and lime zest. Blend again until the sauce is smooth. Pour into clean jars, and store in refrigerator. 
80a8f0d49f598ba987e96e6b514a6869£ Heat the oil in a saucepan over medium heat. Add the onion and red apple; cook and stir until onion is transparent. Season with curry powder, and stir in the water. Add the rice and molasses, cover, and cook over low heat until the rice is tender, and water has been absorbed, about 30 minutes. Mix in the banana, then sprinkle the coconut on top. Heat through for a moment over low heat before serving. 
d327990bcf6ad274702755402e16782a£ In a small bowl, dissolve yeast and sugar in warm water. Let stand until creamy, about 10 minutes. In a large bowl, combine the yeast mixture with the oil, margarine, salt and 1 1/2 cups flour; stir well to combine. Mix in the remaining flour, 1/2 cup at a time, beating well after each addition. When the dough has pulled together, turn it out onto a lightly floured surface and knead until smooth and supple, about 8 minutes. Lightly oil a large bowl, place the dough in the bowl and turn to coat with oil. Cover with a damp cloth and let rise in a warm place until doubled in volume, about 1 hour. Deflate the dough and turn it out onto a lightly floured surface and form into a loaf. Place the loaf into a lightly greased 9x5 inch loaf pan. Cover with a damp cloth and let rise for 15 minutes. Meanwhile, preheat oven to 350 degrees F (175 degrees C). Bake in preheated oven for about 30 minutes or until the top is golden brown and the bottom of the loaf sounds hollow when tapped. Cool in pan 5 minutes and then turn out onto rack and cool completely. 
088d4d7c2968a6cb292ce3641cba4d18£ Cut skirt steaks into about 3 or 4 smaller pieces so it&#39;s easier to fit them into marinade dish. Whisk orange juice, lime juice, olive oil, garlic, salt, cumin, pepper, oregano, and cayenne pepper together in a large bowl. Place skirt steak pieces, 1 at a time, into the marinade to thoroughly coat them. Add sliced onions and toss with the meat. Transfer mixture and marinade to a resealable plastic bag. Squeeze out air, seal bag, and place on a dish. Refrigerate 2 to 3 hours. Transfer pieces of meat onto paper towel-lined rimmed sheet pan to drain for a couple of minutes. Cook over hot coals. Grill first side 3 to 4 minutes. Turn and grill second side until internal temperature is about 125 degrees F (53 degrees C). Look for a shiny glossy surface indicating the meat juice is coming to the surface; this indicates the meat is just about done. Transfer to a plate and allow meat to rest a few minutes. Slice into 1/2-inch slices and arrange on a serving plate. Spoon accumulated juices over the meat. Drizzle with olive oil and sprinkle with coarse salt and chopped cilantro. Serve with lime wedges. 
17c9e48f83430d2cb10481c009f91f75£ Heat the oil in a large pot or deep fryer to 365 degrees F (185 degrees C). In a bowl, mix the flour, egg, and milk. Season with cayenne pepper, seasoned salt, salt, and pepper. Mix in the conch meat, onion, bell pepper, celery, and garlic. Drop the batter by rounded tablespoons into the hot oil, and fry until golden brown. Drain on paper towels. In a bowl, mix the ketchup, lime juice, mayonnaise, hot sauce, salt, and pepper. Serve dipping sauce on the side with the fritters. 
bcc5005fd35c58ccda5d0d91fb41d371£ Stir together the lime juice, honey, soy sauce, and oil in a large bowl. Season with jerk seasoning, hot pepper sauce, salt, and pepper. Add the shrimp and toss well to coat. Cover, and refrigerate for one hour to marinate. Place wooden skewers to soak in warm water. Preheat an outdoor grill for medium-high heat. Remove skewers from the water, pat dry, and spray with nonstick cooking spray. Skewer the shrimp. Grill the shrimp on the grill on both sides until pink and opaque, about 5 minutes per side. 
366670037cef18076ec2d812240a6a38£ Stir together the garlic powder, salt, cayenne pepper, and sazon seasoning in a shallow dish. Coat chicken pieces with this mixture. Heat a Dutch oven or heavy skillet with a lid over medium heat for at least 3 minutes. Sprinkle the sugar over the bottom of the pan, and stir gently until it becomes liquid and caramelizes. Add the chicken, cover, and cook for about 25 minutes. Remove cover, and cook for another 15 to 20 minutes, letting the juices cook down until they are almost gone. Add the bok choy, and cook just until wilted. 
3893c59d85eb28e5e3f57ee1ab0a4796£ Bring 1 cup of water to a boil in a small saucepan over high heat. Add the cinnamon sticks, cloves, and anise seeds. Cover, and set aside to steep for 15 minutes. Meanwhile, combine 2 tablespoons water with 1/2 cup sugar in a saucepan over medium-high heat. Stir occasionally to dissolve the sugar completely, but stop stirring once the mixture comes to a boil. Stay near the stove to monitor the color, swirling the pan gently to redistribute the caramel as the sugar begins to darken. Cook to about 310 degrees F (160 degrees C), or until the sugar turns light golden brown, then pour into a 9x5 inch loaf pan. Set aside to allow the caramel to harden. Preheat an oven to 350 degrees F (175 degrees C). Remove the crusts from the day-old bread, tear the bread into cubes, and place into a large mixing bowl. Strain the spice tea through a fine mesh sieve to remove the spices. Add to the bread along with the evaporated milk. Stir to evenly moisten, and set aside for 10 minutes. Whisk the eggs in a large mixing bowl along with 1 1/2 cups of sugar, the vanilla extract, salt, and melted butter. Stir in the moistened bread mixture until evenly mixed. Pour into the loaf pan over the caramel. Line a roasting pan with a damp kitchen towel. Place the loaf pan on the towel, inside roasting pan, and place roasting pan on oven rack. Fill roasting pan with boiling water to reach halfway up the sides of the loaf pan. Bake in the preheated oven until a toothpick inserted into the center comes out clean, about 1 hour and 15 minutes. Cool in the pan for about an hour, then refrigerate until cold, 2 hours more. When ready, invert the budin onto a serving plate. The caramel will have turned to a syrup and will cover the budin like a sauce. 
fab59b323a16ed25f86273e18a624221£ In a food processor, combine onion, garlic, habanero pepper, and ginger. Pulse until ingredients are minced. Blend in olive oil, brown sugar, vinegar, orange juice concentrate, soy sauce, cinnamon, nutmeg, cloves, cilantro, salt, and pepper. In a container, combine marinade with chicken. Cover, and refrigerate overnight. Preheat an outdoor grill for medium heat and lightly oil grate. Grill chicken for 10 minutes per side, or until no longer pink and juices run clear. 
1599228c5372b118d57e5378af53cafe£ In a blender, combine rum cream liqueur, coffee liqueur, milk and strawberry syrup. Add the banana and crushed ice. Blend until smooth. Pour into glasses and serve. 
ee908ff4ed66553d2ead0ddc52eeaad1£ In the container of a blender, combine the strawberries, sugar, lemon juice and lemon-lime soda. Add the ice and blend until smooth. Pour into a fancy glass to serve. 
3c79b6f9f8ec3675f2bedac11bfe1d7d£ Heat 2 tablespoons of the oil in a large saucepan over medium high heat. Add pork and brown in oil. Meanwhile, place remaining oil in a small saucepan over medium heat and add achiote seeds. Heat until oil becomes very dark orange/red. Remove from heat and set aside. To the browned pork add the onion, cilantro, garlic, salt and pepper. Cook to reduce veggies, then add the tomato sauce, pigeon peas and olives. Mix well. Strain achiote/oil mixture into pork mixture and stir together. Reduce heat to low and let simmer for 10 minutes. Add uncooked rice and water to pork mixture; stir well. Raise temperature to high, cover saucepan and bring all to a boil. Stir again, reduce heat to low and cover; let cook on low about 10 minutes. Remove cover, stir again, replace cover and cook another 10 minutes; stir again. Remove from heat and allow to stand 15 minutes. 
35ff102a85afe297897942d9d4dfa5f1£ Preheat oven to 375 degrees F (190 degrees C). Line a baking dish with parchment paper. In a large bowl, mix together paprika, onion powder, garlic powder, parsley, oregano, salt and pepper. Toss with chicken breasts until evenly coated. In a bowl, combine duck sauce, marinara sauce, mango hot sauce and 1/4 cup grapefruit juice. Coat chicken evenly with sauce mixture. Place bread crumbs in a shallow dish, and dredge chicken until evenly breaded. Place chicken in baking dish. Place nectarine slices around the edge of baking dish. Bake in preheated oven for 15 minutes. Turn the chicken, pour 1/2 cup grapefruit juice over chicken, and continue cooking for another 15 minutes or until done. 
764d1e694e39a82d4571d57eb72e32ea£ Preheat oven to 350 degrees F (175 degrees C). Mix together the brown sugar, ginger, cayenne, clove, cinnamon, paprika, oregano, pepper, salt, and lime zest; set aside. Squeeze the limes, and add the juice to the orange juice. Rub the ribs well with the spice mixture. Place into a glass baking dish, and pour in the juice. Cover the dish, and bake in preheated oven for 90 minutes. Uncover, then continue cooking until nicely colored, 20 to 30 minutes more. Brush the ribs with the pan juices a few times while they are cooking. 
b1a298beedabe9860ed562df516c3c9f£ Place 1 teaspoon of sugar into each of two 12 ounce glasses. Squeeze the juice from a lime wedge into each glass, drop in the wedge, and add 2 sprigs of mint. Use a spoon or muddler to mash the sugar, lime juice, and mint together in the bottom of the glasses. Fill each glass about half full with crushed ice. Pour 1/4 cup rum into each glass. Fill the glasses with club soda, stir, and garnish with additional lime wedges. 
8d3690bf741554da519dc978037eb80c£ Mix together the banana, red pepper, green pepper, yellow pepper, cilantro, green onion, lime juice, brown sugar, ginger, olive oil, and habanero pepper in a bowl; season with salt. Serve within 1 hour. 
94ad59da331e3d87743118eb2b400220£ Whisk together the eggs, milk, and pina colada mix in a bowl. Heat a skillet over medium heat; melt butter in the skillet until the foam disappears. Soak the bread slices in the egg mixture, turning the slices over a couple of times. Gently lay the soaked bread slices into the hot skillet 2 at a time and pan-fry until the french toast is golden brown, about 2 minutes per side. Transfer cooked french toast slices to a warmed platter while you finish cooking. Top each 2-slice serving with several slices of banana to serve. 
5aa5fdd81a69b01c737da696aa831721£ Season chicken thighs with black pepper and adobo seasoning. Heat olive oil in a large pot over medium-high heat. Cook and stir green pepper, red pepper, onion, garlic, and tomato paste in the hot oil, until the vegetables have softened slightly, 3 to 4 minutes. Remove vegetables from the pot and set aside. Pan fry chicken in the pot until browned, 4 to 5 minutes on each side. Return cooked vegetables to the pot along with rice, diced tomatoes, chicken broth, bay leaf, and red pepper flakes. Bring to a boil, then reduce heat to medium-low and simmer until rice is tender and chicken is no longer pink inside, about 20 minutes. Stir in peas and olives and cook for another 5 minutes. Remove from heat and discard bay leaf. Stir in cilantro and serve. 
fb788c2b67ec25438728a66d23daf08a£ Peel tough outer leaves from cabbage, core the head, and shred cabbage. Heat olive oil in a large skillet over medium high heat; Raise heat to high. Stir onion, green bell pepper, and green onion in the hot oil and cook until vegetables have softened, about 5 minutes, stirring often. Stir thyme, Scotch bonnet pepper, and salt into onion mixture. Mix shredded cabbage and carrots into onion mixture until thoroughly combined, cover skillet, and reduce heat to medium-low. Cook until cabbage has started to soften, about 10 minutes, stirring occasionally. Uncover skillet and stir vinegar and sugar into cabbage mixture; cook and stir until cabbage is tender, about 3 more minutes. Discard Scotch bonnet pepper and thyme sprigs before serving. 
2f27b65b5341f01b9f5f0be962b82a77£
92d7d01f7c4080e0422078988a8b1f3d£ In a large bowl dissolve the yeast in the warm water or potato water. Add sugar and salt and mix well. Stir in 7 cups of the flour. On a well-floured surface, knead dough for 7 minutes, incorporating in the last cup of flour. Place dough in a greased bowl. Let rise until doubled. Using a lightly floured board, form dough into 2 long or round loaves. Sprinkle cornmeal on greased baking sheet; place loaves on top. Slash top with a sharp knife. Cover, and let rise until almost doubled. Brush top of loaves with cold water. Sprinkle with sesame seeds, if desired. Place in a cold oven. Turn oven to 400 degrees F (200 degrees C). Bake for 45 minutes, or until nicely browned. Brush twice during baking time with cold water. 
36ad11de5f2b30d96316319e19169578£ Make numerous vertical slits in the turkey legs. In a small bowl combine the olive oil with the salt, pepper, teriyaki, vinegar and oregano. Marinate turkey legs in the oil mixture. Cut onion, green pepper and bacon into small squares (approximately the same size as the slits you cut on the legs). Fill each slit with one piece of pepper, onion and bacon. After the legs are stuffed, brown them in the oil mixture on medium-high. Reduce temperature to low and cover. Cook for 45 minutes or until meat starts to separate from the bone. If the legs dry out when cooking, add a little water to the skillet and lower the temperature. 
f5ad0f281d99aca6ddbf782e0a837ef2£ Heat olive oil in a saucepan over medium heat. Cook and stir onion and garlic in hot oil until softened, 5 to 7 minutes. Stir water, black beans, cumin, and beef bouillon cube into the onion and garlic mixture; bring to a boil, add rice, cover, and simmer until the rice is tender and the moisture is absorbed, about 20 minutes. Gently stir Creole seasoning and cilantro into the beans and rice. 
aa74da44738ccf7bcfd92f9b780b956a£ Soak the salted cod in about 2 quarts of water, changing the water 3 times over the course of 8 hours. Drain and cut the fish into bite-size pieces. Layer the half of each ingredient in the following order: potatoes, cod fish, onions, hard-boiled eggs, capers, garlic, olives, roasted red peppers, and raisins. Place the bay leaf on top, then pour half the tomato sauce and half the olive oil. Repeat with the remaining ingredients in the same order. Pour the water and white wine on top. Do not stir. Cover and bring to a boil over medium heat. Reduce heat to medium-low and simmer until the potatoes are tender, about 30 minutes. 
a52bcc0c8a53e4fa567b32deb11d358f£ Place the rice in a bowl with enough water to cover it and let it soak overnight. Strain the rice and discard the water. Stir the cold water and evaporated milk together. Place the drained rice into a blender along with half of the diluted milk. Blend until the rice is finely ground, about 30 seconds. Add the sugar, cinnamon, and vanilla; blend well. Pour in the remaining diluted milk; blend. Line a strainer with two layers of cheesecloth. Place the strainer over another bowl to catch the liquid. Strain the rice milk through the cheesecloth, discard the solids. Repeat the process if necessary. Serve over ice. 
c031cf294efed1f97e38daae34c4083f£ Mix sweet potatoes, pork, diced tomatoes with green chile peppers, orange juice, lime juice, garlic, cumin, salt, and black pepper together in a slow cooker. Cook on Low for 6 hours. Garnish with cilantro. 
205026882e89fd85ca19268e4f9403ea£
d41d8cd98f00b204e9800998ecf8427e£
4137a2a9175b8eec48686f0de0a863aa£ In a medium bowl, whisk egg yolks until smooth. Whisk in cinnamon and vanilla Stir in coconut milk, cream of coconut, sweetened condensed milk, evaporated milk, and rum. Taste and adjust cinnamon and vanilla if desired. Blend well and strain through a fine sieve or cheesecloth. Pour into clean bottles. Serve chilled. 
