1184d82b84924f43d6b46de96725f400£ Heat canola oil in a deep-fryer or large saucepan to 375 degrees F (190 degrees C). Gather about 2 tablespoons of shredded plantains and shape into patties. Fry the patties in the preheated oil until golden and crispy, about 10 minutes. Drain on paper towels and season with garlic salt. 
1c5a1f824c3ff5d5cac1e982cc4c2331£ Arrange the fish fillets in an oven proof 9x13 glass baking dish. Pour the rum and lime juice over the fish and place a slice onion on each fillet. Cover and refrigerate for 2 to 4 hours. Preheat oven to 325 degrees F (165 degrees C). Remove fish from the refrigerator and pour off about 3/4 of the liquid. Leave the onion slices in the dish and place a thick slice of lemon on each fish fillet. Sprinkle with oregano and black pepper to taste. Place a pat of butter or margarine on each fillet. Bake, covered, at 350 degrees F (165 degrees C) for about 20 to 30 minutes or until fish flakes easily with a fork. Be careful not to over cook the fish or it will be dry. Serve with the cooked onion and lemon slices. 
b3c2266ed075628c369a425e03a4bf91£ Mix sweet potatoes, pork, diced tomatoes with green chile peppers, orange juice, lime juice, garlic, cumin, salt, and black pepper together in a slow cooker. Cook on Low for 6 hours. Garnish with cilantro. 
ff3166f2e1f604ff78dd13de77b3cbab£ Bring water to a boil in a saucepan and stir in sugar, butter, and salt until sugar has dissolved. Turn heat to low and whisk in 1 cup of cornmeal until smooth. Stir in remaining 1/2 cup cornmeal to make a very thick, workable dough. Heat 3 cups vegetable oil in a deep-fryer or large saucepan to 350 degrees F (175 degrees C). Grease your hands well with 2 teaspoons of oil and scoop about 3 tablespoons of cornmeal dough; roll the dough into a ball, then shape into a 3-inch long stick about 1/2 inch wide. Repeat with remaining dough, oiling your hands as needed. Deep-fry the cornmeal sticks until golden brown, working in batches of 3 or 4 at a time. Drain fried cornmeal sticks on paper towels and keep warm. Mix mayonnaise, ketchup, and garlic salt in a bowl until well combined; serve cornmeal sticks with the sauce for dipping. 
4472b13fcfbfc1816b169571fa882246£ Wearing disposable gloves, and being careful not to get any in your eyes or on your skin, roughly chop the habanero peppers. Place the habanero peppers, mango, onion, green onions, and garlic into a blender. Pour in the vinegar, lime juice, and vegetable oil, cover the blender, and pulse until the mixture is very finely chopped. Stop the blender, and add dry mustard powder, salt, curry powder, and lime zest. Blend again until the sauce is smooth. Pour into clean jars, and store in refrigerator. 
eb73f7bceeb8d2c943168bd69ae5f999£ Stir together the garlic powder, salt, cayenne pepper, and sazon seasoning in a shallow dish. Coat chicken pieces with this mixture. Heat a Dutch oven or heavy skillet with a lid over medium heat for at least 3 minutes. Sprinkle the sugar over the bottom of the pan, and stir gently until it becomes liquid and caramelizes. Add the chicken, cover, and cook for about 25 minutes. Remove cover, and cook for another 15 to 20 minutes, letting the juices cook down until they are almost gone. Add the bok choy, and cook just until wilted. 
6ae7ad06d9d3f53ff1b8e7515fb7e20d£ Heat the olive oil in a skillet over medium heat. Stir in the onion and garlic; cook and stir until the onion has softened and turned translucent, about 5 minutes. Add the okra, salt, and pepper. Increase the heat to high; cook and stir until the okra begins to brown, about 10 minutes. Pour the lime juice over the okra and continue cooking for 2 minutes. 
ee26d672ce0c7e5ac968e631ecb839dd£ Pulse the garlic and onion in a blender until very finely chopped. Pour in orange juice, lime juice; season with cumin, oregano, lemon-pepper, black pepper, salt, cilantro, and hot pepper sauce. Blend until thoroughly incorporated. Pour in the olive oil, and blend until smooth. 
d33924206b36764dd465e0b33d0eb6ad£ Preheat oven to 350 degrees F (175 degrees C). Grease a 9x5 inch loaf pan. Sift together the flour, baking powder and salt, set aside. In a medium bowl, cream together the sugar and butter. Beat in the eggs one at a time, then stir in the lime zest, nutmeg, cinnamon and allspice. Add the dry ingredients alternately with the milk, stirring after each addition. Pour batter into the prepared pan. Bake for 75 to 90 minutes in the preheated oven, until a toothpick inserted comes out clean. Cool in the pan for 10 minutes before turning out onto a rack to cool completely. 
f96cf0b489e784d216611b469b68b9d5£ In a food processor or blender, combine the green onions, onion, jalapeno pepper, soy sauce, vinegar, vegetable oil, brown sugar, thyme, cloves, nutmeg and allspice. Mix for about 15 seconds. Place the chicken in a medium bowl, and coat with the marinade. Refrigerate for 4 to 6 hours, or overnight. Preheat grill for high heat. Lightly oil grill grate. Cook chicken on the prepared grill 6 to 8 minutes, until juices run clear. 
987ed90e8df3d77db49462b4c5f6f863£ Heat vegetable oil in a large skillet over medium-high heat. Brown the flank steak on each side, about 4 minutes per side. Transfer beef to a slow cooker. Pour in the beef broth and tomato sauce, then add the onion, bell pepper, garlic, tomato paste, cumin, cilantro, olive oil and vinegar. Stir until well blended. Cover, and cook on High for 4 hours, or on Low for up to 10 hours. When ready to serve, shred meat and serve with tortillas or rice. 
d3218ed4139b3ac14fe5fceac83a86ed£ Place mint leaves and 1 lime wedge into a sturdy glass. Use a muddler to crush the mint and lime to release the mint oils and lime juice. Add 2 more lime wedges and the sugar, and muddle again to release the lime juice. Do not strain the mixture. Fill the glass almost to the top with ice. Pour the rum over the ice, and fill the glass with carbonated water. Stir, taste, and add more sugar if desired. Garnish with the remaining lime wedge. 
ceb76835f92a92a8391a21b6cf6c3fa1£ Combine the onion, brown sugar, soy sauce, vinegar, thyme, sesame oil, garlic, allspice and habanero pepper in the container of a food processor or blender. Process until smooth. Place the chicken into a large resealable bag, and pour in 3/4 of the sauce. Squeeze out excess air, and seal. Marinate in the refrigerator for at least one hour. Preheat your oven&#39;s broiler. Remove chicken from bag, and discard marinade. Broil chicken for 10 to 15 minutes, turning once to ensure even cooking. Heat remaining sauce in a small pan, and pour over chicken when serving. 
d72efb7e039749c311855dc2c5aa1b81£ Place chicken on a plate. Sprinkle the green onion, cilantro, garlic, onion, salt and pepper over it. Cover, and marinate for 30 minutes. Heat the vegetable oil in a deep pot over medium heat. Stir in the sugar, and cook until the sugar has melted into a nice golden brown syrup. Add the chicken pieces, and brown quickly while turning continuously. Cover the pot, and let it cook for 2 minutes. Pour in 1 cup of water, coconut milk and pepper flakes. Replace the lid, and cook over medium heat for 10 minutes. Stir in the ketchup and butter. Continue cooking until chicken is fork tender, 20 to 30 minutes. Taste and season with additional salt and pepper if needed. Serve chicken with the sauce in the pot as a gravy. 
aecd82ef4fba9e52f3661b2353d5bc77£ In a medium saucepan, combine cranberries, orange zest, cinnamon, orange juice, and brown sugar. Add enough water to cover, and bring to a boil over high heat. Immediately reduce heat, and simmer for about 1 hour, or until the sauce has thickened. Taste for sweetness, and adjust with additional sugar if necessary. You can not overcook, so continue cooking until you have a good thick consistency. Let mixture cool, then refrigerate in a covered container. 
06140bf21a0d14968dd194ebe6fdd304£ Heat oil in a large skillet over medium heat. Saute onions until soft. Stir in garlic, and saute about 1 minute. Add tomatoes, and cook until they begin to soften. Stir in wine, olives, capers, and red pepper flakes. Heat to a simmer. Place sea bass into sauce. Cover, and gently simmer for 10 to 12 minutes, or until fish flakes easily with a fork. Transfer fish to a serving plate, and keep warm. Increase the heat, and add butter to sauce. Simmer until the sauce thickens. Stir in cilantro. Serve sauce over fish. 
82b3686e86e93efeefa6c1bb1ec70e75£ Preheat oven to 400 degrees F (200 degrees C). In a large bowl, combine flour, 1 1/2 teaspoons curry powder, and pinch of salt. Cut in 1/4 cup margarine and shortening until mixture resembles coarse crumbs. Stir in water until mixture forms a ball. Shape dough into a log, and cut into 10 equal sections. Roll each section into a six inch circle (approximately 1/8 inch thick). Set aside. Melt margarine in a skillet over medium heat. Saute onion until soft and translucent. Stir in ground beef. Season with 1 teaspoon curry powder, thyme, 1 teaspoon salt, and pepper. Cook until beef is evenly brown, stirring constantly. Stir in beef broth and bread crumbs. Simmer until liquid is absorbed. Remove from heat. Spoon equal amounts of filling into each pastry circle. Fold over and press edges together, making a half circle. Use a fork to press edges, and brush the top of each patty with beaten egg. Bake in preheated oven for 30 minutes, or until golden brown. 
eba5bf58c4b815c305072542431f352a£ Place the garlic, onion, oregano, cumin, chile pepper, salt, and pepper into a blender. Pour in the olive oil and vinegar. Puree until smooth. Spread this mixture all over the pork loin, and place into a slow cooker. Cook on Low until the pork is fork tender, 6 to 8 hours. When ready, cut the pork into chunks, or shred; garnish with lime wedges to serve. 
3e72af7dd0eecd2d947d4347afa428fc£ Heat oil in a large saucepan over medium heat. Saute onion, bell pepper and garlic. When onion is translucent add salt and tomato paste. Reduce heat to low and cook 2 minutes. Stir in the beans and rice. Pour the liquid from the beans into a large measuring cup and add enough water to reach a volume of 2 1/2 cups; pour into beans. Cover and cook on low for 45 to 50 minutes, or until liquid is absorbed and rice is cooked. 
7f2c7d35a57875ad32d6a9256acae054£ In a large saute pan, heat oil over medium heat. Cook onion and garlic in oil, stirring frequently, until transparent. Stir in cubed meat, and cook until browned. Stir in red bell pepper, bay leaf, cumin, and oregano; cook for 2 to 3 minutes. Stir in sherry, tomato sauce, vinegar, olives, raisins, and capers. Pour in enough water to just cover meat. Bring to boil, reduce heat to low, and cover. Simmer until fork tender, about 1 1/2 hours. Add more water if the stew becomes too thick. Stir potatoes into the stew. Season with salt and pepper to taste. Cook, covered, until potatoes are almost tender. Uncover, and cook until done. 
4d0c073e348fa5a35f0652dc80ec20b6£ In a large pot, combine tomato sauce, sofrito sauce, sazon seasoning, adobo seasoning, oregano, and salt. Simmer over medium low heat for 5 minutes. Add meat, and cook until evenly browned. Stir in just enough water to cover meat. Cover, and simmer for about 1 hour. Add potatoes, and cook for about 30 minutes or until potatoes are tender. 
2946294db2a05e3f2b8314141718ae6c£ Wash the chicken and pat dry; place into a large bowl. Season with adobo seasoning, sazon seasoning, and salt. Place the legs into a slow cooker, and cover with the potato slices. Puree the red pepper, green pepper, onion, garlic, cilantro, olive oil, wine, cumin, and oregano in a blender. Pour over the chicken and add the bay leaves. Cook on Low for 6 to 8 hours, until the chicken is easily removed from the bone. 
714b52265fd73ade8c46106ba9a3ac35£ Place beans in a large saucepan with enough water to cover, and soak 8 hours, or overnight; drain. Heat oil in a medium saucepan over medium heat, and saute onion, green bell pepper, and garlic until tender. Into the onion mixture, stir the drained beans, water, tomato paste, pimentos, and vinegar. Season with salt, sugar, and pepper. Bring to a boil. Cover, reduce heat, and simmer 1 1/2 hours, stirring occasionally, until beans are tender. 
a5bf1c98688404bb708d795708fae72c£ Preheat an oven to 325 degrees F (165 degrees C). Grease and flour 2 9x5-inch loaf pans. Whisk the all-purpose flour, whole wheat flour, salt, baking soda, baking powder, cinnamon, and nutmeg together in a bowl. Beat the bananas, eggs, vegetable oil, applesauce, brown sugar, white sugar, and vanilla together in a separate large bowl. Stir the flour mixture into the wet mixture. Fold the zucchini, walnuts, and coconut into the batter until evenly combined. Pour into the prepared pans. Bake in the preheated oven until a toothpick inserted into the center comes out clean, 40 to 50 minutes. Cool in the pans for 25 minutes before removing to cool completely on a wire rack. 
5c48e642a55ef6fd2f2916365530b877£ Preheat oven to 350 degrees F (175 degrees C). Mix together the light brown sugar, 1 teaspoon of black pepper, thyme, cumin, 1 teaspoon of garlic salt, paprika, chili powder, and nutmeg in a bowl until thoroughly combined. Rub both sides of chicken breasts with the spice mixture, and place into a 9x9-inch baking dish. Sprinkle any remaining seasoning mix on top of chicken, if desired. Bake in the preheated oven until the chicken is lightly browned, no longer pink inside, and the juices run clear, about 30 minutes. An instant-read meat thermometer inserted into the thickest part of a chicken breast should read at least 160 degrees F (70 degrees C). While chicken is baking, bring the rice and water to a boil in a saucepan over high heat. Reduce heat to medium-low, cover, and simmer until the rice is tender, and the liquid has been absorbed, 20 to 25 minutes. Chop half the pineapple slices. Mix the chopped pineapple, cilantro, and olive oil into the cooked rice, and season to taste with a pinch or two of garlic salt and black pepper. Fluff the rice up with a fork, and transfer to a serving platter. Serve with the baked chicken, topped with remaining pineapple slices. 
662746f58dc251676a1fcbc57547a97f£ Place the chicken in a bowl, and cover with the teriyaki marinade sauce. Marinate at least 2 hours in the refrigerator. In a small bowl mix the tomatoes, onion, jalapeno pepper, and cilantro. Cover salsa, and refrigerate. In a small bowl, mix the mustard, honey, sugar, oil, vinegar, and lime juice. Cover dressing, and refrigerate. Preheat the grill for high heat. Lightly oil grill grate. Place chicken on the grill, and discard marinade. Cook for 6 to 8 minutes on each side, or until juices run clear. Arrange mixed salad greens on plates. Spoon some of the salsa over each salad, and sprinkle with 1/4 of the pineapple chunks. Break tortilla chips into large chunks, and sprinkle over salads. Lay some of the grilled chicken strips on each salad. Finally, drizzle dressing over each salad, and serve. 
0eab64d72e73a49d9cfa2075dd74b2f7£ Split the sandwich rolls in half, and spread mustard and mayonnaise liberally onto the cut sides. On each sandwich, place and equal amount of Swiss cheese, ham and pork in exactly that order. Place a few pickles onto each one, and put the top of the roll onto the sandwich. Brush the tops with melted butter. Press each sandwich in a sandwich press heated to medium-high heat. If a sandwich press is not available, use a large skillet over medium-high heat, and press the sandwiches down using a sturdy plate or skillet. Some indoor grills may be good for this also. Cook for 5 to 8 minutes, keeping sandwiches pressed. If using a skillet, you may want to flip them once for even browning. Slice diagonally and serve hot. 
6a169171e23165a3709905072617b99a£ Heat the olive oil in a skillet over medium heat. Stir in the onion and garlic; cook and stir until the onion has softened and turned translucent, about 5 minutes. Add the okra, salt, and pepper. Increase the heat to high; cook and stir until the okra begins to brown, about 10 minutes. Pour the lime juice over the okra and continue cooking for 2 minutes. 
abf653fe920b1d35d581c59da040f48c£ Heat the oil in a large skillet over medium heat. Add the plantain slices and fry until they soften, 5 to 10 minutes. Remove from the oil and drain on paper towels. Use a tostonera (a press) to slightly mash each piece until it is about 1/2 inch thick. If you do not have a tostonera, use a mallet or place the pieces between a folded paper bag and press down with a saucer. Press all of the pieces before going onto the next step. Return the pieces to the hot skillet and fry until crispy, about 3 minutes per side. Drain on paper towels and season with garlic powder and salt while still warm. 
c05ae70b0b09bd058a742b4f9290b8a1£ Combine olive oil, vinegar, garlic, oregano, salt, and black pepper in a mortar and pestle; mash into a paste. Make deep slits into the pork with a small knife. Stuff slits with the paste; rub any remaining paste over the pork. Place pork in a plastic roasting bag and put in a roasting pan with a rack. Let marinate in the refrigerator, 8 to 48 hours. Take pork out of the refrigerator, uncover, and bring to room temperature, 1 to 2 hours. Preheat oven to 300 degrees F (150 degrees C). Roast pork skin-side down in the preheated oven until golden brown, about 2 hours. Flip pork and continue roasting, skin-side up, until juices run clear and an instant-read thermometer inserted into the center reads at least 145 degrees F (63 degrees C), 2 to 4 hours more. 
360c5fec780a1eb366d0df590f1ab241£ Preheat an oven to 325 degrees F (165 degrees C). Grease two 8x4-inch loaf pans. Whisk the flour, baking powder, cinnamon, nutmeg, allspice, and salt together in a bowl; set aside. Beat the egg in a mixing bowl; whisk in the milk, beer, and 1 3/4 cups of brown sugar until the brown sugar has dissolved. Stir in the butter, browning sauce, vanilla extract, and lime juice until blended. Add the flour mixture and raisins. Stir until no dry lumps remain. Pour the batter into the prepared loaf pans. Bake in the preheated oven until a toothpick inserted into the center comes out clean, about 1 hour. When the bread is nearly finished, combine 1/2 cup brown sugar and the water in a small saucepan. Bring to a boil over high heat and boil until the sugar is thick and syrupy, about 5 minutes. Pour the glaze over the bread once it&#39;s done; return the bread to the oven and bake 5 minutes longer. Cool in the pans for 5 minutes before turning out onto a wire rack to cool completely. 
7eee15e83cd2607c0b7a5186965ab9c4£ Arrange the grouper on a plate. Drizzle the lime juice over the fillets and season with salt, pepper, and red pepper flakes. Cover with plastic wrap and refrigerate overnight or 8 hours. Preheat oven to 350 degrees F (175 degrees C). Lightly grease a baking dish. Lay the fillets in the prepared baking dish in a single layer. Arrange the tomato slices, onion slices, and bell pepper slices atop the fillets. Cover with aluminum foil. Bake in preheated oven until the fish flakes easily, about 1 hour. 
73d4133871ecefcd62ad6b392d0c494f£ Lay the eye of round roast on your work surface. Use the tip of a sharp boning or paring knife to cut a pocket by inserting the knife all the way through the center of the roast, beginning on the flat side. Rotate the blade 90 degrees and insert the knife in the same spot, creating an cross shape that extends through the roast. Stuff the chorizo pieces into the pocket. Using the same knife, pierce the roast all over. Set aside. Mash garlic and oregano with a mortar and pestle to create a paste. Rub paste all over the roast, then season with paprika, salt, and pepper. Pour the orange juice, lime juice, and lemon juice over the roast. Cover with plastic wrap and marinate in the refrigerator for at least 3 hours, or overnight. Remove the roast from the marinade, and shake off excess. Reserve marinade. Heat a large Dutch oven over medium heat. Place the roast in the Dutch oven and brown on all sides, about 10 minutes. Remove roast to a platter, and set aside. Stir in the onions; cook and stir until the onion has softened and turned translucent, about 5 minutes. Return the roast to the pot. Add the bay leaves, sherry, beef broth, and reserved marinade. Increase heat to medium-high, bring to a boil, then cover and reduce heat to low; simmer 2 hours. Drop potatoes into the pot, cover, and continue to simmer until potatoes are tender and easily pierced with a fork, about 30 minutes more, adding additional beef broth as needed. Remove the roast and place on a platter. Cover the meat with two layers of aluminum foil, and allow to rest in a warm area for 10 minutes. Slice roast into 1/2-inch thick slices, and arrange potatoes on the platter. Spoon the remaining sauce over, and serve. 
05408c4b67fa10e35c210b050c066b7e£ Preheat oven to 350 degrees F (175 degrees C). Fill a large, shallow baking pan with about 1 1/2 inches water. In an 8x13 inch aluminum baking pan over medium heat, mix the sugar and lemon juice. Cook and stir until caramelized. Remove from heat, and blend in mango, sweetened condensed milk, cornstarch, rum, evaporated milk, eggs, and salt. Set pan with the mango mixture into the pan with water. Place in the preheated oven, and bake 45 minutes, or until firm. Cool before turning out onto a platter. 
980b21abca4da8746ebc7ae2b56eac17£ Place vegetable oil, bacon, and onion in a medium skillet over medium high heat. Cook until bacon is evenly brown and onion is tender. Stir tomato sauce and rum into the skillet with bacon and onion, and reduce heat. Simmer about 2 minutes. Mix in lemon juice, brown sugar, and chili sauce. Continue to simmer about 8 minutes. 
12d76a63d8138fab8e34122845ed5eed£ Remove the thick stems of the callaloo leaves, chop roughly, and put into a large saucepan. Add the chicken stock, onion, beef, black pepper, shallots, thyme, chili pepper, and crab meat. Cover, and simmer until meat is tender, about 35 minutes. Add the okra, and cook for 8 minutes. Remove the chili pepper. Puree the soup in a blender or food processor. Reheat, and adjust seasonings. 
5ea5a911a19503036e6059d6131e9608£ Mix the quinoa and water in a saucepan over medium heat, and bring to a boil. Cover, reduce heat, and simmer until all the water is absorbed, 10 to 12 minutes. Remove from heat, and stir in the dried pineapple, dried mango, coconut flakes, macadamia nuts, hot and regular mango chutney until thoroughly combined. Serve hot. 
24be89c18d643feb91f8514f32efe0d3£ Place the green, red, orange, and yellow bell peppers in a blender or bowl of a food processor. Add the tomatoes, green onions, cilantro, tomatillos, and garlic. Blend or pulse according to your preference to make a chunky or smooth mixture. Refrigerate in a covered container up to 5 days, or freeze up to 45 days. 
edcf206d994cdbf60196abc6145b4996£ Combine mayonnaise, sour cream, cilantro, green onions, ground chipotle peppers, lime juice, garlic basil spread, cumin, salt, and black pepper in a small bowl. Stir until combined. Cover and refrigerate for at least 1 hour. Preheat oven to 500 degrees F (260 degrees C). Heat olive oil in large skillet over medium-high heat. Stir onions, red pepper flakes, and oregano in the hot oil until onions begin to soften, about 5 minutes. Season with salt and ground black pepper to taste. Add half the jalapeno pepper rings and cook until they begin to soften, 2 to 3 minutes. Reserve remaining jalapeno rings. Spread each ciabatta roll with 1 tablespoon sweet hot mustard and 2 tablespoons chipotle mayonnaise. Evenly divide the Swiss cheese slices, slices of pork loin, ham, dill pickles, and remaining jalapeno rings among the four sandwiches. Top with cooked onion mixture. Place sandwiches onto a baking sheet and bake in the preheated oven until cheese is melted and bread is toasted and warm, 4 to 5 minutes. 
1950c98af5191ab6f7674d62d066e6b4£ Heat canola oil in a Dutch oven over medium-high heat; cook and stir onion, carrots, salt, black pepper, and sugar until onion is a deep brown color, 15 to 20 minutes. Reduce heat to medium; add garlic, chile pepper, ginger, and curry powder. Stir constantly to incorporate, about 5 minutes. Increase heat to medium-heat and stir 1 can vegetable broth into the onion mixture. Scrape up any vegetables or curry powder stuck to the bottom of the pot with a wooden spoon. Add lentils and remaining 1 can of vegetable broth; cook until lentils are tender, about 30 minutes. Stir cilantro into lentils before serving. 
886370605f65a43287fa756e7bccc8ac£ Pat the fish dry and cut 3 small slits on each side of the fish. Season both sides with salt and pepper. Heat 1 quart oil in a large skillet over medium-high heat until smoking. Carefully place the fish in the pan and fry until browned and crisp, about 5 minutes per side. Remove fish and place on a paper towel-lined plate. Heat 1 teaspoon oil in a large skillet over medium-high heat. Stir onion, garlic and carrot into the pan; cook and stir 1 to 2 minutes. Add thyme, allspice, habanero pepper, vinegar, water, salt, and sugar and continue cooking until onions have softened and liquid has reduced, about 5 minutes. Serve fish topped with onion mixture spooned over the top. 
