1184d82b84924f43d6b46de96725f400£ Heat canola oil in a deep-fryer or large saucepan to 375 degrees F (190 degrees C). Gather about 2 tablespoons of shredded plantains and shape into patties. Fry the patties in the preheated oil until golden and crispy, about 10 minutes. Drain on paper towels and season with garlic salt. 
ae441b08fa003689de6377be7c449515£ Pour the water into a large pot. Separate cabbage into leaves, and place in a steamer basket. Set the basket into the pot with the water. Bring to a boil over medium heat, and place the ear of corn over the cabbage. Cover, and steam for 15 to 20 minutes, or until corn is tender. Remove the basket from the pot, and cool slightly. Cut the ear of corn into four pieces and place them in a serving bowl with the cabbage. Combine the butter, vermouth, shallots, garlic, salt, pepper and red pepper flakes; pour over the cabbage, and stir to coat evenly. Separate the salad onto four plates, and garnish each one with a piece of the corn. 
3129d2eafb6681474f21074b5bcb0f9f£ Bring a large pot of water to a boil. Cut the ends off of the bananas, and make a slit lengthwise down the peel. Cook bananas in boiling water until tender (similar to a potato). Drain, cool, and remove peels. Cut into small chunks and place in a serving bowl. Drizzle 1 tablespoon of olive oil over the pieces, and stir to coat. Meanwhile, heat the remaining tablespoon of oil in a skillet over medium-high heat. Add shrimp and crab, and fry until cooked through, about 5 minutes. Set aside to cool. Add onions, green pepper and seafood to the bananas in the bowl. In a separate bowl, whisk together the red wine vinegar, sugar and bacon pieces. Pour this mixture over the bananas, and toss lightly to coat. Season with salt and pepper. Garnish with slices of hard-cooked egg if desired. 
45340c99a23cb8b0f0abeacbe83c2dce£ Clean the taro leaves by removing the skin from the stalks, and removing the tip from the center rib. Rinse, and cut into bite size pieces. Place the taro leaves, okra, onion, thyme, garlic, salted pig&#39;s tail, pumpkin, water, habanero pepper (whole), and coconut milk into a large pot. Cover, and simmer over low heat for 30 minutes. Add the crab to the pot. Be careful not to puncture the habanero pepper. Cover, and continue to simmer for 30 minutes. Remove the habanero, and season with salt to taste. Puree the soup using an immersion blender until smooth. You could also puree in small batches using a blender. Serve over rice. 
9b15fb22bea0a0efe282cb0d04707e4f£ Heat the olive oil in a saucepan over medium-high heat. Stir in the onion, garlic, and ginger, and cook until tender. Reduce heat to low. Mix in ketchup, brown sugar, molasses, rum, hoisin sauce, tomato paste, vinegar, chili powder, and cayenne pepper. Cook and stir 5 minutes, until well blended and heated through. Stir in remaining rum. 
5e833f6c405aa601700537fdb62b2c2d£ Heat the oil in a large skillet over medium-high heat. Add the onion, bell pepper and thyme; cook and stir until tender and starting to brown. Mix in the tomato paste and tomato sauce and reduce heat to low. Season with seasoned salt, salt and pepper. Simmer for a few minutes, then stir in the black-eyed peas and simmer for a few minutes more. Pour in the water and bring to a boil. When the mixture boils, stir in the grits and return to a boil, then cover, reduce heat to low and cook for 20 to 30 minutes. 
d29ea221aca705be7ce7bcec36fd6d9f£ Chop the coconut meat into pieces about 1/2 inch square. Place water in a saucepan, and bring to a boil over medium-high heat. Stir in cinnamon and sugar until dissolved. Boil mixture until liquid reduces to a syrup consistency, then stir in coconut pieces. Add the lime juice, and turn off heat. Place spoonfuls of sugared coconut mixture into small paper cups. Cool in cups until hardened. 
d14e370d7ef0f295b7ed99d95362216d£ Bring a small pot of water to a boil. Add potato and cook uncovered until slightly tender, about 5 minutes. Drain in a colander. Heat oil in a large skillet or Dutch oven over medium-high heat. Add drained potatoes, corn, sofrito, and garlic; cook and stir until fragrant, 2 to 3 minutes. Add tomato sauce, oregano, and bay leaf; cook and stir until flavors combine, 2 to 3 minutes. Add water and bring mixture to a boil. Lower heat to medium-low; stir in corned beef. Cook until heated through, 6 to 8 minutes. 
5cb87b318dbbd360688e927ba1e092e2£ Preheat oven to 350 degrees F (175 degrees C). Grease a 9x13-inch baking dish. Mix onion and Cheddar cheese together in a bowl. Sprinkle 1/2 of the cheese mixture into the prepared baking dish; top with swai fish. Sprinkle the remaining cheese mixture over fish. Whisk milk, Worcestershire sauce, mustard, salt, and black pepper together in a bowl; pour over fish. Bake in the preheated oven until fish flakes easily with a fork and the cheese is melted, about 45 minutes. 
581ef125bbeeca61bc66f16eb8c7d818£ Heat oil in a large pot or deep fryer to 365 degrees F (185 degrees C). Combine gluten free pancake mix, onions, celery, coconut, gluten free crackers, lobster meat, seafood seasoning, baking powder, salt, and ground black pepper in a bowl. Combine eggs, evaporated milk, and butter in a separate bowl. Stir egg mixture into dry mixture to form a batter. Drop batter by rounded tablespoons into hot oil and fry until golden brown, about 3 minutes. Remove and drain fritters on a rack. 
58dfb7a8832387dce82f63b546872cc0£ Mix cumin, turmeric, allspice, and curry powder together in a small bowl. Heat olive oil in a skillet over medium-low heat. Cook and stir ginger and cumin mixture in the hot oil until fragrant, about 5 minutes. Stir onion and garlic into the ginger mixture; cook and stir until the onion is hot, 1 to 2 minutes. potatoes; cook and stir 1 to 2 minutes. Mix red bell pepper, broccoli, bok choy, and plantains into the the potato mixture. Pour enough water into the skillet to reach about half-full. Cover skillet and cook the mixture at a simmer until the potatoes are tender, 20 to 25 minutes. Season with salt. 
b248e00a2954a5a6b32817f5c452b644£ Combine banana, light rum, lime juice, triple sec, and sugar in a blender; puree until smooth. Add ice cubes and blend on highest setting until slushy, 15 to 20 seconds. Pour into a glass and serve. 
22e7f57e9d462748af4f5dca44b29ccf£ Preheat oven to 325 degrees F (165 degrees C). Sprinkle sazon seasoning and black pepper over steaks; rub in lightly with your fingers. Arrange steaks close together, but not overlapping, in a large casserole dish. Mix green bell peppers, red bell peppers, onion, and garlic together in a large bowl. Spoon over steaks in the casserole dish. Cover with aluminum foil. Bake in the preheated oven until peppers are soft and steaks are cooked through, 1 1/2 to 2 hours. 
5fa5fefa1a8bd07a90d67f75ae9520fe£ Crush garlic into small pieces in a mortar and pestle. Add olive oil, salt, oregano, and black pepper; mash into a paste. Make 12 deep incisions a few inches apart in the roast using a sharp knife. Pack the seasoned garlic paste evenly into the incisions and over the roast. Transfer roast to a large bowl. Pour in red wine, covering roast completely. Cover with plastic wrap and let marinate in the refrigerator, 24 hours. Pour out red wine. Place roast fat-side up in a roasting pan; cover with aluminum foil. Let sit at room temperature, about 30 minutes. Preheat oven to 400 degrees F (200 degrees C). Place roast in the preheated oven; reduce temperature to 300 degrees F (150 degrees C). Bake until slightly pink in the center, about 4 hours. Increase temperature to 400 degrees F (200 degrees C). Uncover roast and continue baking until fat is crispy and an instant-read thermometer inserted into the center reads 160 degrees F (71 degrees C), about 1 hour more. Remove from oven and let rest before carving, 20 to 30 minutes. 
dd3ad4295810c9dc93d264e5f0a76ed0£ Combine chicken legs, lemon juice, onion, garlic, seasoned salt, paprika, thyme, pepper, and cloves in a large bowl. Cover and marinate in the refrigerator for at least 12 hours. Heat oil in a deep-fryer or large saucepan over medium-high heat. Fry chicken in batches until golden brown, about 8 minutes per side. Drain on paper towels. 
d3bdaa3e6ba50c84bc55b3fab36bfdf2£ Stir espresso and coconut syrup together in a mug. Heat milk in a saucepan over medium-low heat until just beginning to boil, about 5 minutes; stir warm milk into espresso mixture. Sprinkle latte with cinnamon. 
869f2379db6c590fa31bec3e38f24c5b£ Combine goat meat, chile pepper, curry powder, garlic, salt, and black pepper in a bowl. Cover and refrigerate to allow flavors to blend, 1 hour to overnight. Remove goat meat mixture from bowl and pat dry, reserving marinade. Heat vegetable oil in a stockpot over medium-high heat. Cook meat in batches, browning on all sides, 5 to 6 minutes per batch. Transfer meat to a plate. Add onion and celery to the stockpot; cook and stir until onion begins to brown, 4 to 6 minutes. Stir browned goat meat into onion mixture. Add reserved marinade, vegetable broth, and bay leaf. Bring to a boil, cover, reduce heat to low, and simmer for 1 hour. Stir in potatoes; simmer until potatoes and meat are tender, 35 to 45 minutes more. Remove stockpot from heat, skim off surface fat, and remove bay leaf. 
6987640b8c8bb637e9a55fedad4a2050£ Whisk 1/2 cup marinade, 1/4 cup lime juice, garlic, and black pepper together in a bowl; pour into a large resealable plastic bag. Add tofu, coat with the marinade, squeeze bag to remove air, and seal the bag. Marinate in the refrigerator for 30 minutes. Drain tofu, discarding marinade. Prepare a large skillet with cooking spray and place over medium-high heat. Cook tofu, turning frequently, until it starts to brown, about 4 minutes; transfer to a bowl. Return skillet to medium-high heat. Cook and stir jicama, pineapple, remaining 1/4 cup marinade, and 1 tablespoon lime juice in the skillet until hot, 2 to 3 minutes. Return tofu to the skillet; cook and stir until heated through, about 2 minutes more. Spoon 1/3 cup tofu mixture evenly down center of each tortilla. Top each with even portions of rice, black beans, and cheese. Fold 2 opposing ends to overlap the edges of the filling. Wrap 1 of the opposing edges of the tortilla over the filling and roll to form a burrito. Top each burrito with salsa and sour cream. 
dc0d86e8749d38251fff3f9022f73d92£ Blend evaporated milk, rum, cream of coconut, sweetened condensed milk, coconut milk, water, nutmeg, 1 teaspoon cinnamon, and vanilla extract in a blender at high speed until creamy, about 3 minutes; pour into a glass pitcher. Refrigerate coquito until chilled, at least 20 minutes. Pour into glasses and dust with cinnamon. 
ead77084ba01663f11e02df12552f791£ Bring the whole plantains with enough water to cover to a boil; reduce heat to medium-low, cover, and simmer until the plantains are tender and the skins have cracked, about 45 minutes. Drain and set aside until cool enough to handle. Heat oil in a deep-fryer or large saucepan to 375 degrees F (190 degrees C). Peel the plantains and mash with the salt and pepper until no lumps remain. Roll the mashed plantain into 3 tablespoon size balls around a cube of cheese. Cook the plantain balls in the hot oil in batches until they are golden brown and float to the surface, about 5 minutes. Move the plantain balls around as they cook to ensure they brown evenly. Drain the cooked plantain balls on a paper towel-lined plate to cool slightly. 
667c9cd8ba2ca365a756a599807ffe11£ Fill a tall glass with ice. Pour the orange vodka, raspberry vodka, rum, orange juice, pineapple juice, and grenadine over the ice; stir well. Garnish with an orange wedge. 
6cad761dc8e60357246b1db91513420d£ In the container of a blender, combine the lemonade concentrate, lemon-lime soda, rum and strawberries. Cover, and blend until smooth. Add ice and blend to desired thickness. 
7317a29db48865227e288856c5d28740£ In a large saucepan over low heat, stir together the guava, tomato sauce, tomato paste, water, and brown sugar until well blended. Stir in liquid smoke, fresh lemon juice, Worcestershire sauce, habanero sauce, and molasses. Season with garlic powder, onion powder, salt, and black pepper. Cover, and cook 30 minutes, stirring occasionally, until thickened. 
cb6bf75053b15e4b2c788eede9bf84ee£ Bring the stock to a boil over high heat, then reduce heat to medium-low. Pour the cornmeal into stock in a steady stream while stirring vigorously until thickened. Cook for 40 minutes, stirring often until very thick. Pour the funchi onto a cold, slightly wet plate, and spread evenly. Cover with another plate, and allow to set, about 30 minutes. Cut into 8 wedges like a pie to serve. 
b1ec92afb6747d514111fd389d64b79e£ Preheat oven to 350 degrees F (175 degrees C). Mix together the vanilla wafer crumbs and butter in a bowl until thoroughly combined, and press the crust into the bottom and up the sides of a 10-inch pie dish. Beat the sweetened condensed milk, Key lime juice, egg yolks, vanilla extract, and Key lime zest in a bowl with an electric mixer until smooth; pour the filling into the prepared cookie crust. Bake the pie in the preheated oven until center of pie is slightly jiggly, about 15 minutes. Allow to cool for 10 minutes, then refrigerate. Mix the rhubarb, strawberries, sugar, water, and pectin in a saucepan over medium heat, and bring to a boil. Stirring often, boil until the rhubarb and berries break down and the glaze begins to thicken and resemble jam, about 20 minutes. Remove from heat; cool to lukewarm. Glaze will thicken as it cools. Spread the glaze over the pie, and refrigerate until chilled. For best texture, allow pie to chill at least 8 hours before serving. 
c047ece21638eb0114f3aef78280945d£ Put cucumbers, basil leaves, lime slices, rum, and raw sugar cubes into a metal cocktail shaker. Mash mixture together with a muddler until the sugar cubes have dissolved. Add ice, place lid onto the shaker, and shake vigorously; strain into a chilled glass tumbler filled with ice. Top cocktail with club soda and garnish with cucumber wedge and basil sprig. 
3d033a3422b7cbda1aacc2bca0f4c135£ Melt coconut oil in a skillet over medium heat; add tomato, onion, garlic, and scotch bonnet chile pepper. Cook and stir tomato mixture until onion is almost translucent, about 5 minutes. Pour sardines and soybean oil into tomato-onion mixture; mash fish with a fork until incorporated. Cover skillet, reduce to low, and cook until sardines are heated through, about 3 minutes. Season with salt and pepper. Serve sardine mixture over rice. 
3af5030445dea55b03b793524e46c96a£ Whisk orange juice, lemon juice, salt, onion powder, garlic powder, black pepper, and sugar together in a large bowl to dissolve seasoning into the liquid. Add scallops, yellow squash, zucchinis, and portobello mushroom to the mojito marinade; toss to coat. Cover bowl with plastic wrap and refrigerate 8 hours to overnight. Preheat oven to 400 degrees F (200 degrees C). Thread onto a skewer a piece of mushroom, yellow squash, zucchini, and a scallop, respectively. Repeat so there are two of each item on the skewer; repeat with remaining skewers. Sprinkle fresh basil evenly over the skewers. Carefully remove tomato insides with a spoon; discard tomato insides. Pour broccoli with cheese sauce into a microwave-safe bowl; cook in microwave until broccoli is tender and the sauce is melted, 3 to 5 minutes. Stir broccoli with cheese sauce and rice together in a bowl; spoon into the hollowed-out tomatoes. Place 2 strips American cheese atop the mixture in a crossing pattern. Cook the skewers in preheated oven until the scallops are cooked through, 25 to 30 minutes. Remove from oven to a plate; cover with aluminum foil to keep warm. Reduce oven heat to 350 degrees F (175 degrees C). Bake tomatoes in the oven until the cheese is bubbling, 5 to 10 minutes. Serve with the skewers. 
79618611e2f4936accd76377d26cd61c£ Combine tequila, mint leaves, sugar, and lime wedges in a tall glass; vigorously stir the mixture, crushing mint with the back of a spoon to release oils and squeezing juice from the lemon wedges. Top with club soda and stir gently to serve. 
697b56be412d51d682e11aa9b57c4ac2£ Preheat oven to 350 degrees F (175 degrees C). Bring a large pot of water to a boil. Cook bell peppers in boiling water until softened, about 10 minutes. Arrange peppers in a baking dish with the cut side on the bottom of the dish. Bake peppers in preheated oven for about 10 minutes. Remove from oven and set aside. Heat oil in a skillet over medium heat. Cook and stir onion in hot oil until fragrant, about 2 minutes. Stir sofrito, garlic, salt, cumin, oregano, and black pepper with the onion; let mixture cook together for about 1 minute. Break ground beef into small pieces into the skillet; cook and stir until the beef is crumbly and completely browned, 7 to 10 minutes. Stir tomato sauce, capers, and rice through the beef mixture; spoon into the peppers. Sprinkle cheese over the top of the stuffed peppers. Continue baking in oven until the cheese is melted, about 10 minutes. 
fc988d5c9aa51f7e9485447ed2db4515£ Bring water, sugar, and anise seeds to a boil in a saucepan; lower heat to medium-low. Simmer until thick and syrupy, about 10 more minutes. Remove from heat and pour through a strainer to separate the seeds out; set syrup aside to cool slightly. Beat eggs yolks in a large bowl until light yellow; add rum, condensed milk, evaporated milk, and vanilla extract. Stir in syrup mixture until mixture is smooth. Pour into decorative bottles and seal tightly. Refrigerate for at least 6 hours before drinking, the longer the better. 
2b303289bb5eba87e234e483f8cb4ae8£ Place luncheon meat cubes, processed cheese sauce, pimientos, and sandwich spread in a blender; pulse to blend into a smooth mixture, stopping often to scrape down blender sides. Transfer spread to a bowl. Spread the mixture onto 15 slices of white bread; top each with a slice of whole wheat bread. Press sandwiches together lightly and cut off crusts. Slice sandwiches in half diagonally to make triangles; sprinkle sandwiches with parsley flakes and top each sandwich half with a piece of sliced cucumber. 
06497ca1a40f20002428c1962583921f£ Place a prosciutto slice on each chicken breast. Trim prosciutto to fit inside the chicken breast with a 1/2-inch border of chicken. Place 2 slices mango in the center of each prosciutto slice. Roll the chicken breast lengthwise to completely enclose the mango and prosciutto. Tuck and pinch the ends to seal rolls tightly. Arrange chicken rolls on a baking sheet and refrigerate until very firm, about 30 minutes. Combine flour, salt, curry powder, black pepper, and thyme in a bowl. Pour mixture onto a plate. Pour beaten eggs onto a separate plate. Sprinkle coconut onto a third plate. Slice chicken rolls into 1 to 1 1/2-inch pieces. Roll chicken in the flour mixture and shake off any excess flour. Coat chicken in the beaten egg until completely covered; allow excess egg to drip off. Roll chicken in coconut. Arrange the coated chicken rolls on a plate in a single layer. Cover and refrigerate to allow coating to set, 15 minutes. Preheat oven to 325 degrees F (165 degrees C). Heat enough vegetable oil in a deep, heavy skillet to immerse chicken rolls. Turn heat to medium. Fry half the chicken rolls in the hot oil until golden brown, about 4 minutes. Remove chicken rolls with a slotted spoon and drain on several layers of paper towels. Repeat with remaining chicken rolls. Place chicken rolls on a baking sheet. Bake in the preheated oven until chicken is no longer pink in the center and juices run clear, about 10 minutes. Splash chicken rolls with lime juice and serve alongside lime wedges. 
94bcf2ed63f98a67a3e59dd7900662e1£ Place yellow onions, chorizo, green bell pepper, and garlic in a food processor; pulse until minced. Transfer onion mixture to a large bowl. Add ground beef, ground pork, bread crumbs, eggs, ketchup, cumin, salt, and black pepper; mix with your hands until well-blended. Form mixture into 12 patties. Heat oil in a large skillet over medium heat. Cook patties in batches until browned and medium well done, about 5 minutes per side. Serve cooked patties on hamburger buns topped with shoestring potatoes. 
8bb9afc27c9e7de8e3bce625daaa6848£ Combine water, rice, coconut milk, kidney beans, thyme, and salt in a large pot. Stick cloves into onion and add to the pot. Bring to a boil; simmer, covered, until most of the liquid is absorbed, about 20 minutes. Uncover and cook until remaining liquid is reduced, about 5 minutes more. 
7c25c3fe92eba1eb6c8367ca4ce091a9£ Heat a large skillet over medium heat. Add ground beef; cook and stir until browned on the outside and no longer pink in the center, about 10 minutes. Remove meat from pan; drain fat. Place tomato sauce, sofrito, green olives, garlic, 1/2 teaspoon salt, recao, and oregano in the skillet. Cook and stir over medium-low heat for 5 minutes. Return ground beef to skillet; reduce to a simmer. Cook, uncovered and stirring occasionally, for 15 minutes more. Preheat oven to 350 degrees F (175 degrees C). Spray an 8x8-inch baking pan with cooking spray. Pour oil into a large skillet over medium-high heat to 350 degrees F (175 degrees C). Fry plantain slices until golden, 3 to 5 minutes per side. Drain on paper towels. Beat eggs thoroughly in a bowl; add 1/2 teaspoon salt. Line the bottom of the baking pan with half the plantains, overlapping as needed. Layer ground beef mixture, green beans, and remaining plantains; pour eggs on top. Top with mozzarella cheese. Bake in the preheated oven until eggs are set and cheese is melted, 20 to 25 minutes. 
d56dfacd2678d8d6315f01e1004e8c3a£ Place chile peppers in a large bowl and cover with hot water. Soak until soft, about 20 minutes. Drain. Heat a large skillet over medium heat. Add chuck roast and season with salt and pepper. Cook meat until dark brown and crispy on all sides, 7 to 10 minutes. While meat cooks, combine softened chile peppers, onion, vinegar, garlic, lime juice, cumin, oregano, agave nectar, and cinnamon in a blender. Process sauce until smooth. Transfer browned meat and all juices to a multi-functional pressure cooker (such as Instant Pot(R)). Stir in sauce from the blender. Close and lock the lid. Select high pressure according to manufacturer&#39;s instructions; set timer for 60 minutes. Allow 10 to 15 minutes for pressure to build. Release pressure carefully using the quick-release method according to manufacturer&#39;s instructions, about 5 minutes. Unlock and remove the lid. 
8f6b7c811331975bd612ceb2bb936188£ Combine water, cornmeal, whole milk, coconut milk, white sugar, vanilla extract, salt, nutmeg, and cinnamon in a blender; blend until smooth. Bring the mixture to a boil in a saucepan; whisk occasionally until beginning to thicken, about 5 minutes. Reduce heat when slow bubbles form. Stir frequently until as thick as you like, about 5 minutes. Add raisins. Remove from heat, cover, and let cool before serving, about 5 minutes. 
e4ef387c9af72a8064eee2b7cda3c421£ Heat ghee in a saucepan over medium heat. Add vermicelli; cook and stir until golden brown, 2 to 3 minutes. Pour evaporated milk and water over vermicelli; bring to a boil. Stir sweetened condensed milk and cinnamon into vermicelli mixture; cook, stirring occasionally, until vermicelli is cooked and milk is thickened, 5 to 10 minutes. Stir raisins into vermicelli mixture; cook until raisins are plump and mixture is thickened, about 5 minutes. Remove from heat and cool slightly. Serve garnished with almonds. 
d9e12c63b15adf6ec0cd077afcae9fd1£ Combine onions, garlic cloves, green bell pepper, red bell pepper, yellow bell pepper, cilantro, oregano, vinegar, cumin, black pepper, and salt in a food processor; process into a smooth paste. 
ac28afdfc6a3052f77118a056f4680b0£ Heat cornstarch in a pot over medium heat. Stir in milk slowly. Add sugar and salt. Cook and stir until slightly thickened, about 15 minutes. Whip egg yolks in a bowl. Stir in 1/4 of the cornstarch mixture. Transfer the egg-cornstarch mixture to the pot. Cook and stir until combined, about 1 minute. Add the lemon rind; cook and stir until thickened, 7 to 10 minutes. Remove from heat; add vanilla extract and mix well. 
af9adb901eabbc03654b0a36fb6ef83b£ Pour water into a saucepan and add tamarind pod pieces, habanero pepper, garlic, salt, and black pepper. Bring to a boil and reduce heat to low; simmer until tamarind pods begin to break down and seeds appear. Stir brown sugar into mixture. Press pods against side of pan with a slotted spoon as they cook to help extract pulp. Discard seeds. Continue simmering until tamarind mixture thickens to the consistency of tomato soup, about 40 minutes, stirring often. Mix cilantro, lime juice, and vinegar into sauce and simmer just until cilantro is wilted, 1 to 2 more minutes. Pour sauce through a fine mesh strainer, pressing as much pulp and solids through the mesh as possible. Discard the remaining almost-dry solids (about a palm full) and scrape the outside of the strainer into retained sauce. 
f63a9db82a3ee2c183127f59b2f34202£ Pour mango nectar, pineapple juice, rum, triple sec, and lime juice into a blender and pulse once or twice to combine. Add ice cubes and blend until drink is slushy and no ice chunks remain, 1 to 2 minutes. Serve in a glass with additional ice if desired. 
