dffcdd5ad0e85dc4188267bbb618c2a1£ Place the sliced steak in a large bowl. Sprinkle the cornstarch over the beef slices and mix to coat. Whisk the soy sauce and sugar together in a small bowl until the sugar dissolves; pour over the beef slices. Mix and marinate in the refrigerator for at least 2 hours or overnight. Heat 3 tablespoons olive oil in a large skillet over medium heat; cook and stir the onion and garlic in the hot oil until tender, 5 to 7 minutes. Stir the oyster sauce into the onion and garlic; season with salt and pepper. Add the snow peas, green peas, carrot, celery, and red bell pepper; cook and stir until the vegetables are slightly tender, yet still crisp, 7 to 10 minutes. Remove the skillet from the heat. Heat 2 tablespoons oil in a separate skillet. Remove the beef from the marinade, shaking off any excess moisture; discard the marinade. Fry the beef slices in the hot oil to your desired degree of doneness, 3 to 5 minutes per side for medium. Add the cooked beef to the vegetable mixture and mix well. Serve hot. 
2f31604beec8a2cac0f0622193117130£ Whisk the sugar, soy sauce, onion, garlic and black pepper together in a large bowl. Add the pork and toss to coat. Cover and refrigerate at least 2 hours. Overnight is best if possible. Preheat an outdoor grill for high heat, and lightly oil the grate. Thread the pork onto the soaked skewers. Cook on the preheated grill until the pork is no longer pink in the center, 3 to 5 minutes per side. 
b5e85026e7de8acc6458b1236e9041f8£ Place the yeast, bread flour, bread improver, sugar, salt, margarine, eggs, and 1 cup of evaporated milk into a bread machine in the order recommended by the manufacturer. Select the Dough cycle, and press start. When the cycle has ended, remove the dough from the machine, and form into 2 inch balls. Dip each ball in the remaining evaporated milk, then in the dry bread crumbs. Place the rolls on a baking sheet crumb-side up. Cover loosely with a cloth or plastic, and let rise until doubled in size, about 30 minutes. Preheat the oven to 350 degrees F (175 degrees C). Bake rolls for 8 minutes, or until golden brown on the top and bottom. 
5ea8533c83fbd76d34b4856fa46a9e37£ Preheat oven to 325 degrees F (165 degrees C). Line bottoms of 3 - 9 inch pans with parchment paper, but do not grease. Mix together the flour, baking powder, and salt; set aside. Place grated ube in a large bowl. Mix together 3/4 cup milk and 1 teaspoon vanilla; gradually blend into ube until smooth. Blend in corn syrup, egg yolks, and oil. Beat in flour mixture until smooth; set aside. In a large glass or metal mixing bowl, beat egg whites with cream of tartar until foamy. Gradually add sugar, then red and blue food coloring, continuing to beat until stiff peaks form. Fold 1/3 of the whites into the batter, then quickly fold in remaining whites until no streaks remain. Pour batter into prepared pans. Bake in the preheated oven for 30 to 35 minutes, or until the center of cake bounces back when lightly tapped. Invert pans on a wire rack and let cool upside down. When cool, run a knife around the edges to loosen cake from pans. Fill between layers with coconut preserves, then frost top and sides with butter icing. To make Butter Icing: Combine evaporated milk and 3/4 cup sugar. set aside. Cream butter until light and fluffy; gradually add sugar mixture, and continue beating to desired spreading consistency. Add food color, one drop at a time until desired tint is achieved. 
deb7432cc51ddbfcf9275536a02432fa£ Make sure the lumpia wrappers are completely thawed. Lay several out on a clean dry surface and cover with a damp towel. The wrappers are very thin and the edges will dry out quickly. In a medium bowl, blend together the ground beef and pork, onion, green pepper and carrot. Place about 2 tablespoons of the meat mixture along the center of the wrapper. The filling should be no bigger around than your thumb or the wrapper will burn before the meat is cooked. Fold one edge of the wrapper over to the other. Fold the outer edges in slightly, then continue to roll into a cylinder. Wet your finger, and moisten the edge to seal. Repeat with the remaining wrappers and filling, keeping finished lumpias covered to prevent drying. This is a good time to recruit a friend or loved one to make the job less repetitive!! Heat oil in a 9 inch skillet at medium to medium high heat until oil is 365 to 375 degrees F (170 to 175 degrees C) Fry 3-4 lumpia at a time. It should only take about 2-3 minutes for each side. The lumpia will be nicely browned when done. Drain on paper towels. You can cut each lumpia into thirds for parties, if you like. In the Philippines, lumpia was eaten with banana ketchup, but I&#39;ve never seen it sold in America. 
97beaa5883b251c5811e3133b9e1a0b9£ Whisk the lemon juice, soy sauce, sugar, salt, and pepper together in a small bowl. Place the sliced steak in a large bowl; pour the lemon juice mixture over the steak and toss to coat. Sprinkle with the cornstarch and lightly mix. Cover with plastic wrap and refrigerate at least 1 hour, up to overnight. Heat 1/4 cup vegetable oil in a large skillet. Remove the beef slices from the marinade, shaking to remove any excess liquid. Fry the beef slices in batches in the hot oil until they start to firm, and are reddish-pink and juicy in the center, 2 to 4 minutes per side. Remove the beef slices from the skillet and set aside on a serving platter. Heat the olive oil in a small skillet over medium heat. Cook and stir the onion and garlic in the hot oil until the onion is golden brown, 5 to 7 minutes; pour over the beef slices. 
2690c4f39944dec6109404ed23128b75£ Preheat an oven to 350 degrees F (175 degrees C). Stir the yucca, eggs, evaporated milk, sweetened condensed milk, and coconut milk together in a bowl until thoroughly combined; pour into a baking dish. Bake in the preheated oven for 1 hour. Switch the oven&#39;s broiler on and bake under the broiler until the top of the cake is browned, 2 to 3 minutes. Cool completely in refrigerator before serving. 
f5d4281999b6c96e08321a7a9e1da05e£ Preheat an oven to 350 degrees F (175 degrees C). Stir the soy sauce, sugar, 1 teaspoon of black pepper, cornstarch, and 1/2 cup of the reserved pineapple juice together in a saucepan until the sugar is completely dissolved; add the onion, garlic, and ginger. Bring the mixture to a boil and cook until the sauce thickens, about 5 minutes. Thoroughly rinse the chicken thighs, drumsticks, and wings; pat dry with paper towels. Arrange the chicken in a baking dish; season with salt and pepper. Bake in the preheated oven for 15 minutes. Pour the pineapple chunks around the chicken pieces; brush the chicken liberally with the sauce and return to the oven for 30 minutes, brushing with sauce every 10 minutes or so. 
bf5c22d0e9f8cdd59fa0dd6d0b5f5cbf£ Bring the mung beans and the water to a boil in a pot; cook at a boil until the beans are soft, about 40 minutes. Mash the beans; set aside. Heat the olive oil in a large pot; cook and stir the onion and garlic in the hot oil over medium heat until softened, 5 to 7 minutes. Add the pork; season with salt and pepper. Continue cooking the mixture another 3 minutes. Gently stir the prawns into the mixture; cook 2 minutes more. Add the tomatoes; cook another 3 minutes. Reduce heat, and pour the chicken broth over the mixture; allow the mixture to simmer in the broth for 5 minutes. Add the mashed beans to the soup; mix well. Cook another 5 minutes, stirring frequently to prevent any of the mixture from sticking to the bottom of the pot. Add more chicken broth or water if the soup is too thick. Stir the spinach leaves into the soup and cook 2 minutes more before serving hot. 
be7362dec0ed7178505e1a4b876bae11£ Heat the canola oil in a large skillet over medium heat and stir in the ginger slices. Cook and stir until fragrant and lightly browned. Remove ginger and set aside. Season chicken with salt and pepper. Place chicken in the same skillet over medium-high heat without crowding. Cook until chicken is lightly brown on all sides. Return the ginger to the skillet and add coconut milk. Bring to a boil, then cover the skillet with the lid tilted to allow steam to escape. Reduce heat to medium-low and simmer until the chicken is no longer pink at the bone, stirring occasionally, about 30 minutes. Stir in the spinach. Simmer uncovered until spinach is warmed through, 8 to 12 minutes. Season with salt and pepper, as necessary. 
bb380cc9b9bbd693c3997191cafa2064£ Stir together the vinegar, soy sauce, ketchup, garlic, and bay leaves in a large saucepan. Add the cubed pork, and bring to a boil over high heat. Reduce heat to medium-low, cover, and simmer until the pork is tender, about 2 1/2 hours. Stir occasionally. If using the green beans, add them during the last half hour of cooking. 
5e528632495fc5c5aecdbe9080396672£ Combine the chicken, vinegar, water, sugar, soy sauce, bay leaves, crushed peppercorns, onion, and garlic in a large pot; stir and bring the mixture to a boil for 2 minutes. Reduce heat to medium-low and cook at a simmer for 30 minutes. Remove the chicken to a large serving platter and set aside. Increase the heat under the pot to medium and cook until the liquid reduces by about one-quarter, about 10 minutes. Season with salt; stir the coconut milk into the mixture. Cover and cook until the coconut milk appears oily, about 10 minutes. Pour the mixture over the chicken to serve. 
cf3897865c5e7d439c46ec31734fcba4£ In a medium pot, combine the tilapia, bok choy, tomatoes and radish. Stir together the tamarind paste and water; pour into the pot. Toss in the chili peppers if using. Bring to a boil, and cook for 5 minutes, or just until the fish is cooked through. Even frozen fish will cook in less than 10 minutes. Do not over cook or else the fish will fall apart. Ladle into bowls to serve. 
8adc0386ca80607343e339d8514629d6£ Melt butter in a large skillet over medium heat. Add ginger, garlic, and onion. Cook until garlic begins to brown, about 5 min. Add squash, coconut milk, and green beans to skillet. Bring to a boil over high heat, then reduce heat to medium, cover, and simmer for 30 minutes until squash is tender, stirring occasionally. Stir in shrimp and tofu, then season to taste with salt, pepper, and sugar. 
c09b6118b253e20f2d652b9a25a33007£ Mix goat meat with vinegar, soy sauce, and garlic in a large bowl; cover and refrigerate from 1 to 8 hours. For best flavor, marinate at least 6 hours. Remove meat from marinade and pat dry with paper towels; reserve marinade and garlic cloves. Heat vegetable oil in a large pot over medium-high heat and brown the goat meat, working in batches if necessary, 10 to 15 minutes. Set goat meat aside. Cook and stir onion, red bell pepper, and garlic cloves from the marinade over medium heat until onion is translucent, about 5 minutes; pour in tomato sauce and bring mixture to a simmer. Allow to cook down slightly, about 5 minutes. Return goat meat to the sauce and pour in reserved marinade and beef stock. Bring to a boil, reduce heat to low, and simmer covered until goat meat is partially tender, 30 to 40 minutes. Stir in potato, carrots, and peas; season with salt, black pepper, and cayenne pepper. Simmer until goat meat is very tender and potato and carrots are cooked through, 20 to 30 more minutes. Adjust seasonings before serving. 
8a703c306c317dbfde0414c143298195£ Combine chicken, soy sauce, olive oil, lemon juice, garlic, and black pepper in a slow cooker; allow to marinate, 10 to 15 minutes. Mix tomatoes, carrots, red potatoes, onion, green bell pepper, red bell pepper, yellow bell pepper, and peas into chicken mixture. Cook on high for 3 to 4 hours (or on Low for 7 to 8 hours). 
f173f31cac2a1926901ac28695040a46£ Place the chicken in a 6-quart pot. Pour the water, vinegar, and soy sauce over the chicken. Add the sugar, onion, garlic, peppercorns, and bay leaves to the pot; bring the mixture to a boil for 2 minutes. Reduce heat to low; simmer until the chicken is no longer pink at the bone and the juices run clear, about 30 minutes. An instant-read thermometer inserted into the thickest part of the thigh, near the bone should read 180 degrees F (82 degrees C). Remove the chicken from the pot and continue cooking the sauce until it thickens, about 10 minutes; season with salt. Return the chicken to the pot, making sure the chicken is covered entirely by the sauce. Cook together until the chicken is reheated, about 3 minutes. 
cd9411a5de4135dc3e763b46e71c9218£ Heat the milk in a small saucepan until it bubbles; remove from heat. Add the butter and sugar; stir until melted. Let cool until lukewarm. Pour the cooled milk mixture into a large mixing bowl. Add the yeast and stir to dissolve. Add the salt, baking soda, baking powder and 4 cups of the flour; stir well to combine. Add the remaining flour, 1/2 cup at a time, stirring well after each addition. When the dough has pulled together, turn it out onto a lightly floured surface and knead until smooth and supple, about 8 minutes. Lightly oil a large mixing bowl, place the dough in the bowl and turn to coat with oil. Cover with a damp cloth and let rise in a warm place until doubled in volume, about 1 hour. Preheat oven to 375 degrees F (190 degrees C). Deflate the dough and turn it out onto a lightly floured surface. Divide the dough into 12 equal pieces and form into rounds. Place the rolls on 2 lightly greased baking sheets. Cover with a damp cloth and let rise until doubled in volume, about 40 minutes. Sprinkle with bread crumbs and bake at 375 degrees F (190 degrees C) for about 15 to 20 minutes or until the tops are golden brown. 
6ff7c7510cb0277d8d72b40abfb07935£ Fill a large saucepan with water, and drop in the oxtail pieces, onion, garlic, salt, and pepper. Bring to a boil, and simmer for 2 hours over medium-low heat, skimming the foam occasionally, until the oxtail meat is very tender and the broth is reduced to 3 cups. Stir in the eggplant, bok choy, and green beans, and simmer for about 20 minutes, until the vegetables are tender. Just before serving, place the peanut butter in a small bowl and thin with 1 or 2 tablespoons of broth. Stir until smooth and add to the stew. 
0044742a471636f1d883a9bc1631dbf5£ Preheat an oven to 325 degrees F (165 degrees C). Grease 16 muffin cups. Stir the flour, 1 cup sugar, baking powder, and salt together in a large bowl. Make a well in the center of the flour mixture and add the oil, egg yolks, grated orange peel, vanilla extract, orange juice, and water. Mix well by hand until smooth with no lumps. Beat the egg whites with the cream of tartar until foamy in a large glass or metal mixing bowl. Gradually add the 1/2 cup sugar, continuing to beat until soft peaks form. Lift your beater or whisk straight up: the egg whites will form soft mounds rather than a sharp peak. Fold the flour mixture into the egg whites. Pour the resulting batter into the prepared muffin cups to about 2/3 full. Bake in the preheated oven until a toothpick inserted into the center comes out clean, about 40 minutes. Cool in the pans for 10 minutes before removing to cool completely on a wire rack. 
b2d7d64abde70b00decc74c9d403ca4d£ Season the beef with salt and pepper; set aside. Heat the oil in a skillet over medium heat; cook the diced onion and garlic in the hot oil until softened, about 5 minutes. Transfer the onion and garlic to a 6-quart pot. Individually brown the beef chunks on all sides in the skillet and place in the pot. Add the tomatoes, crushed peppercorns, olives with their juice, quartered onion, bay leaves, and bouillon cubes to the pot; bring to a boil. Stir the ketchup into the mixture, reduce heat to medium-low, and simmer 1 hour. Remove the beef from the pot and set aside. Add the red bell pepper to the mixture and continue simmering another 30 minutes. While the mixture continues to simmer, heat 2 tablespoons oil in the skillet. Cook the potatoes in the oil until golden brown; immediately add to the simmering mixture. Slice the meat against the grain and add to the pot; stir. Cook together another 5 minutes before serving. If the sauce is too thin, mix the corn flour and water together and stir into the sauce to thicken. 
40fce432d1736882e575e8618e5e58cb£ Bring 2 quarts of water of water to a boil in a saucepan. Add chicken, and cook for 10 to 15 minutes, or until done. Reserve chicken stock, and allow chicken to cool. Cut chicken into small cubes. In a large skillet or wok, saute pork until evenly brown. Stir in chicken, cabbage, and carrots. Cook over medium heat until cabbage is tender. Remove from heat, and allow to cool slightly while you separate the wrappers. In small bowl, combine enough flour and water to make a paste about the consistency of glue. Spoon meat mixture into a thin line on each wrapper, and roll up, using a dab of the flour paste to seal the edge. Keep each lumpia thin; if you over fill them, the wrapper will tear. Save about 1/2 to 1/4 of the filling in the pot for the pancit. Heat large skillet with 1/2 to 1 inch of oil. Fry the lumpia one side at a time, until a nice golden brown. Drain, standing each piece upright, in a pot or bowl lined with paper towel. Return the remainder of the filling to the stove, and gently mix in the pancit noodles. Gradually add the chicken stock, and cook until noodles are tender. For the sauce: With a mortar and pestle or back of a spoon, crush the garlic, then mix into the vinegar. Serve in small bowls with spoons. The sauce can be used as a dip, or to spoon into the lumpia. 
3810ae84a9f9956d767f8240294378dd£ Heat the vegetable oil in a skillet over medium heat. Stir in the onion; cook and stir until the onion has softened and turned translucent, about 5 minutes. Season with salt. Stir in the ginger, tomatoes, and pork chops. Cover and reduce heat to medium-low. Turn the pork occasionally, until browned. Pour in the water and tamarind soup base. Bring to a boil, then reduce heat. Continue simmering until the pork is tender and cooked through, about 30 minutes. Stir in green beans and cook until tender. 
41e5e846d8f6e45abaa9d195da043a93£ Season both sides of the salmon steaks with salt and pepper. Heat 2 tablespoons cooking oil in a skillet over medium heat. Briefly fry the salmon in hot oil until lightly cooked, about 2 minutes per side. Remove from skillet and set aside. Add 1 tablespoon cooking oil to the skillet and allow to get hot before adding the onion and garlic; cook and stir the onion and garlic in the hot oil until fragrant, about 5 minutes. Stir the diced tomatoes into the mixture and season with salt and pepper. Continue cooking until the moisture from the tomatoes makes a sauce, about 5 minutes more. Return the salmon to the skillet and allow to simmer in the sauce until the fish flakes easily with a fork, about 10 minutes. Stir the beaten egg into the sauce and stir until well integrated; serve hot. 
9ea61f8603826517f50cf422dc118d27£ Butter an 8-inch baking dish or pie pan, and set aside. Mix 1/2 cup of water with the cornstarch in a bowl, and stir until smooth. Combine the coconut milk, 3/4 cup of water, and sugar in a saucepan over low heat, and stir until the sugar is dissolved. Bring the mixture to a boil, add the corn kernels, and then stir in the cornstarch mixture, stirring quickly to avoid lumps as it becomes very thick. Bring the mixture back to a boil, and simmer until fully thickened and smooth, stirring constantly, about 2 minutes. Pour the maja blanca into the prepared dish, and set aside to cool until firm, about 2 hours. Place the coconut flakes in a dry skillet over medium heat, and stir to toast. Watch them carefully so they don&#39;t burn. Remove the toasted coconut flakes to a bowl, let cool, and sprinkle over the pudding before serving. 
c9bf75063f6b965522fa71fb25e80ee1£ Heat the olive oil in a skillet over medium heat. Stir in the garlic and onion; cook and stir until the onion has softened and turned translucent, about 5 minutes. Stir in the tomato and cook until softened, then add the salmon. Flake the salmon and continue cooking for 3 minutes. Stir in water, bay leaf, salt, pepper, and fish sauce. Bring to a simmer. Cover and cook for 20 minutes. 
2bba53d6f7197ba7d6ee9b385894ede3£ Preheat the oven to 375 degrees F (190 degrees C). Grease cookie sheets. In a medium bowl, cream together the butter and sugar until smooth. Beat in the eggs, one at a time. Stir in the cornstarch, cream of tartar and baking powder until well blended. Roll the dough into 1 inch balls and place them 1 inch apart onto the prepared cookie sheets. Bake for 10 to 12 minutes in the preheated oven, or until light brown. Remove to wire racks to cool. 
0f0fd8ce074a05b530fe90705ba4e8fd£ Mix the ground pork, shrimp, onion, carrots, green onions, soy sauce, salt, pepper, and MSG in a bowl until well combined. Pull a wrapper off the stack, and cover the remaining wrappers with a damp cloth. Place the wrapper on a work surface. Place a thin line, about the width of your little finger, across one side of the wrapper, 1/2 inch from the edge of the wrapper. Roll the wrapper tightly around the filling, and seal the edges with egg white. Repeat making rolls with the remaining wrappers and filling, and cut the rolls into thirds. Heat the oil in a heavy pan or deep fryer to 375 degrees F (190 degrees C). Deep-fry 3 or 4 lumpia at a time, turning once, until the rolls float and turn golden brown, about 3 minutes. Serve hot. 
9543d1693228c37e4253ab1e2e9023b4£ Grease small cake, puto molds, or ramekins for use in a steamer. Mix the flour, sugar, and baking powder together in a bowl. In a separate, large bowl, scramble the eggs with the evaporated milk and water. Fold the dry mixture into the eggs until evenly blended. Fill the prepared molds 2/3 of the way up with the batter and top with shredded cheese. Fill a wok or a sauce pan that will hold a steamer basket with a few inches of water. Bring the water to a boil over medium-high heat. Place the molds into a steamer basket and place over the boiling water and cover. Steam until a toothpick inserted in the center of one of the putos comes out clean, about 30 minutes. Cool on a wire rack and serve warm or at room temperature. 
ea28668a11b6453ac05ab342dc10bf6d£ Season duck legs with salt and black pepper. Heat vegetable oil in a large, deep skillet over medium-high heat; add duck legs, skin side down, and cook until browned, 3 to 4 minutes per side. Remove duck legs and drain all but 1 tablespoon of duck fat from the pan. Cook onion in reserved duck fat over medium heat until onion begins to turn translucent, 3 to 4 minutes. Add garlic; cook and stir until fragrant, 1 to 2 minutes. Stir chicken broth, rice vinegar, soy sauce, sambal chili paste, and bay leaves into onion mixture; bring to a simmer. Return duck legs to the skillet, loosely cover, and simmer until duck legs are tender and easily pierced with a fork, about 2 hours. Remove cover from the skillet, increase heat to high, and cook until sauce is thick, about 5 minutes; season with salt and black pepper to taste. 
9fe39b16210a293cb0a0ac8e111ed5ff£ Heat the oil in a large pot over medium heat; cook and stir the onion and garlic in the hot oil until tender, about 5 minutes. Stir in the pork and cook until completely browned, 5 to 7 minutes. Stir the shrimp into the mixture; season with salt and pepper. Continue cooking until the shrimp turn pink, about 5 minutes. Add the tomato to the pot, cover, and let cook 5 minutes. Stir the zucchini, okra, green beans, eggplant, and bitter melon into the mixture; cover, and cook until the vegetables are all soft to the touch, about 10 minutes more. Serve hot. 
f7b77a8abe5b9154a49838603a3a118e£ Preheat an oven to 375 degrees F (190 degrees C). Lightly grease 2 baking sheets. Beat the butter, sugar, and vanilla with an electric mixer in a large bowl until smooth. Add the egg whites one at a time, allowing each to blend into the butter mixture before adding the next. Mix in the flour until just incorporated. Drop teaspoonfuls of the dough onto ungreased baking sheets. Spread thinly with a spatula or the back of the spoon into a 3 inch circle. Bake in the preheated oven until browned along the edges, about 5 minutes. Remove the baked wafers from the baking sheet one at a time using a spatula or kitchen turner. Roll each wafer around the handle of a wooden spoon until the edges overlap. Cool seam-side down on a wire rack until completely crisp. 
