ed7c1562a613e29b03c974b94253755d£ Dissolve yeast in the water; stir in the sugar and beat in 2 1/2 cups of rice flour to make a soft sponge. Set aside in a warm place to double in bulk, about 40 minutes. Mix in 2 more cups of rice flour and 1/4 cup of shortening and place the dough on a greased work surface; knead in the remaining 1/4 cup of shortening to make a smooth dough. Cut the dough into 15 equal-sized pieces; form each piece into a ball. Heat the vegetable oil in a skillet over medium heat; cook and stir the onion and garlic in the hot oil until translucent, about 5 minutes. Stir in the chicken, soy sauce, 2 teaspoons of sugar, green onion, salt, and pepper. If the mixture is juicy, add cornstarch to thicken. Working on a lightly greased work surface, flatten a dough ball into a circle about 4 inches in diameter with the heel of your hand. Place about 1 tablespoon of filling into the center of the dough ball, bring the edges of the dough together at the top, and pinch and twist to seal in the filling. Place each filled dumpling onto waxed paper with the pinched seal at the bottom while you finish the rest of the dumplings. Spray a multi-layered bamboo steamer with cooking spray, place the steamer on top of a large saucepan, and pour in water to several inches below the steamer. Bring the water to a boil. Working in several batches, place 3 or 4 filled buns into each steamer layer without letting the buns touch each other or the edge of the steamer, cover the steamer, and let the buns steam over medium-low heat until puffy and the dough is springy, about 15 minutes per batch. Serve warm. 
dd442707924ba2373ec38e1017dc857a£ Soak rice overnight in the water. Preheat oven to 350 degrees F (175 degrees C). Grease a 9x13 inch baking pan. Cook the soaked rice over medium heat in a saucepan with the soaking water, 1/2 can of coconut milk, and white sugar, stirring constantly, until tender and thickened, about 20 minutes. Pour into the prepared baking pan. Stir together the brown sugar, remaining 1/2 can of coconut milk, and coconut preserves in a small saucepan, and bring to a boil. Pour the mixture carefully over the rice. Bake in the preheated oven until the topping thickens, about 25 minutes. Cool completely; cut into squares to serve. 
925f059f62af721cd5683ec07e069979£ Fill a large pot with lightly salted water and bring to a rolling boil over high heat. Once the water is boiling, stir in the spaghetti, and return to a boil. Cook the pasta uncovered, stirring occasionally, until the pasta has cooked through, but is still firm to the bite, about 12 minutes. Drain well in a colander set in the sink. Heat the vegetable oil in a skillet over medium heat. Stir in the garlic and onion; cook and stir until the onion has softened and turned translucent, about 5 minutes. Stir in the beef and pork; season with salt and pepper. Cook and stir until the meat has browned. Pour in the spaghetti sauce, banana ketchup, sugar, and water. Simmer until the sauce has thickened, about 15 minutes. Stir in hot dog slices and continue to cook until hot dogs are heated through. Serve over spaghetti with Cheddar cheese sprinkled on top. 
b6f6943c9a3708cff24ae82e3cb6e422£ NOTE: Cassava, also known as Manioc, tapioca or yucca, can be found in Filipino or Latin American food stores. Usually sold frozen and grated. Mix together the cassava with the coconut milk, melted butter and eggs. Stir in the white sugar, salt, vanilla, cheese and lemon rind. Pour batter into a 9x5 inch loaf pan and bake at 350 degrees F (175 C) for 30-35 minutes or until done. To Make Topping: Put 2 cups coconut milk, condensed milk, flour, and some grated cheese in a saucepan and boil, stirring constantly. When thick, add the slightly beaten egg yolks. Cook for two minutes. Spread on top of the cooked cassava and bake at 400 degrees F (200 degrees C) for ten minutes or until golden brown. 
15306b1d48bdc814c33216bdaabd2a2f£ Preheat oven to 375 degrees F (190 degrees C). Mix together the cake flour, sugar and baking powder. Pour in the water and evaporated milk and stir well. Mix in the eggs and butter or margarine. Pour the mixture into molds or muffin pans. Find a baking pan that your muffin pan will comfortable fit in. Pull the oven rack out a little (perhaps 1/4 out of the oven) and place the baking pan (with the muffin pan inside it) on the rack. VERY CAREFULLY pour about 4 cups of hot tap water into the baking pan which holds the muffin pan. Then VERY SLOWLY AND CAREFULLY slide the rack completely into the oven. Bake at 375 degrees F (190 degrees C) for about 15 minutes or until a toothpick inserted into the center of a muffin comes out clean. Be VERY CAREFUL not to burn your hands with hot water or steam when you remove the muffins from the oven. Top with grated cheese. 
b3c3b6cccf2b1d989f0cf6e2b14172ef£ Place the pork in a large pot; pour enough water into the pot to cover the pork. Stir the soy sauce and lemon juice into the water. Bring the mixture to a boil for 5 minutes. Remove the meat and set aside. Discard the liquid. Refill the pot with fresh water; add the pork liver and bring to a boil for about 5 minutes. Remove the liver and allow to cool; cut into bite sized pieces. Set aside. Heat 3 tablespoons olive oil in a large skillet over medium-high heat; fry the potatoes in the hot oil until golden brown and cooked through, 7 to 10 minutes. Remove the potatoes to a plate lined with paper towels. Add 2 more tablespoons olive oil to the skillet and allow to get hot. Cook and stir the onion and garlic in the hot oil until fragrant, 3 to 5 minutes. Add the pork and pork liver to the skillet; cover and cook for 5 minutes. Stir the tomatoes into the mixture; cook together, stirring occasionally, another 5 minutes. Return the potatoes to the skillet with the green bell pepper. Season with salt and pepper. Cook and stir another 5 minutes. 
513d3edfb70c08d6872755a1f8954eaa£ Heat 2 teaspoons oil in a skillet; cook the eggs in the hot oil until set, 3 to 5 minutes. Cool and slice into thin ribbons; set aside. Heat 2 more teaspoons oil in a large skillet; fry the garlic in the oil, mashing it while frying until light brown and almost crispy, about 5 minutes. Add the rice and mix thoroughly until it is well blended with the garlic. Add the soy sauce and mix again; cook for 2 minutes. Stir the ham into the mixture; cook and stir another 5 minutes. Fold the sliced egg into the mixture and cook until hot, about 3 minutes. 
3e6add57548472312c843404a7aacb26£ Combine the jicama, red bell pepper, green bell pepper, red onion, green chile peppers, ginger, and carrot in a large bowl. Whisk the water, vinegar, sugar, and salt together in a separate bowl; pour over the vegetable mixture and toss to coat. Refrigerate at least 1 hour before serving. 
7256d202d325f4839c2e42cccab3cc1f£ Combine the pig&#39;s feet, vinegar, water, soy sauce, onion, garlic, peppercorns, bay leaves, sugar, and salt together in a stockpot; bring to a boil for 2 to 3 minutes. Reduce heat to medium-low; allow the stew to simmer, stirring occasionally, until the meat pulls easily from the bones and the liquid has thickened, about 1 hour. Serve hot. 
ea047916948efcddcf54147846e77d32£ Heat the oil in a large pot over medium-high heat. Cook the onion and garlic in the hot oil until the onions are tender. Stir in the tomato; cook until soft, about 3 minutes. Crumble the ground beef into the pan and cook until brown, about 5 minutes. Add the water, potato, beef bouillon, fish sauce, salt, and pepper; reduce heat, cover, and simmer until the potatoes are tender, stirring occasionally, about 30 minutes. 
328a4acd2ef5ba873f102129f7017f08£ In a glass bowl or dish, mix together the salt, pepper, coriander, cumin seed, and vegetable oil. Add pork cubes, and stir to coat. Let stand for 20 minutes. Add onion, brown sugar, soy sauce, and ginger; stir to blend. Cover and refrigerate for at least one hour, but best overnight. Preheat an outdoor grill for high heat, and lightly oil the grate. Thread pork cubes onto skewers. Cook pork on the grill, basting frequently with the remaining marinade. Turn occasionally until cooked through, about 15 minutes. Serve sprinkled with lime juice to taste. Discard any unused marinade. 
f72a0bedfafd606ab1faf41b205b1343£ Combine vinegar, soy sauce,1 head garlic, bay leaves, garlic powder, black pepper, and 1 1/2 teaspoons annatto powder in a large bowl. Add chicken, stir to coat with marinade, cover, and refrigerate for at least 4 hours. Remove chicken from the marinade and pat dry. Reserve the marinade. Heat 2 tablespoons vegetable oil in a large skillet over medium-high heat. Cook chicken in the hot oil until browned, about 4 minutes per side. Remove skillet from heat. Heat 1 tablespoon vegetable oil in a small skillet over medium heat. Cook and stir 1 head garlic until browned, about 3 minutes. Add 1 1/2 teaspoons annatto powder; simmer for 3 minutes. Pour annatto mixture over chicken and add reserved marinade. Bring to a simmer, cover, and cook until chicken is tender, about 45 minutes. Uncover and cook until sauce has reduced slightly, about 10 minutes. 
deaba803c08e1fcde8bc607109e8c121£ Heat the oil in a skillet over medium heat. Cook and stir the onion and garlic in the hot oil until the garlic is lightly browned and the onion is glossy, 7 to 10 minutes. Add the catfish; season with salt and pepper. Cover and cook for 2 minutes. Add the coconut milk and stir; cover again and cook until the coconut milk appears oily, about 10 minutes. 
2dca9badf7241fe29aa00567dda5b6f4£ Bring 2 cups of water with 1 teaspoon salt to a boil in a pot; cook the chicken in the boiling water until until no longer pink in the center and the juices run clear, about 10 minutes. An instant-read thermometer inserted into the center should read at least 165 degrees F (74 degrees C). Reserving the liquid, remove the chicken and allow to cool before removing the meat from the bones and shredding with two forks. Discard the skin and bones. While the chicken cools place the shiitake mushrooms in a bowl and pour enough warm water over them to cover completely; allow to soak until pliable, about 30 minutes. Remove from the water, slice, and set aside. Place the bean thread noodles in the water and add more warm water if needed to cover; allow to soak until soft, about 10 minutes. Drain. Cut the noodles if desired. Heat the olive oil in a skillet over medium heat; cook and stir the onion and garlic until softened, about 5 minutes. Add the achiote powder and continue to cook and stir until the mixture is well coated with the red-orange color. Stir the shredded chicken meat, sliced shiitake mushrooms, and fish sauce into the mixture; season with salt and pepper to taste. Allow the mixture to cook about 5 minutes before pouring the reserved liquid from cooking the chicken and the chicken broth into the mixture. Bring to a boil for 5 minutes. Add the noodles and cook another 5 minutes. Garnish with the green onion to serve. 
c1ef69d69ee2fb1bce8f809e2fcc3e1f£ Combine beef chuck, chorizo, garlic, vinegar, and soy sauce in a skillet over medium heat; cook and stir until beef chuck is browned and liquid is reduced, about 20 minutes. Remove from heat. Heat olive oil in a pot over medium heat; cook and stir onion and green bell pepper in the hot oil until onion is translucent, 5 to 10 minutes. Add tomato sauce and simmer until liquid is slightly reduced, 3 to 5 minutes. Stir beef-chorizo mixture into tomato sauce mixture; bring to a boil. Reduce heat to medium-low, cover pot, and simmer for 30 to 40 minutes. Stir potatoes, peas, salt, and pepper into stew; simmer until beef is tender and potatoes are cooked through, 20 to 30 minutes. Add water if needed. 
7d8166c3c25d258dfb2947dff230b1df£ Preheat oven to 375 degrees F (190 degrees C). Grease a baking sheet. Stir together the egg, white sugar, butter, flour, cornstarch, powdered milk, baking powder, and salt in a bowl. Knead for a few minutes to make a soft dough. Divide the dough into 12 portions. Roll each portion into a ball and flatten slightly. Place on the prepared baking sheet 1 inch apart. Bake in the preheated oven until light brown, about 10 minutes. Cool completely and store in an airtight container. 
0ee87d5a92b86af70028bb047ec008ca£ Season pork and chicken with salt and pepper and place in a stock pot. Rub with crushed garlic and torn bay leaf, and coat with vinegar and soy sauce. Cover, and marinate in the refrigerator at least 2 hours or overnight. Bring meat and marinating liquid to a boil in a cast iron casserole or Dutch oven. Reduce heat to a simmer and cook until meat is tender, about 30 minutes. If necessary, add water to prevent sauce from drying out. Strain liquid from meat and set aside; discard bay leaves. Heat 1 tablespoon oil in a large skillet over medium-high heat. Brown the pork and chicken on all sides; reduce heat and stir in remaining 2 cloves of smashed garlic. Cook and stir for 2 minutes more. Pour in reserved cooking liquid, and continue simmering until sauce is slightly thickened. Serve hot. 
f06451e375c37bf3c970892609347b32£ Heat the oil in a Dutch oven over medium heat, and cook the pork until evenly browned. Mix the garlic into the Dutch oven, and cook 1 minute, until tender. Pour in the chicken broth, soy sauce, and cider vinegar. Place the bay leaves into the mixture. Bring to a boil. Reduce heat to medium low, and cook 1 hour, or until the pork is easily shredded with a fork. (For a thicker consistency, blend a small amount of flour with coconut milk, chicken broth, or water, then stir into sauce.) Make sure the meat stays moist and covered with the liquid. If meat looks like it&#39;s drying out, add a bit more chicken broth or water. Stir flour into coconut milk and add to the Dutch oven. Continue cooking until heated through. 
ec502a00c18aeaf89387c41c54862ca7£ In a wok or skillet, saute the garlic and onions in hot oil until the onions are translucent. Add the pepper and soy sauce and saute further. Drain the excess oil, add the water and bring to a boil. Add the carrots and simmer for 5 minutes. Add the green beans, celery, bamboo shoots, water chestnuts, and jicama. Simmer for another 5 minutes. Remove the pan from heat and add the bean sprouts. Cool to room temperature. Place three heaping tablespoons of the filling diagonally near one corner of each wrapper, leaving a 1 1/2 inch space at both ends. Fold the side along the length of the filling over the filling, tuck in both ends, and roll neatly. Keep the roll tight as you assemble. Moisten the other side of the wrapper with water to seal the edge. Cover the rolls with plastic wrap to retain moisture. Heat a wok over medium heat, add oil to 1/2 inch depth, and heat for 5 minutes. Place 3 or 4 egg rolls in the oil, gently. Fry the rolls until all sides are golden brown. Drain on paper towels. Serve immediately 
c7920b882b84559c126c671a164161c1£ In a large Dutch oven or wok, heat oil and stir-fry garlic, ginger, green onions, chile peppers, mushrooms, chicken, shrimp and sausage until shrimp is pink and sausage is slightly browned. Stir in the sake and soy sauce and simmer 2 to 3 minutes. Cover and set aside. In a large saucepan, bring chicken broth to a rolling boil. Add noodles and cook over high heat for 2 minutes. Drain immediately and rinse with cold water. Place the shrimp mixture over medium heat and add the bean sprouts; saute for 2 minutes. Stir in the snow peas and saute 2 minutes. Stir in cooked noodles and toss until well mixed. Serve immediately. 
0421c4025c5e7b2a9fcae0adcda2b872£ Mix the rice flour, 1/2 cup sugar, and the water together in a bowl into a soft dough; set aside. Stir 1/2 cup sugar and sesame seeds together in a small bowl. Toss the coconut with the salt together in a separate bowl. Bring a large pot of water to a boil. Take a portion of the soft dough and roll it into a ball between the palms of your hands. Pull lengthwise and shape into a tongue. Drop into the boiling water. The cake is ready when it floats. Scoop it out with a strainer and roll it in the sugar and sesame seed mixture. Place it on a serving platter. Repeat with the rest of the dough. Top the cakes with coconut and serve warm. 
2509fa179b213d779ad2ceeb26eda44a£ Preheat oven to 350 degrees F (175 degrees C). In a large bowl combine the chicken, flour, pickles, onion, raisins, chorizo and peas. Mix well and season with salt and pepper to taste. Add beaten eggs and mix thoroughly. Spread mixture on a piece of aluminum foil; arrange sausage, hard-cooked egg slices and cheese strips on top of mixture. Shape mixture into a cylindrical roll about 4 inches in diameter and wrap in foil. Bake in preheated oven for 1 hour. Unwrap and slice before serving with ketchup. 
20c03a9b29cf40b48e9c8b93794275df£ Brown beef and pork in a large frying pan with a small amount of oil over medium heat. Drain, place in a large mixing bowl, and set aside. In the same pan, cook the carrots with a splash of soy sauce until tender. Add the bean sprouts, snap peas, mushrooms, and green onions, and a dash each of soy sauce, salt, garlic powder, and black pepper. Cook and stir for 5 minutes, or until vegetables are tender but still firm. Add to beef and pork, and toss to combine. Work with 5, or so, spring roll wrappers at one time, leaving the others covered with a damp cloth to prevent them from drying out. Lay the wrappers so that one corner is facing you. Place a small amount of filling mixture on the corner closest to you, and fold over. Fold the two outside corners inward, then continue rolling up as you would a burrito, leaving the top corner exposed. Brush a small amount of egg white on the top corner, finish rolling, and seal. Repeat with remaining filling and wrappers. Heat vegetable oil in deep-fryer or deep skillet to 375 degrees F (190 degrees C). Fry rolls for about 5 minutes, or until golden brown, then drain on paper towels. 
e7235b470219349afa6b538ffff649d8£ Heat the oil in a large skillet over medium heat. Fry garlic until just beginning to turn golden; remove with a slotted spoon and set aside. Add beef to the oil, and fry until browned on the outside. As the beef is browning, season generously with salt, pepper and hot pepper sauce. Return the garlic to the pan, and cook until meat has reached your desired degree of doneness. It is best at medium to medium-well. Remove the beef to a serving dish using a slotted spoon. Mix the flour with about a cup of water, and pour over the drippings in the pan. Stir until smooth using a fork. Simmer over medium heat until thickened. Pour over the beef in the serving dish. 
75c8dab9d0e21045a354b633c599a054£ Place the beef ribs in a large pot with enough water to cover. Bring to a boil over high heat, and boil for 5 minutes. Drain; discard the cooking water (the ribs will not be fully cooked). Return the beef to the pot. Pour in the 1 quart water, peppercorns, onions, and beef bouillon. Bring to a boil, cover, reduce the heat, and simmer for 1 hour. Skim any fat floating on the surface. Stir in the carrots, celery, chayote, and potatoes; cover, and simmer until potatoes are tender, about 20 minutes. Season with salt. Add cabbage and cook an additional 5 minutes. 
3fb8dd6695ddfcae49833771059f94f5£ Bring a pot of water to a simmer over low heat. Add the chicken breast to the water and cook until no longer pink in the center and the juices run clear, about 30 minutes. An instant-read thermometer inserted into the center should read at least 165 degrees F (74 degrees C). Remove the chicken from the water and allow to cool before shredding the meat into a large bowl. While the chicken cooks, bring a pot of lightly salted water to a boil. Cook the macaroni at a boil until cooked through, but is still firm to the bite, about 8 minutes. Drain and rinse with cool water to halt the cooking process until the pasta is cool to the touch. Add to the bowl with the chicken. Stir the pineapple, apple, celery, carrot, and raisins to the bowl; toss to combine. Add the mayonnaise, sugar, and seasoned salt; gently stir the mixture until evenly coated. Refrigerate at least 30 minutes before serving. 
7575796efd50c359891e738fb0a38639£ Combine the squid, vinegar, and water in a small pot over medium heat; season with salt and pepper. Cook for 10 minutes. Meanwhile, heat the olive oil in a saucepan over medium heat; cook and stir the onion and garlic in the hot oil until softened, 5 to 7 minutes. Stir the tomato and soy sauce into the mixture. Pour the squid mixture into the saucepan and bring to a simmer; cook together another 20 minutes. 
5eaddf2663d3c6fc1aa54100e5400f77£ Whisk the soy sauce, vinegar, and sugar together in a bowl until the sugar is completely dissolved; pour into a large skillet and place over medium heat. Cook the chicken livers in the sauce until no longer pink in the center and the juices run clear, about 15 minutes. An instant-read thermometer inserted into the center should read at least 165 degrees F (74 degrees C). Slice the livers into bite-sized pieces. Preheat an oven to 425 degrees F (220 degrees C). Place one piece of liver, a water chestnut, and a pineapple chunk on a piece of bacon and secure the bacon wrap with a toothpick by inserting through all the ingredients. Place on a baking tray, and repeat until all the ingredients have been wrapped. Bake in the preheated oven on the second rack until the bacon is crispy, about 5 minutes. Serve hot. 
ec74a0e2be1359e60827d787d4a71d5d£ Place potatoes in a pot with enough lightly salted water to cover, and bring to a boil. Cook 10 minutes, or until tender; drain. Place the beef, onion, and green bell pepper in a skillet over medium heat. Season with salt and black pepper. Cook until beef is evenly brown and onion is tender. Mix in peas and carrots, and continue cooking until heated through. In a large bowl, mix the potatoes with the beef mixture. Cover and refrigerate (or place in the freezer) until cooled completely. Heat the oil in a large skillet or deep fryer to 365 degrees F (185 degrees C). Lay egg roll wrappers on a flat surface, and place about 1/4 cup filling in the center of each. Fold to form egg rolls, and seal with moistened fingers. In batches, fry the egg rolls in the heated oil about 3 minutes on each side, until golden brown. Drain on paper towels. 
37e22b7cf13483b688130d38f067f905£ Bring a large pot of water to a boil. Add the wings, and boil for 5 to 8 minutes. Drain in a colander and run under warm water. Return to the dry pot, and add the vinegar, water, bay leaves, peppercorns, onion and jalapenos. Simmer over low heat for 20 minutes. Season the chicken with soy sauce, and simmer for another 10 to 15 minutes, or until the sauce has reduced by 1/2. Remove the wings to a colander, and set aside. Add a few garlic cloves to the liquid in the pan, and simmer until the sauce has a syrupy consistency, and the jalapenos have burst open releasing all of their seeds into the reduction. Heat a large nonstick skillet over medium heat. Add the chicken wings and the remaining garlic. Cook and stir until the garlic is tender and the wings have browned, about 10 minutes. Return wings to the sauce to coat before serving. 
e2ddffcec209d51f2441544c18c1c215£ Heat the olive oil in a large pot over medium heat. Cook the onion and garlic in the hot oil until softened, 5 to 7 minutes. Stir the carrot and celery into the mixture and continue cooking until the carrot and celery have also softened, another 7 to 10 minutes. Pour the chicken broth into the pot and bring to a boil; cook at a boil for 5 minutes. Add the mussels; cover the pot and allow the mussels to simmer in the broth mixture just until they begin to open, about 5 minutes. Discard any mussels which do not open. Stir the spinach into the broth just before serving hot. 
4a72afefeb6ce38afccdb86fa753a27d£ Combine the sweet rice and light coconut milk in a pot; bring to a boil for 10 minutes, while stirring occasionally to keep the rice from sticking to the bottom of the pot. Stir the cocoa powder, sugar, and salt into the rice; reduce heat to low, cover, and continue cooking, stirring occasionally, until the rice is tender, about 10 minutes more. Add the thick coconut milk to the mixture and stir to combine. Serve hot. 
8894e1ff5c750107360c687d0249caf8£ Scrape the cantaloupe meat lengthwise with a spoon or a melon baller and place in a punch bowl; add the water and sugar. Mix thoroughly until all the sugar is dissolved. Chill with the addition of plenty of ice cubes. 
588e3709fedb318320dffe0407d6dd71£ Cook the ground pork in a nonstick skillet over medium heat until completely browned, about 5 minutes. Season with salt and pepper. Heat the olive oil in a separate skillet over medium heat; cook the onion and garlic in the hot oil until the onion is translucent, about 5 minutes. Stir the browned pork into the onion mixture; cook and stir another 5 minutes. Mix the potato, peas and carrots, and raisins into the pork; allow the mixture to cook together until the vegetables are completely tender, about 10 minutes. Allow the filling to cool completely before spooning into empanada dough. 
