ea50102a840517e6027dd24501ea6f3c£ Preheat oven to 375 degrees F (190 degrees C). Grease a baking sheet. Stir together the egg, white sugar, butter, flour, cornstarch, powdered milk, baking powder, and salt in a bowl. Knead for a few minutes to make a soft dough. Divide the dough into 12 portions. Roll each portion into a ball and flatten slightly. Place on the prepared baking sheet 1 inch apart. Bake in the preheated oven until light brown, about 10 minutes. Cool completely and store in an airtight container. 
4942e0e3eb9ec34db4d151dce21619b5£ Place eggs in a saucepan and cover with water. Bring to a boil, remove from heat, and let eggs stand in hot water for 15 minutes. Remove eggs from hot water, cool under cold running water, and peel. Combine rice vinegar, ketchup, brown sugar, and soy sauce in a saucepan. Heat over medium heat while stirring until sugar has dissolved, about 5 minutes. Stir sauce and let cool. Prepare the batter by adding a few drops of red and yellow food coloring to the water to get a deep orange color. Combine flour with salt and pepper in a bowl; pour in orange water and stir until there are no lumps. Heat oil in a wok to 375 degrees F (190 degrees C). Gently roll eggs in cornstarch to coat and shake off excess cornstarch. Dip into orange batter so they are fully covered. Poke eggs with the bamboo skewer and drop into the hot oil. Deep fry until the batter is crispy, about 2 minutes per side. Remove eggs with a slotted spoon and drain on paper towels. 
2e618e5db5a7fc23837fa75b8e6dd8a0£ Bring a large pot of water to a boil. Cook yam in the boiling water until tender, about 30 minutes. Drain and cool until easily handled. Peel and thinly grate the flesh. Melt butter in a wok over medium heat. Stir in condensed milk and vanilla extract. Add grated purple yam. Reduce heat to low and cook, stirring constantly, until mixture is sticky but not dry, about 30 minutes. Pour in evaporated milk; cook and stir for 15 minutes. Remove from heat. Transfer yam mixture to a container and cool to room temperature, about 30 minutes. Chill before serving. 
986ea49ebfeebac8eacf89089ef54376£ Heat 1 tablespoon vegetable oil in a large skillet over medium-low heat; cook and stir onion, celery, and carrot until onion is tender and translucent, 5 to 7 minutes. Celery and carrot may still be crisp; season with salt. Add ground pork and garlic. Continue to cook and stir until pork is no longer pink. Season with more salt. Drain any excess grease and stir in red pepper flakes, garlic powder, turmeric, ginger, cumin, coriander, and celery seed. Set aside to cool. Place about 1 tablespoon pork mixture on a lumpia wrapper with one corner facing you. Fold corner closest to you over filling; fold two side corners toward center and continue rolling wrapper around pork. Brush a small amount of water over the top corner and press to seal. Repeat with remaining filling and wrappers. Heat 1 quart vegetable oil in a deep-fryer or large saucepan to 350 degrees F (175 degrees C). Fry rolls in batches until golden brown, 4 to 6 minutes. Drain on a paper towel-lined plate. 
443856e0dc991a0974a6758a70cfb39f£ Bring 2 cups coconut milk to a boil; stir constantly until oil begins to separate from the milk, about 30 minutes. Skim and reserve oil in a bowl. Reduce heat to medium-low and add 3 tablespoons sugar to remaining milk. Continue to cook and stir until milk becomes brown and crumbly, about 30 minutes more. Remove latik from heat. Grease an 8-inch mold or pie dish with reserved coconut oil. Heat remaining 2 cups coconut milk, cream-style corn, cornstarch, 1/2 cup sugar, and corn kernels in a saucepan over medium heat, stirring constantly, until thickened, about 5 minutes. Pour corn mixture into prepared mold. Cool until maja blanca is set. Cover mold with a plate and invert maja blanca onto the plate. Slice maja blanca and sprinkle with latik. 
a5bb2e8e291b02ed00afabebe502f386£ Heat oil in a large wok over medium heat; add garlic. Cook and stir until fragrant, about 3 minutes. Add onion; cook and stir until translucent, about 5 minutes. Stir in tomatoes; cook, mashing with a fork, until flesh and skin separate, about 5 minutes. Place chicken in the wok; cook and stir until lightly browned, about 5 minutes. Pour in water. Cover and bring to a boil. Stir in tomato sauce; simmer until flavors combine, about 15 minutes. Mix potatoes into the wok; simmer until tender, about 10 minutes. Stir in bell pepper and carrot; simmer until softened, about 5 minutes. Season with salt and pepper. 
1edddf47b887aa6d0261ddd8f99ae31e£ Season duck legs with salt and black pepper. Heat vegetable oil in a large, deep skillet over medium-high heat; add duck legs, skin side down, and cook until browned, 3 to 4 minutes per side. Remove duck legs and drain all but 1 tablespoon of duck fat from the pan. Cook onion in reserved duck fat over medium heat until onion begins to turn translucent, 3 to 4 minutes. Add garlic; cook and stir until fragrant, 1 to 2 minutes. Stir chicken broth, rice vinegar, soy sauce, sambal chili paste, and bay leaves into onion mixture; bring to a simmer. Return duck legs to the skillet, loosely cover, and simmer until duck legs are tender and easily pierced with a fork, about 2 hours. Remove cover from the skillet, increase heat to high, and cook until sauce is thick, about 5 minutes; season with salt and black pepper to taste. 
02c50b8f915ec544dcbaef186dfe6617£ Combine beef chuck, chorizo, garlic, vinegar, and soy sauce in a skillet over medium heat; cook and stir until beef chuck is browned and liquid is reduced, about 20 minutes. Remove from heat. Heat olive oil in a pot over medium heat; cook and stir onion and green bell pepper in the hot oil until onion is translucent, 5 to 10 minutes. Add tomato sauce and simmer until liquid is slightly reduced, 3 to 5 minutes. Stir beef-chorizo mixture into tomato sauce mixture; bring to a boil. Reduce heat to medium-low, cover pot, and simmer for 30 to 40 minutes. Stir potatoes, peas, salt, and pepper into stew; simmer until beef is tender and potatoes are cooked through, 20 to 30 minutes. Add water if needed. 
8951b51a03c95a468712c1fcb8a232b0£ Soak rice overnight in the water. Preheat oven to 350 degrees F (175 degrees C). Grease a 9x13 inch baking pan. Cook the soaked rice over medium heat in a saucepan with the soaking water, 1/2 can of coconut milk, and white sugar, stirring constantly, until tender and thickened, about 20 minutes. Pour into the prepared baking pan. Stir together the brown sugar, remaining 1/2 can of coconut milk, and coconut preserves in a small saucepan, and bring to a boil. Pour the mixture carefully over the rice. Bake in the preheated oven until the topping thickens, about 25 minutes. Cool completely; cut into squares to serve. 
4d166e83edfa70dcbf2d61c2ee3db159£ Place a wok or large skillet over high heat, and pour in 1 tablespoon vegetable oil. Cook pork, stirring frequently, until no pink is showing. Remove pork from pan and set aside. Drain grease from pan, leaving a thin coating. Cook garlic and onion in the same pan for 2 minutes. Stir in the cooked pork, carrots, green onions, and cabbage. Season with pepper, salt, garlic powder, and soy sauce. Remove from heat, and set aside until cool enough to handle. Place three heaping tablespoons of the filling diagonally near one corner of each wrapper, leaving a 1 1/2 inch space at both ends. Fold the side along the length of the filling over the filling, tuck in both ends, and roll neatly. Keep the roll tight as you assemble. Moisten the other side of the wrapper with water to seal the edge. Cover the rolls with plastic wrap to retain moisture. Heat a heavy skillet over medium heat, add oil to 1/2 inch depth, and heat for 5 minutes. Slide 3 or 4 lumpia into the oil. Fry the rolls for 1 to 2 minutes, until all sides are golden brown. Drain on paper towels. Serve immediately. 
afa52f90e1a2950dd5ee9ebee86c3634£ Place the rice noodles in a large bowl, and cover with warm water. When soft, drain, and set aside. Heat oil in a wok or large skillet over medium heat. Saute onion and garlic until soft. Stir in chicken cabbage, carrots and soy sauce. Cook until cabbage begins to soften. Toss in noodles, and cook until heated through, stirring constantly. Transfer pancit to a serving dish and garnish with quartered lemons. 
04725c9eaea6f6d9ce2a10c0486b5dc1£ Combine the chicken, soy sauce, vinegar, garlic, ginger, bay leaves and peppercorns in a Dutch oven. Bring to a boil over medium heat. Once it boils, reduce heat to a simmer. Cover the pot and simmer for 30 minutes, basting the chicken occasionally. After 30 minutes, remove lid and cook until liquid has reduced to half. Remove chicken from the pot to a serving plate. Strain the liquid from the pot to remove all the food particles, and set aside. Serve chicken hot over steamed rice and drizzle with reserved sauce. 
dcc1471048e6f352f59a2a49c8349b5c£ Preheat an outdoor grill for high heat, and lightly oil grate. In a large pot, mix soy sauce, water, vinegar, honey, garlic, bay leaves, and pepper. Bring the mixture to a boil, and place the chicken into the pot. Reduce heat, cover, and cook 35 to 40 minutes. Remove chicken, drain on paper towels, and set aside. Discard bay leaves. Return the mixture to a boil, and cook until reduced to about 1 1/2 cups. Place chicken on the prepared grill, about 5 minutes on each side, until browned and crisp. Serve with the remaining soy sauce mixture. 
1f25700162d6b38389e2e24c1d397fff£ Combine onions, garlic, apple cider vinegar, soy sauce, brown sugar, and bay leaf in slow cooker. Season with black pepper. Place chicken thighs atop mixture. Sprinkle paprika over chicken thighs. Cover and cook on Low for 8 hours. Switch slow cooker to High. Add bok choy to chicken mixture; cook another 5 minutes. Garnish with green onion. 
2a99e625deb9fd456304fe2396d3255a£ Soak the rice noodles in warm water for 20 minutes; drain. Heat 3 tablespoons oil in a wok or large heavy skillet over medium-high heat. Saute noodles for 1 minute. Transfer to serving dish, and keep warm. Add remaining 2 tablespoons oil to skillet, and saute onion, garlic, ginger, shrimp and pork for 1 minute. Stir in bok choy, oyster sauce and chicken broth. Season with pepper flakes. Cover, and cook for 1 minute, or until bok choy is wilted. Spoon over noodles, and garnish with minced green onion. 
cbf48f4ddec43d331d1ba264f9e4d1bb£ In a bowl, stir together the salt, paprika, black pepper, onion powder, oregano, cumin, garlic powder, and chili powder. Store in a sealed jar in a cool, dry place. 
6077864d7d05f5a0c1a86710b3ebd2cd£ In a Large bowl, combine ground pork, ground beef, onion, and carrot. Make sure to completely mix everything. I suggest getting down and dirty and use your hands. Knead the meat in the bowl if you must. Gradually blend in the soy sauce , black pepper, garlic powder, and salt until all ingredients are evenly distributed. Lay out a few wrappers at a time on a flat surface, and place about 2 tablespoons of the filling in a line down the center of the wrapper. Make sure the filling is no thicker than your thumb, or the wrapper will cook faster than the meat. Take the bottom and top edges of the wrapper and fold them towards the center. Take the left and right sides, and fold them towards the center. Moisten the last edge of the wrapper to seal. Now repeat using the rest of the wrappers, and have hubby or the kids help you out. Heat the oil in a deep-fryer or heavy skillet to 375 degrees F (190 degrees C). Fry 3 or 4 lumpia at a time. Fry for about 3 or 4 minutes, turning once. Lumpia are cooked through when they float, and the wrapper is golden brown. Cut in half, or serve as is with dipping sauce. We like sweet and sour sauce, soy sauce with lemon, or banana ketchup. 
257f74b1016f33584146f22e9cd431f2£ Put the warm water in a small mixing bowl and add the yeast and 1 teaspoon of the sugar; stir to dissolve. Let stand until creamy, about 10 minutes. In a large mixing bowl, combine the remaining 15 teaspoons of sugar and the oil and mix until smooth. Add the salt, 1 cup of flour and the yeast mixture; stir well. Add the remaining 5 cups flour, 1/2 cup at a time, until the dough pulls away from the sides of the bowl. Turn the dough onto a lightly floured surface and knead until smooth, supple and elastic; about 10 minutes. Lightly oil a large mixing bowl, place the dough in it and turn to coat the dough with oil. Cover with a damp towel or plastic wrap and let sit in a warm place until the dough has doubled in volume; about 1 hour. Turn the dough onto a lightly floured surface and divide into 4 equal pieces. Form each piece into a cylinder and roll out until the &#39;log&#39; is 1/2 inch in diameter. Using a sharp knife, cut each &#39;log&#39; into 1/2 inch pieces. Place the pieces, flat side down, onto two lightly greased baking sheets. Gently press each roll down to flatten. Preheat oven to 375 degrees F (190 degrees C). Cover the rolls with a damp cloth and let rise until doubled in volume, about 30 minutes. Bake at 375 degrees F (190 degrees C) until golden brown, about 20 minutes. 
3b53af8c54d4fd4af8a2c7623fcc53a2£ Combine all of the dry ingredients. Beat eggs with oil and add to flour mixture. Add mangoes, lemon and raisins. Pour into 2 greased 8 x 4 loaf pans. Bake at 350 degrees F -175 degrees C (325 degrees F for glass pans) for about 60 minutes or until toothpick comes out clean. 
7a4119716f6c9df4fbe5ee2dbdb23632£ Place ribs in a 5 to 6 quart stock pot with the 2 wedged onions, 4 tablespoons of the soy sauce, pepper and star anise. Bring all to a boil. Reduce heat to medium low, cover and let simmer in meat juices until ribs are tender when pierced, about 1 1/4 hours. Stir occasionally. Meanwhile, heat oil in a medium skillet over medium heat. Add remaining chopped onion and saute, stirring often, until onion is soft. Blend in the ginger, honey, sugar, Worcestershire sauce, lemon juice and remaining 2 tablespoons of soy sauce. Cook all together, stirring, until well blended. Remove from heat. Preheat oven to 400 degrees F (200 degrees C). Using tongs, remove ribs from stock pot and arrange in a single layer in an 11x16 inch baking dish. Brush evenly with the honey mixture and bake in the preheated oven, basting often with pan drippings, about 30 minutes or until ribs are well glazed. 
9322f855fe9baf10ea97e7f832d552eb£ Place chicken pieces in a large bowl. Pour vinegar and soy sauce over chicken, and season with ground black pepper to taste. Toss to coat. Heat oil in a large skillet over medium heat, and brown garlic. Be careful not to burn garlic, as this will make the dish taste bitter. After browning garlic, remove it from the oil. Place marinated chicken pieces in hot oil. Pour remaining marinade over all, and add bay leaves. Reduce heat to low, and cook chicken pieces for about 10 minutes on each side, or until no longer pink and juices run clear. The marinade will reduce, and make a nice gravy. Remove bay leaves, and serve immediately. 
da2e062e3b775a8048c66d01e1311b6f£ Heat the oil in a large skillet over medium-high heat. When the oil is hot, add the garlic and ground pork. Cook and stir until the garlic is golden brown. This is the color you want for maximum flavor, do not allow it to burn, or the flavor will be bitter. Stir in the cooked white rice, and season with garlic salt and pepper. Cook and stir until heated through and well blended, about 3 minutes. Serve and enjoy. 
9707f948d842868adbe3a7b753b56210£ Place the rice noodles in a large bowl, and cover with warm water. When soft, cut into 4 inch lengths, drain, and set aside. In a skillet over medium heat, brown the chicken and pork until no pink shows. Season with soy sauce and pepper. Remove from skillet and set aside. Saute the cabbage and carrots until tender. Stir in the noodles, green onions and shrimp. Cook for 4 to 5 minutes, stir in the chicken and pork, and cook for 5 more minutes. 
a086b6f61a213bf026d71fe34f40aa46£ Heat the oil in a large pot over medium heat; cook and stir the onion and garlic in the hot oil until fragrant. Quickly stir the ginger and fish sauce into the onion and garlic mixture before adding the chicken; cook together for 5 minutes. Pour the chicken broth over the mixture and cook another 5 minutes. Add the chayote to the mixture and simmer until the chicken is no longer pink in the center, about 10 minutes more. Season with salt and pepper. Add the bok choy and spinach; cook until the spinach is just wilted, 1 to 2 minutes. Serve hot. 
83b1ab2a7bc0cbd002591d3593c80f94£ Place avocado, ice, sugar, milk, lemon juice, and ice cream into a blender. Puree until smooth. 
46156be4a5bf49750e90d5087b4ecdb4£ Heat the olive oil in a large pot over medium heat; cook and stir the onion, garlic, and ginger in the hot oil until fragrant, about 5 minutes. Add the chicken wings; cook and stir together for 1 minute. Stir the fish sauce into the pot, cover, and cook another 2 minutes. Pour the chicken broth into the pot. Add the sweet rice and stir. Bring the mixture to a boil; cover and cook for 10 minutes, stirring occasionally to assure the rice is not sticking to the bottom of the pot. Season with salt and pepper. Garnish with the green onion, and serve with lemon slices and additional fish sauce, if desired. 
dac416c43b2c8e0e37f89608fe804892£ Heat oil in a large pot over medium heat until oil is shimmering. Cook garlic in oil for no more than 30 seconds. Add all of the chicken to the pot; cook, stirring frequently, until chicken is white all over. Do not brown. Pour in soy sauce, vinegar, and water, and add the pickling spice. Make sure the spice ball is submerged. Bring to a boil, reduce heat to simmer, and place lid on pot so that some steam can escape. Simmer for 1 hour, or until chicken is very tender. 
3f93495ea1a16ca706c6d33b4671aab2£ Heat oil in medium stock pot. Saute onion and garlic until tender. Add beef to pot, and saute until browned. Pour in water. Bring to a boil, reduce heat, and simmer 20 to 30 minutes. Place tomatoes and green beans in pot, and continue to simmer for 10 minutes. Stir in bok choy, broccoli and tamarind soup mix. Simmer for an additional 10 minutes. 
5132acc922035b345e7255d519096392£ Heat oil in a large skillet over medium-high heat. Add onion and garlic, and cook until fragrant. Stir in the tomatoes and potatoes, and cook for 7 to 10 minutes until potatoes are softened. Add the corned beef, and flake into pieces. Cook for another 10 minutes, stirring frequently. Season with salt and pepper, and serve. 
e419dc509cc49ae79d2c289e756b1c74£ Mix pork belly with cooking wine, oyster sauce, cornstarch, sesame oil, salt, and black pepper in a bowl. Marinate in the refrigerator, at least 20 minutes. Heat vegetable oil in a pot over medium-high heat. Add garlic and shallots; cook and stir until fragrant, about 1 minute. Add the pork pieces; fry until browned, about 6 minutes. Pour in water, light soy sauce, and dark soy sauce. Cover with a lid and bring stew to a boil. Reduce heat to medium and cook until pork becomes tender and water is reduced by half, about 30 minutes. Cut shrimp into 3/4-inch pieces. Mix cornstarch and water together in a bowl. Bring stew to a boil. Add the shrimp and peas; cook until shrimp changes color, about 2 minutes. Quickly stir in the cornstarch mixture. Cook and stir until gravy is thickened, 7 to 10 minutes. Heat oil in a wok over medium-high heat. Saute garlic until fragrant, about 1 minute. Increase heat to high. Add rice; cook, breaking up the rice with a spatula, until loosened, 3 to 5 minutes. Add oyster sauce and soy sauce. Cook and stir until rice is fluffy and heated through, about 3 minutes. Add remaining sesame oil. Divide fried rice between 3 or 4 bowls. Portion the pork and shrimp stew equally over the rice. 
f6bf9524d0ff10376cd160d3be1947ee£ Combine water and onion in a pot and bring to a boil. Add chicken, garlic powder, and onion powder. Bring back to a boil and reduce heat to medium-low. Simmer broth until chicken thighs are tender, about 30 minutes. Remove chicken and add carrots to the broth. Stir in 2 tablespoons fish sauce, chicken bouillon, and black pepper. Shred chicken meat and discard bones; return meat to the broth and simmer until carrots are tender, about 10 minutes. Add macaroni; cook until tender, about 20 minutes, adding more water if needed. Stir in evaporated milk and butter; simmer until butter is melted. Add more fish sauce and season with salt and pepper to taste. Pour soup into serving bowls. 
8e80afaa7da9680faf14c3a4f72a0509£ Preheat oven to 400 degrees F (200 degrees C). Prepare a 9x13-inch baking dish with cooking spray. Spread one of the puff pastries into the bottom of the prepared baking dish, stretching so it reaches the edges. Bake pastry in preheated oven until lightly browned, about 5 minutes. Beat egg yolks in a stainless steel bowl until smooth. Add macapuno strings, softened butter, and vanilla to the egg yolks; stir. Place the stainless steel bowl over a pot of boiling water; cook the macapuno mixture, stirring frequently, until it thickens, about 5 minutes. Pour over the baked puff pasty and spread into an even layer. Stretch the unbaked puff pastry over the top of the macapuno layer. Bake in preheated oven until top layer is golden brown, about 18 minutes. Cool to room temperature. 
1adda4441dee24ef1c1b1b8e39aef51b£ Pat pork belly dry with paper towels. Score pork belly skin in a crosshatch pattern with a sharp knife. Place pork belly skin side-up in a large roasting pan. Pour fish sauce evenly over pork belly. Season with rock salt and pepper. Let stand at room temperature for 2 hours. Preheat oven to 400 degrees F (200 degrees C). Cover roasting pan with aluminum foil. Roast pork belly in the preheated oven for 30 minutes. Reduce oven temperature to 300 degrees F (150 degrees C). Continue baking, basting pork belly with juices every 30 minutes, until very tender, about 4 hours. Remove aluminum foil and turn on the oven&#39;s broiler. Broil pork belly until skin is crisp, about 30 minutes. Remove pork belly from oven. Let rest for 30 minutes. Slice off the bone. Mix shallots, soy sauce, calamansi juice, sinamak, and chile peppers in a bowl to make dipping sauce. Serve slices of pork belly with dipping sauce. 
4b6be4c761bb8da064b56147d2b075ff£ Pour milk into a microwave-safe bowl. Heat in the microwave until warm, about 1 minute. Place butter in a microwave-safe bowl. Heat in the microwave until melted, about 30 seconds. Place eggs in a bowl; cover with warm water for 1 minute. Drain and crack into the bowl; beat lightly with a fork. Place warm milk, melted butter, eggs, salt, bread flour, purple yam powder, and bread machine yeast into a bread machine in the order listed. Run &quot;Dough&quot; cycle. Preheat oven to 375 degrees F (190 degrees C). Transfer dough to a greased bowl. Deflate dough with your fist. Cut into 24 oval pieces. Roll each piece into a ball. Pour bread crumbs into a shallow plate; roll balls of dough in bread crumbs until coated. Arrange close together, slightly touching, in an ungreased baking pan. Bake in the preheated oven until tops are golden brown, about 15 minutes. 
427d8e6224f5b34d7ed5dea9ad635750£ Put sugar and water in separate bowls. Separate spring roll wrappers; stack. Peel plantains; cut in half and then half again lengthwise. Place 1 wrapper on a clean work surface with 1 corner facing you. Coat 1 plantain piece in sugar; place 1 inch from the near corner of the wrapper. Fold corner over the plantain; roll up halfway. Fold in 2 side corners; continue rolling until near the top. Moisten top corner with wet fingers; finish rolling. Repeat with remaining wrappers. Heat oil in a deep-fryer or large saucepan to 350 degrees F (175 degrees C). Place egg rolls in a single layer; fry until golden brown on the bottom, 2 to 3 minutes. Flip; sprinkle with brown sugar. Fry 2 to 3 minutes more. Transfer egg rolls to a plate. 
a0314da978ab7fb6674f81f4a9dac331£ Heat 3 tablespoons vegetable oil in a wok or large saucepan over medium heat. Add onion and garlic; cook and stir until softened, about 5 minutes. Stir in ground chicken; cook until no longer pink, about 5 minutes. Drain grease thoroughly. Stir in oyster sauce. Reduce heat to low. Mix cabbage, bean sprouts, and carrots into the chicken mixture. Season with salt and pepper. Place 1 spoonful of chicken mixture in the center of 1 spring roll wrapper. Keep remaining wrappers covered. Fold in opposing edges and roll up wrapper. Transfer to a plate. Repeat with remaining chicken mixture and spring roll wrappers. Heat 2 cups oil in a wok or large saucepan over medium heat. Fry spring rolls in batches until golden brown, 2 to 3 minutes per batch. 
352ddff24e7da0d00937f821214c30ef£ Heat oil in a pot over medium heat. Add onion, garlic, and ginger; cook and stir until onions are translucent, about 5 minutes. Add tomatoes; cook and stir until mushy, about 5 minutes. Stir in miso paste and fish sauce; simmer until flavors combine, about 2 minutes. Pour water into the pot; bring to a boil. Add fish fillets and radish; simmer until radish softens slightly, about 2 minutes. Stir in chile peppers, mustard greens, and kalamansi juice. Simmer, uncovered, until greens are wilted, 1 to 2 minutes. 
de6911d564b755c6473cc6076e7a535d£ In a large pot, combine the water, vinegar, soy sauce, peppercorns, garlic and salt. Mix together, add chicken pieces and simmer over low heat (uncovered) until chicken is cooked through and tender (25 to 35 minutes). Remove chicken from pot and brown in oil in a large skillet over medium high heat. Return chicken, with oil/juices, back to pot with reserved sauce. Cover and simmer over medium heat until sauce reaches desired consistency. 
