d017f2f63f7f6a79553f6f3fe30448e9£ Place eggs in a saucepan and cover with water. Bring to a boil, reduce heat to medium, cover, and cook for 4 minutes. Remove from heat and let stand, covered, for 2 minutes. Rinse eggs in cold water and cool to room temperature; peel. Combine rice vinegar, ketchup, brown sugar, and soy sauce in a saucepan. Cook and stir over medium until sugar has dissolved, about 5 minutes. Let cool. Prepare batter by adding red and yellow food coloring to the water to get a deep orange color. Combine flour, salt, and pepper in a bowl; pour in orange water and stir until there are no lumps. Heat oil in a wok to 375 degrees F (190 degrees C). Gently roll eggs in cornstarch to coat and shake off excess cornstarch. Dip into orange batter so they are fully covered. Poke eggs with the bamboo skewer and drop gently into the hot oil. Deep fry until the batter is crispy, about 2 minutes per side. Remove eggs with a slotted spoon and drain on paper towels. 
d4027c3fcf66b32a696042f12f3c0043£ Combine cornstarch, sugar, flour, salt, and monosodium glutamate in a large bowl. Add eggs, green onions, soy sauce, and garlic. Pat chicken dry and add to the sauce. Cover and refrigerate until marinated, 8 hours to overnight. Heat oil in a deep-fryer or large saucepan to 350 degrees F (175 degrees C). Fry chicken in the hot oil until golden brown, 15 to 25 minutes. An instant-read thermometer inserted near the bone should read 165 degrees F (74 degrees C). 
49f295383c55d3d124a3678aaa089df7£ Heat butter and oil in a large pot over medium heat. Add onion and garlic and cook until onion is soft and translucent, about 5 minutes. Add tomatoes and heat through, about 3 minutes. Stir in cabbage and and cook until softened, about 5 minutes. Add a splash of chicken stock and heat through, about 3 minutes. Mix in corned beef and cook until heated through and flavors have combined, about 10 minutes. 
c17b776e64adc57f596b9c6531ce15ab£ Stir milk, rice, sugar, orange juice, and orange zest together in a heavy saucepan; bring to a boil, reduce heat to medium-low, and cook, stirring frequently, until the rice is tender and the mixture is thickened, 35 to 40 minutes. Remove the saucepan from heat. Stir orange liqueur and cocoa powder through the rice mixture; add chocolate chips and stir until melted into the pudding. 
bd648e81a19aab78c814aef868d398d6£ Mix pork, shrimp, water chestnuts, salt, and pepper together in a large bowl. Reserve 1/3 of the filling mixture for the soup. Wrap about 1 tablespoon of the remaining filling in a wonton wrapper. Repeat until all of the filling is used up. Heat olive oil in a large pot over medium-high heat. Add onion and garlic; saute until onion is translucent, about 5 minutes. Stir in the chicken and the reserved filling. Mix well. Add chicken broth; season with salt and pepper. Bring to a boil. Drop the filled wontons into the soup one by one. Boil until wontons float to the top, 3 to 5 minutes. Add bok choy; boil until tender, about 2 minute more. Garnish with green onions. 
b46982af152f5adaac3361dd6412963d£ Bring 2 cups coconut milk to a boil; stir constantly until oil begins to separate from the milk, about 30 minutes. Skim and reserve oil in a bowl. Reduce heat to medium-low and add 3 tablespoons sugar to remaining milk. Continue to cook and stir until milk becomes brown and crumbly, about 30 minutes more. Remove latik from heat. Grease an 8-inch mold or pie dish with reserved coconut oil. Heat remaining 2 cups coconut milk, cream-style corn, cornstarch, 1/2 cup sugar, and corn kernels in a saucepan over medium heat, stirring constantly, until thickened, about 5 minutes. Pour corn mixture into prepared mold. Cool until maja blanca is set. Cover mold with a plate and invert maja blanca onto the plate. Slice maja blanca and sprinkle with latik. 
0bea1b0fa9c1698c4510c11f9af5d4af£ Heat 1 tablespoon vegetable oil in a large skillet over medium-low heat; cook and stir onion, celery, and carrot until onion is tender and translucent, 5 to 7 minutes. Celery and carrot may still be crisp; season with salt. Add ground pork and garlic. Continue to cook and stir until pork is no longer pink. Season with more salt. Drain any excess grease and stir in red pepper flakes, garlic powder, turmeric, ginger, cumin, coriander, and celery seed. Set aside to cool. Place about 1 tablespoon pork mixture on a lumpia wrapper with one corner facing you. Fold corner closest to you over filling; fold two side corners toward center and continue rolling wrapper around pork. Brush a small amount of water over the top corner and press to seal. Repeat with remaining filling and wrappers. Heat 1 quart vegetable oil in a deep-fryer or large saucepan to 350 degrees F (175 degrees C). Fry rolls in batches until golden brown, 4 to 6 minutes. Drain on a paper towel-lined plate. 
7807dc1c213d91560f6a710094d5923e£ Heat vegetable oil in a large skillet over medium-high heat; cook and stir onions, lemon grass, ginger, and garlic until tender, about 5 minutes. Add chicken and fry until lightly browned, about 10 minutes, turning occasionally. Pour coconut water into skillet and stir in chayote squash. Season with fish sauce. Continue to simmer until chicken is no longer pink in the center and juices run clear, about 10 minutes more. 
9ba03d3dc0f74279c1add85147fbf301£ Combine the mackerel, water, tamarind soup base, and fish sauce in a pot over medium heat. Cover and cook at a simmer for about 15 minutes. Flip the fish, cover again, and simmer another 15 minutes. Remove from heat and allow to sit, covered, for 1 hour. Heat oil in a deep-fryer or large saucepan to 350 degrees F (175 degrees C). Remove the fish from the pot and pat dry with paper towels to remove as much excess moisture as possible. Fry the fish in the hot oil until golden brown, 7 to 10 minutes. Serve hot. 
689cd8fd3bbe4c5e76d7310881c47d35£ Stir the mango, tomato, cilantro, and onion together in a bowl. Season with salt and pepper. Cover and refrigerate until ready to use. 
232656f5dc12c0e04419c7a068e3f6b1£ Preheat an outdoor grill for medium heat and lightly oil the grate. Grill the milkfish fillets until the flesh flakes easily with a fork, 2 to 3 minutes per side. Combine the grilled fillets, tomato, onion, shrimp paste, and water to the pot; bring to a boil for 5 minutes. Season with salt and pepper. Add the long beans and zucchini; stir. Cover the pot and cook over medium heat for 5 minutes. Stir the okra into the mixture and cook another 5 minutes. Serve hot. 
0313cc206442c02840d3c134640aa417£ Cut the top of the coconuts to expose the soft meat inside. Pour the juice into a large bowl. Chop the coconuts in half; use a spoon to scrape the meat from the coconuts and add to the bowl with the juice. Add the water and sugar to the bowl; whisk until the sugar dissolves completely. Divide the ice between two tall glasses and pour the mixture over the ice to serve. 
a7b2342523965cbedd9e997480648956£ Latik topping: Boil 1 cup of coconut cream in a saucepan over medium heat until coconut oil and coconut milk solid separate, stirring constantly, about 15 minutes. Continue cooking until the milk solids become golden brown. Drain oil. Grease two 9 inch round pans and set aside. Mix cornstarch and sugar in a bowl and set aside. Heat 4 cups of coconut cream, butter, vanilla extract, cream-style corn and corn in a saucepan over medium-low heat and bring to a simmer. Slowly add the cornstarch mixture, stirring constantly to prevent any lumps, about 10 minutes. Pour the hot mixture into the prepared pans and allow to set. Sprinkle latik on top. Cool before slicing and serving. 
c660a355a811bea61849a7c512acdcaf£ Heat the olive oil in a skillet over medium heat. Cook the onion and garlic in the hot oil until fragrant, about 5 minutes. Mix the pork into the onion and garlic; cook until no longer pink, about 5 minutes. Stir the prawns into the mixture and cook until no longer translucent, about 5 minutes more. Add the tomatoes; season with salt and pepper. Continue cooking until the tomatoes soften, about 5 minutes. Stir the bitter melon through the mixture and cook until the melon is tender, about 5 minutes. Serve hot. 
ae7157b611e748907accb1b6ffba1819£ Bring a pot of water to a boil. Add the bitter melon and eggplant to the boiling water and return to a boil; cook at a boil for 2 minutes. Drain. Rinse with cold water to stop from cooking further. Toss the bitter melon, eggplant, carrot, garlic, green chile peppers, and sweet onion in a large bowl; cover with plastic wrap and set aside. Stir the water, vinegar, ginger, sugar, and salt together in a pot; bring to a boil until the sugar has dissolved completely. Set aside to cool completely. Pour the cooled vinegar mixture over the vegetables in the bowl, assuring the vegetables are completely submerged. Cover and refrigerate. Serve cold. 
f2495d7c450e3a0849432d96cf895d89£ Place eggs in a saucepan and cover with water. Bring to a boil, remove from heat, and let eggs stand in hot water for 15 minutes. Remove eggs from hot water, cool under cold running water, and peel. Combine rice vinegar, ketchup, brown sugar, and soy sauce in a saucepan. Heat over medium heat while stirring until sugar has dissolved, about 5 minutes. Stir sauce and let cool. Prepare the batter by adding a few drops of red and yellow food coloring to the water to get a deep orange color. Combine flour with salt and pepper in a bowl; pour in orange water and stir until there are no lumps. Heat oil in a wok to 375 degrees F (190 degrees C). Gently roll eggs in cornstarch to coat and shake off excess cornstarch. Dip into orange batter so they are fully covered. Poke eggs with the bamboo skewer and drop into the hot oil. Deep fry until the batter is crispy, about 2 minutes per side. Remove eggs with a slotted spoon and drain on paper towels. 
da4ed0f7ed4bbca77f0c0316eb887c24£ Cut the pork into thin slices measuring about 4-inches square; smaller pieces are fine. Stir the brown sugar, seasoned salt, garlic salt, pepper, and curing salt together in a bowl; sprinkle each of the slices of pork with the mixture. Lay the pork slices flat in a large container with a cover. Let sit in the refrigerator 3 to 4 days before using. To prepare the tocino, combine the desired amount of the pork with enough water to cover in a large non-stick skillet and bring to a boil for about 5 minutes. Drain and discard the water. Dry the pan completely. Heat the oil in the skillet over medium heat; fry the pork slices in the hot oil until lightly browned, 1 to 2 minutes per side. 
3c5786c83a0cbb21987734a70343657f£ Mix the grated coconut with the warm water in a large bowl. Scoop the coconut into a sheet of cheesecloth and squeeze over the bowl to express as much coconut juice as possible; repeat a few times until you feel you&#39;ve gotten as much as you can from the coconut; strain into a non-stick skillet. Discard the coconut. Bring the liquid to a boil and cook until the mixture is dry, about 20 minutes; it will curdle as it dries, leaving coconut oil and the solids, which are called &#39;latik.&#39; 
659f835fd67cb1e4f5089caaa6dab709£ Place jack fruit in a bowl. Add white beans and red beans and mix thoroughly. Place 2 tablespoons of the jackfruit mixture in a tall glass. Fill glass 2/3-full of shaved ice. Pour evaporated milk over the shaved ice. Mix using a teaspoon. Top with 2 tablespoons vanilla ice cream. Repeat layering the halo halo in 3 more glasses. 
ce680a0952954336bd1876159aa10db0£ Heat olive oil in a skillet over medium heat. Add onion and garlic; saute until onion is softened and browned, 10 to 15 minutes. Transfer onion and garlic to a plate. Cook pork and shrimp in the same skillet until browned, 5 to 7 minutes. Add back the onion and garlic; season with salt and pepper. Add jicama, bean sprouts, chickpeas, green beans, celery, and carrot. Cook and stir until vegetables are tender, about 5 minutes. Place filling mixture in a large bowl. Add peanuts and mix well. Place a lettuce leaf on top of a lumpia wrapper. Place 1 tablespoon filling onto the lettuce. Roll up the wrapper, folding 1 end over the filling. Place on a serving platter. Repeat with remaining lettuce, lumpia, and filling. 
1c5110ebed0d264c34e6367f7d73afa8£ Heat olive oil in a saucepan over medium heat. Add garlic; cook and stir until fragrant, about 2 minutes. Mix water, peanut butter, brown sugar, corn flour, and soy sauce together in a small saucepan until well blended and without any lumps. Bring to a boil; stir until mixture is thick, 6 to 10 minutes. Add the cooked garlic and mix well. 
51461456633468954eac97c2181a48a2£ Pound shrimp heads in a mortar until about 1/2 cup juice is released. Drain juice and reserve. Heat olive oil in a skillet over medium heat. Add garlic; cook and stir until slightly brown, 1 to 2 minutes. Add onion; cook until translucent, about 5 minutes. Stir in ham and chorizo; cook until juices release, about 2 minutes. Add pork; cook and stir until no longer pink, about 7 minutes. Season with salt and pepper. Place shrimp into the skillet; cook until opaque, about 3 minutes. Add the reserved shrimp juice and mix thoroughly. Add soy sauce and sugar; cook and stir until combined, about 2 minutes more. Add cabbage, potato, chickpeas, celery, carrot, and ubod. Cook until vegetables are tender, about 3 minutes. Let filling cool until safe to handle, at least 10 minutes. Lay a lettuce leaf on a lumpia wrapper. Place about 2 tablespoons of the filling over the center of the lettuce. Fold 1 end of the wrapper over the filling to secure the lower end; roll wrapper over to cover. Repeat with remaining lettuce, wrappers, and filling. 
c7934471f293b9b833e0adefa59fb409£ Mix liver spread with water in a bowl until a paste is formed. Add vinegar, brown sugar, soy sauce, bay leaves, salt, and pepper. Heat olive oil in a saucepan over medium-high heat. Add onion and garlic; saute until onion is translucent, about 5 minutes. Add the vinegar mixture and let boil for 2 minutes. Stir until combined. Add bread crumbs. Reduce heat and simmer, uncovered, until sauce is thickened, about 20 minutes. Add cornstarch if necessary to thicken the sauce. 
7c44117a9f8afd4a56f8291ce4b4f79f£ Preheat the oven to 400 degrees F (200 degrees C). Rinse pork; pat dry with paper towels. Rub butter all over the skin. Sprinkle salt over the skin. Place pork leg on a rack in a roasting pan. Pour water into the bottom of the pan. Cover pan securely with aluminum foil so that steam will not escape. Roast in the preheated oven for 30 minutes. Remove foil. Reduce heat to 320 degrees F (160 degrees C). Continue baking, basting with drippings every 30 minutes, until skin is crisp, about 3 1/2 hours. An instant-read thermometer inserted into the center should read 176 degrees F (80 degrees C). Place pork leg on a serving platter. Slice into bite-sized portions. 
654a36c88481a8fa7442a5c259fdaa87£ Soak noodles in a bowl of warm water for 5 minutes. Bring a large pot of water to a rolling boil. Stir in noodles and bring back to a boil. Cook until tender, 4 to 5 minutes. Drain. Bring a saucepan of water to a boil. Add shrimp and boil until just opaque, 2 to 3 minutes. Drain. Heat oil in a skillet over medium heat. Add onion and garlic; cook and stir until onion is translucent, about 5 minutes. Transfer half the mixture to a bowl and set aside. Stir achiote powder into the skillet with the remaining onion and garlic mixture. Add prawns; reduce heat and let simmer until well coated, about 2 minutes. Heat a large pot over medium-high heat. Saute pork until browned, crumbly, and no longer pink, 5 to 7 minutes. Add the remaining 1/2 of the onion-garlic mixture; season with salt and pepper. Add cream of chicken soup; stir until well mixed. Add chicken broth; stir until it becomes a thick sauce, about 5 minutes. Place a portion of the noodles on a plate, ladle a portion of the sauce over, and top with a small portion of the shrimp mixture. Garnish with hard-boiled eggs and green onions. 
111dd4ad9a5ef737c24325134214c731£ Soak bihon in a bowl of warm water until soft, about 5 minutes. Drain. Heat oil in a large wok over medium-high heat. Saute onion and garlic until onion is translucent, about 5 minutes. Add chicken, salt, and pepper. Cook and stir until flavors combine, about 3 minutes. Add shrimp; cook until they start to turn color, about 1 minute. Add soy sauce; toss in cabbage, celery, and carrot. Cook until well combined, about 2 minutes. Add 2 cups water; bring to a boil. Cook until vegetables begin to soften, about 2 minutes. Transfer chicken, shrimp, and vegetables to a bowl, leaving the liquid behind in the wok. Add bihon and canton noodles to the liquid. Mix well and cover. Let sit until tender, about 5 minutes. Return 1/2 the chicken-vegetable mixture to the wok; mix with the noodles. Pour soup into bowls; garnish with the remaining chicken-vegetable mixture. 
eb5f2e7760e38d11d36146c9b92a6704£ Heat olive oil in a skillet over medium-high heat. Saute onion and garlic until onion is translucent, about 5 minutes. Add prawns; cook and stir until starting to turn color, about 2 minutes. Add fish sauce and pepper; cover and cook until slightly reduced, about 2 minutes. Pour chicken broth into the skillet with prawns. Cover, reduce heat, and simmer until flavors begin to combine, about 2 minutes. Add patola; re-cover and cook until mostly softened, about 5 minutes. Add misua noodles; let simmer until tender yet firm to the bite, about 2 minutes. 
dcd5725146c71ce455af90922f3c407f£ Mix flour, egg yolks, and salt together in a bowl using your hands, adding water as needed, 1 teaspoon at a time, until the mixture forms a ball. Knead until dough is smooth. Roll dough out on a lightly floured surface using a rolling pin until thin enough be be filled. Cut dough into 7 1/2 by 7 1/2-inch squares. 
0b28bad76acdf65aa46d74dc64e4c327£ Remove scales, gills, and guts from the fish. Rinse and cut crosswise into 3 steak pieces. Pat dry. Arrange eggplant, onion, and ginger in the bottom of a 1 1/2-quart pot. Place fish on top. Add green chiles and sprinkle with salt. Pour water and vinegar into the pot with the fish. Bring to a boil. Boil for 5 minutes; reduce heat and simmer until fish flakes easily with a fork, about 20 minutes. Add green bell pepper and bitter melon. Cook until bitter melon is soft to the touch, about 10 minutes more. 
0c58a4ca9e3efe695a064d1438097b97£ Place sirloin steak on a flat work surface. Slice horizontally through the middle with a very sharp knife, being careful not to cut all the way through to the other side. Open the 2 sides and spread them out like an open book. Place in a dish, season with soy sauce and lemon, and let marinate briefly. Mix ground pork, sweet relish, salt, and pepper together in a bowl. Remove the steak from the lemon-soya sauce marinade and lay it on a flat surface, e.g. a cutting board. Reserve the marinade. Spread ground pork mixture over the steak. Arrange chorizo, eggs, carrot, and ham over the pork. Roll steak into a log until filling is entirely covered; secure at both ends with toothpicks. Tie the meat roll with a string. Heat oil in a large pot over medium heat. Add the meat roll; cook until all sides are browned, about 10 minutes. Add water, tomatoes, onion, garlic, peppercorns, bay leaves, and the reserved marinade. Cover and cook for 5 minutes. Add tomato sauce, salt, and pepper. Reduce heat to low and simmer until sauce flavors blend and meat roll is hot in the center, about 20 minutes. Remove meat roll from the sauce; place on a flat work surface and cut crosswise into slices. Arrange slices on a platter. Pour sauce on top. 
93887c1987a04cc0c36463bbf86dae43£ Mix flour, sugar, salt, and yeast together in a large bowl. Add water and 1/4 cup oil; mix into a dough. Knead until smooth and elastic, at least 10 minutes. Dust with extra flour if necessary. Warm up the oven for 1 minute. Turn oven off. Oil a large bowl; place dough inside and cover with cheesecloth. Place in the warmed oven until size has doubled, about 1 hour. Punch down dough. Keep in the oven until risen, at least 15 minutes more. Knead dough onto a flat work surface and divide into 12 golf-sized balls. Roll out each ball and fill with choice of filling (see footnote for my chicken and pork filling). Gather and twist the edges together to secure the filling. Place each siopao on a 3x3-inch piece of wax paper. Place siopao in a steamer and steam for 30 minutes. 
1aa0e58e4e3a24d8b8fdb6b52bd13156£ Bring a large pot of water to a boil; boil spareribs for 15 minutes; drain. Thoroughly rinse the spareribs with cold water. Rinse the pot and return to the stovetop. Return spareribs to the pot; add taro, 2 cups water, onion, radish, green chiles, tomato, tamarind, ginger, and salt. Bring soup to a boil. Cook until pork and vegetables are tender, about 30 minutes. An instant-read thermometer inserted near the rib bone should read 145 degrees F (63 degrees C). Place green beans and eggplant into the soup. Cook until tender, 5 to 7 minutes more. Strain soup into bowls. Arrange the pork and vegetables on a serving platter while hot. 
5adc915e83d3aa8f156f91aec1535239£ Preheat the oven to 350 degrees F (175 degrees C). Line a roasting pan with enough aluminum foil to cover the whole bangus. Remove scales and gills from bangus. Wash the innards. Pat fish dry with a paper towel. Mix tomato, onion, and 1/3 of the ginger together in a bowl. Season with salt and pepper. Cut open the front side of the fish and fill with the tomato mixture. Place fish in the prepared pan. Mix calamansi juice, soy sauce, garlic, and remaining ginger in a separate bowl. Pour over the fish in the pan. Fold foil over the fish and seal all ends. Bake in the preheated oven until fish flakes easily with a fork, about 60 minutes. 
31ab08c6108d1c8f1f4b479ecb80e9cf£ Preheat the oven to 350 degrees F (175 degrees C). Remove breast bones from chicken. Rinse and pat dry with a paper towel. Place chicken in a roasting pan. Pour soy sauce and lemon juice over chicken, rubbing liquid into the cavity as well. Mix ground pork with onion, tomato, eggs, carrot, chorizo, Cheddar cheese, raisins, garlic, salt, and pepper in a bowl. Stuff chicken with the mixture. Sew the opening to secure the filling. Bake in the preheated oven until chicken is no longer pink at the bone and the juices run clear, about 60 minutes. Cover chicken with aluminum foil if it is getting brown too quickly. An instant-read thermometer inserted near the bone should read 165 degrees F (74 degrees C). Cool briefly before slicing crosswise. Pour drippings from the chicken and broth in a pot over medium-high heat. Bring to a boil. Add corn flour; stir constantly until sauce thickens, 5 to 8 minutes. Serve with the chicken. 
f201025a4ab87f02bccc7428377323c8£ Combine beef stew meat, water, and beef bouillon in a pot; bring to a boil. Boil until tender, 45 to 60 minutes. Heat olive oil in a large pot over medium-high heat. Saute onion and garlic until onion is translucent, about 5 minutes. Add paprika, salt, and pepper. Add tomatoes; bring to a boil and cook until tender, about 5 minutes. Add the boiled beef and all but 1/2 cup of the broth. Heat remaining olive oil in a skillet over medium-high heat. Add potatoes; cook and stir until browned, 5 to 7 minutes. Add to the beef mixture. Add carrots, peas, and red bell pepper. Saute until vegetables are tender, about 5 minutes. Mix liver spread, vinegar, sugar, and reserved beef broth together in a bowl. Pour mixture into the pot with the beef; add the sauteed vegetables. Mix and continue cooking until flavors combine, about 5 minutes more. 
eedd5c1ddfb46603722bf8b55bed6c84£ Remove scales from the bangus. Cut a slit into the fish lengthwise along the back to remove gills, intestines, and innards. Spread open the fish to expose the flesh; pat dry all over. Lay fish flat on a ridged plate and sprinkle with salt and pepper. Spread garlic over the flesh and pour vinegar on top. Cover with plastic wrap and marinate in the refrigerator, 1 hour to overnight. Discard marinade and pat fish dry with paper towels. Heat oil in a large skillet over medium-high heat. Fry the fish until golden brown and crispy, 7 to 10 minutes. 
deb505b28528a3480617024d7c67c3a9£ Heat oil in a deep-fryer or large saucepan to 350 degrees F (175 degrees C). Pat tilapia dry with a paper towel. Cut 2 to 3 slits on either side of the fish. Sprinkle salt on top. Fry in the hot oil until browned, about 2 minutes per side. Heat olive oil in a skillet over medium-high heat. Saute onion and garlic until onion is translucent, about 5 minutes. Add red bell pepper and ginger; saute until fragrant, about 2 minutes. Mix water, vinegar, and sugar together in a bowl. Pour into the onion mixture in the skillet. Cover and bring to a boil. Cook until slightly reduced, about 2 minutes. Season with salt and pepper. Add cornstarch. Boil, stirring often, until sauce is thickened, about 5 minutes. Pour sauce over the fish. 
6c0ae7592b37022f22776d2cff06151c£ Heat olive oil in a skillet over medium-high heat. Saute onion and garlic until onion is translucent, about 5 minutes. Add paprika and mix well. Add chicken, sweet peas, olives, chorizo, salt, and pepper; mix thoroughly. Cover and cook until fragrant, about 5 minutes. Add tomatoes and cook until juices are released, about 5 minutes. Add water; cook until slightly reduced, about 5 minutes. Add sweet rice; mix well. Cover and cook until flavors blend, about 5 minutes. Pour coconut milk into the skillet and bring to a boil. Cook until slightly reduced, about 5 minutes. Add red bell pepper. Cover and cook until rice is tender and chicken is no longer pink near the bone, about 10 minutes more. An instant-read thermometer inserted near the bone should read 165 degrees F (74 degrees C). Garnish with hard-boiled eggs. 
